down	TNFRSF10B; ANGPT2; SLC16A3; SDC3; TGFB1; JCHAIN; IGKV1-17; IGKV1-5; IGLV1-51; IGLV1-40; IGLV2-14; IGLV2-23; IGLV2-11; IGLV3-27; IGHV3-7; IGHV2-70; IGHV2-5; IGHV4-39; IGHV4-59; IGHA1; GYPA; MMP1; CD74; IGKV3-11; ATP1B1; ITGB2; ITGB1; IGKV4-1; IGHV4-34; CD2; ITGAV; THBD; LYN; SLC3A2; ITGA5; DBH; ITGAM; PSG1; VPREB1; SRC; SELL; B4GALT1; IGLL1; CD44; SPN; EPCAM; SDC1; CD58; ITGAL; ITGAX; MAG; ITGA3; MSN; PTPN6; FCER1G; SDC4; GPC1; MYH9; BSG; CEACAM3; PIK3CA; SLC16A1; GRB2; CXADR; SIRPA; OLR1; SLC7A5; TEK; CAV1; PTPN11; PDE4B; SOS1; CD47; PPIL2; ROCK1; SELPLG; GRB7; JAML; SLC7A6; INPP5D; GLG1; GP6; TREM1; SLC7A10; VPREB3; SLC7A7; SLC7A11; F11R;	GO:0050900~leukocyte migration	88	193	45.5958549222798	0.0116122691281806	0.656292545755108	1	1	0.998899261230489	0.998899261230489	1
down	IRF6; OAS1; IFNA21; HLA-B; HLA-H; HLA-A; ISG15; HLA-C; IRF1; IFITM1; HLA-E; IRF2; IFNAR1; EGR1; JAK1; SP100; TYK2; HLA-F; GBP2; IFI27; IRAK1; STAT2; ADAR; IFI35; IRF9; IFITM3; IFITM2; IRF8; BST2; IRF3; IRF4; XAF1; IRF7; ISG20; MYD88; IP6K2; SAMHD1;	GO:0060337~type I interferon signaling pathway	37	67	55.2238805970149	0.0116489878033759	0.656292545755108	1	1	0.998899261230489	0.998899261230489	1
down	RAMP2; TFRC; ITGB2; ITGB1; EZR; CD36; CD9; CXCR1; CXCR2; GRK2; FCER1G; ARRB2; ADM; SNCA; GRIA1; SYK; DNM2; CD81; GRB2; CLTC; CAV1; LRP1; RAB31; LDLRAP1; LILRB1; AP2M1;	GO:0031623~receptor internalization	26	42	61.9047619047619	0.0117627734245457	0.656292545755108	1	1	0.998899261230489	0.998899261230489	1
down	ACSL4; JAK2; PFKFB2; RBP4; GIP; GLUL; GJA1; CD38; GIPR; NKX6-1; PRKCE; PPARD; SOX4; DOC2B; SLC30A8; MCU; UCN3; GPER1; TCF7L2; TM7SF3; GHRL; RPH3AL; IRS2; SERP1; TRH; NNAT;	GO:0032024~positive regulation of insulin secretion	26	42	61.9047619047619	0.0117627734245457	0.656292545755108	1	1	0.998899261230489	0.998899261230489	1
down	MYO1G; MYO1C; WASL; ARPC1B; ARPC2; ARPC3; ARPC5; WIPF1; PLA2G6; IGKV1-17; IGKV1-5; IGLV1-51; IGLV1-40; IGLV2-14; IGLV2-23; IGLV2-11; IGLV3-27; IGHV3-7; IGHV2-70; IGHV2-5; IGHV4-39; IGHV4-59; IGKV3-11; IGKV4-1; IGHV4-34; HSP90AA1; LYN; HSP90AB1; HCK; FGR; FCGR2A; SRC; VAV1; MAPK3; MAPK1; PIK3CA; WAS; SYK; CRK; LIMK1; NCKAP1L; ARPC4; ACTB; CDC42; ACTR3; ACTR2; GRB2; RAC1; ACTG1; PRKCE; PTK2; PRKCD; PAK1; PLPP4; CYFIP1; ABI1; WIPF2; BRK1; ELMO1; ARPC1A; CYFIP2; MYO10; MYH2; BAIAP2; WASF2;	GO:0038096~Fc-gamma receptor signaling pathway involved in phagocytosis	65	135	48.1481481481481	0.0118265096389751	0.656292545755108	1	1	0.998899261230489	0.998899261230489	1
down	DNAJB6; BAG4; BAG3; HSP90AA1; HSP90AB1; HSPA1A; HSPA8; TPR; RPA2; DNAJB1; MAPK3; RPA1; MAPK1; HSPA1L; RPA3; NUP62; MTOR; MAPKAPK2; NUP153; RANBP2; NUP98; YWHAE; HSF1; EP300; NUP160; ATM; ATR; PTGES3; NUP188; CCAR2; NUP133; HSPH1; CREBBP; SIRT1; POM121; DNAJC2; DNAJC7; BAG1; NUP85; CHORDC1; HSPB8;	GO:1900034~regulation of cellular response to heat	41	77	53.2467532467532	0.0127710469725489	0.690790981441715	1	1	0.998899261230489	0.998899261230489	1
down	PLXNB2; CFLAR; AVIL; AP2A1; AGT; APOE; S100A9; FES; LYN; HSPA5; ATF1; CNR1; MDK; ITGA3; EPHA3; SERPINF1; RGS2; PRKCI; RAP1A; DYNLT1; RELN; SCN1B; EP300; PTK6; RAPGEF1; SCARF1; PRKD1; PPP2R5B; NFE2L2; NTRK2; P3H1; PLPPR5; DAB2IP; FBXO38; MOB2; MARK2; SETX; NEGR1; MAGI2; CAMK1D; GPC2; STMN2; RIT2; KATNB1; TMEM30A; DDX56; TENM3; KIDINS220; PLXNB3; FUT9; RAPGEF2; NPTN; LRRC7; TWF1; MUSK;	GO:0010976~positive regulation of neuron projection development	55	111	49.5495495495495	0.0129758159295796	0.697923942189862	1	1	0.998899261230489	0.998899261230489	1
down	CCS; FOXO3; STAU1; GSR; SOD1; PENK; CAT; EIF2S1; GPX1; GSTP1; HSPA1A; G6PD; CYBA; ATP2A2; NCF2; LONP1; SNCA; ETV5; PRKAA2; AIF1; SESN2; CYCS; PRDX1; STX4; PRKAA1; KEAP1; NFE2L1; NCF4; PRKD1; NFE2L2; TXNRD1; LRRK2; SUMO4; PRR5L; SETX; CPEB2; SIRT2; VKORC1L1; PNPT1; GPX8; ERO1A; NOX5; PINK1; FANCD2; NOX4; PPARGC1A; SLC7A11; MSRA;	GO:0034599~cellular response to oxidative stress	48	94	51.063829787234	0.0131378897821445	0.702640581154015	1	1	0.998899261230489	0.998899261230489	1
down	PSMD11; PSMD12; PSMD14; DVL1; SLC9A3R1; AXIN1; PSMD3; FOXO3; SNAI2; CTNND1; LRP4; LATS1; APOE; GLI1; IGFBP1; EGR1; MDK; IGFBP4; MCC; APC; PSMA3; PSMA4; PSMB4; DDIT3; PSMB10; MLLT3; PSMC4; NOTCH1; SOX9; CSNK1A1; PSMB2; GSK3A; EMD; NKX2-5; PSMD4; PSMA6; PSME3; PSMC5; PSMC6; DAB2; CAV1; PSME1; STK4; PSMD2; G3BP1; HDAC1; CUL3; RAPGEF1; PSME4; SHH; STK11; MAPK14; DAB2IP; SOSTDC1; RBMS3; SHISA6; NPHP3; SFRP1; AMER2; UBAC2; PSMF1; DVL3; SFRP2; PRICKLE1; KREMEN1; PSMD1; PFDN5; WWTR1; SOX17; CHD8; TCF7L2; CYLD; LATS2; CCDC88C; DKK4; AMFR; PSME2; PSMD13; RUVBL2; CSNK1A1L; TLE3; TLE4;	GO:0090090~negative regulation of canonical Wnt signaling pathway	82	179	45.8100558659218	0.0132419640824886	0.702640581154015	1	1	0.998899261230489	0.998899261230489	1
down	ATP6V0E1; ATP6V1G1; TFRC; ATP6V1B1; ATP6V1B2; ATP6V1C1; ATP6V0C; ATP6V1E1; ATP6V1A; DNM2; ATP6V0D1; CLTC; ARHGAP1; TCIRG1; RAB11B; HFE; LMTK2; ATP6V0D2; ATP6V0A1; MCOLN1; ATP6V0A4; ATP6V1H; ATP6V1D;	GO:0033572~transferrin transport	23	36	63.8888888888889	0.0133494671695225	0.702640581154015	1	1	0.998899261230489	0.998899261230489	1
down	TRABD2B; HRK; BCL2L11; TGFB1; TFRC; MMP1; CCK; RHOC; MMP3; RPS3; CDH5; SYK; VCP; TCL1A; SUMO1; RACK1; NRG1; BAX; BIK; SPIDR; PPP2R5B; BAK1; MPP7; DAB2IP; SLF2; FNIP1; BRK1; BMF; GNL3L; FAF1; SH3GLB1;	GO:0031334~positive regulation of protein-containing complex assembly	31	54	57.4074074074074	0.0135672108712739	0.702640581154015	1	1	0.998899261230489	0.998899261230489	1
down	WWP2; KPNA3; NPC1; SIVA1; CLDN9; EGFR; GYPA; TFRC; ITGB1; ITGAV; CTSB; CD55; ITGA5; HSPA1A; LAMP1; NCAM1; CD46; ITGA2; CR1; ITGB6; MRC1; GRK2; SERPINB3; CD86; EPS15; NUP153; CD81; DYNLT1; CXADR; SLC20A2; SLAMF1; DAG1; SELPLG; SLC10A1; SCARB1; TNFRSF14; ITCH; VAMP8; ACE2; WWP1; SLC52A1; VPS18; XPR1; LAMP3; F11R;	GO:0046718~viral entry into host cell	45	87	51.7241379310345	0.0136026820854366	0.702640581154015	1	1	0.998899261230489	0.998899261230489	1
down	ACTN4; FAM107A; ACTN1; LCP1; EZR; MARCKS; ADD1; AIF1; EPS8; SHROOM2; NEDD9; PAWR; CORO1B; SWAP70; LIMA1; BAIAP2; USH1C; RHOF; RHOB; BAIAP2L1; RND3; RHOA; PLS1; ESPN; RHOC; RHOBTB1; BAIAP2L2;	GO:0051017~actin filament bundle assembly	27	45	60	0.0137659788077734	0.702640581154015	1	1	0.998899261230489	0.998899261230489	1
down	SLC9A3R1; IKBKB; GAK; SEC16A; RAMP2; ROCK2; CLASP2; FLOT1; BAG4; TSPAN15; ATP1B1; ANXA2; CDH1; JUP; EZR; FLNA; FCER1G; AKT2; RDX; ACTN2; BSG; DPP6; P2RY1; EMP2; CD81; RAB10; RAB11A; RAP1A; SPTBN1; FCHO2; ANK3; DLG1; PPIL2; ROCK1; FLOT2; SLMAP; TMED2; ADIPOQ; WDR72; ZFYVE27; DENND4C; PACS1; TTC7B; PACS2; ZDHHC23; DPP10; ZDHHC22; TSPAN14; FGF13; KCNB2; MYADM; PIP5K1A; CRB3; PACSIN1; SMURF1; SCN3B; ZDHHC3; PKP3; RAPGEF2; MYO5A; F11R; RAB8B; RAB3B; RAB3A; FAM126B; PRAM1; RAB15; RAB3D;	GO:0072659~protein localization to plasma membrane	68	144	47.2222222222222	0.0139723203349392	0.702640581154015	1	1	0.998899261230489	0.998899261230489	1
down	SLN; SCD; KDM6B; PER2; ZBTB7B; HDAC3; JAK2; CNOT3; MFN2; GADD45G; FH; IGF1R; DBH; THRA; ADRB3; CD36; GJA1; CEBPB; APC; STAT6; SYK; GPR3; UCP2; CXCR4; ESRRG; HSF1; CAV1; GRB10; IL18; DYNC1H1; LPIN1; IRF4; ADIPOQ; DECR1; GNAS; FFAR4; ADIPOR2; PPARGC1B; APPL2; ZNF516; DIO2; ADIPOR1; PHOX2B; EPAS1; EHMT1; PDGFC; PPARGC1A; GHRL; PRKAB1;	GO:0120162~positive regulation of cold-induced thermogenesis	49	97	50.5154639175258	0.0141891574322096	0.702640581154015	1	1	0.998899261230489	0.998899261230489	1
down	NRP1; DYSF; LRG1; ARG1; JUN; WNT2; CYBA; SCG2; F3; NF1; NR4A1; HMGB2; ARNT; AKT1; THBS4; FLT4; KDR; HTR2B; MTOR; CXCL12; CAV2; CCL11; CCR3; CDH13; TEK; BMPR2; PRKD1; ECM1; HIF1A; EMC10; RICTOR; PROX1; SIRT1; PRKD2; GDF2; PLXNB3; CCL26; PGF; VIP;	GO:0001938~positive regulation of endothelial cell proliferation	39	73	53.4246575342466	0.0143190742921241	0.702640581154015	1	1	0.998899261230489	0.998899261230489	1
down	HOXA3; AGT; DBH; ACE; LIF; BGN; TGM2; AGTR2; JAG1; MDM2; RBPJ; MEF2C; BAX; BMPR2; BAK1; EPAS1; FOXC2; RSPO3; ATG5; DLL4; CHD7;	GO:0001974~blood vessel remodeling	21	32	65.625	0.0144028574925762	0.702640581154015	1	1	0.998899261230489	0.998899261230489	1
down	MYH9; ACTC1; TJP1; MYO18A; LURAP1; TRPM7; CNN2; PHACTR1; EPB41L4B; ALKBH4; LIMCH1; CDC42BPB; F11R; EPB41L2; FRMD5; EPB41; CIT; ROCK1; ROCK2; FRMD3; CDC42BPG;	GO:0031032~actomyosin structure organization	21	32	65.625	0.0144028574925762	0.702640581154015	1	1	0.998899261230489	0.998899261230489	1
down	ATG13; BAG3; PSEN1; RAB7A; RAB1A; TCIRG1; BECN1; ATG2A; WDR45B; WIPI1; KIAA1324; ATG14; PACS2; STX12; VMP1; AMBRA1; RAB33B; ATG5; MAP1LC3A; ATG3; WDR45; WIPI2; UBXN2B; ATG7; GABARAPL2; RAB1B; MAP1LC3B; TP53INP1; ATG16L2; GABARAPL1; PIK3C3; NSFL1C; BECN2;	GO:0000045~autophagosome assembly	33	59	55.9322033898305	0.0145212102244766	0.702640581154015	1	1	0.998899261230489	0.998899261230489	1
down	JAK2; EDF1; NGF; IGF1; HMGB1; CALM3; SKI; MMP9; ITGA2; MMP8; HMGB2; PPARG; PDX1; TRIM28; HES1; IRF4; SUMO4; SIRT2; MYOCD; HIPK2;	GO:0043388~positive regulation of DNA binding	20	30	66.6666666666667	0.0149085618395647	0.702640581154015	1	1	0.998899261230489	0.998899261230489	1
down	FOXP2; CFLAR; FLNB; NEURL1; SVIL; DCN; MYOG; NF1; MYF6; NR2F2; HOXD10; CASQ1; MEOX2; CSRP3; MYL6; RHOA; CAV1; MEF2C; EP300; KCNAB1; HLX; COL19A1; SIX1; MAPK14; TAZ; VGLL2; BVES; IGSF8; GPCPD1;	GO:0007519~skeletal muscle tissue development	29	50	58	0.0150695362969796	0.702640581154015	1	1	0.998899261230489	0.998899261230489	1
down	TMEM129; RNF103; SGTA; TRIM13; ERLIN1; USP19; HSPA5; HSP90B1; BAG6; VCP; UBE2G2; OS9; TRIM25; TMUB2; SYVN1; NPLOC4; STT3B; UBXN4; EDEM1; RNF185; DERL2; FBXO6; JKAMP; SEL1L; MAN1B1; AMFR; UBE2J1; ANKZF1; RNF175; SEL1L2; FBXO17; PSMC6; DNAJB14; SGTB; FBXO27; RHBDD2; UBE4A; AUP1;	GO:0030433~ubiquitin-dependent ERAD pathway	38	71	53.5211267605634	0.0151638942870308	0.702640581154015	1	1	0.998899261230489	0.998899261230489	1
down	MUSK; KALRN; KLK8; PLA2G6; B4GALT2; INSR; CCK; TH; ITGA5; DBH; GIP; NQO2; CREB1; CEBPB; CNR1; DRD1; ITGA3; HRH1; ADCY8; PSEN1; ITGA8; ATXN1; SLC8A3; PTEN; MAP1A; GRIN2A; ITPR3; CRTC1; ABCA7; ATAD1; LMX1A; JPH3; FGF13; NTAN1; CIC; SCN2A; PAIP2; SYT4; PLK2; KMT2B; SORCS3; NGF; NTF4;	GO:0007613~memory	43	83	51.8072289156626	0.0152791337636425	0.702640581154015	1	1	0.998899261230489	0.998899261230489	1
down	PPP6C; SEC16A; SEC22B; SEC31A; CNIH1; SEC24A; SEC24B; F8; TRAPPC2; F5; CD59; FOLR1; GRIA1; NSF; TRAPPC10; CSNK1D; NAPA; RAB1A; GOLGA2; STX5; CUL3; TMED2; PPP6R3; TRAPPC6B; TRAPPC5; CNIH3; SCFD1; TFG; SEC16B; RAB1B; CTSZ; PEF1; PPP6R1; SAR1B; KLHL21;	GO:0048208~COPII vesicle coating	35	64	54.6875	0.0153488774812898	0.702640581154015	1	1	0.998899261230489	0.998899261230489	1
down	TLR4; DDX3X; TNFSF14; ACTN4; PTP4A3; SASH1; NFAT5; EGFR; APP; EDN1; NR3C2; CD14; EIF2AK2; MMP8; RPS3; CALR; LIMS1; IRAK1; NLRP12; RHOA; RELA; EP300; IL18R1; IL18; TRADD; RC3H1; TRIM44; RBCK1; LRRC19; AGO3; NOD2; TERF2IP; TLR7; NOD1; HMGB1;	GO:1901224~positive regulation of NIK/NF-kappaB signaling	35	64	54.6875	0.0153488774812898	0.702640581154015	1	1	0.998899261230489	0.998899261230489	1
up	WNT9A; WNT9B; CCL16; FGF16; DHH; CXCL13; FGF17; FADS1; GREM1; SH2D1A; GRAP2; FGF18; CXCL14; AVP; TSHB; LHB; IL1B; C1QA; CXCL10; GJB1; INHBA; NMB; CCL3; MAPT; BMP2; CCL4; EDN3; AREG; TSHR; ADCYAP1; TAC1; NTF3; ADORA1; SRD5A2; SSTR3; TNFSF8; GJA4; VIPR2; CXCL5; PTGIR; LHX1; EFNA4; EFNB2; CCL23; IL2; FGF12; CX3CL1; CCL20; CXCL6; CRB1; TNFAIP6; LTB; ENPEP; CXCL9; GRAP; IHH; GPNMB; EFNB3; IL17A; CTF1; BHLHA15; CHST4; TFAP2C; FGF11; FCRL2; TSPAN32; FGF20; IL26; FGF21; GJB4; IL17C; FZD1; TNFRSF11A; ADRA2B; DRD2; FGFBP3; ADRB2; ADRA1D; ADRA2C; OR56A1; FGFBP1; FGFBP2; FJX1;	GO:0007267~cell-cell signaling	83	230	36.0869565217391	0.0154269957314354	0.88319135916446	1	1	0.999999379961111	0.999999379961111	1
up	KMO; IDO1; HAAO; TDO2; KYNU; KYAT1; IDO2; AADAT;	GO:0006569~tryptophan catabolic process	8	9	88.8888888888889	0.0158525712927977	0.88319135916446	1	1	0.999999379961111	0.999999379961111	1
down	GRIN2D; KALRN; CSTB; APP; CNP; GIP; DRD4; HOXD10; NTF4; GDNF; PBX3; PAFAH1B1; CXCL12; ARCN1; PPT1; ATP1A2; MECP2; GRIN1; EN1; EPS8; PUM1; SEZ6; DMBX1; TSC1; NTAN1; SEZ6L; ADAM22; FOXA2;	GO:0008344~adult locomotory behavior	28	48	58.3333333333333	0.0158740128691172	0.702640581154015	1	1	0.998899261230489	0.998899261230489	1
down	SH3PXD2B; CLPSL1; LRCOL1; AZIN1; CYB5B; GMFG; SOD1; IGF2; APOC1; CLPS; CTSA; NCF2; ALOX5AP; YWHAB; RFC1; GTF2F1; DDOST; APOBEC1; PSEN1; MMP15; MMP16; DAOA; DAD1; ARF1; PRKCE; CAV1; STX4; NCF4; HSPB2; GNAS; SH3PXD2A; CWF19L1; CLPSL2; PHACTR4; NCSTN; NSMAF; APH1A; MGST2; CIB1; PSENEN; SAE1; DNMT3L;	GO:0043085~positive regulation of catalytic activity	42	81	51.8518518518518	0.0161964799162408	0.702640581154015	1	1	0.998899261230489	0.998899261230489	1
up	TAX1BP3; DKK1; SIX3; NFATC1; GSC; VGLL4; HIC1; NFATC4; SFRP5; RNF43; NXN; SFRP4; NOTUM; FRZB; DACT3; CITED1; CXXC4; HMGXB4; CBY1; WIF1; SHISA2; NKD1; NKD2;	GO:0030178~negative regulation of Wnt signaling pathway	23	47	48.936170212766	0.0162809105037988	0.88319135916446	1	1	0.999999379961111	0.999999379961111	1
down	A2ML1; SPINT1; SPINT2; SPINK4; CST8; EPPIN; A2M; C3; TIMP1; CST3; CST4; CST1; CSTB; GAPDH; APP; ANXA2; LPA; CST2; FURIN; SPINK8; TFPI; PZP; CST5; SERPINB3; SERPINB1; LCN1; AKT1; RARRES1; SERPINB9; RENBP; SPOCK1; BST2; ROCK1; OVOS2; SPINK14; C3P1; ITIH5; WFDC8; WFDC13; WFDC12; PSMF1; SPOCK2; SPOCK3; CST11; CSTL1; WFDC10A; UBE2Z; WFDC1; BIRC6; CRIM1; FETUB; SERPINA13P; AGT; SERPINA4; SERPINA5; SERPINF1; SERPINI2; SERPINA12; SERPINA6; TIMP4; SERPINA2; SERPINA11; AHSG; SERPINA3; SERPINB5; TIMP2; SERPINB11; SERPINA9; SERPINB10;	GO:0010951~negative regulation of endopeptidase activity	69	148	46.6216216216216	0.0163674014633721	0.702640581154015	1	1	0.998899261230489	0.998899261230489	1
down	RAMP2; AGT; FOS; KRAS; NPPA; CRH; THBD; ITGA5; GIP; RARA; TGFB3; PSG1; PSG2; SCGB1A1; PTHLH; HPGD; ITGA2; PZP; IGFBP5; CAD; CD38; ADM; SLC19A1; NAMPT; PRLHR; PGF; STAT5B; FOSB; HSD11B2; PSG6; PSG7; PSG3; HFE; ADIPOR2; ABCC2; SLC38A2; TEAD3; SLC38A3; EPYC; SPHK2; CLIC5; MAGED2; PSG11; EPN1;	GO:0007565~female pregnancy	44	86	51.1627906976744	0.0165886293411387	0.702640581154015	1	1	0.998899261230489	0.998899261230489	1
down	TNFRSF10B; ATP2A1; SEC16A; BCL2L11; PLA2G6; ERN1; FLOT1; USP19; EIF2S1; THBS1; EEF2; HSP90B1; ATP2A2; CEBPB; ATF4; THBS4; DDIT3; TMEM33; PPP2CB; SRPX; EIF2B5; OS9; NFE2L1; MBTPS1; HERPUD1; TMTC3; ERN2; NRBF2; ERO1A; MAP3K5; ERP44; FICD; GORASP2; HYOU1; ERP27; PDIA3; PPP1R15B; TMEM259; PDIA4;	GO:0034976~response to endoplasmic reticulum stress	39	74	52.7027027027027	0.0166640341061511	0.702640581154015	1	1	0.998899261230489	0.998899261230489	1
down	ARID1A; APAF1; MYO1D; APP; CNP; ITGAM; SRC; NR2F2; DNAJB1; SSTR1; SSTR2; SSTR4; CCKAR; NKX2-1; ATRX; NOTCH1; NDST1; LRP2; E2F1; TOP2B; SHH; KDM2B; FRS2; DLC1; SETD2; TWSG1; PPARGC1A;	GO:0030900~forebrain development	27	46	58.695652173913	0.0167146547067033	0.702640581154015	1	1	0.998899261230489	0.998899261230489	1
down	ANGPT2; ENSA; PFKFB2; CTSV; ATG7; LDHA; THBS1; GIP; GLUL; GJA1; PFKL; EGR1; SREBF1; TGFBR2; HNF4A; CDKN1B; GIPR; EIF2B2; SESN2; PTEN; RHOA; VAMP2; GPLD1; PPARD; EIF2B5; NEUROD1; SMAD2; ADIPOQ; SLC30A8; SIDT2; UCN3; TXN2; TXNIP; TCF7L2; EIF2B4; IRS2;	GO:0009749~response to glucose	36	67	53.7313432835821	0.017010063197281	0.702640581154015	1	1	0.998899261230489	0.998899261230489	1
down	SMAD7; FOS; TGFB1; APOA1; JUN; ITGB1; FURIN; UBB; UBC; TGFB3; SKI; SKIL; SRC; HPGD; CREB1; CBL; PML; ARRB2; CDH5; TGFBR2; ID1; GDF5; PXN; RHOA; RPS27A; SMAD3; ACVR1; PTK2; ADAM9; PTPRK; SMAD2; ZYX; ARHGEF18; APPL2; ZMIZ2; PARD3; USP9X; SIRT1; SMAD5; TWSG1; HIPK2; SMURF1; LTBP3; CGN; ZMIZ1; USP15; F11R; DUSP22;	GO:0007179~transforming growth factor beta receptor signaling pathway	48	96	50	0.0171630655278653	0.702640581154015	1	1	0.998899261230489	0.998899261230489	1
down	SLC6A6; SLC6A9; SLC6A19; SLC16A10; SLC7A6; SLC6A18; SLC38A2; SLC6A14; SLC38A10; SLC38A3; SLC32A1; SLC38A1; SLC38A4; SLC36A3; SLC7A5; SLC7A7; SLC38A11; SLC7A10; SLC36A4; SLC36A2; SLC7A11; SLC36A1;	GO:0003333~amino acid transmembrane transport	22	35	62.8571428571429	0.0173416699824577	0.702640581154015	1	1	0.998899261230489	0.998899261230489	1
down	UBB; CD36; EDN2; STAT3; PIK3CA; NMU; PRKAA2; IRX3; AMPD2; EIF4G1; PRKAA1; MEX3C; METRNL; CRTC3; CRTC1; BMP8A; MFSD2A; FLCN; PASK; SGIP1; MLXIPL; PPARGC1A;	GO:0097009~energy homeostasis	22	35	62.8571428571429	0.0173416699824577	0.702640581154015	1	1	0.998899261230489	0.998899261230489	1
down	CASC3; CDC40; ZC3H11A; SLU7; EIF4E; TPR; HNRNPA2B1; U2AF2; NUP62; EIF4A3; NUP153; RANBP2; AGFG1; NUP98; EIF5A; SRSF3; SRSF2; SRSF11; SRSF4; NCBP1; CPSF1; NUP160; SRSF9; SRSF5; SRSF6; THOC5; DDX39B; SLBP; SRSF7; NUP188; THOC7; SRRM1; THOC2; NUP133; DHX38; SYMPK; POM121; YTHDC1; SMG1; FYTTD1; NUP85; POLDIP3; NXF2; NXF3; UPF2; NXF1; SMG5; CHTOP; RBM8A; MCM3AP;	GO:0006406~mRNA export from nucleus	50	101	49.5049504950495	0.0173590647663119	0.702640581154015	1	1	0.998899261230489	0.998899261230489	1
down	PLXNB2; SOCS1; NDUFS4; HUS1; APOA1; LYN; DRD1; ITPKB; PML; CDH5; STAT2; SESN2; PPP2CA; PTK2; CCDC88A; ATG14; FLCN; CADM4; FNIP1; PHIP; PPP1R9B; ROPN1; TLR8; TLR7; CCDC88C; CORO1C;	GO:0001932~regulation of protein phosphorylation	26	44	59.0909090909091	0.0175915243483921	0.702640581154015	1	1	0.998899261230489	0.998899261230489	1
down	DEPDC5; EIF2S1; HNRNPL; ATF4; TFEB; EIF2AK2; MAPK3; MAPK1; MTOR; DAP; SESN2; SESN3; NPRL3; PRKD1; SZT2; WDR59; RNF152; FLCN; SLC38A2; MAP3K5; MAP1LC3A; RRAGC; EIF2AK4; SH3GLB1; KPTN; DAPL1;	GO:0034198~cellular response to amino acid starvation	26	44	59.0909090909091	0.0175915243483921	0.702640581154015	1	1	0.998899261230489	0.998899261230489	1
down	HSP90B1; EIF2AK2; PPP2R1A; PPP2R1B; HTT; PPP2R2A; DMPK; PPP2R5C; PPP2R5A; PPP2R5B; PPP1R7; PPP2R5E; PPP6R3; PPP2R2D; PPP1R3B; ANKLE2; PHACTR4; PPP4R1; TSC1; PPP1R16A; PPP4R2; PPP4R1L; PPP6R1; SHOC2; PPP1R2; PPP6R2;	GO:0043666~regulation of phosphoprotein phosphatase activity	26	44	59.0909090909091	0.0175915243483921	0.702640581154015	1	1	0.998899261230489	0.998899261230489	1
down	ANGPT2; PDPK1; RAMP2; DDAH1; SASH1; RAPGEF3; PAK4; C3; LRG1; ITGB2; FGF1; ITGB1; PRKCB; THBS1; SP1; HMOX1; CTSH; APELA; RRAS; ANXA3; C6; F3; JUP; XBP1; FLT1; ITGAX; C5AR1; CXCR2; GRN; CDH5; ADM; KDR; TGFBR2; BRCA1; STAT3; GATA4; CCL11; CCR3; BTG1; RHOB; RUNX1; TEK; GAB1; STIM1; PRKD1; NFE2L2; ECM1; HIF1A; EMC10; PIK3R6; CCBE1; MTDH; HIPK1; GATA6; SIRT1; SFRP2; PRKD2; HIPK2; SMOC2; GDF2; AGO2; PGF;	GO:0045766~positive regulation of angiogenesis	62	131	47.3282442748092	0.0176045570298179	0.702640581154015	1	1	0.998899261230489	0.998899261230489	1
down	SOCS3; DVL1; SOCS1; PDPK1; GMFG; GADD45B; THY1; RB1; PTPRC; GSTP1; NF1; ADORA2A; AKT1; NF2; SNCA; PPM1F; TSC2; GNAQ; YWHAG; MLLT1; PAK2; DNAJC3; RGN; PKN1; CEP85; SPRED1; CAMK2N1; ITPRIP; DEPTOR; SMCR8; PYDC1; CHP1; WWTR1; TAOK3; WNK1; SMYD3; PRKRIP1; GSKIP;	GO:0006469~negative regulation of protein kinase activity	38	72	52.7777777777778	0.0176620351749003	0.702640581154015	1	1	0.998899261230489	0.998899261230489	1
down	DDX3X; CFLAR; LAMTOR5; TNFSF14; DNAJB6; TNFAIP8; NGF; RAF1; GPX1; THBS1; VIL1; SRC; CD44; POR; ADORA2A; AKT1; ARRB2; SNCA; ARRB1; SERPINB9; RPS6KA3; CDKN2D; YWHAE; XIAP; MDM2; PAX2; NAIP; HERPUD1; RPS6KA1; CARD16; SH3RF1; FNIP1; TFAP2B; SFRP2; USP47; LAMP3; BIRC3; BIRC2;	GO:0043154~negative regulation of cysteine-type endopeptidase activity involved in apoptotic process	38	72	52.7777777777778	0.0176620351749003	0.702640581154015	1	1	0.998899261230489	0.998899261230489	1
up	WNT9B; FGF2; GLI3; BMP2; BMP4; HOXA11; PBX1; LHX1; GPC3; FGF8; WNT4; PAX8; PKD2; PTCH1; NPNT; FAT4; ADAMTS16; EYA1; CITED1; SALL1; WNT6;	GO:0001658~branching involved in ureteric bud morphogenesis	21	42	50	0.017859556186788	0.88319135916446	1	1	0.999999379961111	0.999999379961111	1
down	CNOT1; RTL1; AXIN1; GALR2; PI15; EDIL3; RAD21; NOBOX; EDF1; DIAPH2; GADD45B; GCM2; CREG1; GADD45G; ARIH2; CLPTM1; IGF2; FGF1; HOXD4; ERG; PIM1; FGF3; BMP1; HOXB1; LIF; EN2; FLG; RPS4Y1; ACRV1; CRABP1; HOXC12; HOXD13; GPX4; CUX1; MEOX2; PLXNA3; ARHGDIB; AGFG1; TCL1A; TBX4; KLF3; HILS1; TPI1; DCAF7; ELF3; DAB2; MC1R; CREM; NOTCH2; CD164; TNP2; MCL1; FOXL1; NFATC3; GRIN2B; ATR; CCIN; CDK13; ZNF267; DIP2A; HLX; ODF1; PSME4; WTAP; TGIF1; ALX1; CSRP2; NFE2; ODF4; TSNAXIP1; TAF7L; SPDYA; ZC3H13; ZMYM4; ANO1; TMEM198; MCTP2; CBLL1; H1FNT; BHLHA9; PIWIL3; SPRED2; LDB1; MORC1; CATSPERD; DZIP1; PLCZ1; ERC1; PRR15; PHC2; WDFY3; RYBP; MINK1; BANP; KDM1B; LSM14A; TDRD9; PHC3; CCHCR1; FAT3; PAQR8; ASZ1; TCP11; PHF3; CCL17; RREB1; USP7; PTP4A1; CCDC120; PIWIL1; TRERF1; SLC26A8; EYA3; MNT; TSNAX; APOL2; LSM14B; SPATA16; AMN; TDRD1; CADM1; NXF2; NKX2-4; PPDPF; CATSPERB; HMX1; SCUBE2; HELLS; MBNL3; SPATA6; SOHLH2; FMN2; NPAP1; DSPP; BTBD7; ADAMTS9; THEG; DKK4; CFDP1; EBF1; GTF2IRD1; PLXNA1; TUBD1; ANGPTL2; CEP131; PRELID1; DRG1; NOSIP; ADAM18; CHST2; RNF114; EPHB4; EPHB2; FLT1; MEF2D; CSF1R; CDH23; CDH11; ZFX; ERBB2; CDH5; IGF1R; DDR1; INSR; VDR; FLT4; FGFR3; CDH6; LMTK2; CDH19; CDH8; NR1I3; RARA; MEF2C; CDH15; BCL11A; EPHA7; CDH13; FSTL5; THRA; EGFR; MEF2A; ERBB3; MEF2B; EPHA3; MST1R; FLT3; CDH7; FSTL1; NTRK2; CDH10; SPINK6; MUSK; EPHA6; CDH17; CDH1; PPARG; TEK; MET; EPHB1; PPARD; KDR; EPHA10; NR1H2; CDH18; SPINK5;	GO:0007275~multicellular organism development	206	513	40.1559454191033	0.0178693087286428	0.702640581154015	1	1	0.998899261230489	0.998899261230489	1
down	RPLP1; RPLP2; SRPRA; RPS17; RPS2; RPL35A; RPS4Y1; RPS3; RPS12; RPL13; RPL10; RPL9; SRP14; RPL13A; RPS27; RPL27A; RPL28; RPS9; RPS5; RPS10; RPL29; SRP54; RPL26; RPL37A; SEC61A1; RPL37; RPS7; RPS8; RPS15A; RPS14; RPS18; RPS29; RPS13; RPS11; RPS6; RPS28; RPL30; RPL31; RPL8; RPL41; RPS27A; RPS21; RPL24; RPL18A; RPL36;	GO:0006614~SRP-dependent cotranslational protein targeting to membrane	45	89	50.561797752809	0.0179313422033494	0.702640581154015	1	1	0.998899261230489	0.998899261230489	1
down	WASL; STX6; STX10; DNAJB6; MYCBP2; VIP; TPR; USP8; RAB9A; RAB14; FKBP1A; SUMO1; RACK1; SYCP1; SIX1; MMD; TESK1; AAK1; RABGAP1L; TBC1D1; ATCAY; PLEKHM2; MMD2; TRIM22; FBXW7; TRIM5; SWAP70; VPS4A; AFDN;	GO:0032880~regulation of protein localization	29	51	56.8627450980392	0.0180737484635086	0.702640581154015	1	1	0.998899261230489	0.998899261230489	1
up	IGKV2-28; IGKV2D-30; IGKV3D-20; IGKV1-12; IGLC7; IGKV2-29; TYROBP; SH2D1A; LILRA1; IGKV1D-33; IGKV1-33; IGKV1-39; IGKV1D-16; IGKV1D-12; IGKV2D-40; IGKV2D-28; IGKV3-15; IGLV2-8; IGLV3-19; IGLV3-1; IGLV6-57; TRAV8-4; IGHV1-69; IGHV1-46; IGHV3-11; IGHV3-48; IGHV3-23; IGHV3-13; IGHV3-53; IGHV3-30; IGHV2-70; COL2A1; IGLV7-43; IGKV1-16; IGKV1D-39; ICAM1; IGKV5-2; CD3E; COL1A2; CD3G; IGLC6; ITGA4; CD19; HLA-G; VCAM1; IGHV1-2; KLRC1; CD34; CD40LG; KIR2DL3; KIR3DL1; CD300C; FGL1; CD226; COLEC12; TREML2; NCR3LG1; LAIR1; CLEC4G; TREML1; PIANP; OSCAR; RAET1E; CD200R1; KIR2DL4; SLA2; SLAMF7; TREM2; HCST; CD300A; SIGLEC9; BTNL8; ICOSLG; BTNL3; BTNL10; BTN1A1; MOG; ERMAP;	GO:0050776~regulation of immune response	78	216	36.1111111111111	0.018130671237599	0.88319135916446	1	1	0.999999379961111	0.999999379961111	1
up	CLDN5; TLR2; ATXN1L; FOSL1; ARF4; PTN; COMT; NTSR1; PRKAR2B; PTGS2; GRM5; GMFB; CNTN2; ARC; NPAS4; NLGN4X; JPH4; SYT11; SHANK3; SLC12A5; PAK6; PAK5; CNTNAP2; SLC24A2; NRXN1; SLC8A2; VDAC3; NRXN3;	GO:0007612~learning	28	62	45.1612903225806	0.0187021452266368	0.88319135916446	1	1	0.999999379961111	0.999999379961111	1
down	TNFRSF11B; KCNK3; XPO1; CHUK; NPC1; AGPAT2; SPINK4; ABCA1; SOD1; APOA1; RPN2; APOD; FABP3; LYN; THBS1; GIP; TOP1; ENO3; TIMP2; POR; ITGA2; PAM; DRD1; MDK; CCND1; ITGA3; HMGB2; CALR; PTPRM; CD38; ABCC1; CTNNB1; ADRA1A; SRP14; TGFBR2; COL18A1; NNMT; HTR2B; GATA4; CDKN1B; MAP1B; SLC6A11; GCLM; ARRB1; PGF; CPT1A; CDK9; NCKAP1L; HDAC4; SRP54; SST; DAD1; UBE2B; ADAM17; HSD11B2; SLC34A1; ATR; NEUROD1; PDE3A; TGIF1; CA9; BLOC1S3; SFRP1; TP53I13; TFAP2B; GATA6; DVL3; SFRP2; CPB2; USP47; SLC22A12; AMELX; GAD1; TIMP4; NPAS2; TXN2; ABCA2; ATG5; WFDC1; PARP4; MYO6; RPH3AL; OR56A4; ANXA1; JUN; JUNB;	GO:0042493~response to drug	86	193	44.559585492228	0.0187872106225589	0.702640581154015	1	1	0.998899261230489	0.998899261230489	1
down	CNOT3; FKBP6; PABPC1; FMR1; NCBP1; SND1; PIWIL3; ERI1; TDRD9; ASZ1; CNOT9; DDX17; PIWIL1; CNOT6L; TDRD1; CNOT2; AGO2; CNOT11; TNRC6B; FAM172A;	GO:0031047~gene silencing by RNA	20	31	64.5161290322581	0.018844149728414	0.702640581154015	1	1	0.998899261230489	0.998899261230489	1
up	TTC26; NKX2-2; WDPCP; GLI3; BMP4; ARL3; EVC; ROR2; FOXF1; PTCH1; IHH; STIL; ARL13B; HHAT; TTC21B; TMEM17; IFT20; DZIP1L; IQUB; TCTN2; IFT27; BOC; TMEM231; IFT57; PKD2L1; IFT80; IFT52; PTCH2; DHH;	GO:0007224~smoothened signaling pathway	29	65	44.6153846153846	0.0190101730318052	0.88319135916446	1	1	0.999999379961111	0.999999379961111	1
down	PSMD11; PSMD12; PSMD14; CHUK; PSMD3; PSMA3; PSMA4; PSMB4; AKT1; PSMB10; PSMC4; PSMB2; PSMD4; PPP4C; PSMA6; PSME3; PSMC5; PSMC6; SKP1; RELB; PSME1; PSMD2; BIRC3; BIRC2; IKBKE; PSME4; PSMF1; PSMD1; MAP3K14; PSME2; PSMD13; DICER1; RELA; REL;	GO:0038061~NIK/NF-kappaB signaling	34	63	53.968253968254	0.0190870187588992	0.702640581154015	1	1	0.998899261230489	0.998899261230489	1
up	IL6; TNFSF4; IGHV2-26; IGHV3-53; IGHV3-49; IGHV1-69-2; IGHG4; IGLC7; IGHV3-15; IGHV3-64; IGHV4-28; IGHV2-70; IGHD; IGHV1-69; IGHV4-4; IGHV3-73; IGHV3-23; IGHV3-13; IGHV1-2; IGHV1-18; IGLL5; IGHV1-24; IGHV3-72; IGHV3-74; IGHV3-48; IGHV3-11; TRBC2; IGHE; IGHV3-20; IGHV1-46; IGHV1OR15-9; IGLC6; IGHV4-31; IGHV4-61; IGHV1-3; IGHV3-66; IGHV1-58; IGHV3-35; IGHV3-30; IGHV3-43;	GO:0050871~positive regulation of B cell activation	40	98	40.8163265306122	0.0199544089432134	0.88319135916446	1	1	0.999999379961111	0.999999379961111	1
up	MSTN; MRAS; TBX1; SGCE; FKTN; VAMP5; CRYAB; CXCL10; PAX3; MSX1; CENPF; LBX1; SMTN; CAV3; EVC; FOXO4; EGR3; SGCG; FHL1; ITGA7; FRG1; TEAD4; TWIST1; SGCA; CTF1; TRIM72; TCF23; MKX; SGCD; HBEGF; TCF12; ANKRD2; ALX4; JPH1; COPRS; ITGB1BP2; ITGA11;	GO:0007517~muscle organ development	37	89	41.5730337078652	0.0200355132642472	0.88319135916446	1	1	0.999999379961111	0.999999379961111	1
