down	SYCE3; MGAT4D; BTBD18; SPATA31C2; ARNTL; USP9Y; ADAM10; MSH4; CLOCK; RAD51C; BCL2L11; CTSV; HSF2BP; GJB3; CRTAP; PIAS1; OR7C1; SUN1; REC8; SBF1; SGPL1; FSTL3; HERC2; SOD1; APOB; SLC4A2; SERPINA5; GLI1; SPATA31D3; SPATA31C1; IGF2R; CCNB1; TSPAN8; GGT1; TBP; PRKACG; ATP2B4; FSHR; BRD2; YY1; CALR; ARID4A; KDM5A; AXL; GPX4; CETN2; ADCYAP1R1; ATRX; CRKL; BAG6; NOTCH1; SOX9; NR2C2; DNM2; BCAP31; LIMK2; RAD23B; HILS1; ACTR1A; UBE2B; PAFAH1B2; CDK16; HSF1; B4GALNT1; E2F1; BNC1; KHDRBS1; BCL2L1; GOLGA3; POU4F2; PRDX4; SMAD4; BIRC3; ATP1A4; CCIN; CYLC2; CCNI; FAM50A; DMC1; PUM1; ODF1; ACOX1; SYCP1; SPA17; TESK1; STK11; RNF151; ODF4; TSNAXIP1; ARID4B; TDRD12; BRDT; HERC4; TAF7L; MEIG1; SOHLH1; ATAT1; GGNBP1; TXNDC8; CATSPERG; SPATA31E1; SETX; PIWIL3; MROH2B; GGN; MORC1; C11orf74; NLRP14; SPATA24; CATSPERD; DZIP1; UBR2; CCDC36; TBC1D21; ADGRG2; ASPM; SPATA6L; CCDC155; ZFP41; BOLL; TEX19; SPATA5; KDM2B; TDRD7; PSMA8; WDR48; SPATA20; SLC2A14; CREB3L4; ZNF296; TCP11; IFT81; GHSR; DAZL; AZIN2; RPL39L; SCMH1; MAEL; CALR3; DEFB118; ADCY10; ODF3; TESK2; IMMP2L; TSNAX; PAIP2; SPATA25; HERPUD2; DPCD; IFT27; SPATA9; LGR4; SPATA16; TDRD1; TEX15; MOV10L1; SHCBP1L; TSGA10; ROPN1B; SPEF2; WDR33; SPATC1L; XRN2; ING2; VCX; GGNBP2; TP63; RAD21L1; VIPAS39; USP42; PLEKHA1; ELL3; DDX4; CCDC87; ASF1B; SPATA6; SOHLH2; NPAP1; RAI14; THEG; NDRG3; DNMT3L; ADAM29; ADAM28; TCFL5; SPATA2; CEP131; AURKC; RUVBL1; YBX2; ADAM18; TESMIN; RNF114; PCDHGA4; PCYT1B; DMRT1; DNMT3A; GGT2; DAZAP1; GGT3P; PRSS44; GGT5; SPATA32; HIST1H1T; NR0B1;	GO:0007283~spermatogenesis	205	407	50.3685503685504	0.0142590205231509	0.811759895536237	1	1	0.999989480410868	0.999989480410868	1
up	NRP1; LAT; ADAM11; ITGA10; ITGB2; ITGB1; PLEK; HCK; ITGA5; FGR; ITGAM; SRC; CEACAM1; VAV1; ITGAL; ITGAX; FCER1G; ITGAE; ITGAD; ILK; ADAM9; NEDD9; ZYX; FERMT3; TSPAN32; FERMT1; VAV3; TLN1; PRAM1;	GO:0007229~integrin-mediated signaling pathway	29	96	30.2083333333333	0.0143562380308295	0.482721793083553	1	1	0.999999948713468	0.999999948713468	1
up	ALDH1A2; ADA; ASS1; KRAS; PKM; XBP1; SRD5A1; ACAT1; AK4; CEBPG; PKD1; HMGCS1; FPGS; DDX39B; HLX; ARID5B; MED1; LSR; PTCD2; JARID2; GNPNAT1; NODAL; SEC63; RARA;	GO:0001889~liver development	24	75	32	0.0144926526807018	0.482721793083553	1	1	0.999999948713468	0.999999948713468	1
up	CLDN4; BHLHE40; PER1; ASS1; NTRK1; SERPINE1; TOP1; CDK4; JUND; TPH1; NOS2; NAMPT; EGR3; KLF10; CRY1; AANAT; METTL3; ARNTL2; RBM4B; HEBP1; NOCT; TIMELESS; HS3ST2; PROKR2;	GO:0007623~circadian rhythm	24	75	32	0.0144926526807018	0.482721793083553	1	1	0.999999948713468	0.999999948713468	1
down	FZD9; TERT; PDPK1; XRCC2; JAK2; CRLF1; SOD1; HRAS; PRKCG; JUN; NEFL; HSP90AB1; TGFB3; HSPD1; EN2; MAG; RASA1; MDK; PTPRZ1; GRN; AXL; CORO1A; GABRA5; PRKCI; PIK3CA; GDF5; MSH2; GCLC; GCLM; MTNR1B; STAR; PSEN1; LIG4; FGF8; DLX1; STXBP1; BTG2; SET; POU4F1; GRIN1; EN1; BAX; BCL2L1; LRP1; CLN3; ROCK1; PTK2B; NFATC4; KIF14; SIX1; ITSN1; SNCB; NTRK2; CPEB4; BHLHB9; GFRAL; TFAP2D; KDM2B; NDNF; TFAP2B; AGAP2; FOXB1; CITED1; FAIM2; PINK1; BARHL1; FOXQ1; AMBRA1; ADNP; HIPK2; DNAJC5; FGF20; NRBP2; PPARGC1A; SIX4; BOK; SNX6; NTF4; BDNF;	GO:0043524~negative regulation of neuron apoptotic process	79	138	57.2463768115942	0.0148706640604608	0.811759895536237	1	1	0.999989480410868	0.999989480410868	1
up	HAX1; RIPK2; RAPGEF3; AVP; TNF; APP; BCL2; TXN; HCLS1; LIF; CD44; NOS1; CALCR; ARRB2; PTGS2; SNCA; ARRB1; ANGPT1; CAPRIN2; RPTOR; PARK7; PDCD10; TRIM6; TNKS1BP1; FNIP2; HDAC6; TENM1;	GO:0033138~positive regulation of peptidyl-serine phosphorylation	27	88	30.6818181818182	0.0151890325341647	0.493118338487241	1	1	0.999999948713468	0.999999948713468	1
up	RIPK2; DYRK3; NTRK1; FES; CSF1R; LYN; HCK; FGR; KIT; FGFR1; SRC; FER; FLT1; EPHA2; FLT4; MATK; ABL2; MAP2K3; CLK2; MAP2K6; EPHB1; TEK; MERTK; STYK1; AATK; HIPK1; HIPK4; TTN; NEK1; CAMKK2; IL12RB2; PEAK1; DYRK4; ABI3; BAZ1B; ALK;	GO:0018108~peptidyl-tyrosine phosphorylation	36	127	28.3464566929134	0.0152146789739636	0.493118338487241	1	1	0.999999948713468	0.999999948713468	1
down	PDLIM1; CDC42EP2; SLC9A3R1; ARHGEF11; ARPC5; PDPK1; FLNB; ABL1; PDGFA; PFN1; ADRA2A; EPB41; BCR; NF1; TNXB; CFL1; ITPKA; CORO1A; PFN2; NF2; ADD1; PAFAH1B1; CRK; ATXN3; RAC3; CDC42; RND3; RAC1; ARHGEF5; ABR; ROCK1; PRKG1; TRIP10; INF2; FGD3; ARHGEF18; FGD6; MOB2; SSH2; DAAM2; PHACTR4; SPIRE2; DOCK2; ARPC1A; FGD4; ARHGEF17; TESK2; AGAP2; CORO1B; KLHL1; DIAPH3; TAOK2; ARHGAP26; CORO2B; DAAM1; WASF2; MICALL2; SHROOM2; PDLIM2; SMTNL2; CAPZA2; PDLIM4; SSH3; SDAD1; ARFGEF3; ARHGEF10; LIMK2; PDLIM5; OPHN1; SPECC1L; PDLIM3; MICALL1; CSRP3; TESK1; PRICKLE4; IQSEC2; FHL3; IQSEC3; MICAL3; AMOTL1; LIMK1; CSRP1; RAC2; EHBP1; SHROOM3; RHOU; RHOV; ARHGEF10L;	GO:0030036~actin cytoskeleton organization	88	157	56.0509554140127	0.0155460539523855	0.811759895536237	1	1	0.999989480410868	0.999989480410868	1
up	MEIOC; RNF8; KIT; RFX2; HSPA2; NSUN2; TARBP2; ODF2; MEI1; NUP210L; CEP57; PLD6; TTC21A; ACRBP; QKI; BBS4; RNF17; ZMYND15; IQCG; MKKS; CDYL; RIMBP3; RIMBP3C; FAM9B; SYCP3; FAM9C;	GO:0007286~spermatid development	26	84	30.952380952381	0.0155922952288164	0.499288045932187	1	1	0.999999948713468	0.999999948713468	1
up	BCL2; CCND1; SLC11A2; HAMP; SLC6A3; FXN; HIF1A; CYBRD1; TFR2;	GO:0010039~response to iron ion	9	18	50	0.0164427352039069	0.519207770588929	1	1	0.999999948713468	0.999999948713468	1
up	FLNA; LIMS1; VASP; CAPZA1; ACTB; RHOA; ACTG1; ILK; FLNC;	GO:0034329~cell junction assembly	9	18	50	0.0164427352039069	0.519207770588929	1	1	0.999999948713468	0.999999948713468	1
up	MYL12B; DYSF; CACNA1H; CHRNG; TPM2; TPM1; DES; RYR1; HRC; MYL9; MYH11; EMD; ACTA2; ACTG2; TPM4; MYL5; ASPH; SNTA1; LTB4R; MYLK; PABPN1; TTN; SORBS1; KCNIP2; MYOF; TLN1; TMOD2; TMOD1; NOS1; TNNT1; LMOD3;	GO:0006936~muscle contraction	31	106	29.2452830188679	0.0165669122717987	0.519207770588929	1	1	0.999999948713468	0.999999948713468	1
down	AGRN; BIN1; ABLIM1; SPTBN2; VILL; SIPA1L3; OBSL1; PRPF40A; ACTL6B; CSPG5; FTCD; PAK4; HLA-DRB1; KRT6A; THY1; KRT16; TUBA3C; TUBA3D; SPTB; DMD; KRT13; ANK1; EPB42; KRT15; KRT4; MDK; CFL1; PRKCI; SOX9; CCL11; ZNF135; ARHGAP4; SPTBN1; KRT76; DST; SPTAN1; CYLC2; CCDC6; UGT8; SH3D19; FGD3; ZMYM4; BRWD3; PADI6; FGD6; RHOU; MAEA; MICAL3; KRT25; FITM2; PDZD8; MICAL1; PHIP; NECTIN2; SH3KBP1; SIPA1; FGD4; CNN2; CCL13; CECR2; SEMA6A; GPR35; KRT84; BRWD1; DIAPH3; ABI2; MARK1; PLCE1; PAK5; MAST1; KLHL20; CDC42BPB; ACTL7B; ACTL7A; PCLO; PACSIN1; MAST4; MAST2; MAST3;	GO:0007010~cytoskeleton organization	79	139	56.8345323741007	0.0167261012876581	0.811759895536237	1	1	0.999989480410868	0.999989480410868	1
down	LEPROT; ATG13; ARIH2; RAC2; HSPA1L; GSK3A; NPEPPS; UBE2D3; SREBF2; PRKAA1; FZD5; RHOU; HUWE1; MICALL2; UBL4B; BAP1; FBXW7; RNF31; PINK1; UBL5; HPS4; TOMM7; USP36; SAE1;	GO:1903955~positive regulation of protein targeting to mitochondrion	24	31	77.4193548387097	0.0170104954048119	0.811759895536237	1	1	0.999989480410868	0.999989480410868	1
up	TOR1A; PQBP1; ULK1; SNAPIN; GBA; APP; SRF; AREG; PTPRM; RAB13; WDR5; RAB11A; CDK5; STX3; ALKBH1; RASGRF1; RAB35; ADGRF1; UNC5A; DTNBP1; CLMN; EHD1; BLOC1S4; STMN3; VAPA; NCDN; USP21; TBC1D24; RAPGEF2; LYN; FRY; SAMD14; MANF;	GO:0031175~neuron projection development	33	115	28.695652173913	0.0170123052934329	0.52165202251932	1	1	0.999999948713468	0.999999948713468	1
up	ANKRD28; USO1; PDCD6; F5; CD59; AREG; LMAN1; SEC13; RAB1A; TMED2; TRAPPC6B; MCFD2; CNIH3; TBC1D20; GORASP1; RAB1B; PREB; TRAPPC2L; TRAPPC4; TRAPPC1; KLHL21;	GO:0048208~COPII vesicle coating	21	64	32.8125	0.0172623041348267	0.52165202251932	1	1	0.999999948713468	0.999999948713468	1
up	DVL2; KDM1A; TNF; IL1B; ESR1; APP; KIT; SRF; ANXA3; HCLS1; FOSL1; TRIM21; IL10; DDIT3; GTF2A2; CEBPG; TRAF2; TRIM14; ARID5B; PPP2R5B; TAF12; NFAM1; FANK1; NODAL; PARK7; TRIM34; TRIM31; RNF41; RGCC; BEX1; CYTL1; TNFRSF11A;	GO:0051091~positive regulation of DNA-binding transcription factor activity	32	111	28.8288288288288	0.0176435919360116	0.52165202251932	1	1	0.999999948713468	0.999999948713468	1
up	LYN; FGR; CD24; FPR2; BTLA;	GO:0002768~immune response-regulating cell surface receptor signaling pathway	5	6	83.3333333333333	0.017836868656133	0.52165202251932	1	1	0.999999948713468	0.999999948713468	1
up	LGALS9; RIPK2; TLR2; PIK3AP1; TNIP2;	GO:0034134~toll-like receptor 2 signaling pathway	5	6	83.3333333333333	0.017836868656133	0.52165202251932	1	1	0.999999948713468	0.999999948713468	1
up	CDC7; UBE2L3; UPF1; TIPIN; TIMELESS;	GO:0044770~cell cycle phase transition	5	6	83.3333333333333	0.017836868656133	0.52165202251932	1	1	0.999999948713468	0.999999948713468	1
up	MMP9; PLAUR; PARK7; CAAP1; PIH1D1;	GO:2001268~negative regulation of cysteine-type endopeptidase activity involved in apoptotic signaling pathway	5	6	83.3333333333333	0.017836868656133	0.52165202251932	1	1	0.999999948713468	0.999999948713468	1
up	NBN; BLM; UBE2N; SETMAR; RAD50; KAT5; BARD1; SMARCAD1;	GO:0000729~DNA double-strand break processing	8	15	53.3333333333333	0.0178368716388331	0.52165202251932	1	1	0.999999948713468	0.999999948713468	1
up	ESR1; SRC; UFM1; RUNX1; CARM1; KCTD6; DDRGK1; UFSP2;	GO:0033146~regulation of intracellular estrogen receptor signaling pathway	8	15	53.3333333333333	0.0178368716388331	0.52165202251932	1	1	0.999999948713468	0.999999948713468	1
up	PPP1R11; SRGN; FCGR2B; PTGER4; NLRP12; SYT11; RGCC; HDAC9;	GO:0050710~negative regulation of cytokine secretion	8	15	53.3333333333333	0.0178368716388331	0.52165202251932	1	1	0.999999948713468	0.999999948713468	1
up	KMO; HYAL3; ICAM1; CCL3; TFPI; CCL2; CEBPB; NFKB1; GBP1; GBP2; RORA; CHI3L1; SIRPA; LCN2; ANKRD1; HIF1A; MYLK3; ZC3H12A; CACTIN; UPF1; KLF2; CCL4; CCL20; CCL1; CCL23;	GO:0071347~cellular response to interleukin-1	25	81	30.8641975308642	0.0179271965798833	0.52165202251932	1	1	0.999999948713468	0.999999948713468	1
up	CD3EAP; MTSS1; DOK2; CSF1R; LYN; CSF1; BDKRB2; TEK; RAPGEF1; AHI1; IL31RA; RASGRP4; PILRB; SH2B3; TNK2; SLA; FLT4; NEDD9; FGR; FES; HCK; FER; MERTK; EPHB1; FLT1; NTRK1; LCP2; CASS4; EPHA2; KIT; FGFR1; SHC1; SRC; ALK;	GO:0007169~transmembrane receptor protein tyrosine kinase signaling pathway	34	120	28.3333333333333	0.0180014505424456	0.52165202251932	1	1	0.999999948713468	0.999999948713468	1
up	EEF2K; PIK3R2; CFLAR; TBC1D4; PARP1; CDK4; SRC; CEACAM1; SLC2A4; FER; XBP1; SRD5A1; RAB13; YWHAG; PPAT; FOXO1; PDE3B; RAB31; TRIB3; SLC25A33; INPP5K; SORBS1; CAPN10; ERRFI1; HDAC9; MYO5A; LPIN1; PKM;	GO:0032869~cellular response to insulin stimulus	28	94	29.7872340425532	0.0183039953951932	0.52165202251932	1	1	0.999999948713468	0.999999948713468	1
up	POM121C; DNAJB6; NUP155; BAG3; NUP214; NUP62; MAPKAPK2; SEC13; RAE1; HIKESHI; NUP188; NUP54; RPTOR; NUP93; NUP37; NUP35; HSPH1; AKT1S1; SIRT1; DNAJC2; NDC1; AAAS; CHORDC1; BAG5;	GO:1900034~regulation of cellular response to heat	24	77	31.1688311688312	0.0183893861019299	0.52165202251932	1	1	0.999999948713468	0.999999948713468	1
down	ODAM; ROCK2; HIP1R; OR2A4; ABL1; PDGFA; HRG; EZR; CORO1A; MTOR; CRK; EPHA5; PRKCD; LRP1; BST1; BST2; ARHGEF5; ROCK1; GPM6B; CDK5R1; CDK10; DIXDC1; RICTOR; TAOK1; ARHGEF19; GRHL3; MLST8; ARHGAP35; TAOK2; CORO2B; SH3BP1; F11R; ARHGAP40; ARHGAP44; RND3; ARHGAP17; RAC1; RAC2; RHOBTB2; RHOB; ARHGAP28; RHOU; RHOC; RHOF; RHOBTB1; RHOV; CDC42; RAC3;	GO:0032956~regulation of actin cytoskeleton organization	48	77	62.3376623376623	0.0185964758839713	0.811759895536237	1	1	0.999989480410868	0.999989480410868	1
down	HYKK; PMS2P1; TK2; PIK3CD; PDXK; BCKDK; PPIP5K2; PAPSS2; NADK; TK1; PRKCG; PGK2; PRPS2; PRPS1L1; MAPK3; EPHB2; AKT1; CIITA; CHKA; STAT3; PIK3CA; PIK3CB; MTOR; PI4KA; PIK3CG; LIMK2; MVK; COASY; PAK2; PMS2P11; PMVK; CERKL; NADK2; IDNK; PPIP5K1; TAOK1; N4BP2; NAGS; SGMS2; COQ8A; PANK1; DCAKD; RFK; ITPKC; PANK2; UCK2; TOLLIP; PANK3; FN3KRP; ETNK1; PANK4; ETNK2; UCKL1; AK3; AK6; GK5; FAM20C; FAM20B; XYLB;	GO:0016310~phosphorylation	59	99	59.5959595959596	0.0186442680236009	0.811759895536237	1	1	0.999989480410868	0.999989480410868	1
up	NDUFA4; COX7A2L; ATP2C2; ATP6V1G1; SLC25A14; SLC2A10; SLC25A27; MT-CO2; MT-CO3; ATP6V1C1; COX7B; ATP6V0C; ATP6V1E1; SLC11A2; CLCN3; CLCN4; UCP2; UCP3; NNT; SURF1; SLC15A2; SLC9B1; SLC9B2; SLC15A3; ATP6V0D2; SLC4A11; ATP6V1C2; ATP6V1E2; SLC46A1; ATP6V0B; SLC2A9; SLC9A2; SLC9A8;	GO:1902600~proton transmembrane transport	33	116	28.448275862069	0.0186982078113427	0.52165202251932	1	1	0.999999948713468	0.999999948713468	1
down	WWP2; KPNA3; NPC1; SIVA1; CLDN9; CLDN1; EGFR; GYPA; TFRC; ITGB3; ITGAV; HSPA1A; LAMP1; NCAM1; CD46; ITGA2; CR1; ITGB5; ITGB6; GRK2; ITGB7; DPP4; SERPINB3; AXL; EPS15; NUP153; CLDN6; CD81; DYNLT1; CXADR; HYAL2; SLAMF1; SCARB2; DAG1; SELPLG; SLC10A1; NECTIN1; MOG; CDHR3; SCARB1; TNFRSF14; ITCH; VAMP8; WWP1; CLEC4M; SLC52A2; CD209; SLC52A1; VPS18; UVRAG; XPR1; LAMP3; F11R;	GO:0046718~viral entry into host cell	53	87	60.9195402298851	0.0187770256225026	0.811759895536237	1	1	0.999989480410868	0.999989480410868	1
up	NRP1; TNFSF12; PDCD6; DYSF; LRG1; ANG; BMP2; F3; IL10; FLT4; ACVRL1; CCR3; TEK; EGR3; HIF1A; RPTOR; MYDGF; SIRT1; PDCL3; ZNF580; PLXNB3; VEGFB; PGF;	GO:0001938~positive regulation of endothelial cell proliferation	23	73	31.5068493150685	0.0188288937014075	0.52165202251932	1	1	0.999999948713468	0.999999948713468	1
up	RGL2; LAT; DOK2; RASGRP1; NTN1; KRAS; TP53; CDK2; SHC1; CDKN1A; RALGDS; DHCR24; BRAP; RAPGEF6; RIT1; SYNGAP1; USP28; PARK7; RASSF1; PLK2; RALB; USP50; RRAS;	GO:0007265~Ras protein signal transduction	23	73	31.5068493150685	0.0188288937014075	0.52165202251932	1	1	0.999999948713468	0.999999948713468	1
up	EIF2S1; HSPA5; CCL2; ATF3; DDIT3; NFE2L2; EIF2AK3;	GO:0036499~PERK-mediated unfolded protein response	7	12	58.3333333333333	0.0188849937599711	0.52165202251932	1	1	0.999999948713468	0.999999948713468	1
up	IL18RAP; CXCR2; F2RL1; CXCL6; IL18; KMT2E; PREX1;	GO:0042119~neutrophil activation	7	12	58.3333333333333	0.0188849937599711	0.52165202251932	1	1	0.999999948713468	0.999999948713468	1
up	TNF; SRC; LCP1; MSN; RHOA; FSCN1; ASAP1;	GO:0071803~positive regulation of podosome assembly	7	12	58.3333333333333	0.0188849937599711	0.52165202251932	1	1	0.999999948713468	0.999999948713468	1
down	GFRAL; CCDC88C; STK3; MAP2K5; OXSR1; MAP3K1; PAK4; MAP2K2; SLK; NRK; MAP4K2; TAOK1; TAOK2; MAP4K1; MAP2K1; STK25; MAP2K7; MAP3K14; PAK3; MAP2K4; PAK2; STK24; MINK1; PAK5; MAP3K4; PAK1; MAP3K3; STK39; MAP3K19; SBK2; STRADB; MAP3K2; STK4; TAOK3;	GO:0031098~stress-activated protein kinase signaling cascade	34	50	68	0.0191058151800879	0.811759895536237	1	1	0.999989480410868	0.999989480410868	1
up	HIP1; PIK3C2A; DVL2; EREG; ARPC2; PIP5K1C; DNAJC6; VAMP4; AP2A2; EPN2; LDLR; AVP; ADRB2; CFTR; AREG; RAB5A; M6PR; CBL; ARRB2; ARRB1; AP2S1; ACTB; ACTR3; YWHAG; UBA52; AP2B1; YWHAZ; ACTG1; OCRL; YWHAH; DHCR24; CCDC88A; STAM; HBEGF; PACSIN2; SNX9; SAR1A;	GO:0061024~membrane organization	37	134	27.6119402985075	0.0191237460311962	0.52165202251932	1	1	0.999999948713468	0.999999948713468	1
up	NRP1; EGR2; HOXB2; PLXNA3; SEMA3F; SEMA3A;	GO:0021612~facial nerve structural organization	6	9	66.6666666666667	0.0191573052097967	0.52165202251932	1	1	0.999999948713468	0.999999948713468	1
up	BLM; ZRANB3; DONSON; SMARCAL1; TIPIN; TIMELESS;	GO:0048478~replication fork protection	6	9	66.6666666666667	0.0191573052097967	0.52165202251932	1	1	0.999999948713468	0.999999948713468	1
up	ACTN1; FLNA; AIF1; EPS8; BAIAP2; BAIAP2L1;	GO:0051764~actin crosslink formation	6	9	66.6666666666667	0.0191573052097967	0.52165202251932	1	1	0.999999948713468	0.999999948713468	1
up	APP; SLFN14; HSPA5; BACE1; LRRK2; A3GALT2;	GO:0071287~cellular response to manganese ion	6	9	66.6666666666667	0.0191573052097967	0.52165202251932	1	1	0.999999948713468	0.999999948713468	1
up	TNKS; PARP1; TERF1; PINX1; SLX1A; TNKS2;	GO:1904357~negative regulation of telomere maintenance via telomere lengthening	6	9	66.6666666666667	0.0191573052097967	0.52165202251932	1	1	0.999999948713468	0.999999948713468	1
up	CCT5; CCT3; CCT8; CCT4; CCT2; CCT7;	GO:1904871~positive regulation of protein localization to Cajal body	6	9	66.6666666666667	0.0191573052097967	0.52165202251932	1	1	0.999999948713468	0.999999948713468	1
down	PRSS38; PRSS37; PSMB11; GGT3P; CLCA1; GGTLC3; TPP1; ADAMDEC1; UBD; EIF3H; KLK8; MMP20; ADAMTS4; PAPLN; ECEL1; NAPSA; F2; PLG; CFB; LTF; MMP1; CAPNS1; CFI; HPN; C2; CTSD; CAPN1; PRSS2; MMP2; CTSG; LPA; CTSH; PRSS56; GZMB; CTSA; RBP3; PEPD; BMP1; APEH; CPB1; ACAN; PCSK2; GGT1; GZMH; ENDOU; KEL; MST1; DPP4; PSMB5; LAP3; TPP2; LCN1; GGT5; VHL; CASP3; MMP13; MASP1; GZMK; MMP14; MMP15; NUP98; CASP7; CASP6; YBEY; RHBDL3; ADAMTS20; RELN; PHEX; DCD; ADAMTSL3; HTRA3; LACTB; ACY1; UBE3A; PAPPA; ADAM15; FGL2; GGTLC2; HABP2; MBTPS1; CLCA4; NEDD8; PRSS8; MEP1B; TYSND1; MMEL1; PRSS36; AGBL2; AGBL4; CPZ; CTRB2; ASTL; DESI1; GGT6; RHBDF2; PRSS55; DPP8; THSD4; TMPRSS11A; TMPRSS7; PRSS41; OVCH2; TMPRSS9; TMPRSS11B; DPP9; ATG4D; VASH2; TRABD2A; AMZ2; TMPRSS12; UNC5CL; PRSS58; KDM8; FBXL6; ADAMTSL1; ADGB; NPEPL1; AGBL5; PRSS33; ADAM32; ADAMTS17; TRAPPC12; PYDC1; ADAMTS14; NCSTN; PIGK; TANK; NUDT16; HMCES; CNDP1; CNDP2; AGBL1; CPNE1; ADAM2; NRIP2; GGTLC1; PRSS22; ADAM7; ADAMTS10; RNPEP; TASP1; RNPEPL1; FOLH1B; CHMP1A; XPNPEP3; FBXO6; DPP3; KLK14; ADAM22; SENP1; CTSZ; KLK11; MALT1; ADAMTS1; USP25; PRSS50; GGT7; FBXO3; ADAM30; ADAM29; ADAM21; ADAMTS6; ADAM28; KLK13; FBXW2; TMPRSS11E; DNPEP; MMP17; AGTPBP1; SPG7; RHBDD3; NAALAD2; ADAM18; ATG4B; MMP24; ST14; CPQ; TLL2; CPA5; CAPN15; CAPN11; CAPN8; ERAP1; CELA3A; CAPN5; CAPN9; CELA2B; TPSAB1; PRSS54; CPA6; CAPN6; PLAT; LVRN; CELA2A; NPEPPS; PGA3; TRHDE; ERAP2; HGFAC; PRCP; CELA3B; PRSS44; PGPEP1; CAPN12; PRSS16; CPA1; PGC; PGPEP1L; THOP1; ENPEP; CPA4; PRSS29P; PRSS1; YME1L1; ERMP1; CLPX;	GO:0006508~proteolysis	216	436	49.5412844036697	0.0196453930813532	0.811759895536237	1	1	0.999989480410868	0.999989480410868	1
up	SPTA1; BCL2; ACTN1; EMP2; ARF1; CGNL1; DBN1; ERMN; BRK1; RND1; BIN3; EVL; SHROOM4; LMOD3; TPM2; MYO1G; RHOG; TMOD1; TMOD2; CORO1C; HIP1; MYO7A; RHOA; TPM1; SAMD14; MYO5A; TTN; CORO6; MYO15A; MYO1E; MYO1F; TPM4; MYO1H; MYO5C;	GO:0007015~actin filament organization	34	121	28.099173553719	0.019729150768224	0.535269795933525	1	1	0.999999948713468	0.999999948713468	1
up	PSMD12; PSMD14; PSMA7; TBL1X; TNKS; RECK; SRC; PSMC3; NFKB1; PSMB1; PSMA1; PSMA3; PSMB8; PSMA5; PSMB4; PSMB6; PSMC4; PSMD8; PSMB3; PSME3; PSMC1; ILK; PIN1; FAM53B; KANK1; PSME4; PSMD6; AMER1; LRRK2; WLS; CAPRIN2; TTC21B; PSMB7; TNKS2; GSKIP; DKK2; CSNK1G1; GPC5; PPM1N;	GO:0090263~positive regulation of canonical Wnt signaling pathway	39	144	27.0833333333333	0.0208383337135738	0.551427834544827	1	1	0.999999948713468	0.999999948713468	1
up	TIMM21; GRPEL1; TOMM20L; TIMM23; TOMM20; TIMM17A; DNAJC19; DNLZ; DNAJC15;	GO:0030150~protein import into mitochondrial matrix	9	19	47.3684210526316	0.0209898813846309	0.551427834544827	1	1	0.999999948713468	0.999999948713468	1
up	TLR4; FFAR3; FFAR2; RIPK2; TLR2; TNF; ADAM17; HIF1A; TSLP;	GO:0032722~positive regulation of chemokine production	9	19	47.3684210526316	0.0209898813846309	0.551427834544827	1	1	0.999999948713468	0.999999948713468	1
up	TLR4; KPNA6; TNF; TICAM1; GBP5; CLEC7A; NOD2; APPL1; TLR6;	GO:1900017~positive regulation of cytokine production involved in inflammatory response	9	19	47.3684210526316	0.0209898813846309	0.551427834544827	1	1	0.999999948713468	0.999999948713468	1
up	HAX1; NRP1; FES; HCK; HCLS1; CDK5; TEK; BAIAP2L1; BAIAP2;	GO:2000251~positive regulation of actin cytoskeleton reorganization	9	19	47.3684210526316	0.0209898813846309	0.551427834544827	1	1	0.999999948713468	0.999999948713468	1
up	RBL1; BCL6; NAMPT; YBX1; CDK6; SIRT1; ZKSCAN3; PLK2; FBXO5;	GO:2000773~negative regulation of cellular senescence	9	19	47.3684210526316	0.0209898813846309	0.551427834544827	1	1	0.999999948713468	0.999999948713468	1
down	PSMB11; WWP2; ARNTL; TRIM38; CLOCK; PSMD3; SPOP; TRIM13; UBE4B; HERC2; FBXO45; PSMA4; PSMB9; PSMB5; PML; CTNNB1; IFI27; PSMB10; CDC34; PSMB2; GSK3A; ATXN3; PSMD4; VCP; PSMA6; UBE2D3; PSMC5; UBE2H; PSMC6; PPP2CB; UBE2B; MDM2; UBXN1; PSME1; PSMD2; MTA1; PPP2R5C; BIRC2; CUL3; KIF14; PCBP2; DDB1; HECTD3; RNF187; SPOPL; FBXL19; TRIM72; SIRT2; ZNRF1; PSMA8; ZFAND2B; KCTD13; RFFL; PSMF1; FBXW5; UBE2W; PELI1; NEDD4L; PSMD1; RNF126; RBCK1; TBL1XR1; TRIM9; USP44; RNF186; KLHL42; FBXL17; TBX21; PSME2; STUB1; PSMD13; FAF1; KLHL20; SMURF2; WWP1; UBXN2B; UBE2U; RMND5A; DCAF11; FBXW7; NSFL1C; AREL1; PLAA; TRIM3; UBE2G1; SHARPIN; RMND5B; RAD23B; MAEA; SIAH3; SPSB3; ITCH; SPSB1; UBE3D; SPSB2; KCTD2; CUL4B; TRIM2; SPSB4;	GO:0043161~proteasome-mediated ubiquitin-dependent protein catabolic process	99	183	54.0983606557377	0.0210816619557977	0.811759895536237	1	1	0.999989480410868	0.999989480410868	1
down	CHEK1; PDPK1; ROCK2; OXSR1; PRKCA; PRKACA; TAF1; GRK2; CAD; MAPK1; AKT1; TTK; TGFBR2; MTOR; MAPK8; CLK1; GSK3A; GSK3B; MAP2K1; PRKCD; CAMK2D; DYRK1A; CDK5R1; CDK10; PRKD1; MARK2; LMTK2; PRKD2; MYLK2; HIPK2; HIPK3; WNK1; STK39; TBK1; SBK1; CDC42BPG; DYRK1B; CIT; ROCK1; CDC42BPB; DYRK2; CDC42BPA;	GO:0018107~peptidyl-threonine phosphorylation	42	66	63.6363636363636	0.0211228741530908	0.811759895536237	1	1	0.999989480410868	0.999989480410868	1
down	DHRS12; PXDNL; C5orf63; ASPDH; MOXD2P; SDR42E2; NCF1C; FADS2P1; KDM4E; AKR1B15; PLOD2; PIR; CYB561D2; UTY; CCS; MGST3; KDM6A; HR; PLOD3; UGDH; FMO6P; PHF2; ALOX12B; SC5D; ALDH1L1; BBOX1; KDM4B; CRYZL1; AIFM1; LDHA; GLUD1; DHFR; CYB5R3; PAH; SOD1; F8; CYP1A1; CYP1A2; CYP2E1; LIPF; LDHB; P4HB; CYP21A2; DBH; FTH1P19; DHRS4L1; MGST1; ACADM; MTHFD1; IMPDH2; BCKDHA; CYBA; CYP4B1; PDIA4; P4HA1; TYR; DAO; UQCRB; HPGD; CYP11B1; NQO1; CBR1; POR; AOC1; IMPDH1; BCKDHB; GPX3; RRM1; ACADL; KDM5A; BLVRB; SDHA; SRD5A2; RRM2; FMO4; UQCRC1; HIBADH; PRDX2; PYCR1; CYP2C19; CBS; GPX4; HSD17B3; HSD17B2; DCT; KDM5C; MTHFR; ACADSB; ALDH3B2; FMO5; FASN; GLUD2; AKR1D1; AKR1C2; HCCS; DIO3; GFER; SESN3; PCBD1; CYP4F2; HSD11B2; CYP4F8; DHODH; CYP27A1; BDH1; CYP4A11; AKR1C1; PRDX1; LOXL1; CYP4F3; DPYD; PRDX4; SELENBP1; DHRS2; PDIA5; LBR; CRYM; PTGR1; JMJD1C; MSMO1; RPE65; ME3; AOC3; P3H1; GFOD2; ALDH1L2; GLYR1; HSD17B12; PHYHD1; AKR1C8P; CYP4A22; NDUFAF5; ASPHD1; RSBN1; TXNDC8; KDM4D; NXN; TTC19; DHRS7B; HEPHL1; CYP4F22; RETSAT; DUS1L; RSBN1L; OGFOD3; DHRS4L2; PAOX; MTHFD1L; CYP20A1; DHRS11; DHRS13; CYP26C1; KDM7A; AGMO; QSOX2; COX15; CYB5R4; MICAL3; P4HA3; HSD17B13; CYP4Z1; P3H2; TPH2; MSRB3; ALDH16A1; RDH10; CYP4X1; CYP4Z2P; KDM8; D2HGDH; ZADH2; CYB561D1; FADS6; KDM1B; CYB561A3; PCYOX1L; RDH13; HSD17B11; SCCPDH; PDPR; KDM2B; AKR7L; MICAL1; STAB2; PXDN; RDH5; KIAA1191; FOXRED1; OXNAD1; HPDL; FAXDC2; AKR1E2; EGLN2; DHRS1; AIFM3; GPX7; DDO; SDHC; HSD17B10; TXN2; COQ7; HEPH; TXNDC17; ALKBH7; DHRS4; DOHH; HTATIP2; ADI1; HIGD2A; ALOXE3; BCO2; EGLN1; KDM4C; GSTO2; ACAD9; L2HGDH; RDH14; VAT1L; CYP4F12; GPHN; TMLHE; HIF1AN; GFOD1; P4HTM; RDH8; TECR; WWOX; DHCR7; GRHPR; AASS; PRODH2; MIOX; KDM5B; NDOR1; MSRA; SARDH; CYP8B1; PHF8; HIGD1A; KDM2A; CRYL1; MSRB2; CMAHP; KDM3A; MMACHC; CYP2A7; CYP2U1; CYP2J2; CYP2D7; CYP2G1P; CYP2A6; CYP2F1; CYP26A1; STEAP3; CYP2S1; PTGES;	GO:0055114~oxidation-reduction process	256	526	48.6692015209125	0.0212398336899418	0.811759895536237	1	1	0.999989480410868	0.999989480410868	1
down	PIK3CD; PITPNM1; PIK3C2B; CDIPT; PIP5K1B; SYNJ2; INPP4B; INPPL1; SYNJ1; SBF1; PLCG2; RAB4A; PIK3CA; PIK3CB; PI4KA; PIK3CG; BMX; PTEN; RAB14; ARF3; VAC14; MTMR1; MTMR2; MTMR3; SLC27A1; PIK3C3; PIP4K2C; FIG4; PIK3R3; INPP5D; CDS1; MTMR8; SH3YL1; PLEKHA8; INPP4A; RUFY1; PIK3R4; PIP5K1A; PITPNM3; PITPNM2; MTMR12; PLEKHA2; PLEKHA1; INPP5E; SACM1L; PI4KB; PIKFYVE;	GO:0006661~phosphatidylinositol biosynthetic process	47	76	61.8421052631579	0.0216063277425185	0.811759895536237	1	1	0.999989480410868	0.999989480410868	1
down	MYH9; MYH10; ACTC1; TJP1; CNN3; CDC42BPA; MYH14; MYO18A; LURAP1; TRPM7; CNN2; EPB41L4B; ALKBH4; CDC42BPB; F11R; EPB41L5; EPB41L2; EPB41L3; EPB41; CIT; ROCK1; ROCK2; EPB41L4A; CDC42BPG;	GO:0031032~actomyosin structure organization	24	32	75	0.0216447846787265	0.811759895536237	1	1	0.999989480410868	0.999989480410868	1
down	KIF28P; POLRMT; DNM1L; TERT; FANCG; CLUH; ESRRA; ALAS1; RAB3A; PRDX3; PHB; HMGCL; LONP1; CEBPA; HCFC1; CAV2; CXADR; CYCS; GABPA; GABPB1; NRF1; MAN2A1; WDR81; VPS13D; MTFR2; VPS13C; CAMKMT; ADGRG6; TFB1M; CHCHD10; MIEF2; CEP89; YME1L1; PHB2; HSD17B10; EPAS1; PINK1; SHARPIN; SIRT3; SIRT5; PPARGC1A; STOML2; AGTPBP1; BCS1L; SIRT4; DNAJA3; RHOT1; CHCHD2P9; ATAD3B; SPG7; CHCHD2; ATAD3A; SQSTM1;	GO:0007005~mitochondrion organization	53	88	60.2272727272727	0.021661244785305	0.811759895536237	1	1	0.999989480410868	0.999989480410868	1
up	HAX1; RGL2; TNF; LYN; FGR; KIT; CD28; FGFR1; SRC; HCLS1; NCF1; FLT1; CBL; F2RL1; MAZ; TGFB2; TEK; PPARD; IL18; ANGPT1; PIK3AP1; PIK3R5; MYDGF; SIRT1; HCST; NTRK1;	GO:0014068~positive regulation of phosphatidylinositol 3-kinase signaling	26	87	29.8850574712644	0.0216831189144016	0.564664363875579	1	1	0.999999948713468	0.999999948713468	1
up	DCDC1; CDC7; ENSA; DYRK3; TACC1; CDC123; RNF8; KLHL18; TNKS; SMC2; RALB; CDK4; ZNF16; RCC1; CCND1; CDK2; NCAPD3; BRCC3; CDK7; DYNLT3; TERF1; ANAPC15; RAN; TUBA1B; RAE1; CDK3; CDK6; CDK5; NSUN2; CKAP5; NEDD9; MAPRE1; SGO2; PMF1; BORA; DCLRE1A; TUBA1A; CHMP1B; NCAPG2; ANKLE2; BRSK2; SYCP3; SYCE1; SPICE1; NUP37; CDC26; MPLKIP; NEK9; SKA2; STAG1; SPDL1; BOD1; LMLN; NEK1; KIF20B; TSG101; HAUS7; TUBA1C; PELO; HAUS8; TIPIN; CINP; SYCP2; ANAPC1; DSN1; REEP4; ZWILCH; CENPJ; KMT5A; LATS2; SMC4; ARL8B; MIS18A; KLHL21; ANAPC4; FBXO5; ANAPC10; TIMELESS; KNSTRN; MAD1L1; ANAPC7; CDC16;	GO:0051301~cell division	82	347	23.6311239193084	0.0221859148881072	0.569621279212398	1	1	0.999999948713468	0.999999948713468	1
up	SGK1; MAFG; MITF; PRDM1; PLAU; PF4; FES; KIT; TAL1; SAT1; NFKBIA; NOS2; PTGER2; BID; JAG1; CXCL9; CCDC88A; PLCD3; NKX2-3; SIRT1; CHRNA10; EGLN3; TOPORS; FANCL; GHRL; OSGIN1; CELA1; TIMELESS; ANXA1; FGR; TGFB2; ALK; SLA; BCL6; HCK; BRICD5; LYN; FER; GKN3P; TFAP2E; JUND; TNK2; SRC;	GO:0042127~regulation of cell population proliferation	43	163	26.3803680981595	0.0222520583761485	0.569621279212398	1	1	0.999999948713468	0.999999948713468	1
