DGE	Genes	Process~name	num_of_Genes	gene_group	percentage%	P-value	Benjamini and Hochberg (FDR)	 Hommel singlewise process	Bonferroni single-step process	Hommel singlewise process	Hochberg step-up process	Benjamini and Yekutieli
up	NKX6-3; EFCAB7; MCIDAS; OVOL3; TLR4; SUPT5H; ARNTL; WASL; AGRN; MEIS1; NR5A2; DDX3X; NFIB; RFXANK; KMT2D; OVOL1; MEIS2; PHOX2A; IRF6; IKBKB; CASK; PPP1R12A; ZNF609; KDM6B; SMAD7; CHUK; PLSCR1; TP73; FOXN1; SOX12; HDAC3; TLR3; CLOCK; FGF10; NKX2-8; TET3; CRX; HOXC11; ATMIN; RIPK2; TBX1; FOXO3; TCF21; CHP2; TLX2; AIRE; MED14; ZNF292; ZIC3; CCNT1; LMX1B; GALR3; BRD4; TBL1X; LRP5; PROP1; MAF; NR1I2; RPS6KA5; GCM2; RPS6KA4; STK16; KLF7; PRPF6; ABLIM3; CAMTA2; SIX3; IL33; DDX58; ECD; HAND1; EGFR; FOS; HRAS; TGFB1; IGF2; PF4; RAF1; PLA2G1B; CD3D; IL4; FGF1; EDN1; JUN; RB1; PGR; ADRB2; DCN; HEXB; YES1; SP1; GLI1; MET; FGF4; NFIC; HOXD4; HOXC4; FGF2; HMGB1; WNT2; HOXB7; UBB; UBC; GLI2; MYBL2; RARA; TGFB3; IRF1; VDR; ESRRA; SRF; BMP4; SKI; XRCC6; HOXD8; OSM; IRF2; HCLS1; DRD2; POU2F1; LIF; ETS2; MYOG; ATF2; FOSL2; VEGFA; HIVEP1; PAX1; TCF4; TCF3; CREB1; EPCAM; HMGA1; JUNB; HOXB4; TAL1; CEBPB; XBP1; SPI1; BMP7; EGR1; ATF1; ATF4; ATF6; TNFRSF1A; TFEB; TFE3; EN2; RXRA; POU3F2; HOXA5; BCL3; HNF1A; S1PR1; TAF1; FGFR2; BMP5; NR4A1; SFPQ; MYF6; PAX7; YY1; PAX6; HMGB2; MAPK3; ARNT; ELK4; TEAD1; HOXD10; MSX1; ARID4A; HOXD3; TLX1; AKT1; OTX2; ELF1; GTF2H1; CIITA; CTNNB1; GTF2F1; RORA; HOXD13; DRD3; SOX18; SOX11; ZNF76; SREBF1; ZEB1; BRCA1; MMP12; GDNF; PBX2; STAT3; ETV6; HNF4A; ELK3; STAT1; STAT6; TXK; WAS; CDKN2B; ETV4; NAMPT; GATA4; NKX2-1; ATRX; NOTCH1; CDX1; ID4; RFX2; RFX3; SOX2; SOX9; NRIP1; NR2C2; SLC11A1; CDK8; EVX1; CEBPA; CEBPD; GSK3A; MEOX2; ETV1; ASCL1; CDK9; SMARCA2; SMARCA4; STAT5B; RPS6KA3; ZNF131; ZNF143; PDX1; GBX2; NKX2-5; FOSB; PRRX1; NR1H2; MLLT6; CDH13; FOXA1; PKNOX1; PAX9; HDAC4; SOX8; CD81; IL2; ACTR3; ACTR2; HAND2; ISL1; HNRNPK; ESRRG; CNBP; RPS27A; PPP3R1; YBX1; NKX6-1; JAG1; PRKDC; ELF3; SMAD3; HOXA4; HSF1; HNRNPU; E2F1; FOXK2; FLI1; SPIB; MEF2A; MEF2B; SP3; PAX5; PAX2; KMT2A; RELA; UBE3A; GRIN1; RNASEL; EN1; RBPJ; GABPA; GABPB1; PPARA; EP300; TEF; TFCP2; SMARCB1; BPTF; POU4F2; NFIA; TCF15; TP53BP1; FOXI1; NFATC3; PRDM2; RLF; FADD; MAP2K5; NR5A1; ATM; FZD5; SMAD4; SQSTM1; MED21; RIPK1; HDAC1; NEUROD1; SNW1; BMPR2; KLF5; CBFB; NFYC; IL18; VEZF1; TFDP1; TFDP2; E2F2; HES1; NFE2L1; HNF4G; IRF3; NCOA6; NR1I3; MORF4L2; PPP2R5B; IRF4; E2F5; PCBP1; RPS6KA1; SHH; SIX1; NEUROD2; NCOA1; SMAD2; USF2; ZFHX3; ZIC1; E2F4; HLF; MAPK14; IL17A; POU2AF1; NRF1; IFI16; FOXD1; PTPRN; RFX4; GLYR1; CDON; ARID4B; AKIRIN2; DCAF6; SOHLH1; UTF1; HES5; FHL5; MYSM1; MLIP; IER5; CREB3L3; PLAG1; GRHL2; TET2; ZNF746; JMJD6; CDC73; TAF2; DUX4L9; CRTC1; MAMSTR; RNF111; CREB3L2; MED25; ASXL2; SETX; MAVS; AKNA; TFAP2D; STRA8; PCGF5; LDB1; BCL9L; NLRC5; METTL23; PPARGC1B; RFX6; CRLF3; CREBRF; ARID3B; SIRT2; ASXL1; MYOCD; SPIC; RNF10; PAF1; ZBTB38; GLIS1; NFATC2IP; ZMIZ2; MAFA; NCOA7; CTCFL; GABPB2; OSR1; FEZF2; KLF14; SP7; LMX1A; GLMP; LMO7; PHIP; AUTS2; ARNTL2; TFAP2B; LPIN2; RTF1; NR4A3; MAML1; RREB1; CREBBP; EZH1; KAT2B; DDX17; ATOH1; COPS5; GATA6; SMARCC1; FOXJ1; ARHGEF2; IRF7; MED12; WBP2; SFRP2; FUBP3; RAX2; ZBED3; MAML3; IFT74; NEUROD6; IL17F; NR1H4; CITED4; CSRNP1; SIN3A; UHRF1; PHOX2B; EYA1; RIT2; TBX5; ELF4; NDN; KLF6; PITX2; NPAS2; EPAS1; ARID3A; ATF6B; CITED2; MESP1; OVOL2; PAGR1; IER2; HELZ2; TBL1XR1; PRKD2; FOXP3; EGLN1; WWTR1; ALX4; CSRNP2; IRF2BPL; NUCKS1; IL25; EPC1; MIXL1; HIPK2; TP63; BCAS3; SMYD3; BARX1; NOD2; SENP2; CHD8; SLC40A1; MLXIPL; IL26; ASH1L; TLR9; SIRT7; SALL1; HOXC10; WWOX; FOXJ2; SENP1; CALCOCO1; CHD7; ZNF219; PPARGC1A; HEY2; LHX3; MLX; TBK1; MED13; KLF15; GDF2; AGO1; INO80; MYO6; PLAGL1; CELA1; PLAGL2; FOXJ3; HDAC5; RUVBL2; FOXA2; RAX; THRAP3; KLF13; PYGO1; NR2E1; SALL2; MTF2; KDM3A; TRAF6; KLF12; DMRT2; DMRT1; USP16; KLF2; GMEB1; IKBKG; NCOA3; FOXO6; ONECUT3; MGA; SOX13; TBX2; LHX6; HIF3A; TBX20; POU6F2; ZNF148; KAT6B; EBF3; NPAS3; LHX1; LRP5L; HOXA2; NKX1-2; SETD3; CAMTA1; LHX5; KDM1B; EBF1; ZNF382; POU2F2; LAGE3; MAX; CTAG2; HMGB3; RAI1; STAT2; POU5F2; IKZF3; SOX10; TAF4; SMARCA5; TBX18; TBR1; HOXC9; LPIN1; SRY; SOX1; NFATC4; DLX3; CTCF; ZNF835; IKZF1; POU3F4; PAXBP1; CCDC160; PTOV1; DLX2; ASXL3; SBNO2; EBF2; THRA; SOX5; DPF1; CRTC2; LHX8; SOX6; PROX2; PCGF6; NCOA2; KAT8; LHX9; POU6F1; DR1; HOXB9; RELB; RXRG; POU5F1B; KMT2C; SIM1; CRTC3; CDK13; RSF1; POU3F3; NFATC2; TEAD2; NKX2-2; JUP; IKZF2; HOXD9; ATAD2B; ZNF740; DLX6; SOX14; IKZF4; TBX21; LDB2; DPF2; TCF20; DPF3; ZNF462; KAT6A;	GO:0045944~positive regulation of transcription by RNA polymerase II	627	1138	55.0966608084358	0	0	0	0	0	0	0
up	TMSB15B; CDC42EP2; INPPL1; MYO1B; SORBS3; DIAPH2; AVIL; SORBS2; PLA2G1B; ALDOA; RAC2; PRKCI; ARHGAP25; CCL11; CAV3; BCAR1; CLRN1; CDC42; TMSB4X; TMSB10; DLG1; FAT1; DBN1; FHOD3; PDLIM3; RUFY3; PPARGC1B; ARHGAP12; CCDC155; WHAMM; POF1B; ARHGEF2; SH3KBP1; TRPV4; RHOF; EVL; SHROOM4; SH3BP1; CD2AP; KPTN; SHROOM3; MYO1G; MYO5B; MYO6; RHOG; TMOD1; RND3; RHOA; RHOJ; RHOB; TMOD3; RHOU; RAC1; MYOM1; LMOD1; CORO1A; MYO7B; CORO7; RND2; CORO1B; MYO1C; TPM3; ARHGAP17; PPP1R9B; MYO5A; RHOD; MYO1D; MYO19; TTN; CORO6; MYOM3; ACTC1; HIP1R; MYO1F; PPP1R9A;	GO:0007015~actin filament organization	75	121	61.9834710743802	0.000136618119569554	0.0300833099292157	1	1	0.778183636957559	0.999994241909226	0.294168588332139
up	ABCA1; ITGAM; FCGR1A; FCER1G; FCGR2B; MYH9; ARHGAP25; CDC42; MFGE8; ARHGAP12; ELMO1; GULP1; BIN2; SH3BP1; IGHV3-66; IGHV3-33; IGHV3-30; IGHE; IGHV2-26; IGHV3-53; IGHV1-24; IGHV3-7; IGHV3-72; IGHA2; IGHV3-43; IGHV4OR15-8; IGHV1OR21-1; IGHV3-20; IGHV3OR15-7; IGHV3-74; IGHV3-21; IGHV2-5; TRDC; IGHV1-69; IGHV3-11; IGHV3OR16-8; IGLC7; IGHV7-81; IGHV4-39; IGHV4-4; IGHV3-49; IGHV1-3; IGHV1-46; IGHV4-59; IGHV4-28; IGHV3-64; IGHV4-61; IGHV1OR15-9; IGHV3-73; IGHV3-15; IGHV1-69-2; IGHV6-1; IGHV3-13; IGHV3-48; IGHV2-70; IGHV3-35; IGKC; IGHV4-34; IGHV2OR16-5; IGHV3OR16-13; IGHV3OR16-12; IGHV1-45; IGHV5-51; IGHV1-58; IGHG4; IGHV1-18; IGHV3-38; IGHV3OR16-9; TRBC1; IGHV3-23; IGHM; IGHV4-31;	GO:0006911~phagocytosis, engulfment	72	115	62.6086956521739	0.000147087907766408	0.0313056649240944	1	1	0.792050400243341	0.999994241909226	0.306121343668247
up	PSMB11; PSMD12; PIK3CD; BTN3A1; PSMD14; IKBKB; CHUK; PDPK1; PSMD3; RIPK2; LAT; PAK3; HRAS; TRBV12-3; TRAC; TRBC1; HLA-DRA; HLA-DRB1; THY1; CD3D; TRBV7-9; HLA-A; PTPRC; CD3G; PLCG2; HLA-DPA1; CD247; PSMA3; PSMA4; PSMB9; MAPK1; PSMB10; CSK; PIK3CA; PIK3CB; TXK; WAS; ZAP70; PSMC4; CRKL; PSMB2; PSEN1; EIF2B2; PSMD4; BCAR1; PSMA6; PSMC5; PSMC6; SKP1; RELA; PSME1; PDE4B; PDE4D; ITK; LCP2; EIF2B5; PAK1; PAK2; PSMD2; PSME4; STK11; HLA-DRB5; RC3H1; DENND1B; TRAT1; PSMA8; SPPL3; PSMF1; INPP5D; RNF31; PSMD1; CARD11; NFKBIZ; RBCK1; PRKD2; FOXP3; LIME1; WNK1; PAG1; TAB2; MALT1; EIF2B4; PSME2; PSMD13; PTPN22; TRAF6; IKBKG; THEMIS2; BTN3A2; BTNL2; PRAM1; VTCN1; BTNL9; BTN2A2; HHLA2; BTNL10; MOG; BTN2A1; TEC;	GO:0050852~T cell receptor signaling pathway	99	174	56.8965517241379	0.000150223309755115	0.0313056649240944	1	1	0.796183541702111	0.999994241909226	0.306121343668247
up	ARNTL; PER2; CLOCK; ENSA; RAPGEF3; GCG; IFNG; SLC25A5; CELA2A; ADRA2A; GIP; ALOX5; SLC2A2; SLC25A4; PRKCA; ADRA2C; CNR1; KCNA5; GCK; HNF4A; GLP1R; RFX3; GIPR; MTNR1B; CPT1A; SLC16A1; SNAP25; RAP1A; ICA1; ABCC8; TCIRG1; NEUROD1; CACNA1C; ITPR2; ITPR3; ITPR1; CACNA1E; CARTPT; SLC8B1; SYT9; RFX6; RAPGEF4; TFAP2B; KCNC2; G6PC2; CACNA2D2; KCNG2; ARL2BP; SSTR5;	GO:0050796~regulation of insulin secretion	49	68	72.0588235294118	0.000159736469417693	0.0323026260297943	1	1	0.808745744661779	0.999994241909226	0.315870092784478
up	PDLIM1; NPHP1; ANXA9; VNN1; NTN1; EGFR; THY1; KRT18; CD2; PKHD1; CDH1; ICAM2; JUP; PECAM1; CDH2; CD33; ITGAL; CTNNA2; S100A11; ICAM3; CTNNB1; SOX9; PSEN1; ITGA8; RAB10; PPP1CA; ADAM8; DSG1; DLG1; TRIM29; SCRIB; FAT1; COL19A1; CNN3; CDSN; KIRREL2; CBLL1; CDH24; STXBP6; DLG5; FBLIM1; ESAM; CYFIP2; VMP1; PDLIM5; JAM3; ROPN1B; TTYH1; VEZT; CD93; TMOD3; CTNNA3; ICAM5; FNDC3A; ZAN; CD2AP; F11R; LRRC1; DLG3; DSG4; CDH11; CTNND1; LAMA3; CDHR3; CDH17; SYNJ2BP-COX16; LPP; DSG3; CDH13; CDH12; PKP3; CDH3; DSC2; DSG2; CDH26; CDH4; SYNJ2BP; CDH23; DSC1; CDH19; IGSF5; CDH8; CDH18; LAMA5; DLG4; DSP; FAT3; CDHR2;	GO:0098609~cell-cell adhesion	88	152	57.8947368421053	0.000219951518403816	0.0411226338842153	1	1	0.850063504354406	0.999994241909226	0.402116229453558
up	NEURL1B; ADAM10; PTP4A3; NEURL1; IL2RA; FCER2; KRT19; ANXA4; AGXT; MDK; KCNA5; PLN; HOXD3; HNF1B; TGFBR2; CDKN1B; NOTCH1; SOX9; CEBPA; ASCL1; FOXA1; YBX1; JAG1; RBPJ; EP300; CNTN1; TBX2; SNW1; HES1; ZNF423; HES5; RIPPLY2; DTX1; NKAP; MAML1; CREBBP; KAT2B; ATOH1; FBXW7; MIB2; PERP; ITCH; MAML3; IFT74; NR1H4; SPEN; S1PR3; MESP1; HES7; GRIP2; WDR12; TP63; POFUT1; DLL4; TMEM100; HEY2; SEL1L; EPN1; DTX2; DLK2; DTX4; APH1A; MIB1; NLE1; SORBS2; DTX3; DTX3L; DLL3;	GO:0007219~Notch signaling pathway	68	109	62.3853211009174	0.000237429619637242	0.0430820295816431	1	1	0.861625759744565	0.999994241909226	0.421276111383194
up	HMX2; WNT10B; ADAM10; KMT2D; BIRC5; TBX1; CHP2; LRP5; CDC123; FGF18; CLDN7; NTN1; FGF19; SLC25A27; SYF2; EGFR; F2; TIMP1; CST3; HRAS; EGF; TGFB1; VIP; IGF2; IFNG; PLA2G1B; PDGFA; CAPNS1; GNAI2; IL4; SLC25A5; FGF1; EDN1; INSR; CCK; ITGAV; CRH; CAPN1; IGF1R; GLI1; FGF4; HCK; IL6R; ADRA2A; PKHD1; FGF2; WNT2; CSF1; CTSH; RARA; TGFB3; FGF3; FGF5; PTHLH; BMP4; IL7; TDGF1; OSM; EDN3; HCLS1; LIF; RAC2; IL9; VEGFA; EPCAM; TSHR; XBP1; POU3F3; POU3F2; NTF3; EDN2; PTN; EPHA1; FGFR2; BMP5; FGFR4; FGFR3; PRTN3; CXCR2; F2R; CALR; PTPN6; PRDX3; CCND2; CDC25B; AKT1; AKT2; CCKBR; TTK; GRK5; ADM; DRD3; IRS1; SOX11; FLT4; TGFBR2; AVPR1A; COL18A1; GDNF; IL6ST; THPO; PBX1; IL15; MATK; PTGFR; SSR1; NAMPT; CRKL; CDKN1B; NOTCH1; RPS9; ID4; SOX9; MARCKSL1; PGF; VEGFC; AGTR2; PDX1; NKX2-5; MVD; PGGT1B; FGF8; TCL1A; HDAC4; CAV3; RAB25; CD81; PTEN; IL2; ISL1; RPS15A; CNBP; EIF5A; SRPK2; RHOG; PURA; HSF1; MDM2; NRG1; RELA; MST1R; PTK2; CD47; BST1; DLG1; IL24; TIAM1; PRKAA1; BAMBI; PAK1; TBX2; SLAMF1; TCIRG1; HDAC1; CUL3; LAMC2; KLF5; CDK13; PTK2B; HES1; HLX; NOLC1; SUZ12; ERBB4; SHH; NTRK2; AKIRIN2; EAPP; RNF187; HES5; PRAMEF17; TNS3; NANOGP8; SAPCD2; CACUL1; HIPK1; KLB; MYOCD; DYNAP; AQP11; MAPK15; TRPM4; PHIP; HPSE2; TFAP2B; NUDT16; SFRP2; CNOT6L; NACC1; S1PR3; IL12RB2; CIB1; PRMT1; MTA3; PDCD10; ROGDI; DERL2; WWTR1; HIPK2; KDM4C; GAREM1; ZNF703; IL21; CBX8; CD248; MLXIPL; ESM1; BIRC6; SPHK2; FGF21; ACER3; GID8; HOXC10; CNOT6; HSF4; FZR1; CEP131; GAB2; CHTOP; IRS2; MAB21L2; HILPDA; REG1A; ERBB2; ERBB3; REG3A; TGFA; IL11RA; REG3G; REG1B; PROK1;	GO:0008284~positive regulation of cell population proliferation	231	490	47.1428571428571	0.000243206317367406	0.0430820295816431	1	1	0.863573954113207	0.999994241909226	0.421276111383194
up	FFAR2; KLF7; OAS1; INSR; PYGL; ADRA2A; DBH; ALOX5; SLC2A4; CYP11B1; PTPN2; HNF1A; CNR1; FGFR4; IGFBP5; PAX6; AKT1; SSTR5; GCK; PCK1; IRS1; G6PC; ADCY8; STAT3; HNF4A; PRCP; MTNR1B; CEBPA; PDX1; SLC16A1; PRKAA2; FOXA1; CAV3; SESN2; SESN3; RPS6; PTPN11; ACSM2A; PRKAA1; NEUROD1; STK11; ADIPOQ; PDK4; CRY2; CRTC2; SLC8B1; CYB5R4; ADIPOR2; RFX6; SLC30A8; ADGRF5; SIDT2; MCU; APPL2; TFAP2B; ADIPOR1; CSMD1; TRPV4; MLXIPL; G6PC2; MBD5; RPH3AL; STXBP5L; HECTD4; FOXO6; BCKDK; IGF1R; FOXO3; PDK3; PDK1;	GO:0042593~glucose homeostasis	70	114	61.4035087719298	0.000271978772545034	0.0456786043584533	1	1	0.873301624674888	0.999994241909226	0.446666626535626
up	LST1; CDC42EP2; SLC9A3R1; PLXNB2; SEMA3E; PLXNB1; DAPK3; COCH; GAS2; PRPF40A; FMNL1; F2; ALDOA; HPN; FES; HEXB; HCK; VIL1; FGR; EPB41; EZR; VEGFA; PTN; CORO1A; RDX; MYH9; CRK; CCL11; PTK2; DMTN; DLG1; BAMBI; PTK2B; GNA13; ARHGAP15; FGD3; BRWD3; DNMBP; FGD5; ARHGEF18; FGD6; RHOU; CYFIP1; MYH14; BVES; SHROOM3; FBLIM1; LPAR1; SEMA4D; SH3KBP1; FGD4; ARAP1; CDC42EP4; SEMA4A; MYO10; PALMD; CDC42SE2; CDC42SE1; ARHGAP35; BRWD1; PARVA; TBCCD1; CFDP1; TAOK2; MKLN1; STRIP2; WASF3; EPB41L3; F11R; RND2; WIPF2; PLXNB3; RAC1; PLXNC1; RND3; RHOG; RAC2; WIPF1; PLXNA1; RHOA; CDC42; PHIP; PLXNA4; WAS; RHOF; RHOJ; RHOD; RHOB; PLXNA2; WASL;	GO:0008360~regulation of cell shape	90	159	56.6037735849057	0.00032898221631994	0.0529335564926953	1	1	0.892530355290847	0.999994241909226	0.517608920876536
up	IFIT3; IRF6; OAS1; IFNA21; HLA-B; HLA-H; HLA-A; ISG15; IFI6; IFIT2; IFIT1; HLA-C; IRF1; IFITM1; HLA-E; IRF2; IFNAR1; EGR1; MX1; MX2; JAK1; SP100; TYK2; OAS2; HLA-F; GBP2; IFI27; STAT1; IRAK1; STAT2; ADAR; IFI35; IRF9; IFITM3; IFITM2; RNASEL; BST2; IRF3; IRF4; OASL; XAF1; RSAD2; IRF7; ISG20; MYD88; IP6K2; SAMHD1;	GO:0060337~type I interferon signaling pathway	47	67	70.1492537313433	0.000331201988348684	0.0529335564926953	1	1	0.893283949985246	0.999994241909226	0.517608920876536
up	SRRM4; DHX15; RBFOX2; HNRNPR; PRPF3; ZRANB2; PTBP3; TRUB2; ECD; PRKACA; HNRNPA2B1; SFPQ; U2AF2; PTBP1; APOBEC1; RBM25; ADAR; RBM11; ADARB1; HSF1; SRSF2; SRSF11; RNASEL; FMR1; ZFP36L1; KHDRBS1; SRSF4; PPP1R8; SRSF9; SRSF5; RBM39; PDCD11; NONO; SF3B4; SRSF7; CPSF6; PAN2; USP39; PAN3; BRDT; ZC3H13; RBM20; RBM26; PRPF38B; KHDRBS2; MBNL2; ESRP1; JMJD6; ERN2; SUPT6H; RBBP6; TSEN54; RBM23; CIR1; CCAR2; CLASRP; FAM172A; HNRNPLL; APOBEC4; SREK1; CELF1; KHSRP; CNOT6L; QKI; SCAF11; TSEN34; CPEB1; XRN2; NSRP1; SCAF1; PRKRIP1; A1CF; MBNL1; ADARB2; MBNL3; PPP4R2; CDK12; PHRF1; PPARGC1A; ACIN1; TTF2; APOBEC2; THRAP3; CSDC2; AURKAIP1; RBM38;	GO:0006397~mRNA processing	86	152	56.578947368421	0.00044330758179878	0.0675805358160632	1	1	0.920518750203528	0.999994241909226	0.660833893162605
up	ARHGAP32; MYO9A; RHOD; ARHGEF11; KALRN; SIPA1L3; SRGAP2; TRIO; PLEKHG5; A2M; BCR; RAC2; VAV1; CHN1; ARHGAP25; RAP1GAP; TSC2; ARHGDIB; VAV2; CDC42; RHOA; RHOB; RAC1; RHOG; ARHGAP8; ARHGAP4; SOS1; SOS2; ARHGAP1; ARHGEF5; AKAP13; ABR; TIAM1; ARHGAP5; ARHGEF7; GNA13; ARHGEF6; RALBP1; TRIP10; RHOH; ITSN1; RALGAPA2; ARHGAP15; FGD3; ARHGAP21; ARHGAP40; OBSCN; RAP1GAP2; ARHGAP17; RALGAPA1; ARHGAP36; ARHGEF18; RHOU; ARHGAP30; RALGAPB; ARHGAP12; RHOT1; TAGAP; PREX1; DEPDC1B; ARAP2; ARHGAP45; ARHGEF1; ARHGEF2; SIPA1; FGD4; ARAP1; ARHGAP9; ARHGAP39; RHOJ; PLEKHG2; RHOF; ARHGEF3; ARHGAP35; FAM13B; ARHGEF12; GMIP; ARHGAP23; ARHGAP28; ARHGAP26; STARD13;	GO:0051056~regulation of small GTPase mediated signal transduction	81	141	57.4468085106383	0.000452942849822224	0.0680031924074003	1	1	0.922300155172595	0.999994241909226	0.664966825779244
up	FEZF1; VWC2L; SOCS2; DAB1; NKX2-2; NGF; GLI2; RARA; BMP4; TCF4; TCF3; TIMP2; ADRA2C; HOXD3; SOX11; ZEB1; BCL6; NBL1; PCP4; ASCL1; NKX2-5; FOXG1; FOXA1; PTEN; RHOA; IRX3; NKX6-1; EIF4G1; REST; NEUROD1; MMD; NEUROD2; NCOA1; VWC2; CDON; BRINP3; GDF7; MMD2; FEZF2; GDPD5; ATOH1; ARHGEF2; SIN3A; PHOX2B; CPNE1; KDM4C; LIN28A; ZC4H2; HMG20B; NAP1L2; TRPC6; BRINP2; BRINP1;	GO:0045666~positive regulation of neuron differentiation	53	81	65.4320987654321	0.00048688818648257	0.0720085826844148	1	1	0.92860901328452	0.999994241909226	0.704133393762654
up	SH3KBP1; NOD2; TLR9; IGHV3OR16-9; IGHV1-45; IGHV3-38; IGHV2-26; IGHV3-53; IGHV3-49; IGHV1-69-2; IGHV1OR21-1; IGHG4; IGHV3OR15-7; IGLC7; IGHV3-15; IGHV4-39; IGHV3-64; IGHV4-28; IGHV2-70; IGHV3-21; IGHV4-59; IGHV1-69; IGHV3OR16-12; IGHV4-4; IGHV2OR16-5; IGHV3-73; IGHV3-23; IGHM; IGHV3-13; IGHV4OR15-8; TRBC1; IGHV1-18; IGHV1-24; IGHV3-72; IGHV3-74; IGHV3-48; IGHV3-11; IGHV3-33; IGHE; IGHV3-20; IGHV1-46; IGHV3OR16-8; IGHV1OR15-9; IGHV4-31; IGHV5-51; IGHV4-61; IGHV1-3; IGHV3OR16-13; IGHV6-1; IGHV4-34; IGHV3-66; IGHV1-58; IGHV3-7; IGHA2; TRDC; IGKC; IGHV3-35; IGHV3-30; IGHV3-43; IGHV2-5; IGHV7-81;	GO:0050871~positive regulation of B cell activation	61	98	62.2448979591837	0.000500619999379115	0.0729506407918772	1	1	0.931153198845154	0.999994241909226	0.71334527584116
up	DAPL1; HMX2; CFAP69; SRRM4; BTBD18; SPATA31C2; KIF2A; APAF1; CRX; PAX4; TLL1; ZIC3; JAK2; GADD45B; GADD45G; CLPTM1; RAF1; TFF1; FGF1; MGP; ROS1; SPATA31D3; SPATA31C1; FGF3; TDGF1; BMP1; ZNF3; TYMP; MAK; MDK; HIST1H1T; YY1; ANXA13; ARNT; PTPN6; AKT1; BMP8B; ADCYAP1R1; BAG6; PGF; FXR1; NKX2-5; CAV3; RBM11; KRTDAP; RPS7; RHOB; SRPK2; DLK1; SIM1; FOXK1; HSPG2; PURA; MYT1; NR5A1; UBE2V1; SQSTM1; AAMP; CYLC2; GNA13; ELAVL3; HLX; ODF1; COL19A1; CCDC85B; ZIC1; UGCG; ECSCR; INSC; ZNF423; TSNAXIP1; SLC9C1; TDRD12; BRDT; HERC4; TAF7L; SOHLH1; SFRP5; GGNBP1; MYO7B; CXCL17; SLCO4C1; SPATA31E1; ILDR2; TCF23; PIWIL3; HUWE1; MROH2B; TAF8; PEG10; MORC1; CAND1; NLRP14; GPSM1; EGFL6; TBC1D21; ARHGEF28; ANKS4B; BOLL; TEX19; PSMA8; VSTM2A; OSR1; MYCBPAP; CCHCR1; SLC2A14; ZNF431; ABHD5; GTSF1; NELL1; EXT2; SYAP1; PBXIP1; TESC; DAZAP1; MAEL; CFAP54; NEUROD6; ODF3; PURB; ZIC5; TSNAX; CITED2; RARRES2; BCL7B; SPATA9; SPATA16; HEMGN; TEX15; AMBRA1; YIPF3; FGF23; TWSG1; ZNF541; RBM38; GGNBP2; UNC45A; PPDPF; YY1AP1; VIPAS39; USP42; CDHR5; FGF22; SH2D2A; NPAP1; RAI14; THEG; NDRG3; TCFL5; NDRG4; CEP131; RNF114; TLL2; NHSL2; SPIC; ELF1; DLX2; RARA; THRA; POU3F2; POU6F2; FOXB1; FST; SOX12; NKX2-8; HES7; KIAA1522; NR2F2; HES5; FOXA2; FOXI1; SOX14; FOXA1; RXRA; FLI1; POU3F3; NKX6-3; POU5F1B; EYA1; NR1H4; VDR; NKX2-2; ETV1; NR1I3; ETV4; NR1H2; FEV; SOX1; PPARA; NR1I2; FOXI2; CAV1; ID1; HNF4A; DDX3X; NKX2-1; ELF2; ETS2; POU6F1; PRRC2A; NRG1; NR2C2; NKX6-1; CDX1; ZFPM1; ELK4; ERF; FGR; RXRG; SPI1; ETV6; HES1; PRRC2B; ONECUT3; CCDC160; NR2E1; SOX18; EGFR; ELK3; DDX4; ETV3; FOXQ1; HNF4G; FES; SRY; POU5F2; FOXD1; PTK6; SOX3; POU2F2; FSTL1; NHSL1; SOX2; SPIB; POU4F2; NR2F6; ETV7; FSTL4; SOX11; POU3F4; TNK1; FRK; GABPA; SLA; EYA3; NKX1-2; SPINK5; ELF4; HCK; POU2F1; HES4; DLX6; ID4; ELF3; SRMS; CAV2; DLX3; HEY2; RB1; YES1;	GO:0030154~cell differentiation	260	572	45.4545454545455	0.000569035864510292	0.0802781838279261	1	1	0.9413233257673	0.999994241909226	0.784997397762894
up	PRSS38; PRSS37; PSMB11; TRABD2B; GGT3P; CLCA1; TPP1; UBD; EIF3H; CFLAR; KLK10; TLL1; TMPRSS11D; KLK8; MMP20; TBL1X; ADAM11; ADAMTS4; MMP23B; PAPLN; F2; PLG; CFB; KLKB1; CAPNS1; CFI; HPN; KLK3; CTSD; CAPN1; ELANE; MMP2; MMP3; LPA; CTSH; PRSS56; CTSA; RBP3; ACE; PEPD; BMP1; APEH; ACAN; PCSK2; CTRB1; GGT1; GZMH; ENDOU; KEL; PRTN3; MMP11; CTSS; LAP3; TPP2; PDIA3; LCN1; CPS1; GGT5; MMP12; VHL; CASP3; CTSK; PSMC4; MASP1; CASP4; MMP14; MMP15; MMP16; NUP98; ADAMTS20; ADAM8; RELN; PHEX; DCD; ADAMTSL3; LACTB; TMPRSS15; FOLH1; UBE3A; FGL2; WFDC2; HABP2; MBTPS1; CASP8; CLCA4; NEDD8; PRSS8; MEP1B; PRSS36; AGBL2; AGBL4; CPZ; CTRB2; PM20D1; DESI1; GGT6; RHBDF2; METAP1D; PRSS55; CASP12; DPP8; THSD4; TMPRSS11A; ADAMTS13; TMPRSS7; PRSS41; TMPRSS9; ADAMTSL2; DPP9; VASH2; AMZ2; PRSS58; FBXL6; ADAMTSL1; KY; NPEPL1; ADAMTS17; ADAMTS16; ADAMTS19; TRAPPC12; NCSTN; PIGK; TANK; CASP10; NUDT16; PIK3IP1; CNDP2; AGBL1; CPNE1; ADAM2; GGTLC1; PAPPA2; TINAGL1; PRSS22; KLK15; ADAM7; ADAMTS10; RNPEP; DPEP2; OSGEPL1; DPEP3; TASP1; RNPEPL1; CHMP1A; MMP25; XPNPEP3; FBXO6; TMPRSS4; ADAM22; SENP1; CTSZ; KLK11; MALT1; ADAMTS1; USP25; PRSS50; TINAG; FBXO3; ADAM30; ADAM29; ADAM21; ADAM28; KLK12; FBXW2; TMPRSS11E; MMP17; AGTPBP1; SPG7; CLCA2; ATG4B; KLK4; ST14; CPQ; TLL2; CPA5; CAPN15; CAPN8; ERAP1; CAPN5; CAPN9; F12; PRSS54; CPO; CAPN6; CAPN14; CELA2A; NPEPPS; ERAP2; PRCP; CELA3B; PGPEP1; CAPN12; PRSS16; CPA1; PGC; PGPEP1L; THOP1; ENPEP; CPA4; CPA2; PRSS1; YME1L1; CELA1; PRSS48; CLPX;	GO:0006508~proteolysis	205	436	47.0183486238532	0.000574574752945867	0.0802781838279261	1	1	0.941918814713547	0.999994241909226	0.784997397762894
up	CDHR4; PTPRT; PLXNB2; PCDH7; DSCAM; CDH16; PCDH8; CDH1; PECAM1; PTPRM; DSG3; CDH13; DSG1; DSC2; PCDH1; DSC1; CDH17; DSG2; FAT1; SDK2; IGSF11; DCHS2; SDK1; AMIGO2; DSG4; PCDH20; PCDH19; FAT3; NECTIN2; ESAM; CDHR1; PCDH15; CLSTN3; CDHR2; PCDH11X; CLSTN2; CDHR5; ROBO2; PCDH18; PCDHB16; TENM3; PCDH10; PLXNB3; PCDHB8; PCDHB10; PCDHA7; PCDHA4; PCDHA12; IGSF9B; PCDHB7; PCDHB6; PCDHB5; PCDHB4; PCDHB15; PCDHB14; PCDHB11; PCDHB1; PCDHGA8; PCDHGA7; PCDHGA3; PCDHGA2; PCDHGA1; PCDHA8; PCDHA5; PCDHA3; PCDHA2; PCDHA13; PCDHA11; PCDHA10; PCDHAC2; NPTN; CNTN2; BSG; CNTN4; MYOT; CDH19; PALLD; CDH4; IGSF9; NEXN; CDH18; CDH23; CDH11; CDHR3; CDH26; CDH3; HMCN1; CDH2; CDH24; CDH8; CDH12;	GO:0007156~homophilic cell adhesion via plasma membrane adhesion molecules	91	165	55.1515151515151	0.000575209511735064	0.0802781838279261	1	1	0.941999094869331	0.999994241909226	0.784997397762894
up	SGK1; NR5A2; LAMA5; FANCA; RBFOX2; NUAK1; LGR5; PRDM1; RBBP9; PIAS1; KCNH1; SIX3; AGT; PF4; TFRC; FES; MELTF; DBH; ESRRA; JUP; TAL1; FUT3; SAT1; ERBB3; IL4R; GUCY2C; TSPO; AGTR1; RPA3; HOXD13; TGFBR2; BRCA1; APOBEC1; EPS15; BAG6; SOX9; JAG1; XIAP; PTK2; BIRC2; BMPR2; SHH; E2F4; HP1BP3; IER5; USP17L2; TMIGD1; KSR1; CADM4; ARHGEF2; SGK3; SCGB3A1; ARX; PPP1R9B; CIB1; RNF126; TXNIP; SGK2; AMBN; CHST11; BIRC6; PDS5B; MBD2; GHRL; CFDP1; TCFL5; CELA1; STAT6; FRK; SRMS; JUN; TFAP2D; TGFB3; FGR; TNK1; YES1; DUSP22; TFAP2B; GKN2; STAT3; TGFB1; SLA; BCL6; STAT5B; HCK; PTK6; STAT1; STAT2; JUNB; GKN1;	GO:0042127~regulation of cell population proliferation	90	163	55.2147239263804	0.000597617747475243	0.0822471424962803	1	1	0.944378660775898	0.999994241909226	0.804250790867474
up	PIK3CD; PITPNM1; PIK3C2B; CDIPT; PIP5K1B; SYNJ2; INPP4B; INPPL1; SYNJ1; PIK3C2G; SBF1; FGF2; PLCG2; RAB4A; RAB5A; PIK3CA; PIK3CB; PI4KA; PIP4K2A; PIK3CG; BMX; PTEN; RAB14; ARF3; VAC14; MTMR1; MTMR2; MTMR3; INPP5J; SLC27A1; TPTE2; PIK3C3; PIP4K2C; FIG4; PIK3R3; INPP5D; CDS1; SH3YL1; PLEKHA8; INPP4A; RUFY1; PIK3R4; PIP5K1A; MTMR12; PLEKHA2; PLEKHA1; INPP5E; SACM1L; PI4KB; PIKFYVE;	GO:0006661~phosphatidylinositol biosynthetic process	50	76	65.7894736842105	0.000632345309128257	0.0853586957740269	1	1	0.948095142276627	0.999994241909226	0.834677005183274
down	TCAF2; SMIM22; SDCBP; PODXL; CLDN4; SNAI2; SPAG9; DIAPH1; FGFR1OP; CLDN1; SNAI1; ONECUT2; FAM107A; F10; PLAU; CGA; IL1B; SOD2; IGF1; ITGB1; CSF1R; LYN; THBS1; RHOC; ITGA5; PDGFRB; CCL3; HSPA5; BMP2; F3; MMP9; PDGFRA; FLT1; ITGAX; ITGA6; SERPINB3; CCR1; CDH5; KDR; CEACAM6; MCAM; NUMB; AIF1; F2RL1; MAZ; ACTG1; ADAM17; CCL7; INSM1; ROR2; ACVR1; PPP3CA; ELP6; STX4; FOXF1; TRIM32; NEDD9; GPNMB; MAPRE1; MYLK; NTRK3; CARMIL1; PLET1; FAM83H; FERMT3; PDPN; GCNT2; ARHGEF39; FAM89B; LRRC15; TWIST2; HAS2; MYADM; HBEGF; CLEC7A; CXCL16; ELP3; CASS4; SPHK1; GTSE1; ONECUT1; CCL26; ANGPTL3; SEMA4G; SEMA6C; SEMA3F; SEMA3C; SEMA3G;	GO:0030335~positive regulation of cell migration	88	226	38.9380530973451	0.00063757441155432	0.795209594889381	1	1	0.998476951327269	0.999999999881244	1
up	TRIM38; IRF6; MID1; JAK2; OAS1; IFNG; HLA-B; HLA-H; HLA-DRA; HLA-DRB1; MT2A; HLA-A; HCK; HLA-C; IRF1; FCGR1A; NCAM1; HLA-E; IRF2; IFNGR1; HLA-DPA1; JAK1; SP100; PML; OAS2; HLA-F; GBP1; GBP2; CIITA; STAT1; B2M; IRF9; PRKCD; TRIM26; NMI; CAMK2B; CAMK2G; CAMK2D; TRIM25; IRF3; IRF4; OASL; HLA-DRB5; TRIM22; FCGR1B; IRF7; TRIM8; TRIM5;	GO:0060333~interferon-gamma-mediated signaling pathway	48	72	66.6666666666667	0.000651497529142842	0.0860758535503522	1	1	0.950146075900477	0.999994241909226	0.841689707281861
up	KIF2A; SGK1; LAMA5; LDB2; PLXNA2; NTN1; DDX58; TGFB1; FUT3; LAMA2; PAX6; AKT1; AKT2; PRKX; RHOA; RHOB; RAC1; MGAT3; NEXN; ROCK1; GNA13; ERBB4; LAMA4; LAMA3; MYSM1; USP17L2; TMIGD1; FRMD5; LDB1; ADGRG3; MINK1; SGK3; AJUBA; SPATA13; PARD6B; GSX2; SLK; FAM49B; TBCCD1; CAMSAP3; MACF1; PLXNB3; PLXNB1; RHOD; TMSB10; TMSB15B; PLXNA1; RND2; TMSB4X; PLXNB2; RHOF; RND3; AMOTL2; PLXNC1; PLXNA4; SST;	GO:0030334~regulation of cell migration	56	89	62.9213483146067	0.000686432321823971	0.0894981299599175	1	1	0.953893572946721	0.999994241909226	0.875154316816282
up	HCN1; CACNA1H; NTSR2; CHRNA1; KCNA5; CHRNA3; KIF5B; ACTN2; CHRNA4; CAV3; ASIC1; GRIN1; KCNA1; KCNMA1; KCNH2; DLG1; GRIK3; ATP1A4; ASIC2; LRRK2; RIMS4; POPDC3; HCN3; HCN2; RIMS2; HCN4; CHRNB3; CHRNA2; GABRA3; GABRB2; RIMS1; PXK; BVES; KCNH3; GABRG3; GLRA2; KCNH6; GLRA3; KCNH1; GABRP; GABRG1; GLRA4; GABRR3; GABRD; KCNH8; GABRA5; GABRA1; HTR3B; KCNH5; CHRNG; GABRQ; CHRNA9; GABRA2; HTR3A; CHRNB4; GABRB3; PIEZO1; GABRR1; GABRG2; HTR3C; GABRE; GABRB1;	GO:0042391~regulation of membrane potential	62	102	60.7843137254902	0.000706873637339456	0.0909663749661905	1	1	0.956074055327921	0.999994241909226	0.88951149898265
up	TLR4; TP73; FGF10; RIPK2; PAK3; SOD1; AGT; EGF; TGFA; PLA2G1B; CD74; FGF1; INSR; PTPRC; FGF2; UBB; UBC; TGFB3; TDGF1; NTF3; FPR1; DRD4; MAPK3; MAPK1; ERP29; PRDX2; MAP2K2; PIK3CB; CRKL; IRAK1; ITGA1; CD81; CXCR4; RPS27A; NRG1; MAP2K1; PTPN11; PRKAA1; MAP2K5; GRM1; UBE2V1; GRM4; MAPK11; MAPK14; MAP3K11; MAPKAPK3; DUSP5; DUSP7; LRRK2; CXCL17; TAOK1; MAPKAPK5; TAB3; FRS2; MADD; LPAR1; PBK; DUSP9; NOD2; TAB2; PLCE1; GHRL; STK39; TAOK2; NOD1; MAP3K2; TRAF6; IKBKG; MAP2K4; PROK1; MAP2K7;	GO:0000187~activation of MAPK activity	71	122	58.1967213114754	0.000751658060088367	0.0954894835566106	1	1	0.960848046616454	0.999994241909226	0.933740557289318
up	PLXNB2; ADAP1; SBF1; SOD1; VAV1; NF1; EPHA1; EPHA3; RDX; BCL6; MTOR; PAFAH1B1; CRK; RAP1GAP; VAV2; EPHA5; DYNLT1; PTK2; ARHGEF5; PRKG1; RAB3GAP1; RALBP1; NTRK2; FGD3; RASIP1; RICTOR; FGD5; FGD6; TRAPPC6B; SBF2; BVES; TBC1D15; AJUBA; FGD4; STMN3; PYCARD; PLXNA4; PLXNB1; CHN1; ARHGAP9; ARHGAP27; PLXNA2; PLXNB3; ARHGAP15; ARHGAP12; PLXNA1; PLXNC1;	GO:0043087~regulation of GTPase activity	47	71	66.1971830985916	0.000821248832046595	0.100453199276432	1	1	0.96826462203528	0.999994241909226	0.982278076917895
up	PDLIM1; PLOD2; APAF1; CLDN3; ACTN4; CBFA2T3; LDHA; CST3; LTA; MB; CRYAB; CAT; RAF1; ATP1B1; REG1A; TH; F7; TGFB3; HSPD1; SRF; CYBA; DRD2; PKM; HSP90B1; VEGFA; CREB1; ITGA2; EGR1; NF1; KCNA5; ALAS2; NPPC; EDNRA; MT3; ARNT; CD38; PML; ADORA1; ADSL; PKLR; SLC6A4; ADM; LONP1; TGFBR2; CASP3; MTHFR; CHRNA4; CDKN1B; PSEN2; MMP14; UCP2; CXCR4; RHOA; SMAD3; TEK; CAV1; TGFBR3; PPARA; EP300; KCNMA1; REST; PRKAA1; PAK1; ATM; SMAD4; BIRC2; PTK2B; ITPR2; ITPR1; POSTN; ADIPOQ; AGTRAP; MYOCD; SCFD1; RYR2; CREBBP; AJUBA; EGLN2; TXN2; EPAS1; CITED2; EGLN1; NOX4; DDIT4; LOXL2; PGF; MMP2; SLC11A2; VEGFC;	GO:0001666~response to hypoxia	89	163	54.601226993865	0.000826997429594467	0.100453199276432	1	1	0.968788384978239	0.999994241909226	0.982278076917895
