DGE	Genes	Process~name	num_of_Genes	gene_group	percentage%	P-value	Benjamini and Hochberg (FDR)	 Hommel singlewise process	Bonferroni single-step process	Hommel singlewise process	Hochberg step-up process	Benjamini and Yekutieli
down	TARM1; SNAP23; PSMD11; PSMD12; SIRPB1; PSMD14; SDCBP; DDX3X; RNASET2; FCN1; MAN2B1; PDXK; ADAM10; APAF1; AGPAT2; DEGS1; SURF4; ARPC5; PSMD3; MGAM; GMFG; DIAPH1; TOM1; LILRB3; DNAJC13; CREG1; ATP6AP2; DGAT1; TRPM2; STK10; TMEM63A; ATG7; BRI3; RAB3D; CYB5R3; HP; PLAU; SERPINA3; C3; CST3; HLA-B; HLA-H; LRG1; AHSG; TTR; FTL; CAT; FUCA1; ALDOA; CSTB; ARG1; ITGB2; GLA; GSN; S100A9; PYGL; ITGAV; CTSD; ANXA2; CAPN1; PSAP; HEXB; CTSB; HSP90AA1; CD55; GUSB; HSP90AB1; ELANE; CTSG; MME; CD14; PTPRC; CD63; ACAA1; GSTP1; HMGB1; CTSH; FGR; HSPA1A; RNASE2; GAA; HLA-C; CTSA; HSPA8; SLC2A3; ITGAM; LAMP1; IGF2R; FCGR2A; ANXA3; RNASE3; DEFA4; XRCC6; CYBA; EEF2; APEH; CD59; SELL; PKM; MMP9; JUP; ARSA; B4GALT1; TIMP2; CD44; GLB1; CD36; BPI; PFKL; CR1; VCL; CD58; CD53; CD33; AZU1; TNFRSF1B; RAB3A; RAB6A; ITGAL; ITGAX; IMPDH1; FPR1; C5AR1; MMP8; PTPRB; FCAR; CXCR1; CXCR2; FPR2; PTAFR; CTSS; S100P; STOM; ATP6V0C; CFP; MAPK1; GCA; GRN; PTPN6; SERPINB3; FCER1G; SERPINB1; S100A7; S100A11; CDA; GALNS; AGL; SRP14; DDOST; CEACAM3; MNDA; IQGAP1; GYG1; SERPINB10; DNASE1L1; SLC11A1; PSEN1; CAMP; RAB5C; RAB7A; RAB27A; P2RX1; HK3; ACLY; IST1; VCP; NCKAP1L; GSDMD; RAB5B; RAB10; RAB14; ACTR2; RAP1B; RAP2B; RHOA; LYZ; B2M; YPEL5; RAP1A; RAC1; VAMP2; DYNLL1; DYNLT1; EEF1A1; TUBB4B; PAFAH1B2; HBB; SIRPA; ADAM8; OLR1; RHOG; ATP11A; CAP1; PRKCD; CD47; SIGLEC14; BST2; LRMP; PTPRJ; PSMD2; DNAJC3; KCNAB2; PDAP1; ROCK1; TCIRG1; ASAH1; IQGAP2; RAB31; SPTAN1; CDK13; COTL1; MLEC; DYNC1H1; MVP; KPNB1; STXBP2; MAPK14; ANO6; CLEC12A; UBR4; ATAD3B; HGSNAT; NBEAL2; UNC13D; CYFIP1; DOK3; TMC6; C6orf120; GOLGA7; RAB44; HUWE1; CAND1; TICAM2; ADGRG3; TBC1D10C; SLC44A2; ORMDL3; STK11IP; LILRB2; SLC15A4; NFAM1; LPCAT1; TSPAN14; PLEKHO2; ATP8B4; CLEC4D; NCSTN; DOCK2; ARHGAP45; ATP6V0A1; RAB24; TMBIM1; LRRC7; CNN2; PSMD1; NEU1; CPNE1; CPPED1; ARHGAP9; ERP44; CRACR2A; VAMP8; AP1M1; ADGRE3; CRISPLD2; TOLLIP; MAGT1; DNAJC5; PTGES2; METTL7A; RHOF; RETN; MMP25; CD93; TMEM30A; CMTM6; ACTR10; KCMF1; VAPA; CTSZ; BIN2; DBNL; PSMD13; HPSE; ATP11B; ATP8A1; PRG3; DERA; CAB39; RAP2C; ATP6V1D; HEBP2; DYNC1LI1; ENPP4;	GO:0043312~neutrophil degranulation	294	483	60.8695652173913	0	0	0	0	0	0	0
down	MSGN1; NKX6-3; TLR4; SUPT5H; WWP2; ARNTL; WASL; AGRN; DDX3X; NFIB; E2F3; RFXANK; KMT2D; MEIS2; BACH1; IRF6; IKBKB; CASK; TFEC; PPP1R12A; ZNF609; KDM6B; SMAD7; CHUK; PLSCR1; HDAC3; NKX2-8; MAFG; CRX; HOXC11; ATMIN; RIPK2; FOXO3; GALR2; TCF21; CHP2; ZNF292; ZEB2; ZIC3; CCNT1; KPNA6; BRD4; TBL1X; PROP1; PITX3; MAF; RPS6KA5; GCM2; RPS6KA4; STK16; KLF7; PRPF6; NFAT5; ABLIM3; CAMTA2; DDX58; ECD; ONECUT2; EGFR; FOS; HRAS; TGFB1; CGA; PTH; IGF2; PF4; RAF1; IGF1; APP; FGF1; EDN1; JUN; RB1; PGR; DCN; HEXB; SP1; GLI1; MET; FGF4; NFIC; HOXD4; HMGB1; WNT2; UBB; UBC; GLI2; AR; RARA; TGFB3; IRF1; ERG; VDR; ESRRA; SRF; SKI; XRCC6; HOXD8; IRF2; HCLS1; HOXB1; POU2F1; LIF; ETS2; MYOG; ATF2; FOSL2; HIVEP1; PAX1; TCF4; TCF3; CREB1; EPCAM; HMGA1; JUNB; CEBPB; XBP1; SPI1; BMP7; EGR1; ATF1; ATF4; ATF6; TFEB; TFE3; WT1; EN2; SLC9A1; BCL3; TAF1; BMP5; NR4A1; SFPQ; MYF6; PAX7; YY1; PAX6; HMGB2; ACVR2A; MAPK3; ARNT; ELK4; TEAD1; HOXD10; ARID4A; NOS1; HOXD3; AKT1; OTX1; ELF1; GTF2H1; CIITA; CTNNB1; GTF2F1; RORA; HOXD13; DDIT3; SOX18; ZNF76; SREBF1; PPARG; ZEB1; BRCA1; GDNF; PBX2; PBX3; STAT3; ETV5; ETV6; HNF4A; ELK3; STAT6; WAS; NAMPT; GATA4; NKX2-1; ATRX; NOTCH1; P2RY1; CDX1; ID4; RFX2; RFX3; SOX9; NRIP1; NR2C2; SLC11A1; ARRB1; CEBPD; GSK3A; MEOX2; CSRP3; ETV1; ASCL1; CDK9; SMARCA4; STAT5B; RPS6KA3; CCNH; ZNF131; ZNF143; PDX1; GBX2; NKX2-5; FOSB; NR1H2; MLLT6; CDH13; FOXA1; PKNOX1; PAX9; DLX1; HDAC4; CTBP2; FOXL2; CD81; ACTR3; ACTR2; HAND2; HNRNPK; ESRRG; CNBP; RPS27A; PPP3R1; YBX1; NKX6-1; JAG1; PRKDC; ELF3; SMAD3; HSF1; HNRNPU; E2F1; FOXK2; RUNX1; FLI1; MC1R; SPIB; MEF2A; MEF2B; IRF8; PAX2; CREM; KMT2A; RELA; ACVR1; REL; GRIN1; EN1; RBPJ; MEF2C; GABPA; GABPB1; SOX4; EP300; TEF; SREBF2; TFCP2; SMARCB1; BPTF; NFIA; TP53BP1; FOXF2; NFATC3; PRDM2; KLF10; RLF; MAPK7; ATM; FZD5; SQSTM1; MED21; RIPK1; HDAC1; NEUROD1; SNW1; BMPR2; KLF5; CBFB; NFYC; IL18; VEZF1; TFDP1; E2F2; HES1; NFE2L1; GBX1; IRF3; NCOA6; MEF2D; NFIX; NR1I3; MORF4L2; PRKD1; PPP2R5B; IRF4; PCBP1; RPS6KA1; SHH; SIX1; MED1; ALX1; NCOA1; SMAD2; USF2; ZFHX3; NFE2L2; E2F4; MAPK14; TAF9; NRF1; HIF1A; IFI16; GLYR1; ARID4B; AKIRIN2; DCAF6; AKNAD1; UTF1; FHL5; MYSM1; DAB2IP; IER5; TET2; ZNF746; JMJD6; CDC73; TAF2; DUX4L9; CRTC1; RNF111; MED25; ASXL2; PTF1A; SETX; MAVS; AKNA; TFAP2D; PCGF5; LDB1; BCL9L; NLRC5; METTL23; PPARGC1B; RFX6; CRLF3; CREBRF; ARID3B; SIRT2; ASXL1; MAML2; MYOCD; OSR2; SPIC; RNF10; PAF1; VGLL2; ZBTB38; NFATC2IP; ZMIZ2; FLCN; LILRB1; NCOA7; CTCFL; GABPB2; FEZF2; KLF14; LMX1A; DOT1L; LEO1; GLMP; LMO7; PHIP; AUTS2; ARNTL2; CSRNP3; TFAP2B; LPIN2; RTF1; MAML1; RREB1; CREBBP; KAT2B; DDX17; ATOH1; GATA6; ARHGEF2; IRF7; MED12; WBP2; SIRT1; SFRP2; FUBP3; RAX2; ZBED3; MAML3; IFT74; NEUROD6; NLRP3; SIN3A; PHOX2B; GPER1; RIT2; TBX5; ELF4; NDN; KLF6; PITX2; NPAS2; EPAS1; ARID3A; ATF6B; FOXC2; CITED2; OVOL2; PAGR1; IER2; HELZ2; TBL1XR1; PRKD2; EGLN1; PEG3; WWTR1; CSRNP2; IRF2BPL; NUCKS1; IL25; EPC1; HIPK2; SOX17; SMYD3; NANOG; MLXIP; BARX1; NOD2; SENP2; CHD8; SLC40A1; GCM1; MLXIPL; SIX2; TCF7L2; ASH1L; SIRT7; MED17; SOHLH2; BARHL2; HOXC10; WWOX; FOXJ2; SENP1; CALCOCO1; CHD7; ZNF219; ONECUT1; PPARGC1A; LHX3; MLX; TBK1; MED13; KLF15; FOXD3; GDF2; POU2F3; AGO2; INO80; ZMIZ1; MYO6; PLAGL1; PLAGL2; FOXJ3; HDAC5; RUVBL2; FOXA2; THRAP3; KLF13; HEY1; MAFB; USP16; KLF2; SOX21; GMEB1; IKBKG; NCOA3; MGA; LPIN3; TBX2; TBX3; SSBP3; POU6F2; ZNF148; KAT6B; MED19; HOXA3; NPAS3; LRP5L; SETD3; CAMTA1; KDM1B; EBF1; ZNF382; POU2F2; LAGE3; MAX; CTAG2; RAI1; STAT2; DLX5; POU5F2; IKZF3; TAF4; SMARCA5; TBX18; LPIN1; SRY; MECOM; PPARD; CTCF; IKZF1; PAXBP1; CCDC160; DLX2; ASXL3; SBNO2; THRA; NR2F1; CRTC2; LHX8; SOX6; KAT8; LHX9; POU6F1; DR1; ZNF613; RELB; ABRA; KMT2C; SIM1; CRTC3; CDK13; RSF1; TEAD3; TBX4; JUP; AHR; NKX2-4; ATAD2B; ZNF740; DLX6; SOX14; IKZF4; DPF2; TBX15; TCF20; ZNF462; KAT6A; PROX1;	GO:0045944~positive regulation of transcription by RNA polymerase II	557	1138	48.9455184534271	0	0	0	0	0	0	0
down	EIF3F; DDX3X; EIF3D; EIF3H; EIF4G3; EIF4E2; EIF1B; EIF3G; EIF3J; EIF2S1; RPLP1; RPLP2; EIF4E; RPS17; PABPC1; RPS2; RPL35A; EIF2S2; RPS4Y1; RPS3; EIF4B; RPS12; RPL13; RPL10; RPL9; RPL13A; EIF2S3; EIF1; RPS27; RPL27A; RPL28; RPS9; RPS5; RPS10; RPL29; EIF2B2; EIF3B; EIF6; EIF3E; EIF4A1; RPL26; RPL37A; RPL37; RPS7; RPS8; RPS15A; RPS14; RPS18; RPS29; RPS13; RPS11; RPS6; RPS28; RPL30; RPL31; RPL8; RPL41; RPS27A; RPS21; EIF4G2; RPL24; RPL18A; EIF4G1; EIF2B5; EIF3A; EIF4A2; EIF4H; LARP1; EIF1AD; MTFMT; EIF3C; EIF3K; EIF2B4; AGO2; RPL36;	GO:0006413~translational initiation	75	130	57.6923076923077	0.000186267039925969	0.0594440213417076	1	1	0.856552843280165	0.998899261230489	0.57922695819055
down	CDK2AP1; DVL1; MUSK; AXIN1; HDAC3; CLDN3; PDE8A; PLA2G6; ROCK2; FLOT1; FGF19; EGFR; C3; HRAS; KRAS; TGFB1; IGF2; HLA-DRB1; TFRC; CD74; ERBB2; APP; INSR; CRH; CSF1R; ANXA2; HSP90AA1; LYN; RALB; MMP9; EFNA1; CCND1; EDNRB; FPR2; ACVR2A; MAPK3; ERP29; CCND2; AKT1; AKT2; FLT4; KDR; MTOR; P2RY1; SOX9; CSNK1D; ARRB1; AIF1; RAC1; RACK1; ADAM17; DAB2; TEK; PTK2; STK4; PAK1; SQSTM1; RIPK1; EPHA7; ADIPOQ; NTRK2; LRRK2; PRR5L; BRAT1; ATG14; MOB2; KNDC1; MAVS; CLDN19; FLCN; FNIP1; PIK3R3; SEMA4D; DVL3; SIRT1; ADTRP; WDFY2; CAMKK2; GPER1; CIB1; PINK1; SENP2; SLCO3A1; LIMCH1; NPTN; FXR2; PGF; FMR1;	GO:0001934~positive regulation of protein phosphorylation	88	161	54.6583850931677	0.000220834359085709	0.0682021985124702	1	1	0.87294541839499	0.998899261230489	0.664567286913488
down	IZUMO1R; COL6A5; ISLR; CASK; PDZD2; INPPL1; EFS; MTSS1; PSTPIP1; EDIL3; DSCAM; PLXNC1; SORBS3; MPDZ; CNTN5; FARP2; CLSTN1; ITGBL1; ATP1B1; APP; ITGB2; ITGB1; ITGAV; LAMB1; THBS1; HCK; ITGA5; PTPRF; HAPLN1; ITGAM; NCAM1; SELL; B4GALT1; CD44; ITGB4; ATP2A2; CD36; ITGA2; VCL; ITGB6; CD22; ITGAL; ITGAX; MAG; IBSP; CD72; CD9; IL32; LAMA2; TNC; APC; FPR2; AZGP1; LAMA1; EPHA3; CCR1; CTNNA1; CTNNB1; ACTN2; SPAM1; COL15A1; COL18A1; CXCL12; CD151; PXN; ENTPD1; ATP4B; CCL11; CCR3; PRKX; EPHB4; EMP2; SLURP1; AFDN; CDH6; CDH8; CDH11; CDH15; LGALS4; BCAR1; RND3; ARF6; RHOB; RAC1; SIRPA; CLDN10; OLR1; RELN; ADAM17; SRPX; DGCR2; EFNB1; PRKCE; DSC2; DST; CD164; DPT; SCN1B; DDR1; LGALS3BP; MFGE8; SPOCK1; CDH17; ARHGAP5; MYBPH; SLAMF1; ADAM9; LSAMP; LAMC2; ITGA9; DSG2; SCARF1; LY6D; SELPLG; ADGRE1; FLOT2; MYBPC2; HES1; NEDD9; HABP2; DSC3; OPCML; COL19A1; PTPRK; CDSN; IGFBP7; LAMA4; FREM2; THEMIS2; SPECC1L; ASTL; MPZL3; MAEA; HAPLN4; IZUMO1; CADM4; CD99L2; CNTNAP5; TM9SF4; TNR; SYMPK; SEMA4D; CNTNAP3B; ERBIN; CSF3R; AMELX; CIB1; OMD; MXRA8; EMILIN2; PRKD2; CNTNAP4; AMBN; CASS4; STAB1; ADAM22; NTM; CFDP1; ADGRE2; TINAG; CLEC4A; CNTN6; ADGRG1; NINJ2; PCDHA13; SRC; PCDHA3; PCDH1; SIGLEC12; PCDHAC1; PCDHA7; PCDHB2; PCDHA10; PCDHAC2; PCDHA11; PCDH11Y; PCDH7; PCDHB12; SIGLEC10; SIGLEC14; PCDHA5; PCDH9; FES; PARD3B; PCDHA9; PCDHB10; PCDHB1; PCDH20; PCDH19; PCDHGB6; SIGLEC8; PCDHB16; PNN; CD33; PCDHB3; PCDH11X; SIGLEC7; ICAM5; PARD3; SIGLECL1; PCDHA2; PCDHGA8; PCDHB6; PCDH8; PCDHA8; TGFBI;	GO:0007155~cell adhesion	206	454	45.374449339207	0.00025406108687287	0.0760119014287768	1	1	0.888694971208108	0.998899261230489	0.740665612068524
down	TMEM150B; BECN2; TECPR2; NPC1; ATG7; S100A9; HMGB1; ITGB4; XBP1; TFEB; ANXA7; VPS41; RGS19; DAP; ARFIP2; HAP1; TMBIM6; VCP; GABARAPL2; RAB1A; SRPX; CLTC; IRF8; SQSTM1; BECN1; USP10; STK11; IFI16; WIPI1; LRRK2; FNBP1L; MAP1S; ULK3; DRAM2; WDFY4; TECPR1; SBF2; SIRT2; PIK3C3; SUPT20H; SMCR8; RUBCN; RAB24; RNF166; GRAMD1A; OPTN; NRBF2; RNF185; C9orf72; GPR137; TRIM5; MAP1LC3B; TOLLIP; ATG5; CHMP4B; RNF41; TBC1D17; TIGAR; VPS18; TBC1D14; VPS51; CHMP2B; PTPN22; SH3GLB1; WDR45; PLEKHM1; ATG4B; AMBRA1; LIX1; EPG5; VMP1;	GO:0006914~autophagy	71	123	57.7235772357724	0.000268069587623265	0.0777726736940952	1	1	0.895333810567187	0.998899261230489	0.757822707774482
down	SDCBP; E2F3; ADAM10; KMT2D; EREG; TBX3; HOXA3; PRC1; CHP2; CDC123; TNFSF13; S1PR2; CLDN7; NTN1; FGF19; GLP2R; SLC25A27; SYF2; EGFR; TIMP1; CST3; HRAS; KRAS; TGFB1; CGA; VIP; GHRH; IGF2; KRT6A; PDGFA; CAPNS1; GNAI2; IGF1; SLC25A5; FGF1; EDN1; ITGB1; INSR; CCK; ITGAV; CRH; CSF1R; CAPN1; LYN; THBS1; IGF1R; GLI1; FGF4; HCK; IL3; IL6R; WNT2; CSF1; CTSH; AR; RARA; TGFB3; FGF3; FGF5; PTHLH; TDGF1; FOLR2; HCLS1; LIF; RAC2; IL9; EPCAM; XBP1; FLT1; ITGAX; EDN2; BMP5; FGFR3; EDNRB; TNC; CXCR2; CALR; PTPN6; SERPINB3; CCND2; CDC25B; AKT1; AKT2; TTK; ADM; FLT4; KDR; FLT3; TGFBR2; AVPR1A; COL18A1; GDNF; IL6ST; IL15; HTR2B; CD86; PTGFR; SSR1; NAMPT; CDKN1B; NOTCH1; RPS9; ID4; SOX9; MARCKSL1; ARRB1; PGF; AGTR2; MECP2; AKR1C2; PDX1; NKX2-5; MVD; PGGT1B; EMP2; AIF1; TCL1A; HDAC4; CD81; PTEN; RPS15A; CNBP; EIF5A; SRPK2; ADAM17; RHOG; HSF1; MDM2; BNC1; NRG1; RELA; MST1R; PTK2; SOX4; CD47; STX4; DLG1; TIAM1; PRKAA1; PAK1; TBX2; SLAMF1; TCIRG1; HDAC1; CUL3; LAMC2; KLF5; CDK13; HES1; HLX; NOLC1; SUZ12; SHH; NTRK2; AKIRIN2; EAPP; SPDYA; RNF187; PRAMEF17; TNS3; CACUL1; HIPK1; KLB; MYOCD; DYNAP; OSR2; SLC35F6; SFRP1; FTMT; AQP11; TRPM4; DOT1L; BRK1; PHIP; TFAP2B; PROX1; HAS2; TSLP; SIRT1; SFRP2; CNOT6L; NACC1; S1PR3; GPER1; CDX2; CIB1; PRMT1; PDCD10; SSBP3; DERL2; WWTR1; HIPK2; KDM4C; ZNF703; MLXIPL; BIRC6; SPHK2; PDGFC; C8orf17; ACER3; GID8; HOXC10; CNOT6; HSF4; FZR1; CEP131; GAB2; CHTOP; IRS2; MAB21L2; REG1A; ERBB2; ERBB3; REG3A; REG3G; REG1B; PROK1; PROK2;	GO:0008284~positive regulation of cell population proliferation	218	490	44.4897959183673	0.000395472998691471	0.104382031985409	1	1	0.938743141545764	0.998899261230489	1
down	TRIM38; IRF6; MID1; JAK2; OAS1; HLA-B; HLA-H; HLA-DRA; HLA-DQA2; HLA-DQA1; HLA-DRB1; HLA-DQB1; MT2A; HLA-A; HLA-DQB2; HCK; HLA-C; IRF1; IFI30; NCAM1; HLA-E; IRF2; IFNGR1; CD44; HLA-DPA1; JAK1; SP100; PTAFR; PML; HLA-F; GBP2; CIITA; IFNGR2; B2M; IRF9; IRF8; PRKCD; TRIM26; NMI; TRIM25; IRF3; IRF4; HLA-DRB5; TRIM22; IRF7; TRIM8; TRIM5;	GO:0060333~interferon-gamma-mediated signaling pathway	47	72	65.2777777777778	0.000403398285299783	0.104382031985409	1	1	0.940140352833144	0.998899261230489	1
down	KIF2A; SGK1; PLXNA2; NTN1; DDX58; TGFB1; FUT3; FLNA; LAMA2; LAMA1; PAX6; AKT1; AKT2; PRKX; RHOA; RHOB; RAC1; NEXN; ROCK1; ENPP2; GNA13; LAMA4; LAMA3; MYSM1; TMIGD1; FRMD5; LDB1; ADGRG3; MINK1; SGK3; SPATA13; PARD6B; GSX2; SLK; FAM49B; TBCCD1; CAMSAP3; MACF1; PLXNB3; PLXNB1; TMSB10; PLXNA1; TMSB4Y; RHOBTB1; PLXNA3; TMSB4X; PLXNB2; RHOF; RHOC; RND3; AMOTL2; PLXNC1; PLXNA4; SST;	GO:0030334~regulation of cell migration	54	89	60.6741573033708	0.000579617728738491	0.142288721408777	1	1	0.963030102970835	0.998899261230489	1
up	CDHR4; PTPRT; PCDH17; PCDHGA12; MPZL2; CDH16; CEACAM5; RET; CEACAM1; DSG3; CEACAM6; PKD1; DSG1; IGSF11; FAT4; DCHS2; AMIGO2; DSG4; DSCAML1; ESAM; PCDH15; PCDHB18P; CLSTN3; PCDH18; CELSR2; NECTIN3; CELSR1; PCDH10; CD84; CDH22; PCDHB8; PCDHGC3; PCDHGB4; PCDHA6; PCDHA4; PCDHA12; IGSF9B; PCDHB9; PCDHB7; PCDHB5; PCDHB4; PCDHB15; PCDHB14; PCDHB13; PCDHB11; PCDHGC5; PCDHGC4; PCDHGB7; PCDHGB3; PCDHGB2; PCDHGB1; PCDHGA9; PCDHGA7; PCDHGA6; PCDHGA5; PCDHGA4; PCDHGA3; PCDHGA2; PCDHGA11; CNTN2; NECTIN4; VSTM2L; MYOT; CDH4; ROBO4; CDHR3; CDH26; CDH3; CDH2; MYPN; CDH9; CDH12;	GO:0007156~homophilic cell adhesion via plasma membrane adhesion molecules	72	165	43.6363636363636	0.000630526777030238	0.88319135916446	1	1	0.999999379961111	0.999999379961111	1
down	HIP1; DVL1; SEC16A; SMAD7; MDM4; ZNF207; CTNND1; TBL1X; HIP1R; USP2; CRTAP; FLOT1; USP19; WIZ; BAG3; APOA1; GAPDH; IGF1; ATP1B1; CSN3; PFN1; HSP90AA1; HSP90AB1; HSPA1A; HSPD1; LAMP1; PIM1; CREB1; TCP1; EFNA1; FLNA; TAF1; CALR; GRN; VHL; BAG6; CCT5; GNAQ; RASSF2; HCFC1; CCNH; PER3; PTEN; RPS7; UBE2B; SUMO1; SMAD3; PRKCD; SOX4; EP300; STK4; PEX6; MORC3; FLOT2; PTGES3; TAF9; ZSWIM7; AAK1; P3H1; WDR81; NAA16; SWSAP1; ATF7IP; GOLGA7; SYVN1; STX12; TSC1; DVL3; USP9X; USP7; FBXW7; NCLN; TRIM44; ZBED3; COG3; PHB2; CHP1; NAPG; PDCD10; PINK1; SAV1; SOX17; HPS4; HYPK; PIM2; USP36; PPARGC1A; SEL1L; TELO2; SUGT1; CDC37; AHSP; HSP90AB4P; HSP90AB2P;	GO:0050821~protein stabilization	94	183	51.3661202185792	0.000671821888812651	0.154147388698629	1	1	0.970033263215887	0.998899261230489	1
down	PDLIM1; PIP5K1C; SRPX2; NTN1; PAK4; EGFR; ANXA1; THY1; ITGB2; KRT18; CD2; ANXA2; CDH1; SRC; JUP; CD44; CRISP2; CD58; CD33; ITGAL; S100A11; CDH5; CTNNB1; SOX9; PSEN1; ITGA8; RAB10; PPP1CA; ADAM8; CDC42EP1; COL14A1; DLG1; RAPGEF1; TRIM29; SCRIB; COL19A1; CDSN; CBLL1; NEGR1; STXBP6; DLG5; FBLIM1; CYFIP2; VMP1; PDLIM5; TTYH1; VEZT; CD93; TMOD3; BAIAP2L1; CTNNA3; CDH7; ICAM5; BAIAP2; FNDC3A; ZAN; F11R; CDH10; LRRC1; DLG3; CDH6; CDH11; CTNND1; LAMA3; CDH17; LIMS1; LPP; CDH13; PKP3; DSC3; DSC2; DSG2; SYNJ2BP; CDH23; CDH15; CDH19; CDH8; CDH18; LRRC7; DLG4; FAT3;	GO:0098609~cell-cell adhesion	81	152	53.2894736842105	0.000676226271709046	0.154147388698629	1	1	0.970320113135505	0.998899261230489	1
down	WASL; SDCBP; ARPC1B; ARPC2; ARPC3; ARPC5; SIPA1L1; EFNA2; KALRN; ROCK2; PAK3; AP2A1; HRAS; LYN; SRC; MMP9; EFNA1; RASA1; EPHA3; EPHB2; CRK; PSEN1; EPHB4; EPHB1; ARPC4; ACTB; CDC42; ACTR3; ACTR2; RHOA; RAC1; AP2B1; ACTG1; EFNB1; PTK2; GRIN1; PTPN11; TIAM1; PAK1; GRIN2B; ROCK1; ARHGEF7; CDK5R1; EPHA7; EPHA10; NCSTN; ANKS1A; ARPC1A; APH1A; AP2M1; PSENEN; EPHA6;	GO:0048013~ephrin receptor signaling pathway	52	86	60.4651162790698	0.000766560434184105	0.167382307798716	1	1	0.974784425893011	0.998899261230489	1
down	SNAP23; PSMD11; PSMD12; PSMD14; IKBKB; CHUK; TAPBP; PSMD3; SEC22B; HLA-B; HLA-H; HLA-A; ITGAV; HLA-C; CYBA; HLA-E; CD36; NCF2; PSMA3; PSMA4; CALR; PSMB4; PDIA3; HLA-F; PSMB10; PSMC4; PSMB2; PSMD4; PSMA6; PSME3; B2M; PSMC5; PSMC6; TAP1; TAP2; PSME1; PSMD2; PSME4; NCF4; VAMP3; PSMF1; PSMD1; VAMP8; CD207; PSME2; PSMD13; IKBKG;	GO:0002479~antigen processing and presentation of exogenous peptide antigen via MHC class I, TAP-dependent	47	75	62.6666666666667	0.000769252302396439	0.167382307798716	1	1	0.974881699313161	0.998899261230489	1
up	WNT9A; WNT9B; HOXA2; TBX1; KLF4; GJB3; ALDH1A2; WNT11; YES1; RET; MYB; LTK; AQP1; SLC6A4; PCK1; LEP; WNT5A; ABL2; YAP1; WNT3; WNT3A; PTK7; TEAD2; NTRK3; ADNP2; BRINP3; STRA8; OSR1; RORB; HDAC2; WNT8B; TESC; WNT5B; NDUFA13; WNT6; RARB; BRINP2;	GO:0071300~cellular response to retinoic acid	37	69	53.6231884057971	0.000840285323433165	0.88319135916446	1	1	0.999999379961111	0.999999379961111	1
down	ESYT2; APOL1; APOD; SERPINA5; APOA4; PSAP; LPA; CETP; TSPO; CHKA; FABP6; PLTP; STARD6; HDLBP; APOBR; APOA5; SPNS3; LRP10; SPNS2; SFTPA1; PDZD8; CFHR4; SLCO2A1; PLEKHA8; APOL2; ESYT1; APOL6; APOL5; CLN8; VPS51; ATP8A1; STARD10; CAV2; ABCA6; ABCA7; ABCA5; ABCA1; ABCA2; ABCA4; ABCA9; ABCA8; CAV1;	GO:0006869~lipid transport	42	65	64.6153846153846	0.000920484095900398	0.191580755090226	1	1	0.980779338471646	0.998899261230489	1
down	PSMD11; PSMD12; PIK3CD; BTN3A1; PSMD14; IKBKB; CHUK; PDPK1; PSMD3; RIPK2; PAK3; BCL10; HRAS; TRBV12-3; TRAC; TRBC1; HLA-DRA; HLA-DQA2; HLA-DQA1; HLA-DRB1; HLA-DQB1; THY1; TRBV7-9; HLA-A; HLA-DQB2; PTPRC; HLA-DPA1; PSMA3; PSMA4; PSMB4; MAPK1; PSMB10; CSK; PIK3CA; WAS; PSMC4; PSMB2; PSEN1; EIF2B2; PSMD4; BCAR1; PSMA6; PSME3; PSMC5; PSMC6; SKP1; RELA; PSME1; PDE4B; PDE4D; PTPRJ; LCP2; EIF2B5; PAK1; PAK2; PSMD2; PSME4; STK11; HLA-DRB5; RC3H1; DENND1B; NFKBID; SPPL3; PSMF1; INPP5D; RNF31; PSMD1; NFKBIZ; RBCK1; PRKD2; WNK1; PAG1; TAB2; MALT1; EIF2B4; PSME2; PSMD13; PTPN22; IKBKG; THEMIS2; CD276; BTN3A2; BTNL2; PRAM1; VTCN1; BTNL9; BTN2A2; HHLA2; BTN2A1;	GO:0050852~T cell receptor signaling pathway	89	174	51.1494252873563	0.00100789931698242	0.200043687277574	1	1	0.984183936778525	0.998899261230489	1
down	TLR4; PIP5K1C; CEACAM4; TUSC2; ANXA1; ITGB1; CD14; ANXA3; NCF2; RAB5A; ITGAL; ADORA2A; CORO1A; SLC11A1; DNM2; ANXA11; IRF8; LRP1; SLAMF1; NCF4; KIAA1109; UNC13D; RAB11FIP2; TICAM2; CD302; ABCA7; TM9SF4; RUBCN; PIP5K1A; MYD88; EIF2AK1; C1orf43; CD93; CDC42SE2; CDC42SE1; CORO1C; ICAM5; ELANE;	GO:0006909~phagocytosis	38	57	66.6666666666667	0.00104095165048035	0.200043687277574	1	1	0.985481957788214	0.998899261230489	1
down	CFLAR; PDPK1; SNAI2; PDE8A; ZPR1; BAG4; EGFR; ERBB2; GSTP1; VIL1; TDGF1; CBL; ZFP36; CAD; AKT1; ID1; IQGAP1; ZFP36L2; SOX9; STAT5B; EEF1A1; PAX2; PTPN12; PTPN11; ZFP36L1; MED1; DAB2IP; SYAP1; PPP1R9B; DUSP22; BAIAP2;	GO:0071364~cellular response to epidermal growth factor stimulus	31	43	72.0930232558139	0.00120061442932984	0.223388430191663	1	1	0.991707518626446	0.998899261230489	1
down	ARPC3; DYNC1LI2; FOXO3; KIF1B; APP; HSPA5; CREB1; CBL; AKT1; USP8; ID1; CRK; PTEN; ARF6; RAP1A; E2F1; RAPGEF1; ACAP2; RAB35; MAGI2; MICALL1; STMN2; CIB1; EHD1; KIDINS220; RAPGEF2; NTRK2;	GO:1990090~cellular response to nerve growth factor stimulus	27	35	77.1428571428572	0.00121330670252418	0.223388430191663	1	1	0.992202674014758	0.998899261230489	1
down	PSMD11; PSMD12; WWP2; ARNTL; PSMD14; TRIM38; PSMD3; SPOP; TRIM13; TBL1X; HERC2; FBXO45; PSMA3; PSMA4; PSMB4; PML; ARRB2; CTNNB1; DDIT3; IFI27; PSMB10; PSMC4; ARRB1; CDC34; PSMB2; GSK3A; ATXN3; PSMD4; VCP; PSMA6; UBE2D3; PSME3; PSMC5; UBE2H; PSMC6; PPP2CB; UBE2B; MDM2; UBXN1; PSME1; PSMD2; MTA1; PPP2R5C; BIRC2; CUL3; TNFAIP1; PSME4; PCBP2; NFE2L2; DDB1; RNF187; SPOPL; FBXL19; SIRT2; ZNRF1; KCTD13; RFFL; PSMF1; FBXW5; UBE2W; SIRT1; PELI1; AGAP3; NEDD4L; PSMD1; RNF126; RBCK1; TBL1XR1; SMURF1; PSME2; PSMD13; FAF1; UBXN11; WWP1; UBXN2B; UBE2U; RMND5A; TRIM71; FBXW7; NSFL1C; AREL1; PLAA; HECW2; TRIM3; SHARPIN; RMND5B; RAD23B; MAEA; ITCH; SPSB1; KCTD2; TRIM2;	GO:0043161~proteasome-mediated ubiquitin-dependent protein catabolic process	92	183	50.2732240437158	0.00125910191387013	0.227316198315684	1	1	0.993966394628551	0.998899261230489	1
down	BECN2; FFAR2; KLF7; OAS1; RBP4; INSR; PYGL; DBH; SLC2A4; CYP11B1; PTPN2; CNR1; IGFBP5; PAX6; AKT1; PPARG; ADCY8; STAT3; HNF4A; GCGR; CSRP3; PDX1; SLC16A1; PRKAA2; FOXA1; SESN2; SESN3; RPS6; PTPN11; SOX4; ACSM2A; PRKAA1; NEUROD1; STK11; ADIPOQ; HIF1A; CRY2; CRTC2; CYB5R4; ADIPOR2; RFX6; SLC30A8; ADGRF5; SIDT2; MCU; APPL2; TFAP2B; ADIPOR1; CSMD1; MLXIPL; TCF7L2; G6PC2; MBD5; RPH3AL; STXBP5L; HECTD4; BACE2; BCKDK; IGF1R; FOXO3; GCKR; PDK3; PDK1;	GO:0042593~glucose homeostasis	63	114	55.2631578947368	0.0012911175493292	0.227316198315684	1	1	0.995127820275586	0.998899261230489	1
down	PLXNB2; SIPA1L1; ADAP1; SBF1; SOD1; VAV1; NF1; EPHA3; RDX; BCL6; MTOR; PAFAH1B1; CRK; RAP1GAP; DYNLT1; PTK2; ARHGEF5; RAB3GAP1; RALBP1; NTRK2; FGD3; DAB2IP; RICTOR; FGD5; FGD6; FGD2; TRAPPC6B; SBF2; BVES; TBC1D15; FGD4; STMN3; PLXNA4; PLXNB1; ARHGAP9; CHN2; ARHGAP27; PLXNA3; PLXNA2; PLXNB3; ARHGAP15; ARHGAP12; PLXNA1; PLXNC1;	GO:0043087~regulation of GTPase activity	44	71	61.9718309859155	0.00130586911503683	0.227316198315684	1	1	0.995391511175342	0.998899261230489	1
down	SRRM4; DHX15; RBFOX2; HNRNPR; PRPF3; ZPR1; ZRANB2; TRUB2; ECD; PRKACA; SON; HNRNPA2B1; SFPQ; U2AF2; PTBP1; APOBEC1; RBM25; ADAR; ADARB1; HSF1; SRSF2; SRSF11; FMR1; ZFP36L1; KHDRBS1; SRSF4; PPP1R8; SRSF9; SRSF5; RBM39; PDCD11; WTAP; NONO; SF3B4; SRSF7; CPSF6; PAN2; USP39; PAN3; ZC3H13; RBM20; RBM26; PRPF38B; ESRP1; JMJD6; PRMT9; ERN2; SUPT6H; RBBP6; TSEN54; RBM23; CIR1; CCAR2; CLASRP; FAM172A; HNRNPLL; SREK1; CELF1; KHSRP; CNOT6L; QKI; SCAF11; TSEN34; AICDA; NSRP1; SCAF1; PRKRIP1; ADARB2; MBNL3; PPP4R2; CDK12; PHRF1; PPARGC1A; ACIN1; TTF2; APOBEC2; THRAP3; AURKAIP1; RBM38;	GO:0006397~mRNA processing	79	152	51.9736842105263	0.00133056656423425	0.227479362249619	1	1	0.995866877235725	0.998899261230489	1
up	TULP1; RRH; PPEF2; RGS16; RS1; SLC24A1; AOC2; USH2A; RP2; LRAT; ABCC6; SIX3; EYA4; COL2A1; OPN1SW; OAT; CRYBA1; RHO; TACSTD2; GNAT1; COL11A1; RLBP1; TYR; PDC; CDH3; GLRA1; PRPH2; GABRR2; CNGA1; MIP; RCVRN; PDE6B; GJC1; LUM; CRYBA4; NRL; LAMB2; CABP4; VSX2; NDP; CACNB2; PDCL; BFSP2; POU4F3; PRR4; CYP1B1; IMPG1; SFRP5; NXNL2; CNNM4; GPR179; OPN5; LCTL; RP1L1; MYO3A; ADGRV1; RABGGTA; RORB; RPGRIP1; BBS4; KRT12; IMPG2; SLITRK6; MKKS; CNGB3; CLN6; AIPL1; CABP1; SPATA7; SLC24A2; VAX2; SLC45A2; RAX; NR2E1; NR2E3; LAMC3; CRYGS; CRYBB2; CRYBB3; CRYGN; PDE6C; CRYBB1; CRYBG3; CRYBA2;	GO:0007601~visual perception	84	207	40.5797101449275	0.00134689980295077	0.88319135916446	1	1	0.999999379961111	0.999999379961111	1
down	PSMD11; PSMD12; PSMD14; XPO1; PSMD3; TNFSF13; PARN; VIM; UBB; UBC; HSPA1A; HSPA8; SCGB1A1; PABPC1; PSMA3; PSMA4; ZFP36; PSMB4; AKT1; YWHAB; PSMB10; PSMC4; ZFP36L2; MAPKAPK2; PSMB2; PSMD4; PSMA6; PSME3; PSMC5; PSMC6; CACNG7; RPS27A; YWHAZ; SET; EIF4G1; PRKCD; PSME1; FMR1; ZFP36L1; PSMD2; PABPC4; HNRNPD; PUM1; PSME4; ELAVL1; EXOSC6; RC3H1; DCP2; XRN1; SERBP1; PSMF1; KHSRP; TNPO1; PSMD1; IGF2BP1; PSME2; PSMD13; CARHSP1; YTHDF2; IGF2BP2; SAMD4B; FXR2;	GO:0043488~regulation of mRNA stability	62	112	55.3571428571429	0.0013600383986242	0.228438730323299	1	1	0.996432979434884	0.998899261230489	1
down	TLR4; RIPK2; PAK3; S1PR2; SOD1; AGT; CD74; IGF1; FGF1; INSR; THBS1; PTPRC; UBB; UBC; TGFB3; GHR; TDGF1; FPR1; C5AR1; DRD4; MAPK3; MAPK1; ADORA2B; ERP29; MAP2K2; MAP2K3; MAPKAPK2; ARRB1; IRAK1; MAPK10; ITGA1; CD81; CXCR4; RPS27A; NRG1; MAP2K1; PTPN11; PRKAA1; UBE2V1; MAPK14; MAP3K11; MAPKAPK3; DUSP7; LRRK2; CXCL17; GFRAL; TAOK1; MAPKAPK5; TAB3; FRS2; MADD; LPAR1; PROK2; NOD2; TAB2; PLCE1; GHRL; STK39; NOD1; MAP3K2; IKBKG; PDE6H; MAP2K4; PROK1; SBK2; MAP2K7;	GO:0000187~activation of MAPK activity	66	122	54.0983606557377	0.0015072280091275	0.248796568265288	1	1	0.998899261230489	0.998899261230489	1
down	SMIM22; SGK1; FANCA; MAFG; RBFOX2; PRDM1; RBBP9; KCNH1; PLAU; AGT; PF4; TFRC; FES; DBH; ESRRA; JUP; FUT3; SAT1; ERBB3; TSPO; RPA3; HOXD13; TGFBR2; BRCA1; APOBEC1; EPS15; BAG6; SOX9; PLCD1; JAG1; XIAP; PTK2; BIRC2; BMPR2; SHH; E2F4; CCDC88A; HP1BP3; IER5; TMIGD1; KSR1; CADM4; ARHGEF2; SGK3; SIRT1; ARX; PPP1R9B; AMELX; CIB1; RNF126; ACE2; CHRNA10; TXNIP; SGK2; AMBN; CHST11; BIRC6; PDS5B; GHRL; CFDP1; SLC7A11; STAT6; JUN; TFAP2D; TGFB3; ANXA1; FGR; TNK1; DUSP22; TFAP2B; GKN2; STAT3; TGFB1; SLA; BCL6; STAT5B; HCK; PTK6; LYN; STAT2; SRC; JUNB; GKN1;	GO:0042127~regulation of cell population proliferation	83	163	50.920245398773	0.00159884382171072	0.255658258722827	1	1	0.998899261230489	0.998899261230489	1
down	SRRM4; DHX15; RBFOX2; PRPF3; DHX16; ZPR1; SF3B1; BCAS2; PRPF6; ZRANB2; LUC7L3; ECD; HNRNPC; SON; WT1; SFPQ; PTBP1; PPP2R1A; FUS; RBM25; PPP2CA; SRPK2; SRSF2; SRSF11; FMR1; SRSF4; NCBP1; PPP1R8; PPIG; PRPF4B; THOC5; DDX39B; RBM39; DHX8; ZNF638; WTAP; NONO; SF3B3; SF3B4; SNRNP35; SRSF7; USP39; ZC3H13; RBM20; PRPF38B; THOC7; ESRP1; JMJD6; SUPT6H; CIR1; SRRM1; CCAR2; CLASRP; THOC2; FAM172A; SREK1; TAF15; KHSRP; RSRC1; QKI; PPP1R9B; SRPK1; SCAF11; USB1; DDX23; NSRP1; RBM38; SCAF1; PRKRIP1; RRAGC; MBNL3; PPP4R2; CDK12; PPARGC1A; ACIN1; TTF2; THRAP3; IVNS1ABP; SMU1; SLU7;	GO:0008380~RNA splicing	80	156	51.2820512820513	0.00165267280478598	0.257261282198617	1	1	0.998899261230489	0.998899261230489	1
down	MIF4GD; DDX3X; PLXNB2; EIF3D; ERBB2; THBS1; VIM; PABPC1; EEF2; HNRNPL; ITGA2; BCL3; RPS6KB1; PTAFR; MAPK3; MAPK1; EIF4A3; MTOR; EIF6; EIF3E; RPL26; RHOA; RBM3; KRT17; FMR1; SOX4; DDX39B; CIRBP; HNRNPD; ELAVL1; RBMS3; YTHDF3; CPEB3; LARP4B; PASK; EIF3C; PYM1; PINK1; POLDIP3; PCIF1; BARHL2; SERP1; FXR2;	GO:0045727~positive regulation of translation	43	70	61.4285714285714	0.00166599117362798	0.257261282198617	1	1	0.998899261230489	0.998899261230489	1
