DGE	Genes	Process~name	num_of_Genes	gene_group	percentage%	P-value	Benjamini and Hochberg (FDR)	 Hommel singlewise process	Bonferroni single-step process	Hommel singlewise process	Hochberg step-up process	Benjamini and Yekutieli
down	TBKBP1; TAF4; DDX3X; ACOT8; IKBKB; XPO1; CFLAR; SGTA; BNIP3L; CCNT1; BRD4; NBN; RNGTT; RFPL3; AP1G2; ATG12; UBR5; RTN3; IPO7; TDP2; DDX58; STAU1; HLA-B; HLA-DRA; HLA-A; SLC25A5; CFI; KRT18; KRT8; RB1; EIF4E; ASGR1; ASGR2; HSP90AA1; SP1; PTPRC; KRT19; HMGB1; POLA1; CALM1; HLA-C; HSPD1; HSPA8; TOP1; TPR; HLA-E; FDPS; CREB1; ATF7; TNFRSF1A; TBP; RAB6A; TAF1; HNRNPA2B1; SP100; POLR2A; BRD2; PSMA3; PSMA4; MSN; ZFP36; MAPK3; ATP6V0C; CANX; PSMB4; MAPK1; PML; IL2RG; YWHAB; CTNNB1; KDR; FLT3; LTBR; NUP62; IL6ST; IFI27; PSMB10; STAT3; RANBP1; IQGAP1; CXCL12; CD151; TUFM; PSMB2; NUP153; RANBP2; TSC2; BCAP31; IRAK1; CCR3; USP11; STAT2; NUP98; NUP107; EIF4A1; PSME3; RHOA; HNRNPK; PPP1CA; YWHAE; GRB2; SUMO1; SKP1; RACK1; UBE2I; FOXK1; HSF1; HNRNPU; MDM2; E2F1; SET; SATB1; TAP1; TAP2; UBXN1; EIF4G1; UBE3A; FMR1; BAX; KLC1; VAC14; EP300; NUP160; DLG1; IK; CALCOCO2; TRIM28; G3BP1; SERINC3; RIPK1; SNW1; DYRK1A; CACNA1C; CDK13; KEAP1; MORC3; IKBKE; EIF4A2; TRIM25; FKBP8; BECN1; IRF3; EIF4H; TRAM1; ITSN1; ZYX; NFE2L2; PKN2; DDB1; BAK1; MICA; SMU1; CRTC2; NUP188; UBR4; MAGI3; RAET1L; E4F1; RICTOR; CRTC3; CRTC1; ATF7IP; SUPT6H; SND1; MAVS; WAPL; SH3RF1; SERINC5; PACS2; RAB11FIP4; KIAA0319L; ABI1; PDZD8; NUP43; WDR48; DNAJB14; DTX3L; NUP133; SLC20A1; GBF1; CREBBP; KAT2B; TANK; TNPO1; USP7; FBXW7; OPTN; SIRT1; POM121; SRPK1; SPEN; MAP3K5; MXRA8; PAAF1; YIPF4; NUP85; RBCK1; SETD2; IFIH1; NLRP1; TRIM5; DERL2; SP110; APOBEC3G; MOV10; UBN1; CD93; APOBEC3C; LMBRD1; EXOC1; UCKL1; ABI2; ITSN2; VAPA; CLEC1B; PI4KB; VPS29; NXF1; ZC3H7B; TBK1; RCOR1; CLEC4A; AP3M1; SAMHD1; TLN1; USP15; YTHDF2; DYNC1LI1; IKBKG; WASF2;	GO:0016032~viral process	230	456	50.4385964912281	0	0	0	0	0	0	0
down	SNAP23; STXBP3; PSMD12; PSMD14; SDCBP; DDX3X; RNASET2; FCN1; MAN2B1; PDXK; ADAM10; APAF1; DEGS1; SURF4; ARPC5; PSMD3; GMFG; DIAPH1; TOM1; LILRB3; DNAJC13; CREG1; ATP6AP2; DGAT1; TRPM2; STK10; TMEM63A; ATG7; BRI3; RAB3D; CYB5R3; HP; PLAU; SERPINA3; C3; CST3; HLA-B; HLA-H; AHSG; TTR; FTL; CAT; FUCA1; ALDOA; CSTB; ARG1; ITGB2; GLA; S100A9; PYGL; GPI; ITGAV; CTSD; CAPN1; PSAP; HEXB; CTSB; HSP90AA1; CD55; GUSB; HSP90AB1; CTSG; CD14; PTPRC; CD63; ACAA1; GSTP1; HMGB1; CTSH; FGR; RNASE2; GAA; HLA-C; CTSA; HSPA8; SLC2A3; ITGAM; LAMP1; IGF2R; FCGR2A; ANXA3; RNASE3; XRCC6; LAMP2; CYBA; EEF2; APEH; CD59; SELL; PKM; JUP; ARSA; B4GALT1; TIMP2; CD44; GLB1; CD36; BPI; PFKL; CR1; VCL; CD53; AOC1; CD33; TNFRSF1B; RAB3A; RAB6A; ITGAL; ITGAX; IMPDH1; FPR1; MMP8; PTPRB; CXCR1; CXCR2; PTAFR; CTSS; S100P; STOM; ATP6V0C; MAPK1; GCA; GRN; PTPN6; SERPINB3; FCER1G; SERPINB1; S100A7; GALNS; SERPINB6; AGL; PGM1; SRP14; DDOST; FRK; PRCP; IQGAP1; GYG1; SERPINB10; DNASE1L1; SLC11A1; PSEN1; CAMP; RAB5C; RAB7A; RAB27A; P2RX1; HK3; ACLY; IST1; CRISP3; VCP; NCKAP1L; GSDMD; RAB5B; RAB10; RAB14; ACTR2; RAP1B; RAP2B; RHOA; B2M; YPEL5; RAP1A; RAC1; VAMP2; DYNLT1; EEF1A1; PAFAH1B2; HBB; ADAM8; RHOG; ATP11A; DSG1; PRKCD; CD47; SIGLEC14; LRMP; PTPRJ; PSMD2; DNAJC3; KCNAB2; PDAP1; ROCK1; TCIRG1; ASAH1; IQGAP2; RAB31; SPTAN1; CDK13; COTL1; MLEC; DYNC1H1; MVP; KPNB1; STXBP2; MAPK14; ANO6; CLEC12A; UBR4; ATAD3B; HGSNAT; NAPRT; NBEAL2; UNC13D; CYFIP1; DOK3; TMC6; C6orf120; GOLGA7; RAB44; HUWE1; CAND1; TICAM2; ADGRG3; TBC1D10C; SLC44A2; ORMDL3; STK11IP; SLC15A4; NFAM1; LPCAT1; TSPAN14; ATP8B4; CLEC4C; CLEC4D; NCSTN; DOCK2; ARHGAP45; ATP6V0A1; RAB24; TMBIM1; LRRC7; CNN2; PSMD1; NEU1; CPNE1; CPPED1; ARHGAP9; ERP44; CRACR2A; VAMP8; AP1M1; ADGRE3; CRISPLD2; TOLLIP; MAGT1; DNAJC5; PTGES2; METTL7A; MMP25; CD93; TMEM30A; CMTM6; ACTR10; KCMF1; VAPA; CTSZ; BIN2; DBNL; PSMD13; PPIE; HPSE; ATP11B; ATP8A1; PRG3; CAB39; RAP2C; ATP6V1D; HEBP2; DYNC1LI1; ENPP4;	GO:0043312~neutrophil degranulation	272	483	56.3146997929607	0	0	0	0	0	0	0
down	SHTN1; PLXNB1; KLK8; SRGAP2; EGFR; NGF; UBB; GJA1; BMP7; WEE1; NBL1; DNM2; ITGA1; RHOA; DYNLT1; PAK1; CTTN; LRRK2; MAP1S; KIRREL3; PACSIN1; ZNF335; ZSWIM6; DBNL; DICER1; EPB41L3; MAP4K4; HCLS1; NTF3; SGK1; DBN1; NRK; MINK1; ANKRD27; STK3; STK4; NTF4; NCKAP1L; GAS7;	GO:0048812~neuron projection morphogenesis	39	62	62.9032258064516	0.000101188689716869	0.013899097186035	0.924561057943032	0.931239511464345	0.712733704200483	0.924561057943032	0.134884550185451
down	PSMD12; PIK3CD; BTN3A1; PSMD14; IKBKB; CHUK; PDPK1; PSMD3; PAK3; HRAS; TRBV12-3; TRAC; TRBC1; HLA-DRA; HLA-DQA1; HLA-DRB1; HLA-DQB1; TRBV7-9; HLA-A; PTPRC; HLA-DPA1; PSMA3; PSMA4; PSMB4; MAPK1; PSMB10; CSK; PIK3CA; PIK3CB; WAS; PSMC4; CRKL; PSMB2; PSEN1; EIF2B2; PSMD4; BCAR1; PSMA6; PSME3; PSMC5; PSMC6; SKP1; PSME1; PTPRJ; LCP2; EIF2B5; PAK1; PAK2; PSMD2; PSME4; STK11; HLA-DRB5; RC3H1; NFKBID; SPPL3; PSMF1; INPP5D; RNF31; PSMD1; NFKBIZ; RBCK1; PRKD2; WNK1; PAG1; TAB2; MALT1; EIF2B4; PSME2; PSMD13; PTPN22; TRAF6; IKBKG; THEMIS2; CD276; BTNL3; BTN3A2; BTNL2; PRAM1; BTN2A2; HHLA2; BTN2A1; TEC;	GO:0050852~T cell receptor signaling pathway	82	174	47.1264367816092	0.000104562649192674	0.0141513244194144	0.955284363024273	0.962290060520182	0.719072407148604	0.955284363024273	0.13733230319153
down	PPP6C; CTDSP2; PPP1R12A; PPM1G; PHLPP1; SBF1; CTDNEP1; PPP1R3D; PTPRC; MYH6; PTPN1; PTPRB; PTPRM; PTPN4; PTPN6; PPP2R1A; PPP2R1B; PPM1A; PTEN; PPP4C; PPP1CA; PPP1CB; PPP2CB; PPP3R1; PPP2R2A; PPP2CA; PTPN12; DUSP2; PPP3CA; DLG1; CAMK2G; MTMR2; MTMR3; PPP2R5A; PTPRR; PTPRK; STK11; PTPN21; PPM1J; SSH2; PPP1R3B; PPM1K; PPM1N; PPP4R1; SSH1; PTPN18; CPPED1; CTDSP1; ILKAP; PPA2; PPP4R1L; CTTNBP2NL; PPM1H; DAPP1; MINPP1; PTPN22; CTDP1; PPP4R2; PTPRE; PTPRA; PTPRD; PPP2R5E; PTPRG; PPP2R5B; PPP2R5C; DUSP7; PTPRJ; PTPN7;	GO:0006470~protein dephosphorylation	68	137	49.6350364963504	0.00012326906316773	0.0155679716429552	1	1	0.746564030652312	0.99975376809601	0.15108023379171
down	MYBPHL; ADAM10; TBX3; MAFG; KDM6A; BCL2L11; ADCY9; PLOD3; EIF4E2; ZFAND5; SLC34A2; SYF2; IGF2; EDN1; ITGB1; POLB; GLI2; AR; TGFB3; MYH6; C6; VEGFA; YBX3; RXRA; EIF2S2; BTF3; EDNRA; MGAT1; NMT1; CTNNB1; MYH9; ADD1; TGFBR2; SSR2; NOTCH1; LIG4; ELL; HAND2; UBE2B; YBX1; SMAD3; ATP11A; NOTCH2; ACVR1; MYO1E; SMAD4; KEAP1; GNA13; DSC3; PTPRR; SMAD2; DBN1; MAN2A1; ZNF568; C2CD3; OTUD7B; ANKRD11; UBR3; RBBP6; CIR1; MIB1; CMIP; RDH10; WDTC1; WDR19; FLCN; HM13; BRK1; SIN3A; PRMT1; HINFP; CCM2; CELF4; NSRP1; ZNF335; TANC2; CHD8; CHST11; RIC8A; GDF3; SMPD4; CAMSAP3; CHD7; KIDINS220; HEG1; ZMIZ1; RTCB; CHTOP; TRAF6; KLF2; EPN1; SLC30A1;	GO:0001701~in utero embryonic development	92	203	45.320197044335	0.000123488202752986	0.0155679716429552	1	1	0.746774631056941	0.99975376809601	0.15108023379171
down	CLEC1B; STK39; CAB39; MAP2K7; MAP2K5; TAOK2; MINK1; OXSR1; MAP3K3; STK24; PAK3; SLK; PAK1; PAK5; SBK2; MAP2K2; STK4; TAOK1; STK25; MAP2K4; MAP4K4; TAOK3; NRK; STK10; MAP4K5; MAP2K1; MAP3K14; MAP4K2; STK3; MAP3K1; MAP3K4; MAP3K2; PAK2;	GO:0023014~signal transduction by protein phosphorylation	33	49	67.3469387755102	0.000133664347439555	0.0166231485065706	1	1	0.756594099156599	0.99975376809601	0.16132025547872
down	CNOT1; PATL2; DDX3X; DAPK3; EIF4E2; GAPDH; EIF4E; RARA; EIF2AK2; RPS3; IGFBP5; CALR; TIA1; RPL13A; RGS2; TOB1; RACK1; YBX1; BTG2; PURA; ILF3; CIRBP; CAPRIN1; GRB7; LARP1; XRN1; CPEB3; RNF139; TSC1; CELF1; PUS7; RBM4; CELF4; PCIF1; INPP5E; PRG3; IGF2BP2; CNOT2; PAIP2; CNOT10; FXR1; FXR2; FMR1; CNOT3; SAMD4B;	GO:0017148~negative regulation of translation	45	78	57.6923076923077	0.000139662005375296	0.0170812513284695	1	1	0.762391260794346	0.99975376809601	0.165765939413688
down	WWP2; PIK3CD; ZBTB7B; INPPL1; CLDN3; SLIT3; ROCK2; DYSF; FGF19; HRAS; TGFB1; APOE; RB1; PGR; CRH; CD46; VEGFA; POU3F2; TAF1; MMP8; ATP2B4; YY1; ERP29; AKT1; KDR; MAP2K2; SERPINF1; VHL; CRKL; NOTCH1; PSEN1; MECP2; DGKQ; PRKAA2; AIF1; HAND2; RACK1; TMF1; RUNX1; MAP2K1; NOTCH2; MEF2C; REST; PRKAA1; PICALM; HDAC1; FLOT2; DIP2A; TERF2; BAK1; OCLN; HIF1A; PARP14; RBMS3; TIPARP; CLDN19; TNRC6A; FLCN; SMCR8; ABCC2; FBXW7; TP53INP1; SIRT1; SFRP2; GPER1; CPNE1; HINFP; NDFIP1; PDCD10; GATA5; BBS2; PINK1; ADNP; FOXP1; GGNBP2; AGO3; MOV10; TNRC6C; AGO4; SLC35C2; DLL4; NDFIP2; TBK1; ANAPC2; NOCT; AGO2; TNRC6B; DICER1; ZNF148; PTPN22; SETDB2; SETDB1;	GO:0010629~negative regulation of gene expression	92	204	45.0980392156863	0.000141059991411896	0.0170812513284695	1	1	0.763723814722745	0.99975376809601	0.165765939413688
down	PIK3CD; PITPNM1; PIK3C2B; CDIPT; PIP5K1B; SYNJ2; INPP4B; INPPL1; SYNJ1; PIP5K1C; PIK3C2G; SBF1; RAB4A; RAB5A; PIK3CA; PIK3CB; PI4KA; PIP4K2A; PIK3CG; PTEN; RAB14; ARF3; ARF1; VAC14; MTMR1; MTMR2; MTMR3; SLC27A1; MTMR14; PIK3C3; FIG4; PIK3R3; INPP5D; CDS1; SH3YL1; INPP4A; RUFY1; PIK3R4; PIP5K1A; MTMR12; INPP5E; SACM1L; PI4KB; PIKFYVE;	GO:0006661~phosphatidylinositol biosynthetic process	44	76	57.8947368421053	0.000155237394915742	0.0185538927975269	1	1	0.777424927887865	0.99975376809601	0.180057269237457
down	RHOA; CCDC88C; STK3; MAP2K5; OXSR1; MAP3K1; STK10; MAP2K2; SLK; NRK; MAP4K2; TAOK1; TAOK2; MAP2K1; STK25; MAP2K7; MAP4K5; MAP3K14; PAK3; MAP4K4; MAP2K4; PAK2; STK24; MINK1; PAK5; MAP3K4; PAK1; MAP3K3; STK39; SBK2; MAP3K2; STK4; TAOK3;	GO:0031098~stress-activated protein kinase signaling cascade	33	50	66	0.000175648556702268	0.0207242777862945	1	1	0.797093150314893	0.99975376809601	0.201119889278226
down	ARID1A; CHD1; KDM6A; SMARCA5; ZBTB7A; RB1; TOP1; PAX7; ATRX; SOX9; SMARCA4; FOXA1; HDAC4; HILS1; RBBP4; SMARCB1; BPTF; PAK1; CBX3; HDAC1; MYSM1; SMARCD3; SUPT6H; PBRM1; SMYD1; SMARCC2; EZH1; KAT2B; SMARCC1; SMARCD2; SMARCE1; SMARCD1; RSF1; CHRAC1; BAZ1A; CHD7; RERE; BAZ2B; BAZ2A; INO80; HDAC5; RUVBL2; HCFC1; DR1; KDM5C; HMGB1; KDM4C; TADA2A; KDM5A; RUVBL1; HMGB2; KDM5B; SATB1; KDM4B; JARID2;	GO:0006338~chromatin remodeling	55	105	52.3809523809524	0.00018743245506847	0.0218346947341156	1	1	0.808468077508119	0.99975376809601	0.211895991389062
down	TRIM38; IRF6; MID1; JAK2; OAS1; HLA-B; HLA-H; HLA-DRA; HLA-DQA1; HLA-DRB1; HLA-DQB1; MT2A; HLA-A; HCK; HLA-C; IFI30; HLA-E; IRF2; IFNGR1; CD44; HLA-DPA1; JAK1; SP100; PTAFR; PML; HLA-F; GBP2; CIITA; IFNGR2; B2M; IRF9; IRF8; PRKCD; TRIM26; NMI; CAMK2G; TRIM25; IRF3; IRF4; HLA-DRB5; TRIM8; TRIM5;	GO:0060333~interferon-gamma-mediated signaling pathway	42	72	58.3333333333333	0.000191659091746121	0.0220479827667444	1	1	0.812554379547271	0.99975376809601	0.213965856787945
down	COPE; GOSR2; SEC16A; DYNC1LI2; SEC22B; SEC31A; VAPB; CNIH1; SEC24A; SEC24B; F8; CD55; TRAPPC2; F5; CD59; FOLR1; KDELR1; COPB2; GRIA1; NSF; CAPZA2; CAPZB; ARCN1; CAPZA1; COPA; VCP; STX17; RAB2A; ACTR1A; RAB1A; SPTBN1; GOLGA2; ANK3; STX5; DCTN2; CUL3; SPTAN1; DYNC1H1; COG2; GOLGB1; TMED2; SEC23A; MPPE1; YIF1B; MIA3; CREB3L2; ARFGAP2; CNIH3; WHAMM; TRAPPC12; GBF1; TFG; ERGIC1; DYNLL2; COG3; SEC16B; LMF1; DCTN5; RAB1B; ARFGAP3; BET1L; ACTR10; CNIH4; VAPA; COPG2; CTSZ; PEF1; NRBP1; DCTN4; COG5; HYOU1; COPG1; DYNC1LI1; TRAPPC5; TRAPPC3L; LMAN2; YIF1A; VTI1B; ERGIC3; TMED7-TICAM2; TICAM2; TMED4; TMED5; TRAPPC6B; SAR1A; KDELR2; BCAP31; CTAGE5;	GO:0006888~endoplasmic reticulum to Golgi vesicle-mediated transport	88	196	44.8979591836735	0.000217105679300333	0.0246300421944154	1	1	0.832657546015684	0.99975376809601	0.239023593977051
down	CASC3; CDC40; ZC3H11A; SLU7; EIF4E; TPR; U2AF2; SARNP; SRSF3; U2AF1; SRSF2; SRSF11; SRSF4; NCBP1; SRSF9; SRSF5; THOC5; DDX39B; SRSF7; THOC7; SRRM1; THOC2; U2AF1L4; DHX38; THOC1; POLDIP3; NXF1; CHTOP; RBM8A; NUP153; POM121; NUP98; NUP188; NUP133; NUP62; NPAP1;	GO:0006405~RNA export from nucleus	36	58	62.0689655172414	0.000221866783485569	0.0246300421944154	1	1	0.835373054158967	0.99975376809601	0.239023593977051
down	ESYT2; NPC1; INPPL1; PSTPIP1; TOM1; LRP4; EPN2; AP2A1; HRAS; CFI; ASGR2; RAB5A; PIK3CB; PIK3CG; TSC2; DNM2; RAB7A; PRSS12; RAB1A; LGALS3BP; MYO1E; PICALM; ENPP2; BECN1; CLINT1; GAPVD1; SHH; TRIP10; DGKD; AAK1; MIA3; RABGAP1L; LRRK2; FKBP15; SCARA5; LRP10; CLEC10A; NOSTRIN; MICALL1; NECAP1; DNER; RIN3; DENND1A; RIN2; RUBCN; SH3KBP1; HOOK2; PGBD1; C9orf72; SNX18; FNBP1; RUFY1; CYTH2; SORT1; SH3GL3; CD163L1; ITSN2; ANKFY1; EPS15L1; ATP6V1H; RABGEF1; MYO6; SYNRG; SNX9; EPN1; WASF2; MARCO; WASL; DENND1C; EQTN; WIPF1; ATP9A; WAS; RAB5B; MIB1; RALBP1; WIPF2; RHOU; PIK3C3; CDC42;	GO:0006897~endocytosis	80	174	45.9770114942529	0.00023045196460203	0.0252482075027676	1	1	0.840273063245214	0.99975376809601	0.245022613081767
down	CASC3; PARN; RPLP1; RPLP2; RPS17; PABPC1; GSPT1; RPS2; RPL35A; RPS3; RPS12; RPL13; RPL10; PPP2R1A; RPL9; RPL13A; RPS27; RPL27A; RPL28; RPS9; RPS5; RPS10; RPL29; EIF3E; RPL26; RPL37A; RPL37; RPS7; RPS8; RPS15A; RPS14; RPS18; RPS29; RPS13; RPS11; ETF1; RPS6; RPS28; RPL30; RPL31; RPL8; RPL41; RPS27A; PPP2R2A; RPS21; PPP2CA; RPL24; RPL18A; EIF4G1; NCBP1; DCP2; SMG7; SMG1; PYM1; UPF2; SMG5; RPL36; RBM8A; DHX34;	GO:0000184~nuclear-transcribed mRNA catabolic process, nonsense-mediated decay	59	117	50.4273504273504	0.000242098058861995	0.026212099243611	1	1	0.846922906820209	0.99975376809601	0.254376753293245
down	AGRN; ABLIM1; SIPA1L3; DIAPH1; PRPF40A; SVIL; HLA-DRB1; APOE; KRT6B; KRT16; TUBA3D; DMD; KRT13; KRT5; KRT15; MDK; CFL1; MSN; CTNNA2; PRKCI; CAPZB; SOX9; CCL11; ARHGAP4; SPTBN1; KRT76; DST; SPTAN1; NEDD9; SH3D19; FGD3; ZMYM4; PADI6; SYNE3; FGD5; FGD6; RHOU; MAEA; MICAL3; KRT25; FGD2; PDZD8; MICAL1; ARAP3; PHIP; PALLD; NECTIN2; SH3KBP1; SIPA1; FGD4; CNN2; SEMA6A; GPR35; KRT84; BRWD1; ABI2; PLCE1; PAK5; STRIP2; WASF3; KLHL20; CDC42BPB; ACTL7B; PACSIN1; MAST4; MAST2; MAST3;	GO:0007010~cytoskeleton organization	67	139	48.2014388489209	0.000260575397425411	0.0278845974710007	1	1	0.857491823548227	0.99975376809601	0.270607603978575
down	NRP1; ROCK2; SASH1; AGT; FGF1; EDN1; GPI; THBS1; RRAS; ANXA3; TDGF1; VEGFA; CALR; GRN; FLT4; KDR; BCAR1; RHOB; GPLD1; TEK; AAMP; BMPR2; PTK2B; PRKD1; EMC10; CCBE1; SCARB1; RIN2; PROX1; FOXC2; PRKD2; FOXP1; SMOC2; BCAS3;	GO:0010595~positive regulation of endothelial cell migration	34	54	62.962962962963	0.000269428767095237	0.0285006085468674	1	1	0.862524596894109	0.99975376809601	0.276585717216104
down	SRRM4; RBFOX2; ZBTB7A; HNRNPL; DDX5; PTBP1; RBM25; RBM5; TRA2B; HNRNPU; FMR1; KHDRBS1; REST; DYRK1A; WTAP; SMU1; SREK1; SRSF12; DDX17; CELF6; RBM4; CELF4; NSRP1; THRAP3; RBM8A; SRSF4; MBNL2; IK; CELF2; SRSF9; SRSF10; MBNL3; SRSF3; SRSF5; SRSF2; RBM17; SRSF7; FXR2; FXR1; CELF1;	GO:0000381~regulation of alternative mRNA splicing, via spliceosome	40	69	57.9710144927536	0.000295267050745007	0.0308788939546171	1	1	0.875230398543893	0.99975376809601	0.299665918263928
down	SMAD7; LDLRAD4; CLDN3; FOXO3; SLIT2; CD74; KRT16; ABHD2; TMIGD3; RRAS; SRF; CDH1; IFITM1; VCL; PTN; NF1; IGFBP5; NF2; NKX2-1; DUSP3; SLURP1; AFDN; PTEN; RHOB; JAG1; ADARB1; PTPRJ; DAG1; KANK1; PTPRK; SHH; ADIPOQ; MIA3; MIIP; ARID2; MCTP1; PODN; MAGI2; SULF1; CLDN19; SCAI; FLCN; DLG5; TP53INP1; SFRP2; DLC1; OSBPL8; RNF41; DUSP22; PLXNB3; ZMYND8; LIMCH1; RAP2C; STK24; RAP2B; ARHGAP4; SRGAP2; SRGAP3;	GO:0030336~negative regulation of cell migration	58	116	50	0.00032064796164355	0.0328037441306297	1	1	0.88392540685421	0.99975376809601	0.318345732261251
down	CASC3; FOXO3; NEURL1; RPLP1; EIF4E; ACO1; RPL10; AKT1; AKT2; GRM5; RPS14; SARNP; TCOF1; NOLC1; MAPKAPK5; LSM14A; PUM2; TSC1; QKI; ATXN2; MKNK1; LSM14B; PCIF1; MKNK2; EIF2B4; CNOT11; CNOT6; PKP3; RBM8A; ZNF706; CYFIP1; MATR3; PTBP2; HNRNPL; PTBP1; HNRNPLL; PTBP3;	GO:0006417~regulation of translation	37	62	59.6774193548387	0.000322890415810351	0.0328037441306297	1	1	0.884702735548726	0.99975376809601	0.318345732261251
down	DNAJB6; BAG4; BAG3; HSP90AA1; HSP90AB1; HSPA8; TPR; RPA2; DNAJB1; MAPK3; RPA1; MAPK1; HSPA1L; RPA3; NUP62; MTOR; MAPKAPK2; NUP153; RANBP2; GSK3B; NUP98; NUP107; YWHAE; HSF1; EP300; NUP160; ATM; ATR; CAMK2G; PTGES3; NUP188; CCAR2; NUP43; NUP133; HSPH1; CREBBP; SIRT1; POM121; DNAJC2; DNAJC7; NUP85; CHORDC1; HSPB8;	GO:1900034~regulation of cellular response to heat	43	77	55.8441558441558	0.000326990128806104	0.0328037441306297	1	1	0.886101718654789	0.99975376809601	0.318345732261251
down	PSMD12; PSMD14; IKBKB; CHUK; PSMD3; RPS6KA5; RPS6KA4; UBB; UBC; IL1R1; EGR1; PSMA3; PSMA4; MAPK3; PSMB4; PSMB10; PSMC4; PSMB2; IRAK1; PSMD4; PSMA6; PSME3; PSMC5; PSMC6; RPS27A; SKP1; PSME1; PSMD2; UBE2V1; SQSTM1; PSME4; TAB3; PSMF1; PELI1; PSMD1; MAP3K3; MYD88; TOLLIP; PELI2; IL1RL2; NOD2; IL1RAP; IRAK4; TAB2; PSME2; PSMD13; NOD1; TRAF6; IRAK3; IKBKG;	GO:0070498~interleukin-1-mediated signaling pathway	50	95	52.6315789473684	0.000327930507445173	0.0328037441306297	1	1	0.886396161624303	0.99975376809601	0.318345732261251
down	APOL1; GAK; HIP1R; HP; JCHAIN; IGKV1-5; IGKV3-20; IGLV1-51; IGLV1-40; IGLV2-14; IGLV2-23; IGLV2-11; IGLV3-27; IGHV3-7; IGHV2-70; IGHV2-5; IGHV4-39; IGHV4-59; IGKC; IGHA1; APOA1; APOE; IGKV3-11; ITGB2; INSR; IGHV4-34; ASGR1; HSP90AA1; CD14; ITGAM; IGF2R; ADRB3; HSP90B1; FOLR1; CD36; M6PR; MRC1; CALR; SFTPD; TGFBR2; DNM2; PPT1; AP1S1; HBB; HSPG2; CLTC; LRP1; PLA2R1; CLN3; PICALM; SCARB2; CTTN; LDLRAP1; LMBR1L; CLEC9A; ARHGAP27; LDLRAD3; MICALL1; SCARB1; HSPH1; SORL1; REPS1; AMN; CXCL16; STAB1; LRP1B; PI4KB; MARCO; CD207; DBNL; PIKFYVE; HYOU1; SNX9; DNAJC13;	GO:0006898~receptor-mediated endocytosis	74	160	46.25	0.000336595490558755	0.0333084763399164	1	1	0.889357824981295	0.99975376809601	0.323243933640989
down	RAB10; VAMP2; SPTBN1; ANK3; GOLGA4; RAB31; ARFRP1; VAMP3; GOLGA7; GCC2; OPTN; BBS2; AMN; KIF13A; GOLPH3; GGA3; GGA2; GGA1; RAB26; MACF1; C16orf70; SYS1-DBNDD2; NSF; GOLPH3L;	GO:0043001~Golgi to plasma membrane protein transport	24	32	75	0.00035089392316312	0.0343540082433	1	1	0.893375928373304	0.99975376809601	0.333390355282973
down	ARNTL; PER2; HDAC3; CLOCK; MYCBP2; USP2; TOP1; EGR1; ATF4; KDM5A; PML; RORA; AHR; NAMPT; NRIP1; CSNK1D; CSNK1E; PPP1CA; PPP1CB; HNRNPU; KMT2A; MTA1; HDAC1; NCOA2; ZFHX3; CARTPT; CRY2; RAI1; HUWE1; SIRT1; NPAS2; MYBBP1A; LGR4; PPARGC1A; NOCT; KDM2A; ID4; ID1;	GO:0032922~circadian regulation of gene expression	38	65	58.4615384615385	0.00036495709127482	0.0349864594896059	1	1	0.896235183747114	0.99975376809601	0.339528013055301
down	PER2; HDAC3; CLOCK; ROCK2; ATG7; CREB1; DRD4; SFPQ; PML; PPARG; HNF4A; MTOR; MAPK9; CSNK1D; CSNK1E; GSK3B; MAPK10; PRKAA2; PPP1CA; PPP1CB; PRKDC; UBE3A; PRKAA1; HNRNPD; NONO; DDB1; CRY2; CCAR2; PROX1; USP9X; USP7; FBXW7; OPN3; PPARGC1A; OPN4; MAGEL2; NOCT; KDM2A;	GO:0042752~regulation of circadian rhythm	38	65	58.4615384615385	0.00036495709127482	0.0349864594896059	1	1	0.896235183747114	0.99975376809601	0.339528013055301
down	SH2B2; ATP6V0E1; IGF2; INSR; IGF1R; PTPN2; PTPN1; PTPRA; ATP6V1B2; ATP6V1C1; APC; ATP6V0C; AKT1; AKT2; ATP6V1E1; SREBF1; ATP6V1A; NAMPT; GSK3A; CSRP3; CAV2; BCAR1; ATP6V0D1; GRB2; GPLD1; SOS1; GAB1; TCIRG1; EIF4EBP1; SLC39A14; RPE65; ATP6V0D2; PHIP; SMARCC1; ATP6V0A1; FOXC2; ATP6V0A4; ATP6V1H; IRS2; ATP6V1D; FOXO3; GRB14; GSK3B; GRB10; GRB7; PIK3R3; ZNF106;	GO:0008286~insulin receptor signaling pathway	47	88	53.4090909090909	0.000380339493735393	0.036085199596359	1	1	0.899353178408635	0.99975376809601	0.350190796622208
down	TAF4; NR5A2; E2F3; MED24; MED26; PGR; AR; RARA; NR2F6; NR2F1; THRA; VDR; ESRRA; TCF4; RXRA; TBP; TAF1; NR4A1; CCND1; POLR2A; TEAD1; GTF2E2; GTF2H1; GTF2F1; RORA; PPARG; HNF4A; NOTCH1; SOX9; NR2C2; CDK8; CDK9; MECP2; CCNH; POLR2H; GTF2A1; NR1H2; PTEN; POLR2F; GTF2I; NOTCH2; RBPJ; BAX; TAF10; TRIM28; SNW1; GTF2H3; CBFB; E2F2; NR1I3; MED1; TAF9; TAF2; MED25; MAML2; MAML1; CREBBP; TAF15; KAT2B; MED12; NRBF2; MAML3; NR1H4; MED15; NOTCH4; WWTR1; PPARGC1A; MED13; NRBP1; GTF2A1L; THRAP3; MED16; MED31; NR2E3;	GO:0006367~transcription initiation from RNA polymerase II promoter	74	161	45.9627329192547	0.000387258625945242	0.0363667462711639	1	1	0.900763563948632	0.99975376809601	0.352923081754038
up	DNAJB9; IGKV3D-7; IGKV6D-21; IGKV1D-8; IGLV3-12; IGKV1OR2-108; IGKV1D-33; IGKV2D-24; IGLV3-21; IGLV7-46; IGKV2-28; IGLV4-60; IGLV9-49; IGKV2D-28; IGKV6-21; IGKV1-33; IGKV1-39; IGLV5-37; IGKV1D-39; TRDV2; IGLV5-52; IGKV2D-40; IGKV3-7; IGKV1-9; IGLV4-3; IGLV2-33; IGKV1D-13; IGLV4-69; IGKV2D-26; IGKV1D-16; IGKV2D-30; IGLV2-8; IGKV1-16; IGLV3-16; IGKV3D-11; IGKV1-6; IGKV1-12; IGKV3D-15; IGKV5-2; IGKV1D-12; IGLV3-1; IGLV1-44; IGLV3-32; IGKV3D-20; IGKV1-13; IGLV8-61; IGLV2-18; IGKV2-30; TRAV38-1; IGKV2-29; IGLV1-50; TRAV9-2; IGKV3-15; IGLV3-10; IGKV1D-43; IGLV5-48; IGLV10-54;	GO:0002377~immunoglobulin production	57	107	53.2710280373832	0.000415124286002433	0.855467372379514	1	1	0.99999731200961	0.99999731200961	1
down	CFLAR; PDPK1; INSR; SP1; GSTP1; SLC2A4; XBP1; AKT1; AKT2; G6PC; PPARG; LEP; PRKCI; GCLC; GSK3A; PTEN; RAB8A; RAB10; YWHAG; VAMP2; PRKDC; GPLD1; GHRHR; ZFP36L1; POU4F2; PAK1; SRSF5; RAB31; SLC39A14; ADIPOQ; CYFIP1; CPEB2; C2CD5; WDTC1; KAT2B; GHSR; SYAP1; HDAC9; HDAC5; IRS2; MYO5A; LPIN2; RAB8B; LPIN1; RPS6KB1; LPIN3; PCK1; PCK2; PKM;	GO:0032869~cellular response to insulin stimulus	49	94	52.1276595744681	0.000440844420926845	0.0409807192504015	1	1	0.911646600120357	0.99975376809601	0.397699635334626
down	PLXNB2; SIPA1L1; ADAP1; SBF1; SOD1; VAV1; NF1; BCL6; MTOR; PAFAH1B1; CRK; RAP1GAP; EFNA5; DYNLT1; PTK2; ARHGEF5; RAB3GAP1; RALBP1; FGD3; RICTOR; FGD5; FGD6; FGD2; TRAPPC6B; SBF2; BVES; TBC1D15; FGD4; STMN3; PLXNA4; PLXNB1; ARHGAP9; ARHGAP27; PLXNA3; PLXNA2; PLXNB3; ARHGAP15; ARHGAP12; PLXNA1; PLXNC1;	GO:0043087~regulation of GTPase activity	40	71	56.3380281690141	0.000453754472630297	0.0417590241161662	1	1	0.914264118237993	0.99975376809601	0.405252737548437
down	SLN; SCD; PER2; ZBTB7B; HDAC3; JAK2; CNOT3; MFN2; GADD45G; FH; IGF1R; DBH; THRA; ADRB3; VEGFA; CD36; GJA1; ADCYAP1; APC; UCP1; LEP; STAT6; GPR3; UCP2; CXCR4; HSF1; GRB10; IL18; DYNC1H1; LPIN1; IRF4; ADIPOQ; DECR1; GNAS; FFAR4; ADIPOR2; PPARGC1B; APPL2; ZNF516; DIO2; ADIPOR1; EPAS1; EHMT1; EBF2; PDGFC; FGF21; PPARGC1A; GHRL; PRKAB1; KDM3A;	GO:0120162~positive regulation of cold-induced thermogenesis	50	97	51.5463917525773	0.000471494816862927	0.0429620475206883	1	1	0.917855446432542	0.99975376809601	0.416927544092317
down	ATG13; ATG12; BAG3; PSEN1; RAB7A; RAB1A; TCIRG1; BECN1; ATG2A; WDR45B; WIPI1; ATG16L1; KIAA1324; ATG14; PACS2; STX12; VMP1; AMBRA1; RAB33B; ATG5; MAP1LC3A; ATG3; WDR45; WIPI2; UBXN2B; ATG7; GABARAPL2; RAB1B; MAP1LC3B; TP53INP1; ATG16L2; GABARAPL1; RB1CC1; PIK3C3; NSFL1C;	GO:0000045~autophagosome assembly	35	59	59.3220338983051	0.00050034808060917	0.0447058581150115	1	1	0.923578265106778	0.99975376809601	0.433850449549819
down	CASC3; CDC40; ZC3H11A; PCF11; SLU7; U2AF2; PAPOLA; SARNP; SRSF3; U2AF1; SRSF2; SRSF11; SRSF4; NCBP1; CPSF1; CSTF3; SRSF9; SRSF5; THOC5; DDX39B; SRSF7; THOC7; PABPN1; ZC3H3; SRRM1; THOC2; U2AF1L4; DHX38; SYMPK; THOC1; POLDIP3; WDR33; CHTOP; RBM8A; RPRD2;	GO:0031124~mRNA 3'-end processing	35	59	59.3220338983051	0.00050034808060917	0.0447058581150115	1	1	0.923578265106778	0.99975376809601	0.433850449549819
down	LEPROT; ATG13; ABLIM3; ARIH2; RAC2; HSPA1L; GSK3A; NPEPPS; UBE2D3; PRKAA1; FZD5; RHOU; HUWE1; MICALL2; BAP1; FBXW7; RNF31; PINK1; UBL5; HPS4; USP36; SAE1; SH3GLB1;	GO:1903955~positive regulation of protein targeting to mitochondrion	23	31	74.1935483870968	0.000514514767926078	0.045529609704074	1	1	0.925334143458984	0.99975376809601	0.441844591979938
down	ARPC1B; RGS9; MBD4; AGT; CST3; TGFB1; PENK; GH1; CAT; CYP1A2; GSTP1; RARA; TFPI; ESRRA; EEF2; NQO1; GJA1; BMP7; PAM; PTN; CCND1; NR2F2; CALR; DUSP1; CD38; TACR3; CTNNB1; GPX4; STAT3; LEP; CASP3; PTGFR; CDKN1B; MAP1B; MMP15; STAT5B; FOXA1; PTEN; STRN3; CASP8; NCOA1; GHSR; ABCC2; RBBP8; TXNIP; MBD2; MBD1; NCOR2; DNMT3A; ANXA1; CSN1S1; GGT5;	GO:0032355~response to estradiol	52	103	50.4854368932039	0.00053312567109709	0.046727195724824	1	1	0.927641762288779	0.99975376809601	0.453466631135083
down	TLR4; CCL21; MAP2K7; NRP1; CFLAR; PDE8A; SEMA7A; FGF19; EGFR; HRAS; TGFB1; GCG; HLA-DRB1; APOE; FGA; FGB; FGG; PDGFA; CD74; GNAI2; CSF1R; PTPRC; FGF4; HMGB1; PLA2G2A; BRAF; CD44; NQO2; CD36; ADCYAP1; FGFR3; FSHR; MAPK3; HTR2A; S100A7; SSTR4; ARRB2; GPR183; ADRA1A; OPRM1; FLT4; KDR; HTR2B; GATA4; CRKL; NOTCH1; P2RY1; ARRB1; PTEN; RAP1B; HAND2; RAP1A; MAP2K1; TEK; NOTCH2; PTPN11; LRP1; SLAMF1; RAPGEF1; PTK2B; NPY5R; FFAR4; SLC30A10; ABCA7; GPBAR1; FBXW7; GPER1; PHB2; CIB1; PRKD2; FGF23; GLIPR2; NOD2; FGF20; NOX4; FGF21; DNAJC27; C5AR2; MARCO; NOD1; PTPN22; RAPGEF2; NPTN; CCL11; CCL17; MUSK; CCL15-CCL14; CCL26; CCL18; PDGFC;	GO:0070374~positive regulation of ERK1 and ERK2 cascade	90	209	43.0622009569378	0.000539869703719109	0.0468718951257261	1	1	0.928518662433008	0.99975376809601	0.454870874399342
down	TLR4; IKBKB; CHUK; CD14; UBB; UBC; UBE2D3; UBE2D2; RPS27A; TRAF3; BIRC3; BIRC2; RIPK1; IKBKE; IRF3; CASP8; TICAM2; CD300LF; TANK; TBK1; IKBKG; LY96;	GO:0035666~TRIF-dependent toll-like receptor signaling pathway	22	29	75.8620689655172	0.000547056294182946	0.0470519539753799	1	1	0.929418961437502	0.99975376809601	0.456618265371388
down	FFAR2; KLF7; OAS1; RBP4; INSR; PYGL; ADRA2A; DBH; SLC2A4; PTPN2; IGFBP5; PAX6; AKT1; PCK1; G6PC; PPARG; STAT3; LEP; HNF4A; PRCP; GCGR; MTNR1B; CSRP3; PDX1; PRKAA2; FOXA1; SESN2; RPS6; PTPN11; PRKAA1; STK11; ADIPOQ; HIF1A; CRY2; CRTC2; SLC8B1; CYB5R4; ADIPOR2; SLC30A8; ADGRF5; MCU; APPL2; ADIPOR1; CSMD1; MLXIPL; TCF7L2; G6PC2; MBD5; RPH3AL; STXBP5L; HECTD4; BACE2; BCKDK; IGF1R; FOXO3; PDK1;	GO:0042593~glucose homeostasis	56	114	49.1228070175439	0.00055833383818582	0.0474906658525131	1	1	0.93079276276075	0.99975376809601	0.460875768820431
down	KIF2A; DYNC1LI2; AP1G1; CTSV; SEC31A; SEC24A; SEC24B; AP2A1; HLA-DRA; HLA-DQA1; HLA-DRB1; HLA-DQB1; CD74; CTSD; CLTA; IFI30; HLA-DOB; HLA-DPA1; CTSS; CANX; HLA-DMA; HLA-DMB; CAPZA2; CAPZB; DNM2; RAB7A; KIF11; CAPZA1; AP1S2; ACTR1A; AP1S1; ARF1; CLTC; KLC1; AP1B1; DCTN2; DYNC1H1; SEC23A; KIF4B; HLA-DRB5; AP2M1; DYNLL2; AP1S3; DCTN5; AP1M1; ACTR10; DCTN4; TRAF6; DYNC1LI1; FCER1G;	GO:0019886~antigen processing and presentation of exogenous peptide antigen via MHC class II	50	98	51.0204081632653	0.000562477733122235	0.0474906658525131	1	1	0.931339492905364	0.99975376809601	0.460875768820431
