down	ARID1A; CHEK1; CTNNB1; ARID1B; SMARCD1; KMT2B; ZMIZ2; ZMIZ1; ELOF1;	GO:0048096~chromatin-mediated maintenance of transcription	9	11	81.8181818181818	0.0178394829805835	0.389044459408317	1	1	0.99975376809601	0.99975376809601	1
down	PIP5K1B; PIP5K1C; BPNT1; PIK3CA; PI4KA; PIP4K2A; EFR3A; TTC7B; IP6K1; SMG1; PIP5K1A; IP6K2; PIKFYVE; PIK3CG; PIK3C3; PIK3C2G; PIK3R3; SOCS4; CISH; PI4KB; FAM126B; PIK3CB; PIK3C2B; SOCS7; SOCS6; PIK3CD;	GO:0046854~phosphatidylinositol phosphorylation	26	54	48.1481481481481	0.0181641649858185	0.395188676984605	1	1	0.99975376809601	0.99975376809601	1
down	PSMD12; PSMD14; SETD1A; PSMD3; TCF3; EIF2AK2; PSMA3; PSMA4; PSMB4; PSMB10; PSMC4; PSMB2; PSMD4; PSMA6; PSME3; PSMC5; PSMC6; RUNX1; KMT2A; PSME1; PSMD2; CBFB; PSME4; LDB1; PSMF1; ITCH; PUS7; PSMD1; PSME2; PSMD13; YTHDF2;	GO:1902036~regulation of hematopoietic stem cell differentiation	31	68	45.5882352941176	0.018423150207867	0.39987795132783	1	1	0.99975376809601	0.99975376809601	1
down	CLASP2; PAFAH1B1; CLASP1; GCC2; CDK5RAP2; BCAS3; SDCCAG8;	GO:0031023~microtubule organizing center organization	7	7	100	0.0188899534916956	0.406181511261955	1	1	0.99975376809601	0.99975376809601	1
down	ADAM10; PSEN1; DYRK1A; ABCA7; NCSTN; APH1A; PSENEN;	GO:0034205~amyloid-beta formation	7	7	100	0.0188899534916956	0.406181511261955	1	1	0.99975376809601	0.99975376809601	1
down	PTPN11; RBPJ; TBX2; SMAD4; HAS2; FOXN4; CHD7;	GO:0036302~atrioventricular canal development	7	7	100	0.0188899534916956	0.406181511261955	1	1	0.99975376809601	0.99975376809601	1
down	EGFR; RPLP1; RPLP2; RPS17; RPS2; RPL35A; EIF2AK2; RPS3; RPS12; RPL13; RPL10; AKT1; RPL9; GGT5; IGHMBP2; RPL13A; RPS27; RPL27A; RPL28; RPS9; RPS5; RPS10; RPL29; RPL26; RPL37A; RPL37; RPS7; RPS8; RPS15A; RPS14; RPS18; RPS29; RPS13; RPS11; RPS6; RPS28; RPL30; RPL31; RPL8; RPL41; RPS27A; RPS21; MRPS15; RPL24; RPL18A; EIF4G1; PABPC4; CPEB4; CPEB2; MRPL52; MRPL41; MRPL43; CPEB3; COPS5; RPL36AL; MRPL34; RRBP1; RPS6KB2; AGO2; RPL36; SRBD1; EEF1A1; RPS4Y2; GSPT1; MRPS12; MRPL57; EEF1A1P5;	GO:0006412~translation	67	175	38.2857142857143	0.0190595112919664	0.406181511261955	1	1	0.99975376809601	0.99975376809601	1
down	NR5A2; ABCD4; SMAD7; SMARCA5; PTP4A3; TFRC; SLC25A5; FGF4; CREB1; XBP1; NFYB; PAX6; PML; MAT2A; PIGA; RFX2; GCLM; CTBP2; SRSF3; HNRNPU; PFKP; TLE4; EPS8; LAPTM5; KLF5; EIF4A2; TRIM25; ARID5B; SRSF7; TEX14; RNF138; KAT6B; SPOCK2; JARID2; PMM1; SIRT1; PDCD10; BCLAF1; KDM5B; MTF2; KDM3A;	GO:1990830~cellular response to leukemia inhibitory factor	41	97	42.2680412371134	0.019110789348737	0.406181511261955	1	1	0.99975376809601	0.99975376809601	1
down	DNM1L; UTY; TAPBP; ATP1B1; CYP1A2; PTPRC; PTHLH; CDH1; TSPAN8; TFEB; NF1; SLC8A1; G6PC; AHR; TGFBR2; GDNF; PIK3CA; PSEN1; AIF1; PPP2CB; ZFP36L1; TAF10; TCIRG1; HIF1A; UMODL1; RICTOR; DUX4L9; ALPK2; PROX1; TRIM44; SORT1; HINFP; FOXP1; POFUT2; MAP3K4; POGZ; HMG20B; CDK11A; MAPK1; MAPK3; AFF4; YBX3; ZNF407; YBX1; ZNF335; TOB2; MAPK9; AFF1; MAPK6; CDK11B; MECOM; MAPK14; SHH; ZNF513; MAPK13; ZNF462; SRPK1; ZNF438; MAPK10; ZNF451; MAPK4; REST; TOB1; SRPK2;	GO:0010468~regulation of gene expression	64	166	38.5542168674699	0.0193637329179868	0.410609295032793	1	1	0.99975376809601	0.99975376809601	1
down	NKX2-8; ZNF217; ABLIM3; ZBTB7A; PTMA; COL4A2; POLR1D; AR; SKI; TCF3; POLR2A; ARNT; HOXD3; NUP62; RFX3; POLR2H; POLR2F; E2F1; MEF2A; PWP1; NCOA1; SMARCD3; ASXL2; LDB1; GPBP1; ASXL1; SCAI; PPP1R13L; PHF3; FUBP3; ATF6B; HINFP; DIDO1; ASXL3; EPC1; RRAGC; GPBP1L1; THAP1; ZNF219; BAZ2A; INO80; PLAGL2; DRG1;	GO:0006351~transcription, DNA-templated	43	103	41.747572815534	0.019430751135976	0.410951511451404	1	1	0.99975376809601	0.99975376809601	1
down	MEFV; FOXO3; DCN; HMGB1; TFEB; PIK3CB; GSK3A; GSK3B; PRKAA2; PRKAA1; ROCK1; PRKD1; STK11; LRRK2; MTDH; RNF152; FLCN; TP53INP1; OPTN; TRIM8; AMBRA1; PLK2; PIM2; SH3GLB1;	GO:0010508~positive regulation of autophagy	24	49	48.9795918367347	0.0196258597389625	0.410951511451404	1	1	0.99975376809601	0.99975376809601	1
down	PPP1R12A; CCP110; ENSA; OFD1; CDK14; HAUS5; PCNT; LATS1; HSP90AA1; CALM3; PRKACA; TUBG1; PPP2R1A; WEE1; CDC25B; CDKN2B; PAFAH1B1; CSNK1D; CSNK1E; DNM2; CCNH; NEK2; ARPP19; ACTR1A; YWHAG; PPP1CB; YWHAE; PPP2R2A; SKP1; TUBA4A; KHDRBS1; DCTN2; DYNC1H1; PCM1; HAUS3; TAF2; CLASP1; SDCCAG8; CEP192; OPTN; MASTL; CDK5RAP2; AKAP9; CEP250; HAUS4; NDE1; LCMT1; CEP131; CEP164; PPME1; USH1C; FBXL12; FBXL18;	GO:0000086~G2/M transition of mitotic cell cycle	53	133	39.8496240601504	0.0199963846787771	0.410951511451404	1	1	0.99975376809601	0.99975376809601	1
down	SLN; PPP1R12A; HNRNPR; OAZ2; TIMP1; SCGB1A1; ANXA3; NQO1; UGT1A1; PLN; SERPINB3; NOTCH1; OAZ1; CLN3; FRY; CAND1; CCAR2; WDTC1; TMBIM1; ANP32E; PPP1R12C; TXNIP; UGT1A8; CABP1; NOSIP;	GO:0043086~negative regulation of catalytic activity	25	52	48.0769230769231	0.0205087934218657	0.420361750248174	1	1	0.99975376809601	0.99975376809601	1
up	DCLK1; DCX; TLX3; ADAM23; PROP1; PPP1R17; COL2A1; S100B; NGFR; POU3F3; PTPRZ1; COX7B; ADORA2A; BTD; GABRA4; NES; ALDH3A2; RCAN1; POU6F2; NHLH2; DRP2; NPTX1; ASIC2; MOG; UGT8; CYP26C1; DHX30; THOC6; AHI1; DSCAML1; GRHL3; SHC3; KLK6; SH3GL2; NMUR2; NHEJ1; ELP3; ARNT2; ROBO2; SNTG2; TAGLN3; HPCAL4; NEUROG3; NCAN; ZIC4; HAPLN1; HAPLN3; MTF1; ACAN; BCAN; ZIC5; ZIC3; EMX1; HAPLN2; VAX1; ZIC1;	GO:0007417~central nervous system development	56	133	42.1052631578947	0.0207302008795179	0.886638668349201	1	1	0.99999731200961	0.99999731200961	1
up	VSTM5; RS1; CHMP2A; GLRA3; POLQ; PRNP; RBMX; ADCY8; KCNC1; KCNC4; KCNA1; KCNB1; KCTD19; BEND3; RNF213; KCTD16; ATL3; KCNV1; TRIM72; KCTD8; KCTD9; ARC; CALHM1; KCNRG; KCNG3; KCNV2; KCNS1; KCNC2; KCNA7; KCTD15; KCTD14; KCNS3; EHD4; KCTD10; KCNF1; EHD1; KCTD5; EHD3; KCND2; SPAST; UPB1; KCNG2; KCND3; KCNS2; PYCARD; RNF112;	GO:0051260~protein homooligomerization	46	105	43.8095238095238	0.0208342306914511	0.886638668349201	1	1	0.99999731200961	0.99999731200961	1
down	AKR1B15; AKR1B10; DGAT1; DHRS3; RBP4; TTR; CYP1A2; CYP2D6; CYP3A5; ALDH1A3; RPE65; AWAT2; RDH10; RDH13; RDH11; RDH12; DGAT2; BCO1; RDH14; RDH8; ADH1C; ADH1B;	GO:0042572~retinol metabolic process	22	44	50	0.0211030857582157	0.425902847001885	1	1	0.99975376809601	0.99975376809601	1
down	SOCS6; LILRB3; LILRB5; HP; CST3; HLA-B; CD74; IL32; WAS; CXCL12; CRISP3; HSF1; TAP1; MST1R; SP140; ACKR1; CLEC1A; RNASE6; NLRP3; CSF3R; NOD2; CLEC1B; MALT1; NOD1; CYSLTR1; STAT3; DUOX1; NOX5; STAT6; STAT2; STAT5B; NOX4;	GO:0006952~defense response	32	72	44.4444444444444	0.021700724638219	0.437006058742954	1	1	0.99975376809601	0.99975376809601	1
down	SH3PXD2B; TNFRSF11B; TBX3; TLL1; CLEC3A; USP1; IGF2; AHSG; ALPL; HEXB; TRAPPC2; GLI2; ACP2; VDR; PTHLH; BMP3; BMP1; ETS2; PAX1; BMP7; FGFR3; GNA11; HOXA13; BMP8B; HOXD13; FBN1; GJA5; SOX9; COMP; RASSF2; RPS6KA3; CDH11; HDAC4; NKX3-2; PHEX; EN1; PRDX1; TCOF1; COL19A1; EXT1; RAI1; FGFRL1; FRZB; MEPE; GDF3; ASH1L; HOXC10; CHD7; TRPS1; SERP1; HOXD4; MMP16; HAPLN4; MMP14;	GO:0001501~skeletal system development	54	137	39.4160583941606	0.0220612218549903	0.443295687186628	1	1	0.99975376809601	0.99975376809601	1
down	ARNTL; PER2; HDAC3; CLOCK; HNRNPR; NCOR1; EGFR; TOP1; HNRNPL; CREB1; SREBF1; LEP; NAMPT; NRIP1; GSK3B; CPT1A; EP300; DYRK1A; NONO; ADIPOQ; RPE65; CRY2; SETX; ARNTL2; PROX1; NPAS2; PPARGC1A; NOCT; HS3ST2; THRAP3; NFIL3; MTNR1A; PROK2;	GO:0007623~circadian rhythm	33	75	44	0.0221171791784808	0.443451851807317	1	1	0.99975376809601	0.99975376809601	1
down	EREG; TIMP1; TFF1; GJA1; BMP7; BSG; CDKN1B; CXCL12; EIF2B2; BTG2; TEK; EIF2B5; DAG1; TIMP4; EIF2B4; ANXA1; STAT6; REG1A; REG3G; STAT3; STAT5B; STAT2; REG1B;	GO:0043434~response to peptide hormone	23	47	48.936170212766	0.0221836797238039	0.443818270648189	1	1	0.99975376809601	0.99975376809601	1
down	EPS15; RAB14; ARF6; ACAP2; KIAA1109; CCDC93; VPS53; LMTK2; MICALL2; DENND1A; SNF8; PTPN23; EPG5; CMTM6; GGA3; VPS29; VPS51; DENND1C; RAB35; RAB11FIP4;	GO:0032456~endocytic recycling	20	39	51.2820512820513	0.0225412977246668	0.44537114512292	1	1	0.99975376809601	0.99975376809601	1
up	MATN2; CHL1; NTN3; DOK2; GFRA3; SLIT1; DAB1; NFASC; LGI1; SPTA1; RET; NGFR; GLI3; SPTB; SRC; NCAM1; PLCG1; BDNF; EPHA8; SHC1; OTX2; RYK; MYH10; WNT5A; LHX2; VASP; EPHB3; EPHA5; CDH4; GFRA1; WNT3; WNT3A; VLDLR; SCN1B; MAPK7; SEMA3F; CRMP1; FOXD1; PTPRO; VAX1; GDF7; SIAH1; ENAH; LMX1A; SHC3; NR4A3; NEO1; ARX; SEMA3C; DPYSL5; BOC; SPTBN4; ROBO2; PDLIM7; SPTBN5; B3GNT2; FLRT3; DOK5; MYOT; NRXN1; NRXN3; VSTM2L; MYPN; SEMA6C; KIF5C; EPHA3; EFNA4; EPHA4; LRTM2; EFNB2; UNC5B; EPHA2; ROBO4; CNTN2; EPHA1; EFNB3; UNC5C; SEMA3D; DSCAML1; EPHA7; UNC5D;	GO:0007411~axon guidance	81	206	39.3203883495146	0.0225783542614906	0.886638668349201	1	1	0.99999731200961	0.99999731200961	1
down	LRCOL1; PLA2G6; PLCH2; CLPS; APOA4; LIPF; PLA2G2A; PAFAH1B1; PPT1; RAB7A; PLCD1; PAFAH1B2; PLCB2; PLCB3; SULT2A1; PLCXD2; PLCB4; IAH1; PLA2G2C; LIPN; LIPK; NCEH1; ASPG; PLCZ1; PLBD2; ABHD4; PAFAH2; PLA2G12B; TBL1XR1; PLA2G2F; PLCE1; PLA2G2D; PLA1A; PNLIPRP2; LIPG;	GO:0016042~lipid catabolic process	35	81	43.2098765432099	0.0228271012029611	0.449845422635654	1	1	0.99975376809601	0.99975376809601	1
down	FOXP2; CFLAR; FLNB; NEURL1; SVIL; DCN; MYOG; NF1; MYF6; NR2F2; HOXD10; CSRP3; MYL6; RHOA; MEF2C; EP300; KCNAB1; HLX; COL19A1; MAPK14; TAZ; BVES; IGSF8; GPCPD1;	GO:0007519~skeletal muscle tissue development	24	50	48	0.0231701269162362	0.44989841990027	1	1	0.99975376809601	0.99975376809601	1
down	NKX2-2; FOS; TGFB1; THBS1; ABHD2; TGFB3; GABRB1; PTN; CD38; TSPO; SREBF1; FOSB; DSG1; UBE3A; DSG2; NCOA2; NCOA1; WBP2; TXNIP; CATSPERB; CSN1S1;	GO:0032570~response to progesterone	21	42	50	0.0238773092288371	0.452600963918928	1	1	0.99975376809601	0.99975376809601	1
down	WWP2; NEURL1; ZBTB7A; EGFR; BMP7; AKT1; BCL6; ARRB1; MMP14; DLK1; BEND6; DLK2; ARRDC1; GDPD5; FBXW7; SLC35C1; DLL4; HIF1AN; YTHDF2; HEY1; JAG1;	GO:0045746~negative regulation of Notch signaling pathway	21	42	50	0.0238773092288371	0.452600963918928	1	1	0.99975376809601	0.99975376809601	1
down	STXBP3; ZBTB7B; INPPL1; CAT; FABP3; CELA2A; EGR1; PLN; CAD; MC4R; ADM; PCK1; MTOR; EIF6; SESN2; MAX; HSD11B2; GHRHR; SRSF4; VPS13C; KBTBD2; TSC1; SIRT1; SORT1; CITED1; GALP; KLF15; SLC27A1; EPM2AIP1; LEP;	GO:0032868~response to insulin	30	67	44.7761194029851	0.0238880329627746	0.452600963918928	1	1	0.99975376809601	0.99975376809601	1
down	MYO1C; STXBP3; TLR4; DAPK3; FLNB; GAPDH; EDN1; TDGF1; HLA-DPA1; MRC1; CASP1; GBP2; KIF5B; RPL13A; IL12RB1; WAS; AIF1; CDC42; ACTR3; ACTR2; ACTG1; IRF8; CD47; STX4; STXBP2; VAMP3; ZYX; KIF16B; GBP4; SLC26A6; CDC42EP4; RAB20; STX8; GBP3; CCL21; CCL17; CCL15-CCL14; CCL11; CCL18; CCL26;	GO:0071346~cellular response to interferon-gamma	40	96	41.6666666666667	0.0239965551222291	0.452600963918928	1	1	0.99975376809601	0.99975376809601	1
down	STK25; SPINT2; CLASP2; SPN; CTNNA1; ACTB; CDC42; ACTR3; ACTR2; DLG1; FAT1; CLASP1; PARD3; PARD6B; CDC42BPB; RHOC; RHOG; RHOB; RND3; RHOU; RHOA; RHOBTB1; PARVG; RAC1; RAC2;	GO:0007163~establishment or maintenance of cell polarity	25	53	47.1698113207547	0.0240677032340291	0.452600963918928	1	1	0.99975376809601	0.99975376809601	1
down	TLR4; MAPK13; DDX58; IL6R; HMGB1; HSPD1; CYBA; CD36; LBP; ADCYAP1; MMP8; ADORA2B; FCER1G; PTPN11; AKIRIN2; ARHGEF2; TSLP; MYD88; IL1RL2; NOD2; ZBTB20; TBC1D23; NOD1; TLR8; TLR7;	GO:0032755~positive regulation of interleukin-6 production	25	53	47.1698113207547	0.0240677032340291	0.452600963918928	1	1	0.99975376809601	0.99975376809601	1
down	TRIM38; UBR5; ARIH2; IFI27; CDC34; UBE2G2; UBE2D3; UBE2G1; UBE2H; UBE2D2; UBE2B; UBE3A; RNF187; FBXO38; UBE2R2; SYVN1; RNF152; ZNRF1; DTX3L; RFFL; PELI1; ITCH; NEDD4L; RNF126; AMFR;	GO:0070936~protein K48-linked ubiquitination	25	53	47.1698113207547	0.0240677032340291	0.452600963918928	1	1	0.99975376809601	0.99975376809601	1
up	FXYD1; KCNK1; KCNN4; KCNAB3; KCNJ13; CDK2; AQP1; KCNJ1; KCNJ6; KCNC1; KCNJ3; KCNC4; ABCC8; KCNA1; KCNMA1; FXYD3; KCNJ8; KCNV1; KCNN1; KCNS1; KCNS3; KCNF1; KCNMB3; KCNK9; KCNIP2; KCNK4; KCNG2; KCND3; KCNS2; KCNH4; KCNK7; KCNMB2;	GO:0006813~potassium ion transport	32	68	47.0588235294118	0.0245340621237249	0.886638668349201	1	1	0.99999731200961	0.99999731200961	1
up	SLC6A2; SLC6A4; SLC18A1; SLC6A3; SLC18A2; SLC29A4; PICK1;	GO:0015844~monoamine transport	7	7	100	0.0247526803082467	0.886638668349201	1	1	0.99999731200961	0.99999731200961	1
down	SHTN1; RFXANK; RGL2; NTN1; HRAS; RB1; ADRA2A; NF1; CRKL; GNB1; GRB2; SOS1; RALGDS; TRIM28; G3BP1; SETDB1; PRKD1; MAPK14; DOK3; RASGRP2; KSR1; MAPKAPK5; RREB1; RIT1; CNKSR1; RIT2; PLK2; PLCE1; SHOC2; USP8; RERG; RRAS;	GO:0007265~Ras protein signal transduction	32	73	43.8356164383562	0.024829083995493	0.452600963918928	1	1	0.99975376809601	0.99975376809601	1
down	CNOT1; MDM4; CNOT3; CNOT4; MUC1; PML; CASP2; CDKN1B; RPL26; BTG2; MDM2; E2F1; BAX; EP300; ATM; TFDP1; E2F4; CNOT6L; ARID3A; PRMT1; CNOT10; PLK2; CNOT2; CNOT11; CNOT6; PLAGL1;	GO:0006977~DNA damage response, signal transduction by p53 class mediator resulting in cell cycle arrest	26	56	46.4285714285714	0.0248817874620103	0.452600963918928	1	1	0.99975376809601	0.99975376809601	1
down	PSMD12; PSMD14; PSMD3; RAD21; PSMA3; PSMA4; PSMB4; PSMB10; PSMC4; PSMB2; PSMD4; PSMA6; PSME3; PSMC5; PSMC6; SKP1; PSME1; PSMD2; PSME4; MIIP; PSMF1; USP47; PSMD1; PSME2; PSMD13; GPR132;	GO:0010972~negative regulation of G2/M transition of mitotic cell cycle	26	56	46.4285714285714	0.0248817874620103	0.452600963918928	1	1	0.99975376809601	0.99975376809601	1
down	PER2; PGK1; RBP4; ALDOA; GAPDH; ENO1; GPI; ENO2; ENO3; ATF4; PCK1; G6PC; PGM1; MDH2; GPD2; TPI1; SLC39A14; PCK2; CRTC2; G6PC2; PPARGC1A; SLC25A13;	GO:0006094~gluconeogenesis	22	45	48.8888888888889	0.0250924849593787	0.452600963918928	1	1	0.99975376809601	0.99975376809601	1
down	KLHL41; FOS; RB1; EEF2; EGR1; FOXN2; NOTCH1; EMD; BTG2; MEF2C; MEF2D; HIVEP3; ANKRD33; BCL9L; SMYD1; LEMD2; ZNF689; MYLK2; HMG20B; GTF3C5; MYOG; MYF6;	GO:0035914~skeletal muscle cell differentiation	22	45	48.8888888888889	0.0250924849593787	0.452600963918928	1	1	0.99975376809601	0.99975376809601	1
down	LRRTM2; RGS14; CRH; PTN; DRD1; MAPK1; MECP2; SLC8A3; PTEN; VAMP2; RELN; STX4; PTK2B; ITPR3; LRRTM1; TNR; PLK2; SHANK2; NPTN; GRIN2A; GRIN2B; GRIN2D;	GO:0060291~long-term synaptic potentiation	22	45	48.8888888888889	0.0250924849593787	0.452600963918928	1	1	0.99975376809601	0.99975376809601	1
down	PAK3; TGFB1; ALPL; HSP90AB1; GLI2; CYBA; IGFBP5; AKT1; STAT3; CDKN1B; HCFC1; TMF1; PAK2; KLF5; IL18; CASP8; PLA2G4F; TIPARP; SMAD5; P2RY13; NOD2; MBD2;	GO:0071407~cellular response to organic cyclic compound	22	45	48.8888888888889	0.0250924849593787	0.452600963918928	1	1	0.99975376809601	0.99975376809601	1
down	PDLIM1; ZFAND5; SGPL1; PML; IQGAP1; ARID5B; TMEM201; PIP5K1A; TNS1;	GO:0010761~fibroblast migration	9	12	75	0.0252783761223871	0.452600963918928	1	1	0.99975376809601	0.99975376809601	1
down	ABCA1; APOA1; APOE; APOC1; APOC3; APOA4; ABCG1; ABCA12; ABCA7;	GO:0033700~phospholipid efflux	9	12	75	0.0252783761223871	0.452600963918928	1	1	0.99975376809601	0.99975376809601	1
down	MFN2; STX17; PACS2; PIK3C3; WIPI2; WDR45B; ATG13; WDR45; WIPI1;	GO:0034497~protein localization to phagophore assembly site	9	12	75	0.0252783761223871	0.452600963918928	1	1	0.99975376809601	0.99975376809601	1
down	GLI1; ESRRA; PRKACA; DDX5; RASSF2; PTK2; REST; TCIRG1; SMOC1;	GO:0045667~regulation of osteoblast differentiation	9	12	75	0.0252783761223871	0.452600963918928	1	1	0.99975376809601	0.99975376809601	1
down	C3; CD36; ITGA2; PPARG; NCKAP1L; RAB31; ANO6; APPL2; STAP1;	GO:0060100~positive regulation of phagocytosis, engulfment	9	12	75	0.0252783761223871	0.452600963918928	1	1	0.99975376809601	0.99975376809601	1
down	GRM8; FFAR3; GPR37; ADCY6; ADCY3; ADCY9; GPR37L1; GNAI2; EDN1; GNAI3; ADRA2A; EDNRA; NPY1R; SSTR2; OPRK1; P2RY1; MTNR1A; NPY2R; ADCY7; OXER1; RXFP2; LPAR1; P2RY12; RIC8A; MARCO; PSAPL1; PSAP;	GO:0007193~adenylate cyclase-inhibiting G protein-coupled receptor signaling pathway	27	59	45.7627118644068	0.0256177079618601	0.455134684117758	1	1	0.99975376809601	0.99975376809601	1
up	KDM6B; SPRY2; ONECUT2; BMP2; GAS1; FGF8; SOX8; ROR2; ERBB4; GDF7; HEY2; NR2E1; WNT5B; WNT3; WNT7B; WNT8A; WNT9B; WNT11; WNT2B; WNT10A; WNT6; WNT4; WNT3A; SOX2; WNT9A; WNT5A; WNT8B;	GO:0045165~cell fate commitment	27	55	49.0909090909091	0.0256371419235615	0.886638668349201	1	1	0.99999731200961	0.99999731200961	1
down	SDCBP; DDX3X; ADAM10; EXTL3; EGFR; S100A9; CYBA; IL9; CD38; AKT1; AVPR1A; MMP14; RPS6KA3; IL2; CDC42; RHOA; EIF4G2; ADAM17; EIF4G1; NCBP1; MAP2K5; PTK2B; RPS6KA1; TAF9; BRAT1; SUPV3L1; MFSD2A; KDM2B; SFRP2; USP47; CIB1; DERL2; CXCL16; CDKN2AIP; INO80;	GO:0030307~positive regulation of cell growth	35	82	42.6829268292683	0.0258891546884251	0.459071080149473	1	1	0.99975376809601	0.99975376809601	1
down	DYSF; BAG4; ITGAV; P4HB; VEGFA; ITGA2; TFE3; MDK; TGM2; CXCL12; ADAM8; PPP3CA; STX4; PTPRJ; ATM; ZFHX3; APBB1IP; FRMD5; TMEM102; FLCN; PRKD2; EPB41L4B; TNFSF18;	GO:0045785~positive regulation of cell adhesion	23	48	47.9166666666667	0.0261939582579793	0.463582688169584	1	1	0.99975376809601	0.99975376809601	1
up	FXYD1; GRID2; ATP8B1; ATP2C2; ATP6V1G1; CYBB; GPR89B; ATP6V1B1; GLRA2; CASQ1; GJC1; CHRNA7; SCNN1A; GRIA4; ATP4B; SCNN1B; CLCN5; CLCNKA; ATP12A; ATP1B3; FXYD4; ATP2B2; PLP2; GRIK2; TRDN; FXYD3; CLCA4; RYR3; ATP6AP1; GRIK5; ASIC2; ATP6V1F; ANO4; ATP13A4; SLC9B1; PDZD11; ANO1; SLC24A5; ANO5; TMC7; TMC3; OSTM1; UNC80; ATP6V1C2; STOML3; BSND; ATP6V1G3; ATP6V0B; P2RX4; ASIC5; ASIC3; SLC24A2; GRID1; CLCA2; NOX1; CLCA3P; CHRNA10; CHRNB2; CHRNA1; GLRA4; CHRNB3; GABRR1; CHRNA2; GABRB3; GLRA3; CHRND; CHRFAM7A; GABRG3; GLRA1; CHRNA3; CHRNB1; GABRA2; HTR3C; GABRA1; GABRD; GABRA4; HTR3B; HTR3E; GABRB2; CHRNG; CHRNB4;	GO:0034220~ion transmembrane transport	81	208	38.9423076923077	0.0264978771441469	0.886638668349201	1	1	0.99999731200961	0.99999731200961	1
down	NBN; ZNF324; ECD; CD74; GNAI2; CSF1R; ERCC1; IRF2; TYR; PAX1; ITGA2; EDNRA; AKT1; STAT3; LIG4; CDK9; EMP2; GNG2; RAP1B; YPEL5; GNB1; RAC1; PRDX1; ZFP36L1; LRP1; PPP1R8; SMAD4; IL18; SCRIB; KANK1; PDK1; BAK1; TXNRD1; USPL1; BRAT1; LARP1; DUX4L9; LMNTD1; POC1B; RASGRP4; NELFB; DAZAP1; PURB; YME1L1; SDCBP2; NAA60; YY1AP1; SH2D2A; SIX2; PDS5B; PAK5; LIPG; TACC2; TACC3; TACC1;	GO:0008283~cell population proliferation	55	142	38.7323943661972	0.0266253616905326	0.468670277530936	1	1	0.99975376809601	0.99975376809601	1
down	VAPB; APOE; ATP1B1; PRKCB; HEXB; VDR; TPT1; ATP2A2; ATF4; TNNI3; DRD4; DRD5; KEL; ATP2B4; CALR; HTR2A; SLC8A1; CDH5; HTR2B; GPR12; CXCL12; CSRP3; CCL11; SLC8A3; ATP2C1; SLC10A7; TCIRG1; CHERP; SLC24A4; TPCN2; RYR2; ATP2A3; TMEM165; NPTN; SLC30A1; ATP2B1; ATP13A1; ATP2A1; ATP13A5;	GO:0006874~cellular calcium ion homeostasis	39	94	41.4893617021277	0.0267691498193532	0.468670277530936	1	1	0.99975376809601	0.99975376809601	1
down	PSMD14; CLDN3; CLDN7; SOD1; PENK; RBP4; CAT; POLB; CRH; CD14; GSTP1; RARA; EEF2; SLC2A4; NQO1; ADCYAP1; CBL; CCND1; EEF1B2; STAT3; LEP; RGS2; HTR3A; TUFM; RGS19; RGS4; IL2; ACTR2; RHOA; GRIN1; GRIN2A; GRIN2B; BIRC2; EIF4EBP1; PTK2B; CASP8; SETDB1; ADIPOQ; BAK1; SETD7; SDF4;	GO:0045471~response to ethanol	41	100	41	0.0270245886297478	0.468670277530936	1	1	0.99975376809601	0.99975376809601	1
down	HDAC3; CHP2; JAK2; UBR5; BAG3; TGFB1; HSP90AB1; TPR; CDH1; HCLS1; JUP; MAPK1; LEP; PSEN1; SMAD3; PRKCD; TRIM28; SHH; MAPK14; MAVS;	GO:0042307~positive regulation of protein import into nucleus	20	40	50	0.0270378308667265	0.468670277530936	1	1	0.99975376809601	0.99975376809601	1
down	MYO1C; CCL21; FCHSD2; BAG4; PFN1; HCK; MTOR; CCL11; NCKAP1L; RHOA; ARF6; GRB2; PRKCE; DLG1; CTTN; PTK2B; LMOD2; RICTOR; BAIAP2L1; CCL26; SNX9; BAIAP2L2; CDC42EP3; CDC42EP4;	GO:0030838~positive regulation of actin filament polymerization	24	51	47.0588235294118	0.0271890634624637	0.468670277530936	1	1	0.99975376809601	0.99975376809601	1
down	TLR4; JAK2; PF4; CD2; CD14; PTPRC; CYBA; HLA-E; CD36; LBP; PTAFR; FCER1G; LEP; PTPN11; PTPRJ; RIPK1; MAVS; ARHGEF2; NOD2; ZBTB20; NOD1; ARFGEF2; LY96; HMGB1;	GO:0032760~positive regulation of tumor necrosis factor production	24	51	47.0588235294118	0.0271890634624637	0.468670277530936	1	1	0.99975376809601	0.99975376809601	1
down	SHTN1; SDCBP; NRP1; OPHN1; NTN1; CTTN; P2RY12; CD2AP;	GO:0006930~substrate-dependent cell migration, cell extension	8	10	80	0.0272573462676946	0.468670277530936	1	1	0.99975376809601	0.99975376809601	1
down	MAF; MDK; GLG1; LNPK; SIX2; TRPS1; SCIN; PTHLH;	GO:0032330~regulation of chondrocyte differentiation	8	10	80	0.0272573462676946	0.468670277530936	1	1	0.99975376809601	0.99975376809601	1
down	TNRC6A; AGO3; TNRC6C; AGO4; AGO2; TNRC6B; MOV10; HELZ;	GO:0035194~posttranscriptional gene silencing by RNA	8	10	80	0.0272573462676946	0.468670277530936	1	1	0.99975376809601	0.99975376809601	1
down	ADAM10; ABCG1; PSEN1; PSEN2; CLN3; NCSTN; APH1A; PSENEN;	GO:0042987~amyloid precursor protein catabolic process	8	10	80	0.0272573462676946	0.468670277530936	1	1	0.99975376809601	0.99975376809601	1
down	CASQ2; ADCYAP1; ATF4; HTR2A; NOS1; ACTN2; PTK2B; VIP;	GO:0043267~negative regulation of potassium ion transport	8	10	80	0.0272573462676946	0.468670277530936	1	1	0.99975376809601	0.99975376809601	1
down	EIF3F; EIF3D; DENR; PTBP1; EIF2D; EIF3B; EIF3A; PCBP2;	GO:0075522~IRES-dependent viral translational initiation	8	10	80	0.0272573462676946	0.468670277530936	1	1	0.99975376809601	0.99975376809601	1
down	SMAD7; LDLRAD4; PDPK1; CIDEA; ZBTB7A; TGFB1; UBB; UBC; TGFB3; SKI; PPM1A; TGFBR2; NKX2-1; DNM2; CAV2; RPS27A; ADAM17; SMAD3; SMAD2; BCL9L; GLG1; PMEPA1; SIRT1; SMURF1; CHST11; ONECUT1; SNX6; STRAP; ZNF451; SKIL;	GO:0030512~negative regulation of transforming growth factor beta receptor signaling pathway	30	68	44.1176470588235	0.0274071850089148	0.468670277530936	1	1	0.99975376809601	0.99975376809601	1
up	ADAMTS3; COL2A1; ANXA2; COL1A2; SERPINF2; COL11A1; COL11A2; ACAN; COL5A1; TNXB; LOX; TGFBR1; LUM; TGFB2; FMOD; FOXC1; ADAMTS14; PXDN; P3H4; COL12A1; OPTC; LOXL3; LOXL4;	GO:0030199~collagen fibril organization	23	45	51.1111111111111	0.0275217262545069	0.886638668349201	1	1	0.99999731200961	0.99999731200961	1
down	AQP9; AQP8; RAPGEF3; PENK; EZR; WT1; IGFBP5; PTAFR; SLC8A1; PCK1; AHR; PIK3CG; KCNQ1; SLC8A3; RAP1B; RAP1A; ZFP36L1; RAPGEF1; ITPR2; ADIPOQ; AKAP9; SLC26A6; NOX4; HCN3; RAPGEF2;	GO:0071320~cellular response to cAMP	25	54	46.2962962962963	0.0280850736896804	0.468670277530936	1	1	0.99975376809601	0.99975376809601	1
up	ODAM; MEN1; QSOX1; MATN3; VGF; WFS1; STC2; PRSS23; TSPAN15; F2; PLG; SERPINC1; KNG1; NPPA; CALCA; FN1; ALB; TF; MMP1; PROC; APOB; IGF1; CHGB; APP; CALB1; GSN; KLK3; SFTPB; IGFBP1; CSF1; LTA4H; PGA5; SAA1; SPP1; LAMC1; SFTPC; BMP4; SCG2; IGFBP3; IGFBP2; CDH2; ITIH2; HRC; TNC; ADORA2A; SDC2; IGFALS; SNCA; MMP13; TSPAN5; SLC34A1; CKAP4; PAPPA; DMP1; MSLN; GAS6; SPARCL1; LTBP1; TTF1; TGFBI; NOTUM; VWA1; APOA5; TSPAN33; SIAH1; GOLM1; PCSK9; SCG3; ABCA3; CHRDL1; PAPPA2; EVA1A; L2HGDH; LMCD1; NAT8; NAT8B; ZDHHC2; SERPINA10;	GO:0044267~cellular protein metabolic process	78	200	39	0.0282705284618703	0.886638668349201	1	1	0.99999731200961	0.99999731200961	1
down	PLOD3; AKAIN1; BCL6; TSC2; MECP2; IST1; HAP1; CD81; GNGT1; SQSTM1; RAB35; NEDD8; CEP128; DDX42; CADM3; STK11IP; NIN; PHYHIP; SPTSSA; CCDC120; CEP250; BBS2; CCDC68; GGA1; MAPRE3; AP4S1; AKAP11; PARD3; PARD3B; SPHKAP; AKAP10; TRAK1;	GO:0008104~protein localization	32	74	43.2432432432432	0.0282980988768021	0.468670277530936	1	1	0.99975376809601	0.99975376809601	1
down	TBX3; FOXS1; PAX6; AHR; TGFBR2; CRKL; PSEN1; MDM2; MEF2C; RAPGEF1; MIB1; MAP3K3; STRA6; ANTXR1; TCF7L2; SPHK2; RAPGEF2; TDGF1; TDGF1P3; CFC1; BMPR2;	GO:0001568~blood vessel development	21	43	48.8372093023256	0.028404379852232	0.468670277530936	1	1	0.99975376809601	0.99975376809601	1
down	CDH5; DSG1; TJP1; FLCN; HDAC7; NR1H4; PARD6B; HEG1; TLN1; CDH19; CDH1; CDH11; CDH8; CDH18; PKP3; CDH10; CDH6; CDH17; CDH23; CDH13; CTNND1;	GO:0007043~cell-cell junction assembly	21	43	48.8372093023256	0.028404379852232	0.468670277530936	1	1	0.99975376809601	0.99975376809601	1
down	ADAM10; CTNND1; CDH1; JUP; CDH5; CTNNA1; NUMB; AFDN; CDH6; CDH8; CDH11; CDH13; CDC42; CDH17; CDH18; CADM3; NECTIN2; CDH10; CDH19; CSK; CDH23;	GO:0034332~adherens junction organization	21	43	48.8372093023256	0.028404379852232	0.468670277530936	1	1	0.99975376809601	0.99975376809601	1
down	TCAP; LEP; HTR2B; CSRP3; TIAM1; TTN; RYR2;	GO:0003300~cardiac muscle hypertrophy	7	8	87.5	0.0288451808118452	0.468670277530936	1	1	0.99975376809601	0.99975376809601	1
down	ATP2A1; TGM2; BCAP31; RAP1GDS1; BAX; BAK1; THADA;	GO:0032471~negative regulation of endoplasmic reticulum calcium ion concentration	7	8	87.5	0.0288451808118452	0.468670277530936	1	1	0.99975376809601	0.99975376809601	1
down	SLC11A1; SLC11A2; SLC39A14; SCARA5; MCOLN1; TTYH1; SLC40A1;	GO:0034755~iron ion transmembrane transport	7	8	87.5	0.0288451808118452	0.468670277530936	1	1	0.99975376809601	0.99975376809601	1
down	CTNND1; MET; CDH1; CBL; CTNNB1; GRB2; CBLL1;	GO:0035635~entry of bacterium into host cell	7	8	87.5	0.0288451808118452	0.468670277530936	1	1	0.99975376809601	0.99975376809601	1
down	ERN1; MARK3; MAP2K2; ATM; RIPK1; DYRK1A; PINK1;	GO:0036289~peptidyl-serine autophosphorylation	7	8	87.5	0.0288451808118452	0.468670277530936	1	1	0.99975376809601	0.99975376809601	1
down	WDR1; RHOC; VCL; CTNNA1; RHOA; PKN2; CLDN19;	GO:0043297~apical junction assembly	7	8	87.5	0.0288451808118452	0.468670277530936	1	1	0.99975376809601	0.99975376809601	1
down	DVL1; MUSK; RER1; LRP4; ETV5; FNTA; DNAJA3;	GO:0071340~skeletal muscle acetylcholine-gated channel clustering	7	8	87.5	0.0288451808118452	0.468670277530936	1	1	0.99975376809601	0.99975376809601	1
down	ITGA3; NUP107; JAG1; NUP160; NUP133; NUP85; SIX2;	GO:0072006~nephron development	7	8	87.5	0.0288451808118452	0.468670277530936	1	1	0.99975376809601	0.99975376809601	1
down	CASQ2; OXSR1; ACTN2; PTEN; NEDD4L; STK39; CAB39;	GO:1901017~negative regulation of potassium ion transmembrane transporter activity	7	8	87.5	0.0288451808118452	0.468670277530936	1	1	0.99975376809601	0.99975376809601	1
