down	TULP1; SOD1; APOA1; AHSG; BCR; CYBA; CALR; IL2RG; SFTPD; IL15; SLC11A1; DNM2; RAB27A; LRP1; MFGE8; LMAN2; ABR; IL15RA; CAMK1D; SPACA3; ABCA7; DOCK2; FCER1G; CD47;	GO:0050766~positive regulation of phagocytosis	24	45	53.3333333333333	0.00946373131203326	0.291348021047515	1	1	0.99975376809601	0.99975376809601	1
down	NOTO; EVI5; CDKL5; TBC1D8; CDKL1; TBC1D9B; SDCCAG8; TBC1D1; TBC1D10C; TBC1D16; TBC1D15; DYNC2LI1; TBC1D22A; SYNE2; TBC1D5; TBC1D10A; TBC1D2; ATG5; TBC1D17; CYLD; ATG3; TBC1D22B; TBC1D14; TBC1D2B;	GO:1902017~regulation of cilium assembly	24	45	53.3333333333333	0.00946373131203326	0.291348021047515	1	1	0.99975376809601	0.99975376809601	1
down	PIK3C2B; CTSV; ATG7; HSPA8; LAMP2; TFEB; KRT20; SREBF1; MTOR; GCGR; MAX; DSC2; BMPR2; CARTPT; WDR45B; WIPI1; LRRK2; KIAA1324; ATG14; MFSD2A; TNRC6A; FBXO22; FLCN; FNIP1; SIRT1; AMBRA1; MAP1LC3B; MAP1LC3A; MYH13; WDR45; WIPI2; STK24; RRAGD; RRAGC;	GO:0009267~cellular response to starvation	34	72	47.2222222222222	0.00960273810631029	0.291348021047515	1	1	0.99975376809601	0.99975376809601	1
down	SMAD7; AXIN1; HDAC3; MYCBP2; FAM107A; UBB; ARRB2; BRCA1; MAPK9; ARRB1; GSK3A; PTTG1IP; FKBP1A; XIAP; UBE3A; BIRC3; CUL3; LRRK2; RNF111; HUWE1; RNF180; RASSF5; FBXW7; CHFR; PELI1; PRICKLE1; NDFIP1; PINK1; SENP2; NDFIP2; TBC1D7; MALT1; TRAF6; BIRC2;	GO:0031398~positive regulation of protein ubiquitination	34	72	47.2222222222222	0.00960273810631029	0.291348021047515	1	1	0.99975376809601	0.99975376809601	1
down	RAB19; RAB5A; RAB27A; RAB1A; RAB31; RAB40C; RAB3A; RAB8A; RAB3B; RAB26; RAB24; RAB33A; DNAJC27; RAB6A; RAB3D; RAB1B; RAB4A; RAB11B; RAB2B; RAB7A; RAB30; RABL2B; RAB44; RAB20; RABL2A; RAB33B; RAB14; RAB8B; RAB5C; RAB21; RAB5B; RAB35; RAB2A; RAB10;	GO:0032482~Rab protein signal transduction	34	72	47.2222222222222	0.00960273810631029	0.291348021047515	1	1	0.99975376809601	0.99975376809601	1
down	DNAJB6; MPDU1; RGS9; CLPX; FKBP9; BAG4; BAG3; GNAI2; GNAI3; HSPA8; PRKCSH; NPPB; TCP1; ATF6; CALR; CANX; ERP29; CCT5; RANBP2; RGS7; RAD23B; VCP; GNG2; GNB1; GNB2; FKBP1A; UBXN1; PPIL2; FKBP5; MOGS; NFYC; MLEC; FKBP8; GANAB; PDIA6; TBCC; P3H1; DNAJC21; ENGASE; GRPEL2; DNAJA3; ERO1A; NGLY1; PFDN5; DNAJC7; ERP44; DNAJC4; AMFR; RUVBL2; TRAP1; PDILT; HSP90B1; CDC37; QSOX2; ERP27; P4HB; HSP90AA1; HSP90AB1; PDIA4; HSP90AB4P; PTGES3;	GO:0006457~protein folding	61	150	40.6666666666667	0.00979846001099438	0.29495973513019	1	1	0.99975376809601	0.99975376809601	1
down	HIP1; PIK3CD; CCL21; EREG; BAG4; FGF19; EGFR; TGFB1; IGF2; PDGFA; FGF1; ITGB1; INSR; GPX1; HSP90AA1; THBS1; HSP90AB1; MET; FGF4; FGF3; FGF5; F3; HCLS1; RAC2; VAV1; FGFR3; IGFBP5; ARRB2; LEP; CD86; PIK3CA; PIK3CB; MTOR; PIK3CG; AKR1C2; GRB2; RAC1; ADAM8; RHOG; MC1R; TEK; MST1R; PTK2; PTPN11; PTPRJ; STK3; GAB1; IL18; ITSN1; MTDH; FRS2; CPNE1; PINK1; OSBPL8; FGF23; P2RY12; FGF20; NOX4; TCF7L2; RTN4; HPSE; IRS2; ARFGEF1; IGF1R; RICTOR; AXL;	GO:0051897~positive regulation of protein kinase B signaling	66	165	40	0.00987645083678723	0.29495973513019	1	1	0.99975376809601	0.99975376809601	1
down	NKX2-8; COBL; PHF2; HRAS; ARG1; IGF2R; PKM; XBP1; PTN; NF1; UGT1A1; MPST; CAD; PIK3CA; NOTCH1; PDX1; ARF6; SMAD3; SP3; DDX39B; HNRNPD; HES1; HLX; ARID5B; MED1; MAN2A1; RB1CC1; PROX1; JARID2; ACO2; UPF2; ONECUT1; GFER; RARA; MET;	GO:0001889~liver development	35	75	46.6666666666667	0.00994191471875661	0.29495973513019	1	1	0.99975376809601	0.99975376809601	1
down	EREG; HGS; STAM2; EGFR; PTPN2; CBL; NUP62; EPS15; DUSP3; ITGA1; CDC42; GRB2; PTPRJ; ARHGEF7; SH3KBP1; TSG101; RNF126; ZFYVE28; EPS15L1; EPN1;	GO:0042059~negative regulation of epidermal growth factor receptor signaling pathway	20	35	57.1428571428571	0.00999972154304241	0.29495973513019	1	1	0.99975376809601	0.99975376809601	1
down	UBB; CD36; STAT3; PIK3CA; PRCP; PRKAA2; IRX3; AMPD2; EIF4G1; PRKAA1; MEX3C; METRNL; CRTC3; CRTC1; MFSD2A; FLCN; PASK; SGIP1; MLXIPL; PPARGC1A;	GO:0097009~energy homeostasis	20	35	57.1428571428571	0.00999972154304241	0.29495973513019	1	1	0.99975376809601	0.99975376809601	1
down	GRIN2D; KALRN; CSTB; CNP; DRD4; HOXD10; NTF4; GDNF; PBX3; PAFAH1B1; CXCL12; ARCN1; PPT1; ATP1A2; MECP2; GRIN1; EN1; EPS8; PUM1; SEZ6; DMBX1; TSC1; NTAN1; SEZ6L; SLITRK6;	GO:0008344~adult locomotory behavior	25	48	52.0833333333333	0.0101774113334565	0.29924190575655	1	1	0.99975376809601	0.99975376809601	1
down	ARID1A; APAF1; PLXNB2; KDM6A; SPINT1; SPINT2; ZEB2; COBL; DEAF1; SEC24B; TGFB1; PFN1; RARA; MTHFD1; SKI; PRKACA; BRD2; ADM; MTHFR; TSC2; RPS7; SCRIB; TMED2; PHACTR4; SHROOM3; TSC1; MED12; PRICKLE1; DLC1; SETD2; IFT122; ARHGAP35; CC2D2A; VANGL2; TRAF6; ST14;	GO:0001843~neural tube closure	36	78	46.1538461538462	0.010260491651664	0.30072390022377	1	1	0.99975376809601	0.99975376809601	1
down	ANGPT2; APOA1; GSTP1; IGF2R; ANXA3; LCP1; PKM; UGT1A1; CAD; AXL; ADM; FLT3; TGFBR2; PPARG; NNMT; NOTCH1; CXCL12; PGF; PDX1; LPIN1; MED1; BAK1; UPF2;	GO:0031100~animal organ regeneration	23	43	53.4883720930233	0.0106612710403828	0.30661149182701	1	1	0.99975376809601	0.99975376809601	1
down	TNFRSF10B; ANGPT2; SDC3; TGFB1; JCHAIN; IGKV1-5; IGKV3-20; IGLV1-51; IGLV1-40; IGLV2-14; IGLV2-23; IGLV2-11; IGLV3-27; IGHV3-7; IGHV2-70; IGHV2-5; IGHV4-39; IGHV4-59; IGKC; IGHA1; CD74; IGKV3-11; ATP1B1; ITGB2; ITGB1; IGHV4-34; CD2; ITGAV; THBD; SLC3A2; ITGA5; DBH; ITGAM; PSG1; VPREB1; SELL; B4GALT1; IGLL1; CD44; SPN; EPCAM; SELE; SDC1; ITGAL; ITGAX; MAG; ITGA3; MSN; PTPN6; FCER1G; GPC1; MYH9; BSG; PIK3CA; PIK3CB; GRB2; CXADR; SLC7A5; TEK; PTPN11; SOS1; CD47; PPIL2; ROCK1; SELPLG; GRB14; GRB7; JAML; SLC7A6; INPP5D; GLG1; GP6; TREM1; VPREB3; F11R;	GO:0050900~leukocyte migration	75	193	38.860103626943	0.0106950490457274	0.306624723887318	1	1	0.99975376809601	0.99975376809601	1
down	WASL; STX10; DNAJB6; MYCBP2; VIP; TPR; ADCYAP1; USP8; RAB14; FKBP1A; SUMO1; RACK1; PICALM; MMD; TESK1; AAK1; RABGAP1L; TBC1D1; ATCAY; PLEKHM2; MMD2; FBXW7; TRIM5; SWAP70; VPS4A; AFDN;	GO:0032880~regulation of protein localization	26	51	50.9803921568627	0.0108543504723719	0.3102254266995	1	1	0.99975376809601	0.99975376809601	1
down	NRP1; EREG; ANGPT2; SRPX2; DYSF; RAPGEF3; PDGFA; APOD; FGF1; ITGAV; COL4A2; ITGA5; HMOX1; VEGFA; XBP1; TYMP; EFNA1; SAT1; PTPRB; EPHB2; S100A7; RORA; MYH9; KDR; GJA5; COL15A1; ID1; LEP; ELK3; PIK3CA; PIK3CG; MMP14; PLCD1; PRKX; EPHB4; EPHB1; PKNOX1; PTEN; HAND2; RHOB; ACTG1; ADAM8; SRPK2; JAG1; HSPG2; TEK; PTK2; RBPJ; MFGE8; FZD5; GAB1; AAMP; KLF5; IL18; VEZF1; PRKD1; MED1; MAPK14; ECM1; HIF1A; ECSCR; EMC10; CXCL17; ARHGAP24; SIRT1; NOX5; MMP19; EPAS1; CIB1; PDCD10; SETD2; PRKD2; BCAS3; PROK2; SH2D2A; DLL4; C1GALT1; SLC12A6; GDF2; HIF3A; HEY1; WASF2; AMOTL2; PTK2B; PGF; COL18A1; ACVR1;	GO:0001525~angiogenesis	87	230	37.8260869565217	0.010952144719417	0.310286003720222	1	1	0.99975376809601	0.99975376809601	1
down	AGRN; HS3ST1; SDC3; GPC4; HEXA; SDC1; GPC1; NDST1; NDST2; HSPG2; EXT1; SLC35D2; GALNT5; XYLT1; GPC2; HAS1; HS3ST6; HS3ST2; GPC6; HS3ST3B1; UGDH;	GO:0006024~glycosaminoglycan biosynthetic process	21	38	55.2631578947368	0.01103356357796	0.310286003720222	1	1	0.99975376809601	0.99975376809601	1
down	GNAI3; CAV2; LRMP; C2CD5; VAMP3; STX16; STX8; VAMP1; SNAP23; VAMP8; DYSF; STX12; STX10; STX4; TSNARE1; STX11; SYT4; STX17; VAMP2; STX5; SYT13;	GO:0006906~vesicle fusion	21	38	55.2631578947368	0.01103356357796	0.310286003720222	1	1	0.99975376809601	0.99975376809601	1
down	SRRM4; SNRNP70; SON; HNRNPH1; FUS; CLK1; CLK3; HNRNPF; TRA2B; AHNAK; MBNL2; METTL4; CELF1; MBNL3; CDK12; HNRNPL; HNRNPLL; PTBP2; PTBP3; AHNAK2; PTBP1;	GO:0043484~regulation of RNA splicing	21	38	55.2631578947368	0.01103356357796	0.310286003720222	1	1	0.99975376809601	0.99975376809601	1
up	IGKV2-28; IGKV2D-30; IGKV3D-20; IGKV1-12; IGLC7; IGKV2-29; C5; IGKV1D-33; IGKV1-33; IGKV1-39; IGKV1D-16; IGKV1D-12; IGKV2D-40; IGKV2D-28; IGKV3-15; IGLV1-44; IGLV2-8; IGLV3-1; IGHV1-69; IGHV1-46; IGHV3-11; IGHV3-48; IGHV3-13; IGHV3-53; IGHV3-33; IGHV2-70; IGHG4; C1QA; C4BPA; IGKV1-16; IGKV1D-39; IGKV2-30; IGKV5-2; C8B; C8G; C4B; IGLC6; MBL2; CR2; IGHV1-2; IGLV3-21; IGHV1-18; IGHV4-4; IGHV3-20; IGHV3-35; IGHD; IGHV1-24; IGHV1-69-2; IGHV3-49; IGHV3-38; IGHV4-61; IGHV3OR15-7; IGHV4-31; IGLL5; CRP; IGHV4-28; IGHV2-26; IGHV3-15; IGHV3-74; IGHV3-64; IGHV3OR16-8; IGHE; IGHV1-3; IGHV3-66; IGHV3-72; IGHV1-58; IGHV3-43; IGHV3-73;	GO:0006958~complement activation, classical pathway	68	161	42.2360248447205	0.0113057465399103	0.886638668349201	1	1	0.99999731200961	0.99999731200961	1
down	LIN7A; RAB3A; TXLNA; NSF; GCGR; RAB27A; HAP1; PRSS12; VAMP2; CDK16; PAK1; ITSN1; VAMP3; MIA3; STXBP5; LLGL2; MICAL3; JAGN1; SCAMP5; SNX19; DNAJC5; LIN7B; LIN7C; EXOC1; RPH3AL; STXBP5L; MYO5A; ARFGEF2; ARFGEF1; SNAP23; CADPS; STX11; STXBP6; RAB11B; EXOC3; EXOC4; SYTL4; EXOC7; STX4; EXOC6B;	GO:0006887~exocytosis	40	90	44.4444444444444	0.011339906015769	0.312458548093179	1	1	0.99975376809601	0.99975376809601	1
down	ARID1A; APAF1; MYO1D; CNP; ITGAM; NR2F2; DNAJB1; SSTR2; SSTR4; CCKAR; NKX2-1; ATRX; NOTCH1; NDST1; E2F1; TOP2B; SHH; KDM2B; FRS2; DLC1; SETD2; TWSG1; ARHGAP35; PPARGC1A;	GO:0030900~forebrain development	24	46	52.1739130434783	0.0114742661763233	0.314232366651972	1	1	0.99975376809601	0.99975376809601	1
down	TLR4; HIP1; CFLAR; DAPK3; SGPL1; CD14; ITGAM; CD38; CASP1; CASP3; CASP2; DAP; BAX; RIPK1; CASP8; SHH; BAK1; TICAM2; DPF2; CASP10; PAWR; MAP3K5; DIDO1; UACA; SENP1; CASP8AP2; LY96; IFI27; IFI27L1; DAPL1; TM2D1;	GO:0097190~apoptotic signaling pathway	31	65	47.6923076923077	0.0117099935350145	0.314232366651972	1	1	0.99975376809601	0.99975376809601	1
down	TAF4; CHEK1; MDM4; RAD1; HUS1; NBN; RPA2; TBP; TAF1; RPA1; PML; AKT1; RPA3; RFC2; BRCA1; PRKAA2; MDM2; RBBP4; EP300; POU4F2; CHD3; TAF10; PRKAA1; ATM; TOP3A; ATR; HDAC1; CDK5R1; STK11; MAPK14; TAF9; TAF2; HIPK1; MAPKAPK5; JMY; BANP; SETD9; PPP1R13L; TOPBP1; DYRK2; KAT6A; TAF15; TP53INP1; PPP1R13B; TP53RK; RAD9A; RBBP8; BARD1; PHF20; HIPK2; RPF2; EHMT1; KMT5A; PRKAB1;	GO:1901796~regulation of signal transduction by p53 class mediator	54	131	41.2213740458015	0.0118191479419082	0.314368839622489	1	1	0.99975376809601	0.99975376809601	1
down	KCNH1; NGF; CSF1R; IGF1R; EZR; RPS6KB1; PTAFR; PIK3CA; PIK3CB; GPR143; RHOA; EXOC1; GAB2; IRS2; PIK3C3; PLCD1; PLCZ1; PLCB2; PIK3CG; PLCB3; PLCB4; PIK3C2B; PI4KB; PIK3CD; PLCH2; PIK3C2G; PI4KA; PLCE1;	GO:0048015~phosphatidylinositol-mediated signaling	28	57	49.1228070175439	0.0120957080338441	0.319807213513532	1	1	0.99975376809601	0.99975376809601	1
down	WDR45B; ATG13; ATG5; ATG3; ATG2A; WIPI2; WDR45; ATG12; WIPI1;	GO:0044804~autophagy of nucleus	9	10	90	0.0121278623835948	0.319807213513532	1	1	0.99975376809601	0.99975376809601	1
down	KMT2D; SETD1A; KMT2A; RLF; KMT2C; PRDM9; KMT2B; SETD1B;	GO:0097692~histone H3-K4 monomethylation	8	8	100	0.012175084114337	0.320135140297838	1	1	0.99975376809601	0.99975376809601	1
down	GRIN2D; PDPK1; EDN1; SELE; EDNRB; AGTR1; AVPR1A; HTR2B; CCR6; CXCR4; NCALD; GRIN1; GRIN2A; GRIN2B; LRRK2; GPRC6A; MCTP2; MCTP1; MCU; TPCN2; TRPM4; RYR2; CAMKK2; MCOLN1; LAT2; P2RY12; NUDT4; PLCE1; CXCR2; CCR3; CALM3; XCR1; CALM1; CALML3; EFCAB11; CALM2; CXCR1; PPP1R9B;	GO:0019722~calcium-mediated signaling	38	85	44.7058823529412	0.0124437497443248	0.326267318794933	1	1	0.99975376809601	0.99975376809601	1
down	SLC30A4; CHUK; DHX15; SNN; FOS; MBP; EPHX1; CNP; SRF; CDH1; NQO1; GABRB1; ATF4; MPST; MAPK3; CHKA; AHR; TTPA; ERCC6; BAX; SRSF9; SCN9A; GLYAT; WAPL; PDZD3; SCFD1; AQP10; TRPM6; SLC23A1; SLC6A14; PON2; OR56A1; PON3;	GO:0009636~response to toxic substance	33	71	46.4788732394366	0.0125689328419616	0.327703555166044	1	1	0.99975376809601	0.99975376809601	1
down	ABLIM1; NRP1; EREG; TBX3; HRAS; IGF2; PDGFA; DCN; BRAF; ITGA2; ITGAX; PAX3; PAX6; COL18A1; COMP; PDX1; HCCS; DGCR2; FLI1; NOTCH2; TLE3; EP300; E2F4; LFNG; SMARCC1; SEMA6A; PDGFC; ETV7; HSPG2; LAMB1; ASXL3; LAMC2; LAMA1; NTN1; ASXL2; VDR; ATRNL1; LAMB4; LAMB3; MEGF9; ASXL1; THRA; AGRN; LAMA3; LAMA2; NTNG2; CDX1;	GO:0009887~animal organ morphogenesis	47	111	42.3423423423423	0.0125790454836551	0.327703555166044	1	1	0.99975376809601	0.99975376809601	1
down	PSMD12; PSMD14; DVL1; PSMD3; GPC4; AP2A1; PFN1; PSMA3; PSMA4; PSMB4; ARRB2; PSMB10; PSMC4; PSMB2; PSMD4; PSMA6; CDC42; PSME3; RHOA; PSMC5; PSMC6; RAC1; CLTC; PSME1; TIAM1; PSMD2; FZD5; PSME4; PSMF1; DVL3; MED12; AP2M1; PRICKLE1; PSMD1; SMURF1; PSME2; PSMD13; DAAM1; GPC6;	GO:0060071~Wnt signaling pathway, planar cell polarity pathway	39	88	44.3181818181818	0.0127059256658417	0.329387701134483	1	1	0.99975376809601	0.99975376809601	1
down	GFRA2; MTSS1; MPZL1; ANGPTL1; CSF1R; NTF3; PTPRG; BDKRB2; PIK3CB; TEK; RAPGEF1; TRADD; ABI1; RASGRP4; CNKSR1; SH2B1; STAP1; GAB2; SH2B3; AXL; MET; FRK; MUSK; BCAR1; KDR; NTF4; EPHB2; SLA; EPHA6; FLT4; EGFR; EPHB4; EPHA10; NEDD9; FGR; PTK6; FES; HCK; FGFR3; INSR; EPHB1; FLT1; TNK1; LCP2; CASS4; MST1R; NGF; FLT3; IGF1R; LMTK2;	GO:0007169~transmembrane receptor protein tyrosine kinase signaling pathway	50	120	41.6666666666667	0.0129031442458504	0.333470985215704	1	1	0.99975376809601	0.99975376809601	1
down	PSMD12; PSMD14; CHUK; PSMD3; PSMA3; PSMA4; PSMB4; AKT1; PSMB10; PSMC4; PSMB2; PSMD4; PPP4C; PSMA6; PSME3; PSMC5; PSMC6; SKP1; PSME1; PSMD2; BIRC3; BIRC2; IKBKE; PSME4; PSMF1; PSMD1; MAP3K14; PSME2; PSMD13; DICER1;	GO:0038061~NIK/NF-kappaB signaling	30	63	47.6190476190476	0.0131885192376754	0.338088976446592	1	1	0.99975376809601	0.99975376809601	1
up	GJB6; CXCL14; ESRRB; SPARC; PDGFRB; BMP2; BDNF; GJB2; SOX2; HOXA1; TGFB2; HPCA; ROR1; NEUROD1; SIX1; FREM2; TIFAB; STOX1; PLPPR4; BMPER; ADGRV1; PCDH15; PHOX2B; CYTL1; LHX3;	GO:0048839~inner ear development	25	46	54.3478260869565	0.0131917058294997	0.886638668349201	1	1	0.99999731200961	0.99999731200961	1
down	GALR2; JAK2; PLA2G6; S1PR4; AGT; EDN1; ITGAV; CD55; HMGB1; CD36; GJA1; ADCYAP1; EDNRB; EDNRA; CD38; BDKRB2; AGTR1; ADM; ADRA1A; AVPR1A; BDKRB1; P2RY1; GIPR; PIK3CG; NPY2R; BCAP31; IL2; GNB1; DLG4; LRP1; CACNA1C; PTK2B; GNA13; ITPR3; FFAR4; PLCZ1; SPPL3; TRPM4; LPAR1; GPER1; LPAR2; PROK2; GPR35; PLCE1; GHRL; SWAP70; TRPC6; CYSLTR1; NPTN; ADRA1D; CXCR4; CXCR2; CCR6; XCR1; FPR1; PTGFR; CCR3; CXCR1; C5AR2; GPR32;	GO:0007204~positive regulation of cytosolic calcium ion concentration	60	150	40	0.0133332866112962	0.340850657454885	1	1	0.99975376809601	0.99975376809601	1
down	AP3B1; ABCA1; HEXB; GAA; ACP2; TFEB; GRN; MTOR; CLN3; MYO7A; MBTPS1; LRRK2; HOOK3; FAM160A2; TPCN2; HPS1; HOOK2; LYST; HPS4; VPS18; NAGPA;	GO:0007040~lysosome organization	21	39	53.8461538461538	0.0135482314406811	0.345386077419911	1	1	0.99975376809601	0.99975376809601	1
down	LATS1; THRA; TRH; NUP62; ASIP; GCGR; OSTN; PTPN11; ADIPOR2; GHSR; UCN3; ADIPOR1; LATS2; GHRL; KDM3A; RXFP2; NR5A2; RARA; FSHR; CGB7; LHCGR; LGR4; LGR5; PPARG;	GO:0009755~hormone-mediated signaling pathway	24	47	51.063829787234	0.013814402783099	0.35008858394383	1	1	0.99975376809601	0.99975376809601	1
down	TDP2; GLI2; NR2F6; SRF; LIF; XBP1; EN2; POU3F2; PBX3; PSEN1; PPT1; EN1; MEF2C; MTMR2; UGCG; ATAT1; THOC2; FIG4; SCYL1; SECISBP2; WNK1; NEUROD4; TENM3; TENM2;	GO:0048666~neuron development	24	47	51.063829787234	0.013814402783099	0.35008858394383	1	1	0.99975376809601	0.99975376809601	1
up	KMO; AKAP8; LDOC1; BCL10; ASS1; CXCL10; CSF2; SERPINE1; ICAM1; VIM; CSF3; CXCL8; SRC; CAPN2; CEBPB; NFKB1; TNFAIP3; IL10; CD68; NOS2; WNT5A; CX3CR1; STAR; CCR5; SIRPA; CXCL6; LCN2; HAMP; PPARD; RELA; PDE4B; PDE4D; NR1H3; PDCD4; ZC3H12A; CMPK2; DAB2IP; CARD17; NUGGC; TICAM1; LILRB2; TNIP2; HAVCR2; CACTIN; NLRP7; TNIP3; LITAF; PLSCR4; SHPK; PYCARD; SBNO2; CXCL1; DEFA4; PDCD1LG2; PF4V1; CXCL2; IL36B; CXCL13; CD80; IL1F10; CXCL9; DEFA3; CXCL5; IL1B; IL1A; PPBP; IL37; CD274;	GO:0071222~cellular response to lipopolysaccharide	68	163	41.7177914110429	0.0138178395627422	0.886638668349201	1	1	0.99999731200961	0.99999731200961	1
down	GALR2; SORBS3; DYSF; CACNA1H; TPM3; TPM2; CALM1; MYH1; MYH7; MYH6; GJA1; VCL; MYL12A; RYR1; SLC8A1; CLCN1; UTRN; SLC6A8; PXN; EMD; ITGA1; MYL6; CALD1; ASPH; SNTB1; KCNJ12; SLMAP; TAZ; PABPN1; TTN; TRIM63; MYL10; MYH2; MYH13; TLN1; MYH4; MYOM3; TNNT3; LMOD2; TMOD3; NOS1; TNNT1; MYOM1; LMOD3; TNNI3;	GO:0006936~muscle contraction	45	106	42.4528301886792	0.0138855421386392	0.35008858394383	1	1	0.99975376809601	0.99975376809601	1
down	NR5A2; NPC1; ABCA1; SEC24A; APOA1; APOE; APOC3; FABP3; APOA4; CETP; XBP1; RORA; G6PC; SOAT1; HNF4A; ABCG1; NR1H2; MALL; IL18; NFE2L1; LDLRAP1; TTC39B; SCARB1; MYLIP; SIRT1; DGAT2; ABCA2; LIMA1; MED13; RALY; HDAC9; LIPG; PLA2G12B; LRP5L; VDR; NR1H4; NR1I3;	GO:0042632~cholesterol homeostasis	37	83	44.578313253012	0.013955172532769	0.35008858394383	1	1	0.99975376809601	0.99975376809601	1
up	CHRNA1; CHRM1; CHRNB1; P2RX3; STXBP1; EGR3; STAC3; P2RX2; DTNA; CHRND; CHRNB3; RIMBP2; CHRNB4; RIMBP3C; CHRNB2; CHRNA3; CHAT; CHRNA2; CHRNG; SLC5A7;	GO:0007274~neuromuscular synaptic transmission	20	34	58.8235294117647	0.0139940295110211	0.886638668349201	1	1	0.99999731200961	0.99999731200961	1
down	AGT; FOS; CRH; THBD; ITGA5; RARA; TGFB3; PSG1; SCGB1A1; PTHLH; ITGA2; ADCYAP1; ADRA2C; PZP; IGFBP5; CAD; CD38; ADM; LEP; SLC19A1; NAMPT; PRLHR; PGF; STAT5B; FOSB; HSD11B2; PSG6; PSG7; PSG5; HFE; ADIPOR2; ABCC2; SLC38A2; SPHK2; CLIC5; MAGED2; PSG11; EPN1;	GO:0007565~female pregnancy	38	86	44.1860465116279	0.0142386564618692	0.350369934274283	1	1	0.99975376809601	0.99975376809601	1
down	YDJC; HAS3; UGDH; B4GALT2; CS; PGLS; PGM3; TFF1; AMY2A; ALDH2; INSR; GPI; HEXA; SLC3A2; GUSB; SLC2A2; SLC2A3; ADRB3; SI; SLC2A4; ABO; FUT4; TALDO1; SPAM1; GNPDA1; IDH2; IDH3G; GALK2; SLC3A1; FUT2; MLEC; GANAB; PHKG1; HYAL4; PGGHG; GGTA1P; GLT6D1; GALNT7; GPD1L; GALM; NPL; LDHAL6B; CHST5; NAGPA; A4GNT; ST3GAL5; FUT9; AMDHD2; GBE1; B3GAT2;	GO:0005975~carbohydrate metabolic process	50	121	41.3223140495868	0.0144414245768365	0.354411814348337	1	1	0.99975376809601	0.99975376809601	1
down	ACSL4; JAK2; PFKFB2; GLUD1; RBP4; GJA1; CD38; GIPR; PRKCE; SLC30A8; MCU; UCN3; GPER1; TCF7L2; TM7SF3; SIRT3; GHRL; RPH3AL; IRS2; SERP1; TRH; NNAT;	GO:0032024~positive regulation of insulin secretion	22	42	52.3809523809524	0.014607593189818	0.35753638331355	1	1	0.99975376809601	0.99975376809601	1
down	CBX4; CHD2; HDAC3; DAPK3; BRD4; NCOR1; ZBTB7A; CBX6; CBX7; HMGB2; DEK; GPX4; BAG6; SMARCA4; RAG2; HNRNPU; SATB1; MBTD1; TRIM28; IKZF1; HDAC1; TDG; CHD9; BCORL1; RSBN1; DPPA3; AEBP2; HIST2H3A; METTL4; BANP; L3MBTL4; SETD7; PHF21A; SIRT1; ZNF462; DNAJC2; NUCKS1; VCX; EHMT1; TCF7L1; UTP3; BRWD1; ALKBH4; HMG20B; LRWD1; TLK1; PADI3; HDAC5; SPIN1; HYPM; PHF1; HIST1H2AC; H2AFJ; H2AFV; FAM50A; MTF2;	GO:0006325~chromatin organization	56	139	40.2877697841727	0.014725321220919	0.359461886461849	1	1	0.99975376809601	0.99975376809601	1
down	GAK; ADCY6; APOE; NR2F1; MAG; PTPRG; CD38; PAFAH1B1; DCC; PTEN; B2M; MDM2; LRP1; SPOCK1; SEMA3A; KANK1; DGUOK; LRRK2; RAP1GAP2; DENND5A; THOC2; MYLIP; TSC1; LPAR1; STMN2; RIT2; CIB1; RTN4R; CTSZ;	GO:0010977~negative regulation of neuron projection development	29	61	47.5409836065574	0.0148600697473371	0.361791592287681	1	1	0.99975376809601	0.99975376809601	1
down	DNM1L; SYNJ1; PIP5K1C; CANX; ARF6; SCRIB; ITSN1; DENND1A; STON2; PACSIN1; PICALM; SYT5; ACTL8; ACTG1; OPHN1; ACTBL2; ACTB; NLGN4Y; KIAA1109; FCHO2;	GO:0048488~synaptic vesicle endocytosis	20	37	54.0540540540541	0.0152838846107384	0.366525630308542	1	1	0.99975376809601	0.99975376809601	1
down	CFLAR; BCL2L11; AIFM1; EGFR; MYOG; ITGA2; UGT1A1; NRIP1; HSF1; POU4F2; HNRNPD; BCL2L2; PPP1R9B; GPER1; ZNF703; DDX18; PPARGC1A; RUVBL2; NCOA3; SSTR2;	GO:0071392~cellular response to estradiol stimulus	20	37	54.0540540540541	0.0152838846107384	0.366525630308542	1	1	0.99975376809601	0.99975376809601	1
down	RER1; PDPK1; EGFR; ITGB1; EZR; ATP2B4; PRKCH; ITGA3; EPHB2; AKT1; KIF5B; PRKCI; ARF6; RHOG; SPTBN1; PRKCE; LRP1; STX4; DLG1; SQSTM1; PLS1; RAB11FIP2; DPP10; PPP1R9B; GPER1; CIB1;	GO:1903078~positive regulation of protein localization to plasma membrane	26	53	49.0566037735849	0.0153901830497475	0.366525630308542	1	1	0.99975376809601	0.99975376809601	1
down	CHEK1; BACH1; FANCA; RAD51C; HUS1; RECQL5; UBR5; MBD4; POLB; FH; ERCC1; POLA1; MSH3; RPA1; IGHMBP2; CHRNA4; ATRX; CSNK1E; CDK9; VCP; POLE2; UBE2D3; UBE2B; SUMO1; BTG2; HSF1; CHAF1B; TRIM28; ATR; GTF2H3; TRIP12; PSME4; MORF4L2; NONO; DDB1; KMT5B; INO80D; INTS3; NFRKB; TAOK1; EEPD1; RPAIN; SLF2; ENDOV; JMY; BOD1L1; HELB; TOPBP1; NABP1; UBE2W; OTUB1; SMG1; SMC6; PNKP; RBBP8; HINFP; SLF1; PAGR1; TEX15; TAOK3; SIRT7; FBXO6; UVRAG; PARP4; FZR1; CEP164; RUVBL2; POLH; RUVBL1; RPA4; RFC2; PDS5A; INO80; RECQL; GTF2H1; UBE2U; TRRAP; RBM17; SMARCB1; RAD1; RAD9A; RPA2; PDS5B; EID3; RPS3;	GO:0006281~DNA repair	85	228	37.280701754386	0.0154157924140926	0.366525630308542	1	1	0.99975376809601	0.99975376809601	1
down	ADAM10; PLXNB1; DSCAM; CLDN7; SPN; RASA1; MDK; DUSP1; ARHGDIB; CDH13; CD164; MIA3; DACT2; CBLL1; SEMA4D; SIPA1; PLXNB3; PLXNA2; PLXNB2; PLXNA4; PLXNA3; PLXNC1; PLXNA1;	GO:0007162~negative regulation of cell adhesion	23	45	51.1111111111111	0.0155978253810463	0.368068684568638	1	1	0.99975376809601	0.99975376809601	1
down	TLR4; SDCBP; CCL21; AXIN1; PJA2; GADD45B; GADD45G; FGF19; HRAS; HMGB1; MMP8; FLT4; LTBR; RASSF2; CDC42; MAP4K2; STK3; SLAMF1; RIPK1; PTK2B; SEMA3A; MAP3K11; TAOK1; SH3RF1; MINK1; RB1CC1; SH3RF2; MAP3K5; TAOK3; HIPK2; NOD2; TAOK2; NOD1; TRAF3; DUSP22; TRAF6;	GO:0046330~positive regulation of JNK cascade	36	81	44.4444444444444	0.0156531473230634	0.368429449652565	1	1	0.99975376809601	0.99975376809601	1
up	SMAD6; TCF21; CRLF1; GDF11; RET; RARB; FGFR1; BMP4; BDNF; SDC4; LHX1; ARG2; SIM1; FOXC1; SIX1; NPNT; SFRP1; BMPER; OSR1; ROBO2; SALL1;	GO:0001657~ureteric bud development	21	37	56.7567567567568	0.0157920165459069	0.886638668349201	1	1	0.99999731200961	0.99999731200961	1
down	INPPL1; FOXP2; PRDM1; SGPL1; CYP1A2; MYL2; IGF2R; GABRG2; RAB3A; ACO1; MTOR; PSEN1; MECP2; ATM; MORC3; ITPR1; ARID5B; SMAD2; SCN9A; SZT2; TIPARP; PPP1R13L; NDN; CHST11; ASH1L; STK36; KDM5B; AGO2; HEG1; PLAGL2; SERP1;	GO:0009791~post-embryonic development	31	67	46.2686567164179	0.0159112883252919	0.369776733478942	1	1	0.99975376809601	0.99975376809601	1
down	SLC33A1; ATP2A1; ATP6V0E1; SLC25A27; COX8A; COX6A1; COX4I1; COX6B1; ATP2A2; COX5A; ATP6V1B2; ATP6V1C1; UCP1; ATP6V0C; ATP6V1E1; ATP6V1A; SLC15A1; SLC11A2; UCP2; ATP6V0D1; ATP2C1; SLC25A3; COX6A2; COX10; TCIRG1; ATP1A4; SLC9A5; SLC9C2; TMCO3; COX15; OTOP3; OTOP2; SLC15A4; ATP6V0D2; ATP6V0A1; ATP2A3; SLC46A1; NOX5; SLC9A7; ATP6V0A4; SLC17A5; ATP6V1H; SLC9A8; ATP6V1D; SLC36A2; SLC36A3; ATP1A2; ATP4A;	GO:1902600~proton transmembrane transport	48	116	41.3793103448276	0.0159719081917935	0.370250556899435	1	1	0.99975376809601	0.99975376809601	1
down	ESYT2; B3GALNT1; GLA; HEXA; PSAP; HEXB; CTSA; ARSA; GLB1; SMPD1; GALC; BAX; ASAH1; UGCG; CPTP; SUMF1; ST6GALNAC3; NEU1; ESYT1; GBA2; SMPD4;	GO:0006687~glycosphingolipid metabolic process	21	40	52.5	0.0164960141523444	0.379532045610063	1	1	0.99975376809601	0.99975376809601	1
down	ADCY6; ADCY3; ADCY9; RAF1; TMIGD3; CALM3; ACR; ADRB3; ADCYAP1; DRD1; DRD5; LHCGR; EDNRA; ADORA2B; GIPR; ADCY7; GHRHR; LGR5; RXFP2; LGR4; FSHR;	GO:0007190~activation of adenylate cyclase activity	21	40	52.5	0.0164960141523444	0.379532045610063	1	1	0.99975376809601	0.99975376809601	1
down	CASQ2; TCAP; KLHL41; ITGB1; KRT8; KRT19; PRKAR1A; SRF; MYH6; ACTN2; NKX2-5; ACTG1; FHOD3; LMOD2; TTN; TNNT1; MYOM3; CSRP3; TNNT3; WDR1; MYOM1;	GO:0045214~sarcomere organization	21	40	52.5	0.0164960141523444	0.379532045610063	1	1	0.99975376809601	0.99975376809601	1
up	GFY; CRX; USH2A; RLBP1; MIP; SCNN1A; CRYBB2; SCNN1B; VSX2; IRX5; BFSP2; PDE6H; TGFBI; LRIT3; CNNM4; LCTL; SLC24A5; RD3; CPLX4; RIMS1; CALHM3; CNGA4; BBS5; MYO3A; BBS1; MYO3B; RAX2; RPGRIP1; NYX; VSX1; SPATA7; SLC24A2; SLC45A2;	GO:0050896~response to stimulus	33	68	48.5294117647059	0.0166537267942183	0.886638668349201	1	1	0.99999731200961	0.99999731200961	1
down	MAN2B1; GALR2; EGFR; CRH; THRA; MAPK1; EPHB2; GRM5; CASP3; PAFAH1B1; SLC11A2; PSEN1; CCL11; SLC8A3; PTEN; B2M; MEF2C; EP300; GRIN2A; GRIN2B; CLN3; PICALM; KCNAB1; LHX8; NCSTN; GHSR; AMFR; VIP;	GO:0007611~learning or memory	28	59	47.4576271186441	0.0167510928851473	0.381584920351512	1	1	0.99975376809601	0.99975376809601	1
down	PSMD12; PSMD14; AZIN1; PSMD3; OAZ2; NQO1; PSMA3; PSMA4; PSMB4; PSMB10; PSMC4; PSMB2; OAZ1; PSMD4; PSMA6; PSME3; PSMC5; PSMC6; PSME1; PSMD2; PSME4; PSMF1; PSMD1; PSME2; PSMD13;	GO:0006521~regulation of cellular amino acid metabolic process	25	51	49.0196078431373	0.0173742340226527	0.389039113650785	1	1	0.99975376809601	0.99975376809601	1
up	GNAT3; KCNK1; AVP; MT-ND4; MT-ND6; DRD2; CHRNB2; CNR1; CHRNA7; STAR; NKX6-1; SLC6A3; PPP1R1B; SLC7A11; CHRND; CHRNB1; CHRNG; CHRNB3; CHRNB4; CHRNA3; CHRNA1; CHRNA2;	GO:0035094~response to nicotine	22	40	55	0.017557619886678	0.886638668349201	1	1	0.99999731200961	0.99999731200961	1
down	DVL1; TUBG1; PCM1; HOOK3; CHP1; CIB1; SLK; STMN3; CRIPT; SLAIN2; CEP126; TUBGCP3; TUBGCP6; TUBGCP2; HOOK2; DYNC1H1; CCDC88A; CCDC88C; DST; CCDC88B; KATNAL2; CAMSAP3;	GO:0031122~cytoplasmic microtubule organization	22	43	51.1627906976744	0.0176224808521585	0.389044459408317	1	1	0.99975376809601	0.99975376809601	1
down	DNM1L; SEC24A; TGFB1; FGA; FGB; FGG; TGFB3; EZR; CD33; ABCG1; MYOM1; ARF6; ADAM8; ARF1; ADAM9; TTN; MYO18A; SYTL4; GOLPH3L; GOLPH3; EXOC1; CD2AP;	GO:0050714~positive regulation of protein secretion	22	43	51.1627906976744	0.0176224808521585	0.389044459408317	1	1	0.99975376809601	0.99975376809601	1
down	SDCBP; LRRTM2; LRPAP1; DLG4; MTMR2; ANKRD13D; LRRTM1; ANKRD13A; ATXN2;	GO:0002091~negative regulation of receptor internalization	9	11	81.8181818181818	0.0178394829805835	0.389044459408317	1	1	0.99975376809601	0.99975376809601	1
down	PSMD14; SERPINB3; AKIRIN2; SFRP2; PSENEN; PRELID1; PSME1; PSME2; PSME3;	GO:0010950~positive regulation of endopeptidase activity	9	11	81.8181818181818	0.0178394829805835	0.389044459408317	1	1	0.99975376809601	0.99975376809601	1
down	AKT1; PIK3CA; MTOR; TSC2; E2F1; TFDP1; STK11; DAPK2; IKBKG;	GO:0043276~anoikis	9	11	81.8181818181818	0.0178394829805835	0.389044459408317	1	1	0.99975376809601	0.99975376809601	1
