DGE	Genes	Process~name	num_of_Genes	gene_group	percentage%	P-value	Benjamini and Hochberg (FDR)	 Hommel singlewise process	Bonferroni single-step process	Hommel singlewise process	Hochberg step-up process	Benjamini and Yekutieli
down	PRMT5; AURKA; TP73; PRKAB2; RAD17; MTA2; TP53; RPA2; CSNK2A2; TBP; RPA1; AKT1; RPA3; RFC4; RFC2; RFC5; NOP2; RPL5; TAF6; DNA2; BLM; PRKAG1; BRPF1; RPL11; CSNK2A1; MDM2; SSRP1; CHD3; TAF10; ATR; WRN; CHD4; RRS1; TAF5; TAF11; TAF7; TAF12; RBBP7; TAF9; TAF3; MAPKAPK5; TAF1L; TTC5; BANP; HIPK4; PPP1R13L; ATRIP; ING5; TAF15; RAD50; KAT5; PPP1R13B; EHMT2; PRMT6; TP53RK; RAD9A; RBBP8; BARD1; PLK3; RPF2; RMI1; EHMT1; MEAF6; TAF9B; BRD7; KMT5A; PRKAG3; PRKAG2; NOC2L; L3MBTL1; PRKAB1; SUPT16H;	GO:1901796~regulation of signal transduction by p53 class mediator	72	131	54.9618320610687	0.000126329239675704	0.0274568594833668	1	1	0.782690537278499	1	0.266950343240424
down	PSMD11; PSMD12; IGF2BP3; PSMD14; XPO1; PSMD3; PARN; HSPB1; VIM; HSPA8; PRKCA; PSMB1; PSMA2; PSMA3; PSMA4; APEX1; PSMA5; PSMB4; PSMB5; AKT1; PSMC2; PSMB10; PSMC4; ZFP36L2; PSMB3; PSMD7; PSMD4; PSME3; PSMC1; PSMC5; CACNG7; RPS27A; YWHAZ; SET; EIF4G1; EXOSC9; PSME1; PSMD2; PABPC4; EXOSC2; HNRNPD; PSME4; PSMD6; PSMD5; EXOSC6; ALKBH5; SERBP1; KHSRP; RBM24; DHX36; EXOSC4; DCP1A; EXOSC5; EXOSC3; IGF2BP1; PSME2; PSMD13; DIS3; CARHSP1; EXOSC1; YTHDF2; IGF2BP2; FXR2; ZC3H14;	GO:0043488~regulation of mRNA stability	64	112	57.1428571428571	0.000128932958086247	0.0274568594833668	1	1	0.787308100513881	1	0.266950343240424
up	IGKV2-28; IGKV2D-30; IGKV3D-20; IGKV1-12; IGLC7; IGKV2-29; MASP2; CFB; C3; IGKV1D-33; IGKV1-33; IGKV1-39; IGKV1-17; IGKV1D-16; IGKV1-5; IGKV1D-12; IGKV2D-40; IGKV2D-28; IGKV3-20; IGLV1-47; IGLV1-51; IGLV1-40; IGLV2-14; IGLV2-23; IGLV2-11; IGLV2-8; IGLV3-1; IGLV3-25; IGLV3-27; IGHV1-69; IGHV1-46; IGHV3-13; IGHV3-53; IGHV3-33; IGHV3-7; IGHV2-70; IGHV2-5; IGHV4-39; IGHV4-59; IGKC; IGHG1; IGHG4; C1QA; C1QC; IGKV1D-39; IGKV3-11; IGKV4-1; IGKV5-2; IGHV4-34; C8A; C8B; IGLC6; IGLC3; CFP; IGLV3-21; FCN2; RGCC;	GO:0006956~complement activation	57	92	61.9565217391304	0.000171107059883879	0.0867814747246357	1	1	0.94551494656728	0.999999997829908	0.836516662152518
down	POLR2D; RBFOX2; HNRNPR; DUSP11; HNRNPC; HNRNPA1; HNRNPL; POLR2C; HNRNPA2B1; POLR2A; PTBP1; POLR2B; GTF2F1; POLR2I; RBMX; HNRNPA3; HNRNPM; POLR2H; POLR2J; POLR2K; HNRNPH2; POLR2F; HNRNPK; POLR2G; HNRNPU; HNRNPA0; HNRNPD; PCBP1; PCBP2; WDR74; METTL3; DDX54; ATXN2; METTL14;	GO:0016070~RNA metabolic process	34	46	73.9130434782609	0.000176290197863582	0.0367075367551504	1	1	0.83120828292679	1	0.356890398999715
down	ACACB; KCNK3; XPO1; PFAS; NPC1; GNPAT; TP73; BCAR3; SRP72; ABCC6; SOD1; PNP; MYC; MT-ND1; CYP1A1; FABP3; RET; THBS1; SRP19; LGALS1; GIP; MGST1; CDK4; XRCC5; ENO3; TIMP2; CTPS1; IGFBP2; XRCC1; CDH3; GAL; CCNO; UQCRC2; CCND1; AK4; CALR; ABCD3; AQP1; ALDH3A1; ABCC1; MCM7; ADRA1A; HNF1B; TGFBR2; CDKN1A; COL18A1; NNMT; HTR2B; GATA4; SLC6A11; PGF; PPOX; CDK9; TERF1; PMS1; PMS2; FGF8; S100A10; SRP54; SST; DAD1; SORD; HMGCS1; XPC; GNA12; EMX2; ATR; PTCH1; BLMH; LRP8; SS18; TGIF1; BLOC1S3; TP53I13; DVL3; CPB2; GAD1; PLIN2; NPAS2; TXN2; ABCA3; GABRG3; SEMA3C; ABCA2; RAB6C; ABCG8; ABCG5; SLC12A5; RPP21; WFDC1; SRP68; NPC1L1; SCN11A; RPH3AL; JUND; ANXA1;	GO:0042493~response to drug	96	193	49.740932642487	0.00018654158151088	0.0373312237703589	1	1	0.840505973683136	1	0.362954219331584
down	DDX39A; NUDT21; ZC3H11A; CPSF4; U2AF2; CSTF2; EIF4A3; MAGOH; SARNP; SRSF3; SRSF2; CSTF1; SRSF1; SRSF4; CPSF1; CSTF3; SRSF9; SRSF6; RNPS1; SRSF7; THOC7; FIP1L1; PABPN1; THOC6; ZC3H3; SRRM1; CPSF7; U2AF1L4; SYMPK; CLP1; THOC1; THOC3; UPF3B; CSTF2T; CPSF2; CPSF3; CHTOP; RBM8A; RPRD1A; RPRD1B;	GO:0031124~mRNA 3'-end processing	40	59	67.7966101694915	0.000187253737161885	0.0373312237703589	1	1	0.841143787331189	1	0.362954219331584
down	POLR2D; HMGN1; ERCC1; PCNA; RPA2; LIG1; XRCC1; POLR2C; ERCC3; XPA; TCEA1; POLR2A; RPA1; POLD1; POLR2B; RPA3; RFC4; RFC2; POLR2I; RFC5; POLD2; LIG3; CCNH; POLR2H; POLR2J; POLR2K; COPS2; POLR2F; POLR2G; RBX1; RPS27A; ERCC6; ERCC8; CUL4A; GTF2H2; POLD3; ERCC4; ZNF830; COPS7B; XAB2; POLD4; POLK; ISY1; PRPF19; PPIE; COPS3;	GO:0006283~transcription-coupled nucleotide-excision repair	46	73	63.013698630137	0.0002220277669297	0.0423798062250858	1	1	0.861023862733621	1	0.412039251069586
down	NDUFS8; NDUFA4; NDUFA1; NDUFS4; NDUFC1; NDUFS5; COQ9; NDUFS7; NDUFS2; NDUFS6; NDUFS3; NDUFB6; NDUFA3; NDUFB4; NDUFB8; NDUFB2; NDUFA7; NDUFC2; MT-ND1; MT-ND2; MT-ND3; MT-ND4L; MT-ND4; MT-ND5; MT-ND6; DLD; NDUFB7; NDUFV1; NDUFV3; NDUFA5; NDUFB11; NDUFA13; NDUFA12; NDUFAF1; NDUFB9;	GO:0006120~mitochondrial electron transport, NADH to ubiquinone	35	49	71.4285714285714	0.000227504451664862	0.0423798062250858	1	1	0.86392699349113	1	0.412039251069586
down	PSMD11; PSMD12; PSMD14; UBE2C; PSMD3; BUB3; BUB1B; CDK1; ERCC3; PSMB1; PSMA2; PSMA3; PSMA4; PSMA5; PSMB4; PSMB5; CDC27; PSMC2; PSMB10; PSMC4; PSMB3; PSMD7; UBE2E1; PLK1; PSMD4; ANAPC15; PSME3; PSMC1; PSMC5; TFAP4; XPC; PSME1; PSMD2; CUL1; PSME4; PSMD6; PSMD5; CDC26; ATAD5; ANAPC1; CDC23; ANAPC5; ANAPC4; ANAPC2; FBXO5; PSME2; FZR1; PSMD13; BTRC;	GO:1901990~regulation of mitotic cell cycle phase transition	49	80	61.25	0.000231509917306028	0.0423798062250858	1	1	0.866026468688368	1	0.412039251069586
down	DDX39A; ZC3H11A; NUP155; CPSF4; EIF4E; HNRNPA2B1; U2AF2; NUP62; EIF4A3; NUP98; NUP107; MAGOH; EIF5A; RAE1; SARNP; SRSF3; SRSF2; HHEX; SRSF1; SRSF4; CPSF1; SRSF9; SRSF6; SLBP; RNPS1; SRSF7; NUP188; THOC7; ALKBH5; FIP1L1; NUP54; SMG6; THOC6; SRRM1; NUP93; RBM15B; NUP35; U2AF1L4; NUP205; SYMPK; UPF1; SEH1L; THOC1; THOC3; NUP88; NDC1; NUP58; NUP85; UPF3B; CPSF2; NXF1; CPSF3; NXT1; DDX19B; SMG5; CHTOP; RBM8A; GLE1;	GO:0006406~mRNA export from nucleus	58	101	57.4257425742574	0.000235192094312109	0.0423798062250858	1	1	0.867928825259751	1	0.412039251069586
down	SSPO; HMX3; SRRM4; DLL1; CRX; SUV39H1; TNFSF12; NUDT21; TLL1; SOX15; CREBL2; TDRD6; GADD45B; VAMP5; ZIC2; CLPTM1; KRT6A; TFF1; ROS1; MYBL1; BMP1; ZNF3; ANXA13; ARNT; SRD5A2; AKT1; STX2; COL15A1; ADCYAP1R1; PGF; CAV3; HSD17B7; FOXL2; KRTDAP; RPS3A; RPS7; RHOB; HSPG2; NHLH2; HHEX; CREM; MECOM; GNA12; TNFAIP2; SLFN5; SQSTM1; AAMP; CCIN; SIM2; ELAVL3; ZNF268; HLX; CBX2; CSRP2; MEA1; ECSCR; RNF151; ODF4; TSNAXIP1; ZNF750; TMEM176B; SLC9C1; MORN2; ZC3H12A; ACSBG2; MEIG1; SFRP4; ALKBH5; PLET1; CATSPERG; TTLL7; SPATA31E1; TCF23; PIWIL4; ARHGAP22; BMP8A; HUWE1; MROH2B; ZSCAN2; TXNDC2; NLRP14; SPATA24; GPSM1; RBM45; EGFL6; LRRC34; ATOH7; ARHGEF28; ARHGAP24; OSR2; BOLL; TEX19; SPATA5; ANGPTL6; MYCBPAP; CCHCR1; ANKRD49; TCP11; PTPRU; SYAP1; PBXIP1; EID2B; NUS1; DAZAP1; APOLD1; TBATA; LRGUK; CFAP54; TSSK3; UHRF2; ZIC5; SPAG8; RARRES2; BCL7B; SPATA25; HTATIP2; RBM4; SPATA9; RBM24; SPATA16; NAA15; CADM1; TRIM54; SHCBP1L; YIPF3; TWSG1; ZNF541; UNC45A; PPDPF; SMOC1; SUV39H2; CATSPERB; GORASP2; USP42; SMURF1; FGF22; SRA1; SH2D2A; SPAG4; PARP11; CCDC87; PRMT7; ASF1B; SPATA6; SOHLH2; RAI14; SFMBT1; DDX41; ZHX1; TCFL5; NDRG4; SRPK3; CEP131; RNF114; HSPB11; CLIC4; BZW2; FER; DLX1; ELK1; DLX2; RARA; POU3F2; POU6F2; SOX17; POU3F1; HES7; NR2F2; HES5; FOXA2; FOXI1; POU3F3; EYA1; ID2; NR1H4; ETV1; EYA4; NR1H2; SOX1; NR2E3; NR1D1; TNK2; ID1; HNF4A; ONECUT1; NKX2-1; FOXA3; POU5F1; POU6F1; PRRC2A; SPDEF; NR1D2; NHS; CDX1; ERF; RARB; RXRG; HES1; RBL1; FOXD4L1; FOXC2; PPARD; SOX18; EGFR; NKX6-2; DDX4; HNF4G; EYA2; ELF5; FOXD1; FOXD2; FSTL5; SOX3; FSTL1; NKX2-3; SOX2; SPIB; SRC; NR2F6; RXRB; SOX11; POU3F4; TNK1; SOX7; EHF; DLX5; HES2; FOXE3; SPINK5; BHLHE40; HES4; SRMS; CAV2; FOXE1; HEY2; ONECUT2;	GO:0030154~cell differentiation	236	572	41.2587412587413	0.000241353341040362	0.0426694491612867	1	1	0.871141338312183	1	0.414855315349729
down	CDC7; DLL1; CHP2; VEGFD; GDF9; DNAJA2; LRP5; CRLF1; CDC123; CIAO1; FGF18; ALDH1A2; UFL1; STAMBP; FGFR1OP; FGF19; GLP2R; SLC25A27; EGFR; F2; TIMP1; CST3; MYC; HRAS; TGFB1; VIP; EPO; KRT6A; CXCL10; PLA2G1B; PDGFA; CSF2; CAPNS1; EDN1; ITGB1; CCK; NPM1; ITGAV; THBS1; NMB; PKHD1; CSF1; AR; RARA; TGFB3; CDK4; ODC1; BMP4; EDN3; LIF; FOSL1; AREG; VEGFA; PDGFRA; FER; ZNF16; XBP1; ADCYAP1; ATF3; POU3F3; POU3F2; EDN2; KITLG; FGF7; BMP5; F2R; CNTFR; CALR; CCND2; CDC25B; ALDH3A1; AKT1; AKT2; TTK; GRK5; ADM; SOX11; FLT4; KDR; CHRNA7; TGFBR1; TGFBR2; COL18A1; GDNF; IL6ST; CEACAM6; IL15; HTR2B; NOP2; NOTCH1; RPS9; DHPS; UBE2A; PGF; FLT3LG; EFNB2; AKR1C2; CRIP2; PDX1; MVD; EMP2; FGF8; NAP1L1; MAZ; CAV3; RAB25; CD81; RPS15A; CNBP; RPS4X; RPL23; EIF5A; CSNK2A1; CX3CL1; HMGN5; HSF1; MDM2; TIAL1; RELA; EGR4; FOXM1; STX4; TSPAN31; PAK1; TBX2; ILK; TCIRG1; CUL4A; RUNX2; COX17; HES1; ZNF268; HLX; NOLC1; ERBB4; SHH; EZH2; NTRK3; FXN; NTRK2; FAM98B; AKIRIN2; SPDYA; ACER2; RNF187; HES5; IL34; STOX1; NCCRP1; SAPCD2; CARM1; KLB; CCAR1; OSR2; FAM98A; CSNK2A3; TET1; MAPK15; DOT1L; HPSE2; PROX1; HAS2; TSLP; TBRG4; SIRT1; CDCA7L; KIF20B; NACC1; S1PR3; LGMN; S100A13; CIB1; PRMT1; SLC25A33; SSBP3; ROGDI; DERL2; WWTR1; ZNF703; MLXIPL; FGF20; ESM1; RPRD1B; FGF21; CLCF1; ASH2L; SERTAD1; CNOT7; FBXO5; MCTS1; CCPG1; HSF4; FZR1; CEP131; CHTOP; IRS2; NOX1; TNFRSF11A; HBEGF; REG3A; IL11RA; PRL; REG1B; CSF3; PROK1; CNTF;	GO:0008284~positive regulation of cell population proliferation	206	490	42.0408163265306	0.00026653180293279	0.0462482035829675	1	1	0.884266647094754	1	0.449649889063435
down	ELL2; POLR2D; CCNT2; CCNK; POLR2C; TBP; POLR2A; GTF2E1; GTF2E2; POLR2B; GTF2F1; POLR2I; TAF6; CDK9; POLR2H; POLR2J; POLR2K; POLR2F; POLR2G; GTF2B; TAF5; TAF11; SNAPC1; TAF9; SNAPC4; ICE2; INTS3; INTS5; INTS8; RPAP2; INTS1; ZC3H8; NABP1; INTS12; INTS4; RPRD1A; SRRT; INTS2; ELL3; RPRD1B; INTS9; INTS7; INTS10; ICE1;	GO:0042795~snRNA transcription by RNA polymerase II	44	70	62.8571428571429	0.000312219898763066	0.0531909172983624	1	1	0.908047836490948	1	0.517150682825643
down	PSMD14; RAD51B; AP5Z1; RAD51C; XRCC3; XRCC2; RAD51D; REC8; PARP1; RPA2; XRCC1; SFPQ; RPA1; RPA3; LIG3; BRCA2; BLM; UBE2N; RAD51; GEN1; KDM4D; RFWD3; MMS22L; POLN; SFR1; PALB2; SMC5; SLX4; MEIOB; RAD50; ERCC4; NABP1; TONSL; RBBP8; SLX1A; NUCKS1; RAD21L1; AUNIP; MORF4L1; POLL; FAN1; RAD54B; REV3L; RMI1; RAD52; WRN; RPA4; NSMCE1; HUS1B;	GO:0000724~double-strand break repair via homologous recombination	49	82	59.7560975609756	0.000352605185248489	0.0589984033174704	1	1	0.920864199079063	1	0.573614182852076
up	SGK1; PIK3CD; ADAM10; RIOK3; CASK; CHUK; PDPK1; MAP3K13; KALRN; GMFG; CCNT1; JAK2; HUS1; CPNE3; ERN1; RPS6KA5; STK17B; STK10; PRKD3; MAP4K4; LATS1; WNT11; RAF1; ERBB2; NTRK1; APP; PRKCB; INSR; FYN; LYN; RHO; HCK; FGR; ERG; PIM1; PSKH1; BRAF; CREB1; EIF2AK2; TAF1; PRKACG; JAK1; ITPKA; GUCY2C; PIK3R1; MAPK1; LTK; CCND3; GRK3; CSK; PIK3CA; TEC; FRK; GRK6; SYK; MAPK8; CSNK1A1; CSNK1D; PIK3CG; MAPKAPK2; CLK3; GSK3B; NEK2; JAK3; DAPK1; LIMK1; LIMK2; RIPK4; SRPK2; CCNA1; MAP3K9; PRKCE; GUCY2D; ACVR1; PRKCZ; PRKCD; RNASEL; AKAP13; MERTK; STK4; PRKAA1; PAK2; STK3; MAP3K1; ATM; ROCK1; CAMK2G; CAMK2D; DYRK1A; RUNX3; PTK6; CCNI; MORC3; PTK2B; PDK1; STK38; MMD; STK11; PKN2; CAMK4; CCNG2; PDK4; MAPK6; PHKG1; MYLK3; LRRK1; PAN3; TNNI3K; LRRK2; OBSCN; TSSK4; KSR2; CCNI2; MARK2; TAOK1; STRADA; PXK; PIM3; HIPK1; CAMK1D; CCNJL; GLYCTK; TEX14; LMTK2; PDIK1L; MINK1; CAMKK1; MLKL; CAMKV; PIK3C3; ACVR1C; ANKK1; STK35; NEK7; PPP4R1; CCNB3; MYO3B; MAML1; DYRK2; SGK3; MARK4; ALPK3; LMTK3; ALPK1; PSKH2; CAMKK2; TRIB1; TESK2; PPP1R9B; SRPK1; PIK3R4; P2RX7; MAP3K5; SMAD5; MKNK1; TRPM6; PINK1; PRKD2; STRADB; NUAK2; SIK2; TAOK3; HIPK2; HIPK3; WNK1; POMK; SGK2; BIRC6; SNRK; LATS2; PLK2; PIM2; FNIP2; STK26; EIF2AK4; HCST; TBK1; DAPK2; TLK1; CDK11A; STK38L; MAP3K2; WNK2; DYRK1B; MAP4K5; CDC42BPB; IRAK3; STK24; BMPR2; CDK19; PHKA2; CDK13; CHEK1; CDK12; ACVR2B; PRPF4B; CDK18; RPS6KA1; RPS6KB1; BMP2KL; RPS6KA3; CDKL1; PHKB; CDK14; FAM20A; AMHR2; FAM20B; CDKL5; PEAK1; CDK8;	GO:0006468~protein phosphorylation	210	482	43.5684647302905	0.000420899854121637	0.178942552645453	1	1	0.999999997829908	0.999999997829908	1
up	ADGRB1; CD36; CLEC7A; IGHV4-39; IGHV3-74; IGHG1; IGHV1-69; IGLL5; IGHV1OR21-1; IGHV3-43; IGHV4-28; IGLC6; IGHV1OR15-9; IGHV3OR16-13; IGHV3OR16-12; IGHV1-46; IGHV3-64; IGHV3-66; IGHV3-16; IGHV3-72; IGHV1-45; IGHV3OR15-7; IGHA2; IGHA1; IGHV1-3; IGHV3-35; IGHV1-18; IGHG4; IGHV3OR16-10; IGHV1-69-2; IGHV3OR16-9; IGHV3-20; IGHV3-21; IGLC7; IGLC3; IGHE; IGHV3-13; IGHV2-70; IGHV3-53; IGHV3OR16-8; IGHV3-38; IGHV3-7; IGHV1-58; IGHV4OR15-8; IGHV4-61; IGHV2OR16-5; IGHM; IGLL1; IGHV2-5; TRBC1; IGHV5-51; IGHV3-73; IGKC; IGHV6-1; IGHV4-31; IGHV4-59; IGHV4-34; IGHV3-33;	GO:0006910~phagocytosis, recognition	58	99	58.5858585858586	0.000435837810897066	0.178942552645453	1	1	0.999999997829908	0.999999997829908	1
down	AP4M1; PLOD3; ULK1; TP53; NPM1; AKAIN1; ERCC3; BCL6; TSC2; NR0B1; CAV3; CD81; GNGT1; SQSTM1; RAB35; DHCR24; MAPRE1; NEDD8; DUOXA1; DUOXA2; ODF2; CROCC; GRASP; DDX42; CDAN1; CADM3; NBEA; SPTSSA; CCDC120; WNK4; ALS2; VPS13A; BBS2; BIN3; SLC9A2; MLH3; GGA1; AP4E1; AP4B1; TRAK2; PARD3B; LRRC61; SPHKAP; AKAP3; HEATR5B;	GO:0008104~protein localization	45	74	60.8108108108108	0.000455392882680927	0.0723225645884795	1	1	0.940699308048908	1	0.703158839146121
down	FOXE1; IGF2BP3; FSCN2; MPZL2; TBX19; TBX10; DEAF1; FGF18; EYA4; TBX6; TSHB; TH; HOXB5; CPM; LIG1; F2R; MNX1; GPC3; EFNB2; CLTCL1; HIRA; FGF8; SOX10; HOXA4; POU5F1; EN1; CST6; NEDD8; LZTR1; S1PR3; EYA1; MLXIPL; SIX2; MRPL40; ONECUT1; DKK3; SIX4; DKKL1; SCML1; SOX13; ERVW-1; SCML2; LYVE1; IGF2BP2; FOXD4L1; SOX17; FOXL2; SOX15; SOX11; FBN1; SOX1; FOXE3; FOXI1; FOXC2; PITX2; SOX2; FOXA3; FOXD2; SOX7; ANKRD11; SOX3; FBN3; FOXD1; PITX3; FOXA2; PITX1; SOX18;	GO:0009653~anatomical structure morphogenesis	67	127	52.755905511811	0.000495953985837017	0.0774514807882141	1	1	0.9485163204387	1	0.753024918724522
down	RAD51B; RAD51C; XRCC3; RAD21; KIN; ACTL6A; ERCC1; TFPT; XRCC6; XRCC5; RAG1; RPA1; APEX1; IGHMBP2; RAD52; BLM; RAD51; ENDOG; TSN; NFRKB; INO80C; PAXIP1; REC114; RPAIN; SUPV3L1; EID3; INO80E; RAD50; MCRS1; NSMCE3; PAGR1; INO80B; THAP9; ACTR8; ACTR5; NSMCE4A; APEX2; RUVBL2; RUVBL1; UCHL5; MSH2; WRN; HMGB1P1;	GO:0006310~DNA recombination	43	70	61.4285714285714	0.000515892134442142	0.0792444147495552	1	1	0.952336880180194	1	0.770456786221144
down	FANCA; XRCC3; RAD51D; USP1; ERCC1; RPA2; RPA1; RPA3; RPS27A; RAD51; FAAP100; ATR; FAAP20; RFWD3; DCLRE1A; POLN; SLX4; FANCM; C17orf53; FANCB; ATRIP; ERCC4; MUS81; SLX1A; FAAP24; FANCD2; NUCKS1; EXO5; DCLRE1B; FANCE; FANCF; FANCL; FAN1; MSH6;	GO:0036297~interstrand cross-link repair	34	50	68	0.000526877705200546	0.0796265177053083	1	1	0.954486146421875	1	0.774171796499478
up	TNFSF4; TLR9; IGHV3OR16-9; IGHV1-45; IGHV3-16; IGHV3-38; IGHV3-53; IGHV1-69-2; IGHV1OR21-1; IGHG4; IGHV3OR15-7; IGLC7; IGLC3; IGHV4-39; IGHV3-64; IGHV4-28; IGHV2-70; IGHV3-21; IGHV4-59; IGHV1-69; IGHV3OR16-12; IGLL1; IGHV2OR16-5; IGHV3-73; IGHM; IGHG1; IGHV3-13; IGHV4OR15-8; TRBC1; IGHV1-18; IGLL5; IGHA1; IGHV3-72; IGHV3-74; IGHV3-33; IGHE; IGHV3OR16-10; IGHV3-20; IGHV1-46; IGHV3OR16-8; IGHV1OR15-9; IGLC6; IGHV4-31; IGHV5-51; IGHV4-61; IGHV1-3; IGHV3OR16-13; IGHV6-1; IGHV4-34; IGHV3-66; IGHV1-58; IGHV3-7; IGHA2; IGKC; IGHV3-35; IGHV3-43; IGHV2-5;	GO:0050871~positive regulation of B cell activation	57	98	58.1632653061224	0.000553539719096219	0.216937248093073	1	1	0.999999997829908	0.999999997829908	1
down	TMSB15B; CDC42EP2; INPPL1; NCK2; SORBS3; SORBS2; TF; PLA2G1B; ALDOA; ACTN1; NCK1; PRKCI; EMP2; CAV3; BCAR1; TMSB10; ARF1; CGNL1; DBN1; CARMIL1; XIRP1; RUFY3; WHAMM; POF1B; RND1; ARHGEF2; SH3KBP1; TRPV4; RHOF; BIN3; MAD2L2; KPTN; SHROOM3; LMOD3; TPM2; TMOD1; TMOD2; CORO1C; RND3; RHOBTB2; RHOA; SHROOM2; RHOJ; RHOB; MYOM1; LMOD1; RHOC; RHOV; RHOQ; RND2; TPM1; CORO1B; RHOBTB3; MYO1C; ARHGAP17; MYO19; CORO6; MYO15A; MYO1E; PPP1R9A; TPM4; MYO1H; MYO5C; MYO1A;	GO:0007015~actin filament organization	64	121	52.8925619834711	0.000619961860605756	0.0907662911543114	1	1	0.968324774513106	1	0.882478660495829
down	NEURL1; EIF4E; RPL10; AKT1; AKT2; GRM5; METAP1; MTPN; NANOS3; MAGOH; RPS14; RPL38; SARNP; RBM3; TCOF1; NOLC1; PIWIL4; MAPKAPK5; NGDN; GEMIN5; GCN1; PTCD3; DNAJC1; ATXN2; RBM4B; LSM14B; EIF2A; PCIF1; MKNK2; EIF2B4; PA2G4; RBM8A; ZNF706; PUM3; MATR3; PTBP2; HNRNPL; PTBP1; RBM20;	GO:0006417~regulation of translation	39	62	62.9032258064516	0.000656572799673905	0.0923155520875899	1	1	0.973040889116727	1	0.897541407863503
down	NDUFS8; STK25; TOR1A; OGG1; LIAS; ANGPTL7; NDUFS2; PSIP1; IDH1; NDUFB4; OXSR1; MT-CO1; MT-ND3; PRNP; ERCC1; HMOX1; MBL2; ALAD; NQO1; TAT; ERCC3; XPA; RPS3; PSMB5; PRDX6; PRDX5; AKT1; PRDX2; PTGS2; NUDT1; GPX4; CHRNA4; GSS; FGF8; ERCC6; ERCC8; WRN; PON2; DHCR24; MICB; SCARA3; RRM2B; OXR1; RBPMS; SIRT1; NEIL1; ALS2; PNKP; TXN2; DUOX2; C19orf12; NDUFA12; HAO1; HMOX2; ATOX1; PRDX1;	GO:0006979~response to oxidative stress	56	102	54.9019607843137	0.000675772628954685	0.0923155520875899	1	1	0.975500833147906	1	0.897541407863503
down	TP73; MSH5; RNASEH2A; PCNA; RPA2; LIG1; RPA1; POLD1; RPA3; MLH1; MSH2; POLD2; MSH6; PMS2; POLD3; SETD2; POLD4; MLH3; PMS1; PMS2P2; MUTYH; XPC; PMS2P1; PMS2P3; PMS2P5;	GO:0006298~mismatch repair	25	32	78.125	0.00069472015393035	0.0923155520875899	1	1	0.977953745995947	1	0.897541407863503
down	SNRPGP15; PRMT5; GEMIN2; SART1; SNUPN; SNRPC; SNRPB; CLNS1A; GEMIN4; SNRPE; SNRPF; SNRPG; SNRPD2; SART3; SMN1; GEMIN5; GEMIN6; TGS1; GEMIN7; PRMT7; DDX20; STRAP; COIL;	GO:0000387~spliceosomal snRNP assembly	23	28	82.1428571428571	0.000698863624845503	0.0923155520875899	1	1	0.978446824760059	1	0.897541407863503
down	DFFA; TOR1A; SGTA; CRTAP; HSPB1; CLU; PDIA4; PPIB; DNAJB2; PEX19; CSNK2A1; FKBP4; PPID; TRAP1; P3H1; DNAJC24; CHORDC1; ST13P5; FKBP1C; FKBP1A; ST13; FKBP1B; UNC45A; ST13P4;	GO:0061077~chaperone-mediated protein folding	24	30	80	0.000699509519553776	0.0923155520875899	1	1	0.978588702766651	1	0.897541407863503
down	CDC7; ORC5; ORC4; ZNF324; CCNE2; MYC; ITGB1; EIF4E; POLA1; CDK4; GSPT1; RPA2; RCC1; CCND1; MCM3; RPA1; MCM4; MCM5; MCM7; RPA3; ACVR1B; CDKN1A; NASP; PRIM1; PRIM2; MCM2; CCNH; BCAT1; POLE2; CDK3; CDK6; PPAT; KHDRBS1; POLE; PPP3CA; TAF10; RPA4; ORC1; EIF4EBP1; CUL1; CUL2; CUL4A; MCM6; SPDYA; MCM10; CUL5; RBBP8; CDC6; HINFP; PLK3; POLE3; ORC3; DBF4; CAMK2A; USP26;	GO:0000082~G1/S transition of mitotic cell cycle	55	100	55	0.000726809396148553	0.094586167248777	1	1	0.980772633978694	1	0.919617548691372
down	POLR3A; POLR2D; CREBL2; MITF; TCEA3; ZBTB7A; NR3C1; PTMA; COL4A2; AR; SKI; TCF3; HOXB9; POLR2C; BCL3; POLR2A; ARNT; POLR2B; HOXA9; HOXC9; POLR2I; NUP62; NR4A2; POLR2H; POLR2J; PPP5C; POLR2K; HIRA; POLR2F; POLR2G; ILF2; PWP1; RNPS1; NFKBIB; LIN52; LIN9; GTF2H2C; SMARCD3; ASXL1; PPP1R13L; TCEANC2; MMS19; HINFP; POLR3C; SLC39A8; XAB2; MYNN; CREBZF; TOPORS; POLR3E; POLR3B; ZNF219; ASH2L; PPP1R1B; LZTS1; DRG1;	GO:0006351~transcription, DNA-templated	56	103	54.3689320388349	0.000803757356434232	0.103167211366969	1	1	0.985690083852698	1	1
down	VPS37C; HGS; CHMP2A; PRKAB2; ULK1; TOMM70; MFN2; GABARAP; SRC; CSNK2A2; VDAC1; PRKAG1; DYNLL1; CSNK2A1; TCIRG1; SQSTM1; TOMM20; ACBD5; VPS36; VPS37D; MFN1; TOMM5; MTMR14; HDAC10; MVB12A; DYNLL2; CHMP6; SNF8; PGAM5; MAP1LC3C; CHMP4A; UBXN6; GABARAPL1; CHMP4B; VPS37B; ZFYVE1; VTA1; TOMM22; TOMM7; PRKAG3; PRKAG2; VPS28; UBQLN1; VPS4A; PLAA; CHMP3; PRKAB1; ATG4B; WIPI2; MAP1LC3B2; EI24; GABARAPL3;	GO:0016236~macroautophagy	52	94	55.3191489361702	0.000904017329032447	0.11294189830712	1	1	0.992104320375147	1	1
down	EME2; REV3L; DXO; ENDOD1; RAG1; DNA2; POLG; PMS2; POLE; WRN; TATDN3; GEN1; ZRANB3; ZC3H12B; PDE12; TATDN1; DCLRE1A; APLF; FANCM; REXO1; PLD6; PGBD5; MEIOB; EXD1; DDX1; TATDN2; HMCES; HARBI1; ATAD5; PNKP; RAD9A; RBBP8; TREX2; SLX1A; MGME1; PELO; STK31; EXO5; DCLRE1B; TDP1; APEX2; LAS1L; RAD50;	GO:0090305~nucleic acid phosphodiester bond hydrolysis	43	73	58.9041095890411	0.000966641376429211	0.119176706541338	1	1	0.996110987876054	1	1
down	PSMD11; PSMD12; PSMD14; PSMD3; PSMB1; PSMA2; PSMA3; PSMA4; PSMA5; PSMB4; PSMB5; PSMC2; PSMB10; CCNF; PSMC4; PSMB3; PSMD7; PSMD4; PSME3; PSMC1; PSMC5; RBX1; PSME1; PSMD2; CUL1; PSME4; PSMD6; PSMD5; FBXW5; WWTR1; FBXL15; FBXO6; FBXO2; FBXW11; FBXL2; FBXO4; PSME2; PSMD13; BTRC; NCCRP1; FBXO27; LRRC29; CUL4A; FBXO39; CUL2; FBXL12; FBXL6; FBXL14; CUL5; FBXO44; FBXL8; FBXW4;	GO:0031146~SCF-dependent proteasomal ubiquitin-dependent protein catabolic process	52	95	54.7368421052632	0.00107848996185711	0.129557063366681	1	1	1	1	1
down	PSMD11; PSMD12; PSMD14; DVL1; PSMD3; FZD6; AP2A2; AP2A1; PFN1; PSMB1; PSMA2; PSMA3; PSMA4; PSMA5; PSMB4; PSMB5; PSMC2; PSMB10; PSMC4; PSMB3; PSMD7; AP2S1; PSMD4; PSME3; RHOA; PSMC1; PSMC5; AP2B1; ROR1; PSME1; PSMD2; FZD2; PSME4; PSMD6; PSMD5; ARHGEF19; VANGL1; DVL3; AP2M1; SMURF2; SMURF1; CELSR2; PARD6A; CELSR1; PSME2; FZD4; PSMD13; DAAM1; GPC6;	GO:0060071~Wnt signaling pathway, planar cell polarity pathway	49	88	55.6818181818182	0.00112390582878608	0.133303767287665	1	1	1	1	1
down	PSD; TOR1A; PHGDH; GALR2; PQBP1; ULK1; LGI1; NPY; APOE; GBA; LAMB1; MAPT; SRF; AREG; ADCYAP1; EPHA8; L1CAM; GDNF; RAB13; WDR5; RAB11A; BLOC1S1; CDK16; ERCC6; CNTN1; ALKBH1; RASGRF1; RAB35; ZFYVE27; CAMSAP1; ADGRF1; BLOC1S3; BLOC1S2; TMEM108; ATCAY; MICALL2; MICALL1; BLOC1S5; GDPD5; DTNBP1; CLMN; NRTN; PRMT1; SH3GL2; EHD1; BLOC1S4; STMN3; ATXN10; NCDN; USP21; TBC1D24; PLP1; STMN4; STMN1; GPRIN1; MAP4; CDNF; PPP1R9A; STMND1; GPM6B;	GO:0031175~neuron projection development	60	115	52.1739130434783	0.00115110182822298	0.1340839627934	1	1	1	1	1
down	PSMD11; PSMD12; PSMD14; UBE2C; AURKA; PSMD3; BUB3; BUB1B; CDK1; PSMB1; PSMA2; PSMA3; PSMA4; PSMA5; PSMB4; PSMB5; CDC27; PSMC2; PSMB10; PSMC4; PSMB3; PSMD7; UBE2E1; PLK1; PSMD4; ANAPC15; PSME3; PSMC1; PSMC5; RPS27A; PSME1; PSMD2; PSME4; PSMD6; PSMD5; UBE2S; CDC26; ANAPC1; CDC23; ANAPC5; ANAPC4; ANAPC2; FBXO5; PSME2; FZR1; PSMD13;	GO:0031145~anaphase-promoting complex-dependent catabolic process	46	81	56.7901234567901	0.00115910362713612	0.1340839627934	1	1	1	1	1
down	TTC26; CCDC66; GMNC; UNC119B; BBIP1; CEP290; OFD1; PCNT; SNAP29; WDPCP; ONECUT2; GSN; PKHD1; FLNA; CCNO; NOTCH1; RFX2; NME5; RAB8A; OCRL; IFT88; RFX4; FAM161A; ARL13B; CFAP70; CEP162; TTBK2; TMEM107; NPHP3; DZIP1; NUDCD3; CCDC65; SPAG16; IQUB; GALNT11; DNAAF1; BBS1; IFT81; RPGR; TCTN2; IFT74; HYLS1; CFAP54; SCLT1; FUZ; CCDC28B; BBS2; WDR11; WWTR1; RAB17; PTPN23; EHD1; TMEM231; IFT122; CELSR2; TMEM138; MKKS; STK36; EHD3; TMEM216; CEP126; WDR35; ATXN10; ONECUT1; HDAC6; DCDC2; INTU; RABL2B; B9D1; CEP164; IFT52; TTLL3; HSPB11; CEP83; ATP6V1D; TEKT5; MAFIP; TBC1D32; CFAP44; TEKT2; TTC36; PTPDC1; TTC39C; TEKT4; WDR19; CDC14B; CEP131; CCDC40;	GO:0060271~cilium assembly	88	187	47.0588235294118	0.00124817960439305	0.139231463013844	1	1	1	1	1
down	RPS19; NOP14; FAM207A; BTRC; UTP6; UTP4; DCAF13; TSR2; TSR1; RPS8; RPS16; WDR46; RRP36; DHX37; TBL3; DIEXF; NGDN; RPS14; UTP3; NOL10; HEATR1; BMS1;	GO:0000462~maturation of SSU-rRNA from tricistronic rRNA transcript (SSU-rRNA, 5.8S rRNA, LSU-rRNA)	22	28	78.5714285714286	0.0013528516230078	0.145887625724933	1	1	1	1	1
down	PES1; NVL; RPL35A; RPL7; RPL5; RPL14; RPL26; RPL11; RRS1; WDR74; GTF3A; RPF2; SDAD1; NIP7; RPL26L1; NPM1; SURF6; ZNF622; NOC2L; EBNA1BP2; HEATR3; MRTO4;	GO:0042273~ribosomal large subunit biogenesis	22	28	78.5714285714286	0.0013528516230078	0.145887625724933	1	1	1	1	1
down	NOP2; RPL5; RPL11; RRS1; MRTO4; RPL12; RPF2; RPL3L; NLE1; RPL10; RPL23A; RPLP0; MDN1; RPL10L; RPL3; RPL6; PPAN; RPL24; RSL24D1; RPLP0P6; MRPL20;	GO:0000027~ribosomal large subunit assembly	21	26	80.7692307692308	0.00136089701402309	0.145887625724933	1	1	1	1	1
down	RCCD1; CBX4; SOX1; HDAC3; DAPK3; SUV39H1; SOX15; BRD4; SS18L1; TOX; ZBTB7A; CBX6; NR3C1; HMGN1; DNMT1; RBL1; GPX4; SOX2; SMARCA4; FOXA3; HMGN5; HNRNPU; RELA; TRIM28; HLTF; CBX2; BRD3; SAFB; HMGN3; EZH2; EMSY; TLK2; PHF13; CDAN1; BANP; L3MBTL4; RCBTB1; TET1; CHD6; L3MBTL2; HDAC10; SIRT1; L3MBTL3; DNAJC2; NUCKS1; TDRD3; BRD9; EHMT1; TCF7L1; ZNF304; HMG20A; UTP3; BABAM1; ALKBH4; HMG20B; LRWD1; SFMBT1; PADI1; FOXA2; PADI2; L3MBTL1; PHF1; TAF6; HIST1H2AH; H2AFJ; TAF6L; GATAD1; PHF19; FAM50A;	GO:0006325~chromatin organization	69	139	49.6402877697842	0.00141686957783971	0.149169302745596	1	1	1	1	1
down	PHF2; ZMPSTE24; ALDH1A2; ONECUT2; OTC; ADA; ASS1; HRAS; QDPR; HGF; PKM; XBP1; HNF1A; ACAT1; AK4; CAD; HMGCL; NOTCH1; PDX1; CEBPG; WNT4; ARF6; SMAD3; HMGCS1; TGFBR3; RELA; ATP7A; DBP; BAAT; HNRNPD; HES1; HLX; ARID5B; AACS; LSR; PROX1; JARID2; GNPNAT1; ONECUT1; RARB; GFER; RARA; MET;	GO:0001889~liver development	43	75	57.3333333333333	0.00143345529873296	0.149238623879198	1	1	1	1	1
down	GRM8; TULP1; TULP2; RRH; PPEF2; FSCN2; RGS16; CRX; PDE6D; OPA1; SLC24A1; KERA; USH2A; DHRS3; BEST1; LRAT; ABCC6; ZIC2; EYA4; EML2; COL1A1; COL2A1; OAT; TH; RLBP1; PDE6A; CHRNB2; CDH3; GLRA1; CHM; PAX6; CNGA1; MIP; RCVRN; TIMP3; GJC1; COL18A1; GPR143; GUCY2F; RABGGTB; NRL; RP1; IRX5; POU6F2; ROM1; CRYZ; EFEMP1; PDCL; GRK1; CNGA3; PRR4; RPE65; IMPG1; FAM161A; LRIT3; CNNM4; GPR179; TRPM1; CPLX4; RDH10; ZNF513; BBS1; WDR36; BBS10; GRK7; ADGRV1; RABGGTA; RORB; RDH5; RPGR; DNAJC19; HMCN1; KIFC3; BBS2; MFRP; IMPG2; CABP2; MKKS; CLN6; RDH8; AIPL1; VSX1; CABP1; OPN4; SLC24A2; GJD2; HSF4; NOB1; OCLM; NR2E3; GJA3; ARR3; CRYGS; UNC119; CRYBG3;	GO:0007601~visual perception	95	207	45.8937198067633	0.00150982111568498	0.155461800593058	1	1	1	1	1
down	HCN1; CACNA1H; NTSR2; CHRNA1; DLD; CHRNB1; GLRA1; ACTN2; CHRNA4; SLC1A6; CAV3; SLC26A5; KCNA1; KCNMA1; KCNH2; ASIC2; SLC4A8; CNIH2; CNIH3; SLC39A8; RIMS4; POPDC3; RANGRF; RIMS3; HCN4; CHRNB3; GABRA3; GABRB2; KCNH7; GABRG3; POPDC2; CHRNA10; CHRNB2; GLRA2; KCNH6; GLRA3; KCNH4; GABRP; ZACN; GABRG1; GLRA4; GABRR3; CHRNA7; KCNH5; GABRQ; GABRA2; CHRNB4; PIEZO1; GABRR1; CHRFAM7A; GABRG2; HTR3C; GABRE; GABRB1;	GO:0042391~regulation of membrane potential	54	102	52.9411764705882	0.00154179015141198	0.15702797520359	1	1	1	1	1
