down	LRCOL1; CYB5B; PPP1R12B; NUPR1; PRKRA; B3GAT3; DPM2; SOD1; CXCL1; XRCC5; GTF2F1; TRIM23; DDOST; NR4A2; GMFB; DAD1; ARF1; ATP7A; STX4; FXN; LTC4S; GNAS; NOXA1; SLX4; DCP1B; KRTCAP2; NOXO1; APH1B; NSMAF; AZIN2; APH1A; WRNIP1; CIB1; DCP1A; PSENEN; SAE1; DNMT3L; GTF3C4; MMP24;	GO:0043085~positive regulation of catalytic activity	39	81	48.1481481481481	0.0192803538137355	0.605479574599104	1	1	1	1	1
down	ODAM; MEN1; QSOX1; MATN3; VGF; CALU; PRSS23; SLC34A2; TSPAN15; NAPSA; F2; PLG; SERPINC1; TIMP1; CST3; KNG1; NPPA; PENK; PRL; CALCA; APOE; AHSG; AFP; TF; APOB; CHGB; SERPIND1; GSN; APOA4; P4HB; LAMB1; MMP2; LGALS1; CSF1; C4A; SAA1; LAMC1; BMP4; PRKCSH; HSP90B1; IGFBP2; IGFBP4; HRC; ADORA2B; SDC2; SFTPD; FBN1; IGFALS; GPC3; BACE1; TSPAN5; RPS27A; HSPG2; MFGE8; FSTL1; MSLN; LTBP1; PDIA6; RCN1; TTF1; IGFBP7; NOTUM; VWA1; APOA5; SFTPA2; FAM20C; SHISA5; D2HGDH; GOLM1; APH1B; SCG3; PNPLA2; APH1A; ABCA3; MXRA8; PAPPA2; L2HGDH; AMBN; PSENEN; GGA3; CCDC59; ZDHHC2; GGA1;	GO:0044267~cellular protein metabolic process	83	200	41.5	0.019321066467997	0.605479574599104	1	1	1	1	1
up	FZD9; TERT; PDPK1; JAK2; KRAS; SOD2; NTRK1; JUN; FYN; NEFL; BCL2; CEBPB; MAG; RASA1; C5AR1; MDK; ERBB3; IL10; MT3; GRN; ADORA2A; CORO1A; ARRB2; PIK3CA; GCLC; GCLM; MTNR1B; ARRB1; PSEN1; LIG4; PPT1; MECP2; ADAM8; BTG2; POU4F1; GRIN1; MEF2C; BCL2L1; NAIP; CLN3; ROCK1; PTK2B; ITSN1; SNCB; CPEB4; BHLHB9; GFRAL; TFAP2D; DRAXIN; KDM2B; NDNF; TFAP2B; AGAP2; FOXB1; CITED1; PINK1; BARHL1; AMBRA1; ADNP; HIPK2; DNAJC5; PPARGC1A; SNX6;	GO:0043524~negative regulation of neuron apoptotic process	63	138	45.6521739130435	0.019689502767031	0.846389002762938	1	1	0.999999997829908	0.999999997829908	1
down	PRKAB2; ATP6V1G1; ULK1; VPS26A; GBA; GAPDH; CAPNS1; PRKACA; ATP6V0C; ATP6V1E1; MTOR; PRKAG1; RHEB; VPS26B; RRAGB; LAMTOR1; SNX32; RPTOR; ATP6V0D2; SLC38A9; ATP6V1C2; ATP6V0E2; ATP6V1E2; ATP13A2; HDAC6; PRKAG3; PRKAG2; LAMTOR3; UBQLN2; LAMTOR2; PRKAB1; ATP6V0A2; ATP6V1D; SNX5; UBQLN1;	GO:0016241~regulation of macroautophagy	35	71	49.2957746478873	0.0201205346836116	0.621295503346362	1	1	1	1	1
up	NFAT5; CSF1R; MME; ITGA4; HCLS1; PTPN2; PTPN4; PTPN6; CASP1; PTPN7; FLT3; STAT3; PTPN9; MAPK8; CXCR4; NKX6-1; POU4F1; PTPN12; PTPN11; POU4F2; IL18R1; PTPN20; PID1; IL1F10; PTPN18; TBK1; LEF1; TRAF6; NLRP12;	GO:0071345~cellular response to cytokine stimulus	29	53	54.7169811320755	0.0201839918707091	0.846389002762938	1	1	0.999999997829908	0.999999997829908	1
down	AIP; PPIH; FKBP9; PPIB; FKBP2; PPIF; NKTR; PPIA; FKBP1A; FKBP1B; PPID; PPIL6; PPIL4; PPWD1; FKBP14; FKBP11; AIPL1; PPIE; PIN4; FKBP7; PPIL2; FKBP4; FKBP1C; CWC27; PPIL3;	GO:0000413~protein peptidyl-prolyl isomerization	25	46	54.3478260869565	0.0203965035368574	0.621295503346362	1	1	1	1	1
down	AIP; HNRNPDL; SOD1; CA1; RPLP0; P4HB; ANXA2; GSTA2; SNRPA1; RALA; TCP1; HNRNPA2B1; CFL1; MSN; IL12B; TYK2; TALDO1; HSPA9; PPIA; GSTO1; ARF1; MTAP; PDCD4; CNN2; PSME2;	GO:0035722~interleukin-12-mediated signaling pathway	25	46	54.3478260869565	0.0203965035368574	0.621295503346362	1	1	1	1	1
down	CIT; JTB; KIF4A; STAMBP; RHOC; STMN1; CFL1; PLK1; RHOB; SPTBN1; KIF23; UNC119; ESPL1; RAB35; KIF4B; MAP9; CEP55; TTC19; SNX33; MITD1; CKAP2; NUSAP1; CHMP4B; INCENP; ANLN; SNX9; ROCK2;	GO:0000281~mitotic cytokinesis	27	51	52.9411764705882	0.0206734699766342	0.621295503346362	1	1	1	1	1
down	MYO1C; CCL24; BIN1; CCL21; CDC42EP2; NCK2; NPHS1; BAG4; ICAM1; PFN1; CSF3; NCK1; FER; LMOD1; MTOR; VASP; RHOA; ARF6; CTTN; CARMIL1; FCHSD1; BAIAP2L1; SNX9; BAIAP2; C15orf62; CDC42EP1; CDC42EP3;	GO:0030838~positive regulation of actin filament polymerization	27	51	52.9411764705882	0.0206734699766342	0.621295503346362	1	1	1	1	1
down	BMPR1B; TULP1; DLL1; GRM6; OPA1; NPHP4; RET; SKI; ACHE; RRM1; PAX6; LHX2; SOX8; HPCA; BAX; TCIRG1; NECTIN1; TTLL5; ZNF513; LPCAT1; RORB; PFDN5; MFRP; TGIF2; NR2E3; RP1; MDM1; PDE6A; DCX;	GO:0060041~retina development in camera-type eye	29	56	51.7857142857143	0.0207445845486691	0.621295503346362	1	1	1	1	1
up	TMEM150B; TECPR2; ATG7; S100A9; HMGB1; DRD2; ITGB4; TFEB; DRD3; PIK3CB; VPS41; RGS19; HAP1; TMBIM6; VCP; GABARAPL2; RAB1A; CLTC; IRF8; FOXO1; BECN1; USP10; STK11; IFI16; WIPI1; LRRK2; FNBP1L; DRAM2; WDFY4; TECPR1; SBF2; DRAM1; PIK3C3; SUPT20H; RB1CC1; SMCR8; TBC1D5; GRAMD1A; OPTN; RAB39B; NRBF2; C9orf72; TRIM5; MAP1LC3B; TOLLIP; ATG5; TIGAR; VPS18; TBC1D14; UVRAG; CHMP2B; PTPN22; SH3GLB1; PLEKHM1; AMBRA1; LIX1; VMP1;	GO:0006914~autophagy	57	123	46.3414634146341	0.0207800957485774	0.846389002762938	1	1	0.999999997829908	0.999999997829908	1
down	RAB27B; QSOX1; ISLR; ACTN4; VEGFD; PCDH7; WDR1; ENDOD1; SOD1; CFD; PLG; SERPINA3; TIMP1; KNG1; TGFB1; AHSG; TF; ALDOA; PDGFA; A1BG; ITGB3; SERPING1; PROS1; THBS1; CD63; SPARC; TGFB3; CLU; ACTN1; HGF; VEGFA; VCL; FLNA; CD9; ACTN2; TIMP3; TAGLN2; ITIH3; LGALS3BP; ITIH4; ECM1; HABP4; APOOL; CD109; CDC37L1; NHLRC2; SCCPDH; SCG3; RARRES2; GTPBP2; TOR4A; CYB5R1; MAGED2; TLN1; TEX264;	GO:0002576~platelet degranulation	55	124	44.3548387096774	0.0208642269051833	0.621295503346362	1	1	1	1	1
down	DNA2; POLG; RRM2B; DNAJA3; PRIMPOL; TEFM; MGME1; POLG2; SSBP1;	GO:0006264~mitochondrial DNA replication	9	10	90	0.0212542042198597	0.621295503346362	1	1	1	1	1
down	KMO; EPO; TP53; TH; HSP90AB1; ANXA7; BDKRB2; BAX; PAPPA2;	GO:0009651~response to salt stress	9	10	90	0.0212542042198597	0.621295503346362	1	1	1	1	1
down	HNRNPA2B1; SMAD3; SMAD1; PUS10; METTL3; DGCR8; SRRT; DROSHA; MRPL44;	GO:0031053~primary miRNA processing	9	10	90	0.0212542042198597	0.621295503346362	1	1	1	1	1
down	AP3D1; AP1G1; CD63; RAB38; RAB32; BLOC1S3; BLOC1S5; ANKRD27; AP1M1;	GO:0035646~endosome to melanosome transport	9	10	90	0.0212542042198597	0.621295503346362	1	1	1	1	1
down	NCL; MTOR; SMARCA4; SMARCB1; PWP1; DDX11; NOL11; IPPK; PIH1D1;	GO:1901838~positive regulation of transcription of nucleolar large rRNA by RNA polymerase I	9	10	90	0.0212542042198597	0.621295503346362	1	1	1	1	1
down	WDR43; WDR75; UTP15; RIOK1; RIOK2; HEATR1; SIRT7; TRMT112; DIMT1;	GO:2000234~positive regulation of rRNA processing	9	10	90	0.0212542042198597	0.621295503346362	1	1	1	1	1
up	TGM5; PPL; KRT75; KRT18; KRT8; CAPN1; FURIN; KRT3; KRT5; JUP; DSP; KRT15; FLG; SPRR1B; SPRR2E; DSG3; SPRR1A; SPRR2A; KRT9; KRT20; KRT2; KRT6C; KRT85; KRT76; DSG1; DSC2; KRT17; DSG2; CDSN; PRSS8; KRT71; SPINK9; LCE1A; LIPN; LIPK; LIPM; KRT79; KAZN; SPINK6; KRT74; KRT25; KRT77; DSG4; KRT73; CERS3; KRT78; EVPL; PERP; KRT12; KRT23; SPRR3; PKP3; ST14;	GO:0070268~cornification	53	113	46.9026548672566	0.021414191272728	0.846389002762938	1	1	0.999999997829908	0.999999997829908	1
down	CCDC78; PRICKLE3; ITGB1; AKT1; NUBP1; DEUP1; PDCL; CDK10; E2F5; TWF2; TAPT1; FAM92B; LRRC56; SAXO1; PIFO; GPR22; TCHP; RABEP2; DNAH9; WRAP73; ODF2L; NUBP2;	GO:0030030~cell projection organization	22	39	56.4102564102564	0.0214834304252104	0.621295503346362	1	1	1	1	1
down	CCDC22; SNX4; RAB13; ARF6; SNX17; MICALL2; VPS52; SNF8; VPS50; RAB17; EHD4; PTPN23; EHD1; EPG5; GGA3; EHD3; EHD2; VPS29; VPS51; DENND1C; RAB35; SNX3;	GO:0032456~endocytic recycling	22	39	56.4102564102564	0.0214834304252104	0.621295503346362	1	1	1	1	1
down	OGG1; SOD1; EGFR; MT1A; MT1E; GSN; HMOX1; MT1G; MAPK3; AKT1; MAPK9; STAR; PPP5C; MT1H; MT1X; HSF1; ATP7A; DAXX; MT1M; MT1HL1; MT2A; MT1DP;	GO:0071276~cellular response to cadmium ion	22	39	56.4102564102564	0.0214834304252104	0.621295503346362	1	1	1	1	1
down	RAB29; LRP5; SLC22A3; HSPA5; TCP1; CCT5; CCT8; CCT4; RAB28; COPZ1; DNM1; RAB40B; TRIP4; RAB43; SCFD1; DNAJC17; CD274; SLC7A8; GGA1; ANTXR1; ANTXRL; ANTXR2;	GO:1901998~toxin transport	22	39	56.4102564102564	0.0214834304252104	0.621295503346362	1	1	1	1	1
up	KLLN; SGK1; HRK; TNFRSF10A; HIP1; EBAG9; APAF1; CHEK1; TNFRSF10B; AIM2; AREL1; PLSCR1; OGT; CFLAR; SIAH2; BCL2L11; TNFSF14; KIF1B; PHLPP1; TLR2; JAK2; HIP1R; SMNDC1; STK17B; TNFSF15; RTN3; GADD45G; GJB6; NTN1; AVP; IFNG; IL1B; RAF1; ITGB2; PRKCB; S100A9; CD2; CD14; VIL1; CTSH; CGB3; GZMB; BCL2; RALB; PIM1; GZMA; NCF1; NFKB1; MX1; C5AR1; FGFR2; RPS6KB1; PAX3; GADD45A; DNASE1; MT3; MAPK1; ADORA2A; PRDX3; TIA1; KRT20; SNCA; BRCA1; IFI27; CASR; CASP3; HTT; DCC; MAP2K4; BAG6; IER3; LGALS7; FASLG; ARRB1; SERPINB9; TNFSF10; FXR1; BCAP31; RPS6KA3; MAP2K6; RBM5; DAPK1; FAM3B; PTEN; CXCR4; UBE2D3; PRAME; MAP3K9; MEF2A; PRKCE; RASSF7; KMT2A; NOTCH2; ZBTB16; PRKCD; MEF2C; ZFP36L1; EP300; FOXO1; BNIP2; IL24; TIAM1; STK4; NAIP; TRAF3; PAK2; STK3; BIK; ROCK1; BIRC3; BIRC2; TNFAIP1; PTK2B; FKBP8; BECN1; CASP8; ARHGEF6; PDCD1; RPS6KA1; PKN2; MAPK14; IL17A; BAK1; SFRP5; BCL2L15; MAGI3; ZFAND6; GRAMD4; TRAF7; DRAM2; DPP8; UNC5A; RASSF6; BNIPL; C6orf120; PIM3; SGMS1; TRIM69; RNF130; GPR65; TNS4; RYBP; DRAM1; RNF152; TMEM102; TOPAZ1; LGALS14; MZB1; PDCD6IP; RASSF5; SLC5A11; RFFL; TFAP2B; ELMO1; DPF2; INPP5D; TNFRSF25; FATE1; RFK; TP53INP1; CIDEC; EAF2; CYFIP2; SFRP2; PAWR; ITCH; CLPTM1L; KREMEN1; NLRP3; BBC3; ZNF385A; MYD88; CITED1; CARD6; BCL2L13; CARD14; BEX2; CHIA; NLRP1; NUAK2; CSRNP2; ATG5; SLK; TP63; GHITM; HIPK3; RRAGC; TP53AIP1; S100A14; PTPRH; MRPS30; NGB; NLRC4; TIGAR; PAK6; BIRC6; DIABLO; PAK5; STK26; GULP1; IL19; DAPK2; FEM1B; PLAGL1; EDAR; ING4; CDK11A; CARD8; EPB41L3; SH3GLB1; CASP4; CASP10; CASP1; PYCARD;	GO:0006915~apoptotic process	214	552	38.768115942029	0.0218024695286483	0.846389002762938	1	1	0.999999997829908	0.999999997829908	1
up	LILRA5; TLR4; MAPK13; TLR3; CLOCK; TLR2; JAK2; TNF; IFNG; IL1B; S100A9; LPL; OSM; ETS1; ITGA2; CEBPB; MDK; TGM2; CCL1; TNFSF4; SNCA; CCR2; CEBPA; STAT5B; NLRP12; IL2; PLA2G7; IL18; TNIP1; NAPEPLD; MGST2; CDK19; SUCNR1; NFKBIZ; IL21; IL23A; TLR9; CD47; GPSM3;	GO:0050729~positive regulation of inflammatory response	39	78	50	0.0223241869570651	0.846389002762938	1	1	0.999999997829908	0.999999997829908	1
down	ACACB; HCN1; ALDH1A2; GLS; HPRT1; ALDOA; TK1; RYR1; MIP; CTH; SHMT1; ALDH1A3; TDO2; ALDH9A1; VASP; KCNJ2; CRYZ; GOLGA2; ACACA; RYR3; SYCP1; CRTC1; CBR4; TRPV1; APIP; ACOT13; THG1L; KIF25; USP16; PFKP;	GO:0051289~protein homotetramerization	30	59	50.8474576271186	0.0224166714874097	0.640216763559611	1	1	1	1	1
down	ARHGAP10; PIK3R2; ARHGAP33; RASGRF2; MCF2L; ARHGAP6; SRGAP3; ARHGEF9; TRIO; FAM13A; RHOC; BCR; CHN1; RHOQ; GDI1; INPP5B; TSC2; GDI2; ARHGDIA; RHOA; RHOB; ARHGAP8; OCRL; ARHGAP1; MYO9B; TRIP10; ARHGAP44; ARHGAP11B; AMOT; ARHGAP21; SYDE2; ARHGEF16; GARNL3; RAP1GAP2; ARHGAP17; ARHGAP22; NET1; SRGAP1; TIAM2; ARHGEF19; RHOT2; ARHGAP24; ARHGAP18; NGEF; ARAP3; ARHGEF1; ARHGEF2; ARHGEF26; SIPA1; RHOV; DLC1; DEPDC7; ARHGDIG; RHOBTB2; ARHGAP39; RHOJ; PLEKHG2; RHOF; ARHGAP23; ARHGAP28; STARD13;	GO:0051056~regulation of small GTPase mediated signal transduction	61	141	43.2624113475177	0.022516542914896	0.640216763559611	1	1	1	1	1
down	ESYT2; SSC5D; PIK3C2A; BIN1; NPC1; INPPL1; TMPRSS2; CD5L; SNX2; LRP4; LRP5; AP2A1; HRAS; LDLR; SYP; ENDOU; TSC2; CAV3; PRSS12; LOXL3; TMPRSS15; LRP2; DNM1; TNK2; LGALS3BP; MYO1E; UNC119; RIN1; LRP8; RABEP1; SHH; TRIP10; AAK1; SCARA3; SCARA5; ARC; MICALL1; NECAP1; DNER; RIN3; USP33; SNX33; STAB2; RUBCN; SH3KBP1; SCARF2; HHIPL1; PGBD1; MTMR9; FNBP1; RUFY1; SH3GL3; TMPRSS5; EHD1; RABEP2; NECAP2; EHD2; EPS15L1; MRC2; RAB22A; MTMR6; USP20; LOXL2; SNX9; EPN1; STON1; BIN3; DENND1C; ATP9B; RHOJ; RHOV; RHOQ; HEATR5B;	GO:0006897~endocytosis	73	174	41.9540229885057	0.0225476554935615	0.640216763559611	1	1	1	1	1
down	KMO; AKAP8; BCL10; ASS1; CXCL10; CSF2; ICAM1; VIM; GSTP1; CSF3; CXCL8; RARA; BCR; CDK4; SRC; CAPN2; XBP1; NR1D1; TNFAIP3; TBXA2R; IL12B; CD68; NOS2; STAR; RHOA; CXCL6; HSF1; PPARD; RELA; PDE4D; NFKBIB; PDCD4; ZC3H12A; DAB2IP; PRPF8; CTR9; ADAMTS13; PABPN1; TICAM2; TICAM1; PAF1; TNIP2; CACTIN; TRIM41; GHSR; UPF1; TNIP3; NOD2; PLSCR4; CHMP5; NFKBIL1; PLAA; CXCL1; NR1H4; CXCL2; IL36B; CXCL13; NR1H2; CXCL11; IL36RN; CXCL9; CXCL3; IRAK1; DEFA5; DEFA6; IL36G; IL1A; IL37; CD274;	GO:0071222~cellular response to lipopolysaccharide	69	163	42.3312883435583	0.0226501852996037	0.64118500379845	1	1	1	1	1
up	CLASP2; IFNG; JUN; VIL1; CTSH; ITGA2; ITGA3; SOX9; INSL3; CCR6; PRKCE; ENPP2; BMPR2; HIF1A; CLASP1; RREB1; GLIPR2; DOCK5; EPB41L5; CAPN7; PLCG2;	GO:0010634~positive regulation of epithelial cell migration	21	35	60	0.0228323776397379	0.846389002762938	1	1	0.999999997829908	0.999999997829908	1
up	CCDC88B; SASH3; IL1B; CD4; TFRC; IL4; PTPRC; CCL5; CD46; CD1D; HLA-DMB; CD40LG; CD6; CORO1A; CD70; LEP; AIF1; NCKAP1L; PRKCQ; IL23R; CLECL1; LILRB2; CARD11; IL21; CD209; IL23A; TNFSF13B; TRAF6; TNFRSF13C; CD80; TNFSF4; JAK3;	GO:0042102~positive regulation of T cell proliferation	32	61	52.4590163934426	0.0229594408196169	0.846389002762938	1	1	0.999999997829908	0.999999997829908	1
up	CAB39; MAP2K5; PAK6; MINK1; MAP3K3; STK24; PAK3; SLK; MAP2K6; PAK5; STK4; TAOK1; MAP2K4; MAP4K4; MAP2K3; TAOK3; STRADB; STK10; MAP4K5; MAP3K14; STRADA; STK3; MAP3K1; MAP3K4; MAP3K2; PAK2; STK26;	GO:0023014~signal transduction by protein phosphorylation	27	49	55.1020408163265	0.0229650532606283	0.846389002762938	1	1	0.999999997829908	0.999999997829908	1
down	ASIC5; KCNK1; SLC24A1; HCN1; SCN2B; CACNA1H; SLC34A2; SLC3A2; SCNN1A; ATP1A2; SCNN1B; SCNN1G; ATP1B3; SCN1B; SLC20A2; SHROOM2; SLC17A1; ASIC2; SLC4A8; CNNM4; SLC24A5; SLC34A3; SLC4A11; SLC20A1; ASIC4; SLC28A3; SLC24A3; SCN3B; SLC17A7; ASIC3; SLC24A2; SLC8A2; SLC17A4; HCN4; SCN10A; SCN7A; SCN1A; SCN11A;	GO:0035725~sodium ion transmembrane transport	38	80	47.5	0.0239017253167386	0.663432055249731	1	1	1	1	1
down	NUP155; ZBTB7A; PGAM1; NUP62; NUP98; PRKAG1; EIF6; NUP107; RAE1; GCKR; NUP188; NUP54; NUP93; NUP35; NUP205; SEH1L; JMJD8; NUP88; NDC1; NUP58; NUP85; PRKAG2; SLC2A6;	GO:0006110~regulation of glycolytic process	23	42	54.7619047619048	0.0239637137286393	0.663432055249731	1	1	1	1	1
down	MB; ANG; SRF; TAC1; ACAT1; ADRA1A; LONP1; NKX2-1; SORD; FHL2; DHCR24; SFRP4; GHSR; RBM14; MMS19; TXN2; FOXC2; PIAS3; TIMP3; NOS1; NOS2; TIMP2; TIMP1;	GO:0009725~response to hormone	23	42	54.7619047619048	0.0239637137286393	0.663432055249731	1	1	1	1	1
down	FOXP2; MITF; WDPCP; CYP1A1; SKI; WT1; FBN1; EFEMP1; SHROOM2; CACNA1C; RAB3GAP1; SHH; HES5; GRHL2; SLC25A25; MTERF4; PITX2; FOXC2; STRA6; TWSG1; TMEM231; HSF4; B9D1;	GO:0043010~camera-type eye development	23	42	54.7619047619048	0.0239637137286393	0.663432055249731	1	1	1	1	1
down	MEN1; HTRA2; NUPR1; TGFB1; BMP2; BMP4; BMP7; ADCYAP1; NR4A1; PTGS2; TAF6; RHOB; CDK6; ZBTB17; PDCD4; THAP5; CAMK2N1; TP53I13; SIPA1; PPP1R13B; TSPYL2; RNF167; CHMP1A;	GO:0045786~negative regulation of cell cycle	23	42	54.7619047619048	0.0239637137286393	0.663432055249731	1	1	1	1	1
down	EEF2K; GRID2; ADGRB2; ADGRB3; SRPX2; ADGRL1; SLITRK3; OXT; CBLN1; PTPRD; OXTR; EPHB3; NTRK3; ASIC2; NTRK2; LRRTM1; AMIGO1; CBLN2; LRTM2; DLG5; SLITRK1; SLITRK2; SYNDIG1; ADGRL3; LRRC4B; IL1RAPL1; NRXN1; CLSTN1; FLRT1; CLSTN3; FLRT2;	GO:0051965~positive regulation of synapse assembly	31	62	50	0.0240733389402508	0.663432055249731	1	1	1	1	1
up	JAK2; STK16; EGF; ERBB2; NTRK1; INSR; FYN; FES; CSF1R; LYN; HCK; FGR; FLT1; EIF2AK2; EPHA1; FGFR2; ERBB3; FGFR3; JAK1; EPHB2; PTPN6; LTK; FLT3; CSK; TEC; SYK; MAP2K4; MAP2K3; CLK1; CLK3; JAK3; MAP2K6; EPHB4; EPHB1; TEK; MST1R; PTK2; PRKCD; TWF1; MERTK; MAP2K5; DYRK1A; PTK2B; EPHA10; HIPK1; LMTK2; ABI1; TTN; DYRK2; CAMKK2; TESK2; IL12RB2; HIPK2; HIPK3; PEAK1; CLK4; ABI2; DYRK1B;	GO:0018108~peptidyl-tyrosine phosphorylation	58	127	45.6692913385827	0.0242300645538764	0.846389002762938	1	1	0.999999997829908	0.999999997829908	1
down	NPC1; INSIG1; LRP5; APOM; LDLR; APOE; APOC3; APOB; LCAT; FABP3; APOA4; FABP4; XBP1; NR1D1; CYP7A1; CES1; RORA; HNF4A; NR1H2; CAV3; AKR1C1; MALL; LDLRAP1; TTC39B; LAMTOR1; APOA5; GPIHBP1; SCARB1; NUS1; SIRT1; ABCA2; ABCG8; ABCG5; EHD1; COMMD9; LIMA1; RALY; CYP7B1; NR1H4;	GO:0042632~cholesterol homeostasis	39	83	46.9879518072289	0.0251338711031956	0.663432055249731	1	1	1	1	1
down	SNX3; MYCBP2; EGFR; HMGCR; PRKCG; SERPINE2; FLNA; NOS2; PHB; SMAD3; RELA; GRIN2A; GRIN2C; SF3B3; CYP51A1; SIRT2; AZIN2; FMN2; MAD2L2; BANP;	GO:0042177~negative regulation of protein catabolic process	20	35	57.1428571428571	0.0251403224434918	0.663432055249731	1	1	1	1	1
down	DLL1; ACACB; EDN2; LEPR; IRX3; AMPD2; EIF4G1; NR1D2; SLC35D3; METRNL; PM20D1; CRTC1; BMP8A; FLCN; NR4A3; OMA1; MRAP2; PASK; TRPV4; MLXIPL;	GO:0097009~energy homeostasis	20	35	57.1428571428571	0.0251403224434918	0.663432055249731	1	1	1	1	1
down	PIK3C2A; BIN1; HGS; GAK; SYNJ2; ARPC2; GNPAT; PIP5K1C; DNAJC6; VAMP4; AP2A2; AP2A1; EGFR; LDLR; TF; APOB; CHRM2; CLTA; CLTB; HSPA8; RALA; CFTR; AREG; PRKCI; CLTCL1; AP2S1; ACTB; YWHAE; RPS27A; AP2B1; VAMP2; YWHAZ; ACTG1; DAB2; LRP2; OCRL; CTTN; DHCR24; TRIP10; SLC18A3; AAK1; CCDC88A; LDLRAP1; SYT9; NECAP1; ARPC1A; SH3KBP1; AP2M1; FNBP1; HBEGF; SH3GL2; SLC2A8; EPS15L1; FZD4; PACSIN2; SNX9; EPN1; SAR1A;	GO:0061024~membrane organization	58	134	43.2835820895522	0.025359403312158	0.663432055249731	1	1	1	1	1
down	FANCA; BRD4; SEMA7A; AHSG; ANXA1; SELE; GGT1; CMA1; AGTR1; PTGS2; GPX4; SLC7A2; RELA; IRF3; NR1D2; ZYX; DUOXA1; DUOXA2; MCPH1; SETD6; MGLL; FANCD2; FOXP1; NOD2; DROSHA; IL20; IL37; STK39; SPATA2; USP18; BCL6; BCL6B; GGT2; CASP12; GGT3P; IL1RL2; CASP5;	GO:0050727~regulation of inflammatory response	37	78	47.4358974358974	0.0259112620535117	0.663432055249731	1	1	1	1	1
down	TP53; ERCC1; POLA1; RPA2; ERCC3; RPA1; RPA3; BRCA2; RAD23A; XPC; RPA4; ERCC8; SLX4; ERCC4; NEIL2; NEIL1; MMS19; POLL; FAN1; GTF2H2C; HUS1B; GTF2H2;	GO:0006289~nucleotide-excision repair	22	40	55	0.025983052340502	0.663432055249731	1	1	1	1	1
down	ACACB; PRKAB2; MLYCD; PLA2G1B; XBP1; ABCD3; FASN; PRKAG1; ACACA; MCAT; CBR4; FADS6; HSD17B8; MGLL; ELOVL4; PRKAG3; PRKAG2; PRKAB1; OXSM; ACSM6; ACLY; ACSM5;	GO:0006633~fatty acid biosynthetic process	22	40	55	0.025983052340502	0.663432055249731	1	1	1	1	1
down	DNAJA2; DNAJB6; AHSA1; PFN1; MYL3; TPM1; RAB3A; DNAJB1; DNAJB2; TNNT2; ATP4B; HSPA2; ATP1B3; NAPA; DNAJC24; HSCB; DNAJC10; DNAJC9; DNAJC19; DNAJC1; CHTOP; DNAJC15;	GO:0032781~positive regulation of ATPase activity	22	40	55	0.025983052340502	0.663432055249731	1	1	1	1	1
down	CCL24; CDC42EP2; MYL12B; PLXNB2; PLXNB1; DAPK3; GAS2; ATP10A; DIAPH1; WDR1; PALM; ZMPSTE24; FMNL1; F2; ALDOA; ANXA1; ICAM1; HPN; TPM1; CCL3; EZR; VEGFA; ANXA7; MSN; KDR; P2RY1; SLC26A5; CDC42EP1; GNA12; EPS8; ITGA7; PLEKHO1; DNMBP; PDPN; FMNL3; ARHGAP18; SHROOM3; SH3KBP1; DLC1; S100A13; CCL13; CDC42SE2; CFDP1; LIMD1; TAOK2; STRIP2; BAIAP2; RND2; RHOBTB3; FMNL2; RHOV; PLXNB3; RHOBTB2; RND3; RHOC; PLXND1; RND1; PLXNA1; RHOA; CDC42EP3; PLXNA4; RHOF; RHOQ; RHOJ; RHOB; C15orf62; PLXNA3;	GO:0008360~regulation of cell shape	67	159	42.1383647798742	0.0260700555926537	0.663432055249731	1	1	1	1	1
down	VPS37C; XPO1; NMT2; NUP155; NUP62; NUP98; NUP107; RAN; RPS27A; RAE1; KPNB1; NUP188; NUP54; VPS37D; NUP93; NUP35; NUP205; SEH1L; MVB12A; NUP88; NDC1; NUP58; NUP85; MVB12B; VPS37B; VPS28;	GO:0075733~intracellular transport of virus	26	50	52	0.0265467924524142	0.663432055249731	1	1	1	1	1
down	OVOL1; TP73; CYP26A1; LRP4; NDUFS6; ALDH1A2; WDPCP; REN; CA2; ASS1; AGT; TFAP2A; DCN; PKHD1; GLI2; ODC1; BMP4; VEGFA; WT1; AGTR1; HNF1B; SOX11; TGFBR1; TMED10; CASP9; WNT4; PPAT; BAX; ARID5B; TNS2; RRM2B; NPHP3; PROX1; HAS2; IFT27; STRA6; GREB1L; SIX2; CYP26B1; SALL1; NLE1; HSPB11; IFT88;	GO:0001822~kidney development	43	94	45.7446808510638	0.0265495058101004	0.663432055249731	1	1	1	1	1
down	EEF2K; PIK3R2; TBC1D4; PLA2G1B; APRT; GSTP1; PARP1; CDK4; SRC; SLC2A4; FER; RHOQ; XBP1; SLC9A1; AKT1; AKT2; PRKCI; STAT1; STAR; GSK3A; RAB13; RAB8A; VAMP2; PRKDC; GPLD1; PPAT; PAK1; PDE3B; ADIPOQ; GHSR; SYAP1; SLC25A33; INPP5K; SORBS1; CPEB1; CAPN10; ERRFI1; IRS2; LPIN1; PCK1; PKLR; PCK2; PKM;	GO:0032869~cellular response to insulin stimulus	43	94	45.7446808510638	0.0265495058101004	0.663432055249731	1	1	1	1	1
down	SMIM22; CLIC1; PES1; RAD51D; ITGB1; MYBL2; IRF1; HSPA8; BCR; MX2; GRK5; NF2; PLK1; NANOS3; RACK1; ADARB1; CDK3; CDK16; CDK17; MECOM; FOXM1; TARDBP; LIN52; LIN9; FIGNL1; SIRT2; CDK20; UBA3; CABLES1; MADD; CDKL2; MASTL; LIN37; PRR11; UHRF2; CABLES2; ZNF703; PRDM11; TXLNG; L3MBTL1; USP16; CSNK2A1; E2F8; TSC2; E2F4; CSNK2A3; CSNK2A2; E2F5; FBXL8; GADD45B; JUND; E2F6; FBXL12;	GO:0051726~regulation of cell cycle	53	121	43.801652892562	0.0269756158289067	0.663432055249731	1	1	1	1	1
up	WWP2; KPNA3; GYPA; TFRC; CTSB; CD55; HSPA1A; HSPA1B; LAMP1; CD46; ITGA2; CR1; MRC1; ITGB7; DPP4; SERPINB3; CD80; EPS15; TNFRSF4; GPR15; NUP153; CXADR; SLAMF1; SCARB2; SELPLG; SLC10A1; MOG; CLEC4G; TNFRSF14; HAVCR1; ITCH; VAMP8; ACE2; WWP1; CLEC4M; CD209; SLC52A1; VPS18; UVRAG; XPR1; LAMP3; F11R;	GO:0046718~viral entry into host cell	42	87	48.2758620689655	0.0271624031328075	0.846389002762938	1	1	0.999999997829908	0.999999997829908	1
up	EREG; PDPK1; RPS6KA5; EGF; TGFA; VIL1; TDGF1; BRAF; CBL; PIK3R1; PIK3CA; IQGAP1; SOX9; GRB2; ADAM17; PTPN11; SOS1; GRB7; DGKD; EPGN; FAM83A; REPS2; KIF16B; ERBIN; GAREM1; PTK2; PTK2B;	GO:0007173~epidermal growth factor receptor signaling pathway	27	50	54	0.0272369062610003	0.846389002762938	1	1	0.999999997829908	0.999999997829908	1
up	DDX3X; CFLAR; SIAH2; LAMTOR5; TNFSF14; AVP; TNF; RAF1; GPX1; VIL1; CD44; POR; MT3; ADORA2A; PRDX3; ARRB2; SNCA; ARRB1; SERPINB9; RPS6KA3; CDKN2D; XIAP; PAX2; NAIP; MAP2K5; HERPUD1; RPS6KA1; CARD16; FNIP1; TFAP2B; SFRP2; USP47; LEF1; LAMP3; BIRC3; BIRC2;	GO:0043154~negative regulation of cysteine-type endopeptidase activity involved in apoptotic process	36	72	50	0.0272848439755287	0.846389002762938	1	1	0.999999997829908	0.999999997829908	1
down	DVL1; MAPT; TUBG1; CAV3; TRDN; WDR73; CIB1; PLK3; STMN3; CRIPT; MAP10; CEP126; TUBGCP4; TUBGCP3; KATNA1; TUBGCP2; CAMSAP1; CCDC88A; FIGNL1; DST; FIGNL2; KATNAL2; KATNAL1;	GO:0031122~cytoplasmic microtubule organization	23	43	53.4883720930233	0.0286903820591707	0.663432055249731	1	1	1	1	1
down	NUPR1; KDM4A; EIF4E; MET; HGF; AKT1; ADRA1A; HTR2B; MTOR; GATA4; LEPR; DAP; EIF4G1; GOLGA2; KLHL22; CPTP; TLK2; SIRT2; RUBCN; MTMR9; RNF5; ZKSCAN3; WDR6; TREM2; KIF25;	GO:0010507~negative regulation of autophagy	25	48	52.0833333333333	0.0288429188872715	0.663432055249731	1	1	1	1	1
down	ARHGAP33; NUPR1; INMT; EPHX1; CNP; CCL3; CDK4; SRF; CCL4; NQO1; GABRB1; ATF4; XPA; CES1; CYP2F1; MAPK3; AHR; CDKN1A; KCNC1; ERCC6; BAX; SRSF9; DHRS2; ADAMTS13; BPHL; SCFD1; WDR35; SLC7A8; SLC6A14; SLC7A11; PON2; PON3; PON1; BLMH;	GO:0009636~response to toxic substance	34	71	47.887323943662	0.0289145653278835	0.663432055249731	1	1	1	1	1
up	HIP1; WASL; FCHO1; EREG; ARPC3; ARPC5; SYNJ1; TGOLN2; HIP1R; STAM2; EPN2; EGF; TGFA; AVP; CD4; MBP; PMP2; TFRC; ADRB2; UBB; UBC; IGF2R; RAB5A; M6PR; CBL; YWHAQ; AVPR2; YWHAB; ARRB2; EPS15; ARRB1; DNM2; AGFG1; ARPC4; ACTR3; ACTR2; YWHAG; UBA52; GRB2; CLTC; FCHO2; CLN3; PICALM; SCARB2; GAPVD1; ITSN1; VAMP3; FNBP1L; EPGN; BAIAP2L2; LPCAT2; TBC1D1; SYT2; REPS2; STON2; REPS1; CHP1; VAMP8; SAR1B; TMEM33;	GO:0061024~membrane organization	60	134	44.7761194029851	0.0291395253604697	0.846389002762938	1	1	0.999999997829908	0.999999997829908	1
down	SMIM22; CXCL11; FANCA; RBFOX2; TBX19; MITF; LGR5; PRDM1; PLAU; AGT; CXCL10; CLU; NFKBIA; GRPR; AGTR1; NOS2; RPA3; TGFBR2; PTGER2; PLA2G4A; AVPR1B; PLCD1; BID; CXCL9; SHH; E2F4; CCDC88A; USP17L2; TMIGD1; PLCD3; CADM4; NKX2-3; ARHGEF2; SIRT1; ARX; CIB1; RNF126; GNL3; CDCA7; CHRNA10; TXNIP; EGLN3; AMBN; TOPORS; FANCL; BEX4; CFDP1; TCFL5; TIMELESS; SLC7A11; SRMS; TGFB3; ANXA1; TNK1; DUSP15; GKN2; TFAP2A; ALK; BCL6B; TGFB1; BCL6; BRICD5; FER; STAT1; JUND; TNK2; SRC; GKN1;	GO:0042127~regulation of cell population proliferation	68	163	41.7177914110429	0.0291437921815304	0.663432055249731	1	1	1	1	1
down	CBX4; NUP155; EGR2; NUP62; NUP98; SUMO3; NUP107; UBE2I; RAE1; MDM2; TRIM28; NUP188; NUP54; NUP93; PIAS4; NUP35; NUP205; MUL1; SEH1L; EYA1; NUP88; NDC1; NUP58; NUP85; IFIH1; KIAA1586; TOPORS; SENP1; SAE1; UBA2; PIAS3; ZMIZ2;	GO:0016925~protein sumoylation	32	66	48.4848484848485	0.029667227799948	0.663432055249731	1	1	1	1	1
down	IRF6; INSIG1; MSC; DHRS3; WDPCP; COL2A1; TFAP2A; SKI; COL11A2; PDGFRA; MSX1; TGFBR1; MEOX2; EPHB3; PRRX1; DLX5; LOXL3; ASPH; FOXF2; NPRL3; TBX2; ARID5B; SHH; OSR2; WFIKKN2; ANP32B; WFIKKN1; CSRNP1; ALX4; INTU; SATB2; INSIG2;	GO:0060021~roof of mouth development	32	66	48.4848484848485	0.029667227799948	0.663432055249731	1	1	1	1	1
down	ORC3; MCM3; MCM6; MCM7; MCM2; MCM4; MCM5;	GO:0006267~pre-replicative complex assembly involved in nuclear cell cycle DNA replication	7	7	100	0.0298668781532566	0.663432055249731	1	1	1	1	1
down	NDUFS2; NDUFB6; NDUFV1; BID; NDUFV3; TAZ; NDUFA12;	GO:0042775~mitochondrial ATP synthesis coupled electron transport	7	7	100	0.0298668781532566	0.663432055249731	1	1	1	1	1
down	HNRNPA2B1; DNA2; BLM; DHX9; WRN; DDX11; DHX36;	GO:0044806~G-quadruplex DNA unwinding	7	7	100	0.0298668781532566	0.663432055249731	1	1	1	1	1
down	MEN1; NR1D1; NR4A1; SGPP2; NR4A3; FMC1; ERRFI1;	GO:0061469~regulation of type B pancreatic cell proliferation	7	7	100	0.0298668781532566	0.663432055249731	1	1	1	1	1
down	PARN; EXOSC6; EXOSC4; EXOSC2; EXOSC10; EXOSC5; EXOSC3;	GO:0071051~polyadenylation-dependent snoRNA 3'-end processing	7	7	100	0.0298668781532566	0.663432055249731	1	1	1	1	1
down	TP73; IRAK2; MAP3K7; RIPK2; SOD1; AGT; C5; PLA2G1B; CDK1; RET; THBS1; SAA1; TGFB3; BMP2; HGF; DRD4; MAPK3; ADORA2B; ERP29; PRDX2; MAP2K2; CHRNA7; IRAK1; ITGA1; CD81; UBE2N; RPS27A; GNG3; MAP2K1; GRM1; GRM4; PEA15; TAB1; NTRK3; MAP3K11; DUSP5; DUSP7; MAPKAPK5; MADD; PBK; DUSP9; NOD2; PLCE1; LPAR3; STK39; TAOK2; ALK; NOD1; IKBKG; PROK1; MUC20; SBK2; MAP2K7;	GO:0000187~activation of MAPK activity	53	122	43.4426229508197	0.0299321490015448	0.663432055249731	1	1	1	1	1
up	PDPK1; TNFSF14; ICOSLG; GRAP2; PAK3; FYN; LYN; VAV1; CD24; DPP4; PIK3R1; PTPN6; CD40LG; CD80; CSK; PIK3CA; CDC42; GRB2; RAC1; PTPN11; PAK2; PDCD1; TNFRSF14; CARD11; HHLA2; TNFSF13B; CD5; TNFRSF13C;	GO:0031295~T cell costimulation	28	53	52.8301886792453	0.0299995857688334	0.846389002762938	1	1	0.999999997829908	0.999999997829908	1
down	DNM1L; TOR1B; GAK; VAPB; CASQ1; CAV2; ATL3; JAGN1; ATL2; MAPK15; ATL1; CCDC47; SEC16B; TMEM38B; SMPD4; EIF2AK3; SEC31A; LMAN2L; SEC31B; LMAN1;	GO:0007029~endoplasmic reticulum organization	20	36	55.5555555555556	0.0305655148191387	0.663432055249731	1	1	1	1	1
