DGE	Genes	Process~name	num_of_Genes	gene_group	percentage%	P-value	Benjamini and Hochberg (FDR)	 Hommel singlewise process	Bonferroni single-step process	Hommel singlewise process	Hochberg step-up process	Benjamini and Yekutieli
down	E2F8; ZBTB7C; NKX6-3; EFCAB7; BMPR1B; SUPT5H; WWP2; WASL; AGRN; DLL1; E2F3; RFXANK; OVOL1; BACH1; IRF6; IKBKB; PPP1R12A; ZNF609; CHUK; PLSCR1; NKRF; OGT; SOX12; HDAC3; YY2; CLOCK; FGF10; MAFG; TET3; TBX1; KLF4; GALR2; TCF21; TRIAP1; AIRE; MED14; SOX15; ZNF292; ST18; FOXD2; CCNT2; KPNA6; LRP5; MAF; NR1I2; LRP6; RPS6KA5; KLF7; CCNK; MTA2; NFAT5; SOX30; VENTX; KAT7; TNKS; FSTL3; NFATC1; DDX58; EOMES; HAND1; ABL1; FOS; MYC; HRAS; POMC; IGF2; ESR1; PLA2G1B; NR3C1; MYCN; CD3D; TP53; IGF1; APP; SERPINE1; FGF1; IL6; JUN; TFAP2A; RB1; PGR; ADRB2; DCN; SP1; PFKM; SERPINF2; HOXD4; HOXC4; HOXB5; CSF3; MYB; MYBL1; MYBL2; AR; RARA; TGFB3; CD28; EGR2; ERG; TOP2A; VDR; ESRRA; SRF; SKI; IRF2; DRD2; HOXB2; ETS1; LIF; ETS2; MYOG; FOSL1; FOSL2; GATA1; JUNB; JUND; TAL1; XBP1; ERCC2; BMP7; ARF4; EGR1; ADCYAP1; ATF1; ATF4; TNFRSF1A; ERCC3; TFEB; TFE3; SLC9A1; NFKB1; HOXA5; IL11; HNF1A; S1PR1; TAF1; FGFR2; BMP6; USF1; GAL; NR4A1; ITGA6; MYF6; GATA3; LMO2; CD40; PAX6; ACVR2A; PIK3R1; POU1F1; HOXD10; MSX1; SMARCA1; MZF1; RBL1; HOXA10; HOXA7; HOXC13; AKT1; CTNNB1; DDIT3; ZNF76; BMPR1A; SREBF1; PPARG; MMP12; PBX3; STAT3; ETV5; ETV6; WNT5A; HNF4A; STAT6; ATRX; YAP1; GALR1; P2RY1; CDX1; ID4; RFX2; RFX5; SOX2; SOX9; NRIP1; NR2C2; ARRB1; EVX1; CEBPA; GSK3A; ETV1; ASCL1; CDK9; SMARCA2; STAT5B; MNAT1; GTF2A2; ZNF143; HMGA2; PDX1; FOSB; PRRX1; NRL; NR1H2; F2RL1; MLLT10; MLLT6; CDH13; FOXA1; FOXA3; PAX9; DLX1; CTBP2; PRDM15; SOX8; FOXL2; CD81; IL2; ACTR2; HAND2; TBPL1; SUPT4H1; RNF4; CX3CL1; JAG1; PRKDC; ELF3; SMAD3; HSF1; NFKB2; HNRNPU; TFAP4; MC1R; POU4F1; SPIB; PAX5; HHEX; CREM; KMT2A; CEBPZ; RELA; REL; EGR4; MEF2C; GABPB1; PAX8; SOX4; FOXM1; PPP3CA; DHX9; EP300; DBP; FOXO1; BPTF; NFIA; TCF15; TP53BP1; HYAL2; FOXF1; FOXI1; PRDM2; ZBTB17; RLF; FADD; MAP2K5; GPS2; NOG; ATM; FZD5; SMAD4; SQSTM1; PKD2; SNW1; CBFB; NFYC; CAMK1; IL18; VEZF1; TFDP1; E2F2; HLTF; HNF4G; ZNF268; IHH; IRF3; RRP1B; NCOA6; MTF1; NFIX; NR1I3; MORF4L2; TNIP1; PPP2R5B; E2F5; PCBP1; RPS6KA1; SAFB; SS18; TAF7; TCEA2; MED1; TWIST1; NCOA1; SMAD2; USF2; ZFHX3; NFE2L2; BATF; HLF; HIF1A; FOXD1; CDON; HES5; FHL5; MYSM1; MLIP; DAB2IP; CREB3L3; PLAG1; CAPRIN2; GRHL2; TET2; CCDC62; DUX4L9; CRTC1; RNF111; ZBTB49; MED25; ASXL2; BHLHA15; PTF1A; PID1; LDB1; BCL9L; SKAP1; CARM1; PPARGC1B; TMPRSS6; CRLF3; NPAS4; CREBRF; ARID3B; ASXL1; MAML2; PELP1; ZNF654; TTC5; AHI1; SIX5; OSR2; SPIC; RNF10; NFATC2IP; GLIS3; TNIP2; NCOA7; LMX1A; LEO1; GLMP; CKAP2; ARNTL2; CSRNP3; RTF1; RORB; TFAP2C; RREB1; CREBBP; EZH1; KAT2A; KAT2B; ATOH1; COPS5; FOXJ1; ARHGEF2; KAT5; MED12; WBP2; EAF2; SFRP2; DDRGK1; FUBP3; CDK5RAP3; TOX2; RBM14; ZNF300; CITED4; SIN3A; TCF12; PHOX2B; EYA1; GPER1; ZBTB18; ELF4; NDN; KLF6; NKX3-1; EPAS1; SMO; ARID3A; ATF6B; FOXC2; MESP1; OVOL2; PAGR1; IER2; FOXP3; WDR61; EGLN1; PEG3; BRD8; IRF2BPL; EPC1; DHX36; MIXL1; HIPK2; TP63; SOX17; SMYD3; ELL3; BEX1; CHD8; SLC40A1; MLXIPL; SIX2; TCF7L2; PRDM10; TLR9; SIRT7; HOXC10; EHF; WWOX; FOXJ2; CALCOCO1; ZFAT; CHD7; ZNF219; PPARGC1A; HEY2; NUFIP1; SERTAD1; ZNF639; KLF15; CNOT7; SALL4; LEF1; FOXD3; POU2F3; INO80; AKAP8L; PLAGL1; BARX2; CELA1; TFR2; FOXJ3; SATB2; HDAC5; FOXA2; ATF5; ZNF175; KDM3A; KLF12; NEUROG3; ZSCAN21; FHOD1; SOX21; CHCHD2; NCOA3; FOXO6; ZNF821; MGA; ASCL2; TBX3; TBX19; LHX6; ZBTB24; THRB; HIF3A; SSBP3; ZNF148; KAT6B; MED19; EBF3; STAT4; HOXA3; NPAS3; LRP5L; HOXA2; STAT5A; ZNF382; CTAG2; HMGB3; NPAS1; NR1D2; TCEA1; DLX5; ZNF649; HOXA9; SOX10; TAF4; EBF4; RARB; ATAD2; TBX18; HOXC9; ZNF501; SRY; MECOM; PPARD; NFATC4; ZBED2; DLX3; PPRC1; CTCF; MCRS1; ZNF835; POU3F4; CCDC160; PTOV1; ZNF497; DLX2; ASXL3; THRA; SOX5; CRTC2; GFI1; TEAD4; IKZF5; NR1D1; BCL9; ZNF567; HOXB9; RELB; KMT2C; CRTC3; CDK13; HDX; TEAD3; POU3F3; SPAG8; NFATC2; HMGB1P1; SSBP4; TEAD2; TBX4; NKX2-2; LHX2; SIM2; JUP; IKZF2; E2F6; TBX10; SS18L1; SSBP2; PHF10; IKZF4; DPF2; TCF20; POU3F1; TBX6; ZNF462; ZNF691; PROX1; NKX3-2; TAF4B;	GO:0045944~positive regulation of transcription by RNA polymerase II	563	1138	49.4727592267135	0	0	0	0	0	0	0
down	TRGV5; TRGV8; TRDV1; TRDV2; IRGM; CD300LB; ADGRB1; SH2D1B; POLR3A; IKBKB; CHUK; POLR3G; HMGB3; AKAP8; TYROBP; TLR5; SH2D1A; ANKRD17; DDX58; TTC4; CD160; BCL10; F12; JCHAIN; C1QA; S100B; APP; CFI; C2; CD14; C1S; C4A; C4B; CLU; DEFA4; C6; TRIM27; LGALS3; HK1; CR2; GATA3; PTX3; KLRC2; CD6; AXL; SFTPD; TRIM23; PPARG; IFI27; MATR3; CASP4; GZMM; CRISP3; USP14; F2RL1; ADAR; GSDMD; TIRAP; NLRP6; LILRA4; B2M; SRPK2; PRKDC; ARG2; ADARB1; MST1R; BTK; DHX9; MAP4K2; TRIM26; TRIM32; FADD; TRIM28; SKP2; IFIT5; ADAM15; SERINC3; TRIM29; TRIM14; TRIM25; AGER; DEFB133; TKFC; CD300E; DAB2IP; SUSD4; CLEC6A; APOBEC3H; TNFAIP8L2; SARM1; ZC3HAV1; METTL3; NLRX1; SERINC5; TICAM2; NRROS; TREML1; RNF135; APOBEC3F; DDX60; ZNF683; MCOLN2; LILRA2; CD177; DEFB124; DEFB105A; DTX3L; CLEC4C; CACTIN; PYDC1; PSPC1; ARHGEF2; RNASE6; MR1; APOBEC3D; OTULIN; PLD4; SLAMF6; KLRG1; ITCH; PGLYRP2; RBM14; WRNIP1; SRPK1; GPER1; TRGV9; ELF4; MAP3K5; RARRES2; CNPY3; POLR3C; TRIM62; TLR10; IFIH1; TRIM8; CD244; RNASE7; CARD9; DHX36; CLEC4M; IL1RL2; LY9; IL1RAP; NLRC4; DDX21; TLR9; ZCCHC3; POLR3E; POLR3B; NLRP2; LYAR; CLEC5A; TLR7; TREM2; IL36G; C1RL; MSRB1; TRIM10; MARCO; APOBEC3B; CD84; MID2; CLEC4E; CLEC4A; TRIM35; TLR6; ZBTB1; MFHAS1; POLR3H; IGHV3OR16-13; IGHV3-16; IGHV3-35; IGHA1; IGHV1OR15-9; RELB; IGHV3-66; RELA; IGHV3OR16-8; IGHV3OR16-12; IGHV4-61; IGHV2-70; IGHV1-69-2; IGHV2-26; IGHV2OR16-5; TRBC1; IGHV1-3; NFKB2; IGHV4-4; IGHV3-30; IGLC7; IGHV6-1; TRIM59; IGHV3-38; IGHV1-58; IGHV3OR16-9; IGHV3-7; IGHV3-33; IGLL1; IGHV1OR21-1; IGHV3OR16-10; IGHV4OR15-8; IGHV1-46; IGHG1; IGHV7-81; IGHG4; IGHA2; IGHV3OR15-7; IGLL5; IGHV1-45; IGHV3-74; IGHV1-24; MYD88; IGHV3-73; IGHV4-31; PPP1R14B; ANKHD1; IGHE; IGHD; NFKB1; CAMP; IGHV3-43; REL; IGHV1OR15-1; IGHV3-20;	GO:0045087~innate immune response	224	505	44.3564356435644	0.000105351736277126	0.0280884602297602	1	1	0.73061429108187	1	0.274265236046649
down	SHISA3; WIPF3; HACD1; ARVCF; LEFTY2; ACKR2; ENC1; MRAS; WNT9A; AXIN1; HMGB3; GALR2; PRICKLE3; RAD21; TDRD6; DIAPH2; GADD45B; VENTX; GADD45G; ZMYM6; GNRH1; IGF2; FGF1; HOXD4; CSF3; ZGLP1; ERG; VCAN; HOXB2; LIF; ZNF7; PMCH; RPS4Y1; LMO2; CRABP1; HOXA10; HOXA9; HOXA11; CYLC1; CUX1; HMGA2; FOXA3; TCL1A; RBM11; HUNK; PRDM15; TBX4; HILS1; NANOS3; DCAF7; PHC1; ELF3; FGD1; MC1R; TNFRSF17; ZNF45; PAX5; CREM; NOTCH2; CLC; MCL1; MN1; FLII; CDK13; ZMYM3; ZNF267; DIP2A; ODF1; PSME4; PCOLCE; PDCD1; TGIF1; HLF; ZNF74; DGKD; ODF4; SPRED3; CEP55; TDRD12; ODF2; SFRP5; ERMARD; GFI1B; HHAT; ANO1; DIEXF; RNF43; MCTP2; CCSAP; DPY19L2; SPESP1; SHISA2; CBLL1; H1FNT; G2E3; PIWIL4; ZSCAN2; LDB1; TXNRD3; SLC22A16; SPATA24; EGFL6; PRR15; SIAH3; PHC2; CDK20; GCNT2; MTURN; NME8; RYBP; MINK1; ZFP41; BANP; TDRD9; CATSPER1; RHOXF1; SPATA20; CCHCR1; FAT3; PAQR8; CACTIN; TWIST2; EDARADD; FAM3C; CCL17; RREB1; DAZL; PTP4A1; PBXIP1; CCDC120; KAZALD1; RADIL; TRERF1; TSSK3; MNT; TSNAX; NKX3-1; PRRX2; EBF4; JPH2; WDR18; COLEC11; SPATA9; TSSK6; TSSK1B; AMN; HEMGN; TDRD1; TRIM54; NXF2; NELFA; PPDPF; EBF3; EDA2R; SCUBE2; MBNL3; SPATA6; PAQR5; DONSON; EHF; BTBD7; POGK; ADAMTS9; SUCO; DKK2; PLEKHB1; GTF2IRD1; HOOK1; OSGIN1; ANGPTL2; CEP131; DRG1; ZNF256; TESMIN; POMT1; CFAP20; TLL2; EPHA2; EPHB2; NR1D1; FGFR2; NTRK3; RARB; TYRO3; CDH23; IGF1R; DDR1; EPHA1; ROR2; VDR; FSTL3; NTRK1; RET; THRB; CDH3; CDH6; LMTK2; RYK; NR1I3; RARA; MEF2C; NR1D2; BCL11A; FSTL4; CDH13; PTCD2; THRA; NR1I2; TIE1; EPHB6; MST1R; AXL; FLT3; CDH7; FGFR4; SPINK6; CDH26; CDK2; EPHA4; CDHR3; PPARG; ROS1; CDH24; EPHB3; PPARD; KIT; NR1H2;	GO:0007275~multicellular organism development	227	513	44.2495126705653	0.000106373902610146	0.0280884602297602	1	1	0.732167130240348	1	0.274265236046649
down	GPR89A; TRAF5; CCL21; TRIM38; IKBKB; CHUK; UBD; CFLAR; MAP3K7; TSPAN6; CCDC22; ANKRD17; APOL3; BCL10; ABL1; TFRC; S100B; FYN; RHOC; LGALS1; HMOX1; CD36; GJA1; TNFRSF1A; FLNA; CD40; S100A4; CCR7; CTNNB1; NUP62; FASLG; TNFSF10; PPP5C; F2RL1; TIRAP; UBE2N; FKBP1A; UBE2I; CX3CL1; ATP2C1; RELA; REL; AKAP13; TRIM32; FADD; IFIT5; TRIM25; IRF3; TRADD; WLS; CLEC6A; CC2D1A; TICAM2; ZDHHC13; ZDHHC17; LURAP1L; SLC44A2; SHISA5; TAB3; TNIP2; C18orf32; SLC20A1; SECTM1; CANT1; LPAR1; EDA; TRIM52; MIB2; AJUBA; TMEM101; LURAP1; JMJD8; MAP3K14; MAP3K3; MYD88; NDFIP1; TRIM62; CARD11; TRIM8; CARD9; DHX36; ECT2; NEK6; DDX21; TLR9; TERF2IP; TAB2; GPRC5B; MID2; TLR6; EDA2R; TNFRSF19; TRAF2; IL1F10; IL37; IL36G; EDAR;	GO:0043123~positive regulation of I-kappaB kinase/NF-kappaB signaling	97	183	53.0054644808743	0.000111026900845301	0.0285456005594367	1	1	0.739163360490375	1	0.278728909006989
down	E2F8; PES1; POLR3G; TBX1; BUB1; VEGFD; CYP1A1; GNAI2; IGF1; CDK1; ERCC1; UCHL1; IRF2; FER; ERCC2; ANXA7; IL12A; IL12B; CDC25A; CDC25C; AKT1; MCM7; MYH10; LIPA; STAT3; YAP1; CDK9; DLX5; GNG2; CKS1B; RAP1B; GNB1; CDK3; PPARD; LRP1; PPP1R8; SMAD4; CUL1; BYSL; RASGRF1; IL18; BOP1; SCRIB; KANK1; MELK; PDK1; BAK1; TXNRD1; SETMAR; GRHL2; DUX4L9; CSPG4; MCM10; ASCC3; FBXW8; OTUD6B; TBCK; NELFB; KAT2A; MAP4K1; RHBDF1; AURKB; CDK5RAP3; PURB; USP28; GNL3; DPH1; SDCBP2; TP63; FAM83D; NAA60; SIX2; MORF4L1; DACH1; AXIN2; LIPG; TACC2; TACC3; TACC1;	GO:0008283~cell population proliferation	79	142	55.6338028169014	0.000146808837219181	0.0356005634322273	1	1	0.786724555257454	1	0.347615955209549
down	NUPR2; WNT10B; IRF6; PPM1G; PRKAB2; GAS2; BRINP1; ERN1; CDC123; MFN2; ABL1; MYC; HRAS; TP53; IFNW1; RB1; THBS1; GADD45A; IL12A; IL12B; DDIT3; CDKN1A; MTOR; CDKN2A; CDKN2C; MSH2; CDKN1B; SOX2; MAPK12; PRKAA2; GAS1; CDKN2D; TGFB2; SMAD3; CDK6; NOTCH2; ATM; ILK; PKD2; HEPACAM; DHCR24; STK11; ZFHX3; TBRG1; RRAGB; LAMTOR1; ZBTB49; BRINP3; ERN2; KMT2E; JMY; SLC38A9; KAT2B; APBB2; TBRG4; TP53INP1; SGSM3; KIF20B; PPP1R9B; GAS2L1; CGREF1; BARD1; STRADB; RRAGC; WDR6; TCF7L2; RASSF1; RPRM; PRKAG2; LAMTOR3; PLAGL1; ING4; WHAMMP3; WHAMM;	GO:0007050~cell cycle arrest	74	131	56.4885496183206	0.000164994344508229	0.0383808272820333	1	1	0.798581566087768	1	0.374763392797854
down	PIK3C2A; BIN1; ACKR2; NPC1; INPPL1; TOM1; LRP5; ZFYVE9; ABL1; HRAS; LDLR; APP; CFI; CD5; ASGR2; RAB5A; CD6; AMPH; DNM2; RAB7A; CAV3; PRSS12; TMPRSS3; LOXL3; RAB1A; DNM1; TNK2; LGALS3BP; MYO1E; RIN1; EEA1; AGER; RABEP1; TRIP10; DPYSL2; DGKD; AAK1; RABGAP1L; FKBP15; RINL; ARC; LRP10; NOSTRIN; CLEC4F; EHBP1; STEAP2; DNER; DENND1A; USP33; SNX33; STAB2; SH3KBP1; HOOK2; LOXL4; HHIPL1; PGBD1; C9orf72; MTMR9; CYTH2; TMPRSS13; CLEC4M; EHD1; RABEP2; ACKR4; CD163L1; TMPRSS4; ITSN2; EHD2; SH3BP4; ANKFY1; EPS15L1; MRC2; ATP6V1H; RAB22A; SYNRG; USP20; LOXL2; LRP12; SNX9; EPN1; STON1; WASF2; SNAP91; MARCO; WASL; BIN3; TIGD5; WIPF3; RHOV; WIPF2; PIK3C3; HEATR5B;	GO:0006897~endocytosis	92	174	52.8735632183908	0.000174488180022303	0.0396453376469279	1	1	0.804783641473176	1	0.387110500146366
down	PLK4; CEP290; NPHP1; CCP110; HAUS5; PCNT; FGFR1OP; TUBB4A; CDK1; PRKACA; PAFAH1B1; CSNK1D; CSNK1E; PLK1; DYNLL1; TUBA4A; TUBB4B; CKAP5; DCTN1; IQCB1; MAPRE1; TCTN1; C2CD3; ODF2; TMEM67; CEP78; CEP162; CEP135; RPGRIP1L; TTBK2; TCTN3; HAUS6; CNTRL; CEP57; CEP97; AHI1; CEP70; NEDD1; FBF1; HAUS1; TCTN2; SCLT1; RAB3IP; CDK5RAP2; CEP89; HAUS7; AKAP9; B9D2; HAUS8; CEP250; HAUS2; MKS1; NDE1; CC2D2A; B9D1; CEP131; CEP164; NINL;	GO:0097711~ciliary basal body-plasma membrane docking	58	95	61.0526315789474	0.000184114424272019	0.0408817710258552	1	1	0.811067127415202	1	0.399183454297415
down	ADAMTS3; OGT; ADAMTS2; F12; FURIN; F3; CTSS; PCSK6; CASP2; ECE1; COMP; MMP14; MMP16; PCSK7; TYSND1; C2CD3; ASPRV1; SDE2; PCSK4; ADAMTS13; LONP2; DYNC2H1; PIK3C3; APH1B; PCSK5; APH1A; FKRP; PSENEN; IFT172; AFG3L2; PCSK1; CPXM2; CPM; AEBP1; CPD; CPXM1; CPE; PCSK2; CPN1;	GO:0016485~protein processing	39	55	70.9090909090909	0.000241918240377892	0.052523137966489	1	1	0.832857168080645	1	0.512853702711236
down	PTPDC1; PGP; EYA2; PTPRT; CDC14B; RNGTT; DNAJC6; DUSP11; DUSP14; PTPN2; PTPN1; PTPRZ1; PTPN3; DUSP1; PTPRM; PTPN6; CDC25A; CDC25B; CDC25C; PTPN9; DUSP3; PTPN5; PTEN; PTPN12; DUSP2; PTPRJ; PTP4A2; DUSP4; DUSP8; PTPRS; MTM1; MTMR1; PTPN14; DUSP5; PTPN21; DUSP7; DUSP28; PTPN20; TPTE2; HACD2; SSH2; MDP1; MTMR14; DUSP18; SSH3; DUSP19; PTPMT1; SSH1; PTPRU; PTPRN2; PTP4A1; EYA1; DUSP23; DUSP15; MTMR4; PALD1; MTMR7; UBASH3B; PTPN22;	GO:0035335~peptidyl-tyrosine dephosphorylation	59	99	59.5959595959596	0.000260246184898838	0.0540979835417372	1	1	0.838601534210598	1	0.52823102812884
down	PES1; MPHOSPH10; WDR46; RRP8; RRP9; UTP20; POP7; RPS17; RPL35A; RPL7; RPS27; GEMIN4; YBEY; RPL27; RPS7; RPS16; NOP14; EXOSC10; TBL3; EXOSC2; C1D; BOP1; FRG1; PDCD11; BMS1; EXOSC7; WDR43; PWP2; DIEXF; NOL8; WDR75; DHX37; PELP1; RBFA; DDX51; WDR36; UTP15; UTP4; EXOSC8; DDX27; RPP25; WDR18; NOC4L; WDR12; REXO4; XRN2; DDX47; HEATR1; NOL6; WDR55; NOL11; ISG20L2; EXOSC4; EXOSC3; DDX21; DCAF13; IMP3; LYAR; TEX10; UTP6; CHD7; WDR3; PA2G4; DIS3; RCL1; DDX52; WBP11; NOP58; RRP7A; SBDS; POP5; DDX54; DDX10; RRP1B; BYSL; PIH1D2;	GO:0006364~rRNA processing	76	139	54.6762589928058	0.000286859614099688	0.0579651979922713	1	1	0.846960438819038	1	0.565991819409061
down	CDC7; CHEK1; ORC4; KIN; CDC45; RNASEH2A; KAT7; CDK1; CHTF8; PTMS; CDK2; MCM3; POLD1; MCM4; MCM5; MCM7; RFC4; IGHMBP2; RFC5; RFC3; POLD2; MCM2; BLM; NAP1L1; SET; POLE; DHX9; SSRP1; NFIA; CHAF1A; ATM; ORC1; ORC2; POLA2; WRN; MCM6; NFIX; CCDC88A; TBRG1; SDE2; MCM10; RBBP6; DTD1; ATRIP; ING5; KCTD13; UPF1; KAT5; FAM111A; SIN3A; DNAJC2; BARD1; CDC6; GRWD1; DSCC1; TIPIN; CINP; REPIN1; NT5M; MCM9; DONSON; DTL; POLK; DBF4; POLL; MCM8; POLI; ING4; TIMELESS; EXO1; ORC6; TOP1; CDT1;	GO:0006260~DNA replication	73	132	55.3030303030303	0.000290715936706376	0.0579651979922713	1	1	0.848170915397391	1	0.565991819409061
down	EXOC5; IKBKB; GAK; SEC16A; LAMA5; RAMP1; RAMP3; ATP2C2; LRP6; PALM; NFASC; BAG4; ANXA2; JUP; TNFRSF1A; FLNA; EPHA2; AKT2; RDX; BSG; DPP6; P2RY1; RAB13; CACNB3; ATP1B3; CAV3; CD81; S100A10; RAB8A; RAB10; STXBP1; TSPAN5; PRKG2; PPIL2; FLOT2; GAS6; KCNB1; TMED2; SEC23A; WDR72; ZFYVE27; GPR158; TMEM150A; PACS2; SKAP1; IFT20; ZDHHC23; DPP10; ZDHHC22; TSPAN14; RAPGEF6; KCNB2; NKD2; TESC; MRAP2; PKP2; INPP5K; CRB3; PACSIN1; WNK3; SPTBN4; SMURF1; SYTL2; SCN3B; EHD3; EHD2; TNIK; TTC7A; EFR3B; EPB41L3; KCNIP3; RAPGEF2; RAB40A; FAM126B; RAB40B; RAB40C; RAB3D; RAB3C;	GO:0072659~protein localization to plasma membrane	78	144	54.1666666666667	0.000298785550253089	0.0583826965194536	1	1	0.850692184292634	1	0.570068416387683
down	TMSB15B; TMSB4Y; INPPL1; MYO1B; SORBS3; DIAPH2; SORBS2; TF; PLA2G1B; TMSB15A; BCL2; ACTN1; CAV3; BCAR1; TMSB10; CGNL1; FAT1; FHOD3; CARMIL1; RUFY3; PPARGC1B; ARHGAP12; ERMN; WHAMM; BRK1; POF1B; ARHGEF2; SH3KBP1; PACSIN1; TRPV4; RHOF; BIN3; EVL; SHROOM4; SH3BP1; KPTN; SHROOM3; LMOD3; TPM2; TMOD1; TMOD4; RHOBTB2; SHROOM2; RHOB; TMOD3; MYOM1; RHOC; MYO7B; CORO7; RHOV; RND2; TPM1; SAMD14; CORO1B; RHOBTB3; ARHGAP17; PPP1R9B; RHOD; CORO6; MYOM2; RHOBTB1; ACTC1; HIP1R; MYO1E; RAC3; PPP1R9A; MYO5C; MYO1A;	GO:0007015~actin filament organization	68	121	56.198347107438	0.000328472862089146	0.0617149973579031	1	1	0.860010269092981	1	0.602606130045175
down	ARID1A; KDM6A; ACTL6B; ZBTB7A; MYC; ESR1; RB1; MYB; TOP1; GATA3; SMARCA1; ATRX; SOX9; SMARCA2; FOXA1; HILS1; SUPT4H1; BPTF; MYSM1; SMARCD3; SUPT6H; NPM2; CHD1L; INO80E; SMARCC2; EZH1; KAT2A; KAT2B; SMARCE1; SCMH1; FOXP3; INO80B; TP63; SMARCAD1; SUV39H2; CHRAC1; BAZ1A; CHD7; RERE; BAZ2B; BAZ2A; BAZ1B; INO80; HDAC5; ZBTB1; TAF6L; MORC2; KDM4A; HCFC1; TADA2B; SATB2; TADA2A; HMGB3; KDM5D; KDM4D; HMGB1P1; INO80C; KDM5B; SATB1; KDM4B; KDM4E;	GO:0006338~chromatin remodeling	61	105	58.0952380952381	0.000341349850916939	0.062924302706764	1	1	0.864054682091265	1	0.614414196925481
down	WTIP; CCL24; AGRN; BIN1; ABLIM1; PLD2; SIPA1L3; DIAPH1; OBSL1; PALM; ACTL6B; MICAL2; CSPG5; SVIL; ZMYM6; PAK4; THY1; TPM1; TUBA3D; DMD; CCL2; KRT5; DES; KRT15; CTNNA2; CYLC1; CAPZB; SOX9; ZNF135; CNTNAP1; CCL7; FGD1; KRT76; DST; DMTN; BFSP1; ZMYM3; NEDD9; KISS1; CCDC6; DPYSL2; UGT8; CAMSAP1; FGD6; LARP4; MAEA; ARC; MICAL3; FGD2; FMNL3; FITM2; NECTIN2; SH3KBP1; FMNL2; TSPAN32; CNN2; CCL13; CECR2; SEMA6A; GPR35; PAK6; NCKIPSD; PLCE1; ZRANB1; TNIK; STRIP2; WASF3; MAST1; KLHL20; PCLO; PACSIN2; ARHGAP10; PACSIN1; AJUBA; MAST4;	GO:0007010~cytoskeleton organization	75	139	53.9568345323741	0.000419025740494905	0.0744342088115495	1	1	0.886328560871857	1	0.726800817227263
down	PIK3C2A; ATP6V0E1; BCAR3; SOGA1; ATP6V1G2; IGF2; IGF1R; IGFBP1; IDE; ATP6V1B1; PTPN2; PTPN1; ATP6V0C; SHC1; AKT1; AKT2; ATP6V1E1; SREBF1; GSK3A; CAV2; BCAR1; ATP6V0D1; GRB2; GPLD1; FOXO1; EIF4EBP1; EIF4EBP2; PDK2; ATP6AP1; RPE65; STXBP4; ATP6V0D2; ATP6V1C2; ATP6V0E2; ATP6V1E2; ATP6V0B; FOXC2; RARRES2; SORBS1; NDEL1; KL; ATP6V1H; APPL1; BAIAP2; ATP6V0A2; ATP6V1D; GRB14; GRB10; GRB7; FOXO6; PIK3R3; ZNF106; PIK3R1;	GO:0008286~insulin receptor signaling pathway	53	88	60.2272727272727	0.000431012156241417	0.0751962279728329	1	1	0.888316054013561	1	0.734241430327159
down	OGG1; HTRA2; MBD3; ADA; FOS; GNRH1; KRT14; C1QA; MT-ND4; CAT; NTRK1; CYP1A1; TYMS; EIF2S1; JUN; GSN; DCN; IGFBP1; CNP; DLD; TGFB3; ENO3; TIMP2; JUND; IGFBP2; ERCC2; ATP2B1; CNR1; IL10; HTR2A; GJB2; TACR3; TSPO; ALDH3A1; AKT1; CD68; CTNNA1; ADRA1A; PCK1; NUDT1; LONP1; SERPINF1; SREBF1; TGFBR2; STAT3; CASP2; P2RY1; GSS; NPY2R; GSK3A; CASP9; FOXG1; UCP3; PTEN; GRB2; KRT83; CX3CL1; NFKB2; PAX5; PTH1R; RELA; LRP1; PPP3CA; PDE4D; SCAP; DAG1; WRN; ENDOG; RGN; NFE2L2; BAK1; CARM1; AURKB; PPP1R9B; SIN3A; SRR; GLRX2; SIRT3; ATP8A2; PPARGC1A; KL; FBXO4; AMFR; PPP1R9A; LOXL2; DNMT3A;	GO:0007568~aging	86	166	51.8072289156626	0.000451941732175443	0.0774643986553347	1	1	0.891789622619287	1	0.756388616842258
down	ARID1A; DVL2; PLXNB2; KDM6A; LIAS; FZD6; SEC24B; BCL10; ABL1; PFN1; RARA; SKI; PRKACA; PRKACB; SDC4; LHX2; TGFB2; RPS7; NOG; SCRIB; TMED2; STIL; TEAD2; TWIST1; GRHL2; MTHFD1L; PHACTR4; SHROOM3; KAT2A; GLMN; MED12; PRICKLE1; KIF20B; BBS4; FUZ; SEMA4C; IFT122; FZD3; IFT57; MKS1; CELSR1; CC2D2A; IFT172; SALL4; VANGL2; ST14; LRP6; VASP;	GO:0001843~neural tube closure	48	78	61.5384615384615	0.00055263992472776	0.0899882010765036	1	1	0.908533763133072	1	0.878675264068446
down	PSD; PHGDH; GALR2; ULK1; UBE4B; LGI1; NPY; APP; IL6; LAMB1; MAP2; SRF; AREG; ADCYAP1; PTPRM; RYK; RAB13; RAC3; WDR5; BTG2; POU4F1; ERCC6; CNTN1; STX3; ALKBH1; RASGRF1; AGER; RAB35; ZFYVE27; CAMSAP1; BLOC1S3; BLOC1S2; TMEM108; CNTN4; MICALL2; NLGN1; GDPD5; DTNBP1; CLMN; DOCK7; PRMT1; MYOC; EHD1; TBC1D23; FLRT3; NCDN; CNTNAP2; USP21; BLOC1S6; TBC1D24; RAPGEF2; LRP12; FRYL; GPM6A; RB1; PPP1R9B; STMN4; FRY; MAP4; CDNF; PPP1R9A; STMND1; GPM6B; SAMD14;	GO:0031175~neuron projection development	64	115	55.6521739130435	0.000583015540004395	0.0933780627187366	1	1	0.913575729403414	1	0.91177502090337
down	PDLIM1; NPHP1; LRP6; ANXA9; NTN1; PAK4; CSTA; THY1; ANXA2; BCL2; ICAM2; JUP; CD44; ITGA6; CD24; CTNNA2; CD34; SHC1; ICAM3; CTNNB1; CD200; SOX9; RAB10; CX3CL1; CDC42EP1; COL14A1; FOXF1; TRIM29; SCRIB; FAT1; NECTIN1; CNN3; CBLL1; CDH24; DLG5; FBLIM1; ADGRV1; NRCAM; CYFIP2; VMP1; PKP2; TTYH1; TENM2; TMOD3; CRNN; BAIAP2L1; CTNNA3; CDH7; ICAM5; BAIAP2; FNDC3A; DLG3; CDH6; DSG4; LAMA3; CDHR3; ARVCF; LIMS1; SYNJ2BP-COX16; LPP; DSG3; CELSR1; CDH13; CELSR2; CDH3; PKP4; DSC3; COL16A1; CDH26; CDH23; IGSF5; DLG2; LAMA5; LRRC7; PKP1; DLG4; DSP; FAT3; ICOS;	GO:0098609~cell-cell adhesion	79	152	51.9736842105263	0.000696892443795116	0.109816760901263	1	1	0.922938038559879	1	1
down	RFXANK; MRAS; RGL2; LAT; DOK2; GRAP2; NTN1; NRAS; HRAS; KRAS; TP53; IGF1; JUN; RB1; ADRA2A; CCNA2; CDK2; DNMT1; SHC1; CDKN1A; CDKN2A; CRKL; GNB1; GRB2; SHC2; TRIM28; GRAP; SETDB1; DHCR24; MAPK11; BRAP; RASGRP3; MAPKAPK5; RAPGEF6; RREB1; RIT1; SYNGAP1; USP28; RASSF1; PLCE1; RALB; RERG; RRAS2; KSR2; RRAS;	GO:0007265~Ras protein signal transduction	45	73	61.6438356164384	0.000786405500011411	0.12195526563669	1	1	0.93011200740508	1	1
down	WWP2; KPNA3; NPC1; HYAL3; CLDN9; LDLR; TFRC; CDK1; CTSB; RPSA; LAMP1; NCAM1; IDE; PVR; ITGB6; CR2; GRK2; ITGB7; HTR2A; EPHA2; SERPINB3; AXL; CD80; CD86; TNFRSF4; NUP153; EFNB2; CD81; TYRO3; SLC20A2; HYAL1; HYAL2; SCARB2; DAG1; GAS6; NECTIN1; EFNB3; CLEC4G; CDHR3; SCARB1; HAVCR1; ITCH; NECTIN4; VAMP8; ACE2; CLEC4M; SLC52A1; CLEC5A; VPS18; XPR1; ZNF639;	GO:0046718~viral entry into host cell	51	87	58.6206896551724	0.000856516142863639	0.128740964858119	1	1	0.93570022820444	1	1
down	TAF4; E2F3; PPM1D; POLR2D; MED7; MED14; MED24; NR1I2; MED26; ESR1; NR3C1; PGR; CDK1; NR3C2; AR; RARA; RARB; THRA; THRB; VDR; ESRRA; CDK4; NR2C1; CCNB1; ERCC2; ERCC3; NR1D1; TAF1; NR4A1; POLR2A; PPARG; CDKN1A; HNF4A; YAP1; SOX9; NR2C2; TAF6; CDK9; RORC; MECP2; NR0B1; MNAT1; GTF2A2; NR1H2; PTEN; GTF2I; ZNF45; PPARD; NOTCH2; TAF10; TRIM28; SNW1; CBFB; E2F2; HNF4G; NR1I3; NR1D2; NR0B2; TAF5; TAF7; TEAD4; TEAD2; MED1; MED27; MED25; NR2C2AP; MAML2; TAF4B; RORB; GTF2H4; CREBBP; TAF15; KAT2B; MED12; MED8; MED15; NOTCH4; TEAD3; PPARGC1A; MED23; GTF2A1L; MED31;	GO:0006367~transcription initiation from RNA polymerase II promoter	82	161	50.9316770186335	0.000882590456691035	0.130650132755627	1	1	0.937790363010033	1	1
down	PLPP1; SPTLC2; PLPP2; PRKD3; SGPL1; CERS1; ALDH3B1; ALDH3A2; CSNK1G2; KDSR; CERKL; ACER2; PPM1L; DEGS2; HACD2; CERS6; FA2H; SGMS1; SGPP2; CERS5; SPTSSB; ACER1; SPTSSA; SAMD8; ELOVL1; CERS4; ACER3; SPTLC3; ELOVL5; HACD1; ELOVL3; HACD3; ELOVL2; HACD4; ELOVL4;	GO:0030148~sphingolipid biosynthetic process	35	52	67.3076923076923	0.000959703442941717	0.137886803493244	1	1	0.943958033293485	1	1
down	WNT10B; WNT9A; AXIN1; STRN; SNX3; VPS26A; GPC4; LRP6; CDK14; TNKS; WNT11; DRD2; CPE; MCC; CCNE1; CD24; RYK; CTNNB1; DDIT3; WNT5A; GRK6; CSNK1A1; CSNK1D; GSK3A; PRKAA2; WNT3; RAC3; CSNK2A1; XIAP; NDP; HHEX; TLE2; TLE3; TLE4; PKD2; CUL1; FAM53B; RSPO4; RSPO1; AMER1; TMEM170B; WLS; RNF43; RSPO2; SOSTDC1; SHISA6; MARK2; DAAM2; TRABD2A; CCAR2; CCNY; LEO1; RTF1; WNT2B; NKD2; NKD1; OTULIN; ADGRA2; LZTS2; WDR61; PORCN; CXXC4; TNKS2; SOX17; LGR6; CHD8; CELSR2; BRD7; CTNNBIP1; DACT1; WWOX; CALCOCO1; VPS29; DKK2; WNT16; ZRANB1; HMGXB4; VAX2; FBXW11; TNIK; AMFR; ZNRF3; NDRG2; CELA1; AMOTL2; AXIN2; WNT6; VRK1; VRK2; CSNK1G1; LEF1; TCF7L2; CSNK1E; CSNK1G2; TCF7;	GO:0016055~Wnt signaling pathway	95	194	48.9690721649485	0.000976103333033329	0.138210573387473	1	1	0.945252935805616	1	1
down	TTC26; CCDC66; UNC119B; ABLIM1; CEP290; LAMA5; ABCC4; PCNT; GSN; FLNA; RFX2; NME5; RAB8A; ACTR2; ATP6V0D1; RAB1A; OCRL; IFT88; IQCB1; TCTN1; FAM161A; TMEM67; ATAT1; FNBP1L; CEP162; TTBK2; TCTN3; ARMC9; NUDCD3; BBS7; IFT20; DZIP1L; SPAG16; AHI1; BBS5; NME8; GALNT11; FBF1; TCTEX1D2; IFT81; RPGR; FOXJ1; WDR34; IFT43; TCTN2; CEP19; HYLS1; FOPNL; SCLT1; NEK1; BBS4; CEP89; B9D2; FUZ; CCDC28B; CEP250; BBS2; TEKT3; WDR11; FHDC1; CCDC113; RAB17; EHD1; IFT122; CELSR2; MKKS; STK36; MKS1; EHD3; CC2D2A; WDR35; HDAC6; IFT172; RAB23; INTU; RABL2B; B9D1; CEP164; KIF3A; ATP6V1D; CFAP20; MAFIP; CFAP44; PTPDC1; BBS9; TTC39C; CDC14B; TRAF3IP1; IFT80; CEP131; DYNC2H1; CCDC40;	GO:0060271~cilium assembly	92	187	49.1978609625668	0.00103889218901054	0.142957418121592	1	1	0.95029979896188	1	1
down	KDM6A; TP53; ERCC1; AR; RARA; RARB; ERCC2; HOXA5; MTOR; SLC1A2; ATRX; COMP; ADARB1; SP2; ERCC6; NOTCH2; PDE4D; EP300; TAF10; ATM; FKBP8; IHH; TMED2; STIL; TARBP2; CTC1; GNAS; PLAG1; GRHL2; SLC25A25; SLC4A10; RBBP6; PALB2; STK40; WDTC1; KAT2A; SLITRK1; APBA2; SMO; WDR11; TNKS2; RC3H2; ETNK2; SMPD3; UNC79; DHCR7; CELA1; ATF5; CLIC4;	GO:0035264~multicellular organism growth	49	84	58.3333333333333	0.00115415494614279	0.156612414219654	1	1	0.956191653405312	1	1
down	KRBA1; RIMBP3C; ADM5; MATN2; PIK3C2B; SOCS7; NCKAP5; KHNYN; INE1; MPPED1; SIPA1L1; HSPA12A; PRICKLE3; ZNF862; MEGF6; CTAG2; KRT36; SORBS2; AGFG2; METTL18; ZBTB11; A1BG; MSMB; ZNF688; ZSCAN22; GLI4; ETV3; MAGEA4; HSPA7; YLPM1; ZNF142; XG; RIPPLY3; SMIM11A; KRTDAP; NOMO3; FAM189B; ZXDB; RBM10; ZNF200; REEP5; LMNB2; TLE4; TCHH; KRTAP1-1; PUDP; MN1; HMGXB3; BFSP1; COTL1; ERV3-1; GGTLC2; TMEM132B; NOMO1; PDGFRL; FAM189A2; ZNF77; ZNF79; CCDC6; KRT24; EXOC3L2; QRICH1; PRICKLE4; GRIPAP1; TIGD5; ANKRD39; HSP90AB2P; TMEM128; NOM1; FAM209A; SLC25A30; TPRG1L; TRAPPC3L; IDNK; ERMARD; TSTD2; ZNF697; ANKRD45; CDKAL1; LYPLAL1; TMEM268; ZKSCAN2; CRYBG3; SMYD5; NOXRED1; EDC4; GGT6; INO80C; POMZP3; TMEM205; NXPE4; IGFL2; C6orf15; BTNL3; TMEM108; DCHS2; AATK; TMEM91; LHFPL2; FAM47E; GOLT1A; USP53; H2AFV; SLC46A3; VMO1; TRPT1; NOP9; IGFN1; NRAP; UNC93A; NIT1; CPNE8; LIX1L; ARID3B; NAXD; NRM; LRRC34; SLC22A15; RBFA; RUSC2; OR2L13; TMEM132C; KLHL36; ZADH2; IL22RA1; SAMD12; NECAB1; FAM184A; ZNF114; TMEM116; C19orf18; ACRBP; GSTCD; BEST2; OR10H4; RPLP0P6; WDR36; STOML3; GSDMB; RPS4Y2; SCFD2; CHAC2; KBTBD7; FAM151A; SPRYD4; CASKIN2; S100Z; THAP4; FAM3C; TMEM131; NPIPB3; LPP; TMEM54; KIAA1191; TMEM143; TMEM125; EXOSC8; ZBTB8A; LENG1; ISOC1; MRPS24; KIF12; SCRN2; WBP1; CFAP36; SDSL; ZNF486; ACY3; OXNAD1; CYYR1; HHIPL1; CALR3; ZNF75A; FAM210A; ZNF558; ZFP3; TIMP4; SPAG8; SULT4A1; C17orf80; TMEM121; HGH1; CHCHD7; C2orf49; PBDC1; TMEM106C; SPATA9; GTPBP2; FSD1L; ANKRD30B; GPR87; PRRG3; TM6SF1; KLHL4; C20orf27; VN1R1; NPFFR1; MKRN2; SPATC1L; FXYD6; LPAR5; CYSTM1; MRPL46; GAL3ST2; KCNQ1DN; WDR55; BRD9; PLEKHA3; POPDC2; MAGEE1; ATP13A1; APMAP; EMC7; MYOZ2; SERHL; STRN4; SMCO4; INPP5E; FAM114A2; CCM2L; ETNK2; ARL15; EMC3; AKAP7; ACTR3B; SIPA1L2; TXNDC16; CGN; NYNRIN; IMPACT; STOML1; ZMYM2; TRIM10; CACFD1; RSPH14; RPUSD1; ZNF223; IKZF2; EXOG; DIP2C; EPB41L3; RCL1; VWA7; FAM32A; FAM215A; INSL5; MPC1; WSB1; LINC01558;	GO:0008150~biological_process	249	603	41.2935323383085	0.00120732511706023	0.159076324205117	1	1	0.957776861781131	1	1
