down	SYNCRIP; SHOX2; RSL1D1; UFL1; SNAI1; COL1A1; ALPL; HNRNPC; CCL3; COL6A1; BMP2; BMP6; EPHA2; FGF9; AKT1; PHB; RBMX; FASN; HIRA; DLX5; HSPE1; RRAS2; RPS15; TPM4; DHX9; RUNX2; FHL2; MEF2D; GPNMB; TWIST1; FIGNL1; TP53INP2; SFRP1; LRRC17; CCDC47; CREB3L1; MYBBP1A; WWTR1; CHRD; RDH14; RRBP1; MRC2; ITGA11; ASF1A;	GO:0001649~osteoblast differentiation	44	106	41.5094339622642	0.00378179813805224	0.232587221306301	1	1	0.999999999999943	0.999999999999942	1
down	VPS37C; HGS; CHMP2A; PRKAB2; TOMM70; GABARAP; CSNK2A2; VDAC1; DYNLL1; CSNK2B; CSNK2A1; SQSTM1; YOD1; VPS36; MFN1; TOMM5; HDAC10; MTERF3; SNF8; PGAM5; TMEM74; TSG101; VPS25; MAP1LC3C; CHMP4A; GABARAPL1; ATG10; CHMP4B; VPS37B; VTA1; TOMM22; TOMM7; PRKAG3; PRKAG2; UBQLN1; PLAA; CHMP3; MAP1LC3B2; EI24; GABARAPL3;	GO:0016236~macroautophagy	40	94	42.5531914893617	0.00399389237142234	0.243766111475215	1	1	0.999999999999943	0.999999999999942	1
down	RPS23; RPS26; RPL10A; RPL32; RPL11; RPL38; RPL24; RPL19; RPL6; RPL18; TMA7; RPL22; ZC3H15; HSPA14; RPL15; RPLP0P6; RPL22L1; RPL29; RPL26L1; DRG1; RPSA; RPL17; RPLP0;	GO:0002181~cytoplasmic translation	23	44	52.2727272727273	0.00411325697749565	0.246145382433124	1	1	0.999999999999943	0.999999999999942	1
down	RAD51B; RAD51C; XRCC3; RAD21; KIN; ACTL6A; ERCC1; TFPT; XRCC6; XRCC5; APEX1; RAD52; BLM; ENDOG; INO80C; PAXIP1; SUPV3L1; EID3; INO80E; RAD50; MCRS1; INO80B; THAP9; ACTR5; NSMCE4A; RUVBL2; RUVBL1; UCHL5; HMGB2; MSH2; WRN; RECQL4;	GO:0006310~DNA recombination	32	70	45.7142857142857	0.00413599035705292	0.246145382433124	1	1	0.999999999999943	0.999999999999942	1
down	E2F3; IPO13; SNUPN; AGT; LMNA; TP53; DRD1; FGF9; AKT1; CDKN1A; PPP3CA; GCKR; KPNB1; TMCO6; PRICKLE1; PPP1R10; PHB2; SIX2; APPL1; TNPO3; NUP88; NUP214; NUP188; POM121C; NXT1; NUP155; NUP62; FAM53B; POM121B; SPRN; NUP50; NXT2; HEATR3; NUP93; IPO7;	GO:0006606~protein import into nucleus	35	79	44.3037974683544	0.00414437618340247	0.246145382433124	1	1	0.999999999999943	0.999999999999942	1
down	G6PD; GCK; TP53I3; DCXR; FMO2; NOCT; NOX1; IDH1; IDH2;	GO:0006739~NADP metabolic process	9	9	100	0.00414489891911507	0.246145382433124	1	1	0.999999999999943	0.999999999999942	1
down	E2F8; POLR3G; TBX1; BUB1; NBN; ECD; CYP1A1; IGF1; CDK1; ERCC1; XRCC5; GLUL; PAX1; FER; ANXA7; EDNRA; CDC25A; CDC25C; AKT1; CKS2; MCM7; THPO; MKI67; EMP2; DLX5; CKS1B; LRP2; CDK3; PPARD; PRDX1; BCL2L1; LRP1; IL18; SCRIB; MELK; TXNRD1; SETMAR; ASCC3; OGFOD1; OTUD6B; USP13; RHBDF1; AURKB; CDK5RAP3; USP28; GNL3; DPH1; FAM83D; SIX2; PAK1IP1; RRN3; MORF4L1; DDX41; AXIN2; TACC1;	GO:0008283~cell population proliferation	55	142	38.7323943661972	0.00432671149147013	0.255217901332422	1	1	0.999999999999943	0.999999999999942	1
down	OGT; B4GAT1; TRAK2; PLOD3; FKTN; PGM3; GCNT3; LARGE1; ST8SIA6; GALNT2; EOGT; GALNT10; POMGNT2; POGLUT1; B3GALNT2; TET1; C1GALT1C1; GALNT9; A4GNT; B3GNT6; B3GNT4; B3GNT9; B3GALT6; B3GALT2; B3GALT1; B3GNT7;	GO:0006493~protein O-linked glycosylation	26	53	49.0566037735849	0.0045572195421093	0.26677048275869	1	1	0.999999999999943	0.999999999999942	1
down	TCERG1; MED7; NUPR1; PQBP1; TAF5L; MED26; ACTL6A; ZCCHC18; ACTN1; APEX1; FUS; ID1; BUD31; SCAND1; ID3; ARID5B; TAF11; NFKBIB; PKN1; TAF12; PMF1; MED27; ZCCHC12; SRCAP; TADA2B; CCAR1; RBPMS; SMARCE1; TADA1; MYCBP; TSG101; MTA3; TDRD3; CENPJ; SRA1; DAXX; MED23; ABT1; GTF2A1L; RUVBL1;	GO:1903508~positive regulation of nucleic acid-templated transcription	40	95	42.1052631578947	0.00460140022079669	0.26677048275869	1	1	0.999999999999943	0.999999999999942	1
down	ZBTB42; MSTN; TBX1; FKTN; CACNA1H; VAMP5; IGF1; MYH3; DMD; COL6A3; XBP1; CAPN3; LAMA2; CENPF; EMD; ETV1; MAPK12; CAV3; FOXO4; ID3; EGR3; SGCG; FHL1; FHL3; ITGA7; FRG1; MEF2D; TWIST1; SPEG; SGCA; MKX; EID2B; SIRT1; HBEGF; TCF12; PRR14; ITGB1BP2; ITGA11;	GO:0007517~muscle organ development	38	89	42.6966292134831	0.00471434947726723	0.26677048275869	1	1	0.999999999999943	0.999999999999942	1
down	TNFRSF10A; HIP1; TP73; DAPK3; LRP5; RSL1D1; ZBTB7A; TP53; LGALS1; ACTN1; BCL3; CHM; FAS; APEX1; CALR; AKT1; PRDX2; PHB; NF2; BRCA1; BCL6; TNFSF9; STAT1; DAPK1; RABGGTB; CASP6; BID; BCAR1; CRADD; PAX8; BAX; TRAF2; TARDBP; NAE1; PMAIP1; LRP8; WRN; PLK5; TP53I3; USP17L2; SARM1; ZNF420; OMA1; SIRT1; RTKN; TRAF4; PIDD1; SDF2L1; BRMS1; SRA1; RTN4; IFT57; STK26; TNFRSF10D; GLS2; LCMT1; OSGIN1; FBXO10; ALK; PRELID1; ANP32A; PPID; NME2; CLU; MOAP1; ANP32E; ABL2; NME3; DAXX; DNAJA3; NME2P1; ANP32B; USP17L7;	GO:0042981~regulation of apoptotic process	73	202	36.1386138613861	0.00472293845853966	0.26677048275869	1	1	0.999999999999943	0.999999999999942	1
down	DDX39A; NUDT21; U2AF2; CSTF2; EIF4A3; MAGOH; SRSF3; U2AF1; SRSF2; CSTF1; SRSF1; CSTF3; SRSF9; SRSF6; THOC7; PABPN1; THOC6; ZC3H3; CPSF7; U2AF1L4; CLP1; THOC3; UPF3B; CSTF2T; CPSF2; CPSF3; RPRD1A; RPRD1B;	GO:0031124~mRNA 3'-end processing	28	59	47.4576271186441	0.00473503189331614	0.26677048275869	1	1	0.999999999999943	0.999999999999942	1
up	ROS1; CLEC1B; CAB39; MAP2K7; MAP2K5; TAOK2; MAP3K19; PAK6; MINK1; MAP3K3; STK24; PAK3; SLK; PAK1; PAK5; TNIK; MAP2K2; STK4; TAOK1; STK25; MAP2K4; MAP4K4; MAP2K3; TAOK3; NRK; STK10; MAP4K5; MAP3K14; MAP4K2; MAP4K1; STK3; MAP3K1; MAP3K4; MAP3K2; PAK2;	GO:0023014~signal transduction by protein phosphorylation	35	49	71.4285714285714	0.00480486386142465	0.829632073614287	1	1	0.999999996934652	0.999999996934652	1
down	METTL21EP; RRP8; METTL18; CYP1A2; AHCY; HNMT; TPMT; PRDM15; GSTO1; MAT1A; GNMT; NSUN5P1; METTL24; SPOUT1; NDUFAF5; NSUN5P2; CARNMT1; METTL25; FAM86B1; LRTOMT; MTR; METTL17; ARMT1; AS3MT; PRDM11; PRDM10; PRDM8; COQ3; MTRR; PEMT;	GO:0032259~methylation	30	65	46.1538461538462	0.00483558740580248	0.267295457293069	1	1	0.999999999999943	0.999999999999942	1
down	VSTM5; CHMP2A; POLQ; LETM1; ALAD; FUS; RBMX; ADCY8; BLM; KCNB1; KCTD19; BEND3; KCTD18; KCTD8; KCTD1; KCTD9; ARC; CEP57; CALHM1; KCTD6; ATL2; SHKBP1; PNPT1; KCNV2; ATL1; KCTD12; ALS2; KCNA7; PRMT1; KCNS3; TRMT61B; EHD4; KCTD10; KCNF1; EHD1; ECT2; KCTD5; EHD3; SPAST; G3BP2; ZBTB1; KCTD3; RNF112;	GO:0051260~protein homooligomerization	43	105	40.9523809523809	0.0050241582953463	0.272576094183942	1	1	0.999999999999943	0.999999999999942	1
down	PPEF1; PPEF2; CTDSPL; PPM1D; PPM1G; CDC14B; DUSP11; PPM1B; BCL2; MYH3; PPP3CC; PPP1CA; PPP3R1; PPP2CA; CYCS; CTDSPL2; PPP2R3A; PPP3CA; PTPRS; MTM1; PPP2R5D; PTPN14; DUSP5; PTPRO; TIMM50; PPM1J; PPM1L; PPM1N; STYX; UBLCP1; PTPRN2; PDXP; PGAM5; DUSP26; LHPP; ILKAP; PPP1R3E; SDHAF2; MTMR4; PDP2; DUSP13; FBXW11; PPP1R3C; MTMR7; MTMR6; STYXL1; DUSP10; DUSP12; PTPRG; FAM220A; PPP2R5B; DUSP9; DUSP7;	GO:0006470~protein dephosphorylation	53	137	38.6861313868613	0.00511168726694022	0.273942801153278	1	1	0.999999999999943	0.999999999999942	1
down	ALDH1A2; COL3A1; SPARC; BCL2; SRF; FOSL1; OXTR; DDOST; PLA2G5; IL6ST; STAT1; LIFR; BCL2L1; ITIH4; OSMR; CD274; TNFRSF11A; RELB; TIMP2; TIMP4; RELA; NFKB2; TIMP1; NFKB1;	GO:0034097~response to cytokine	24	48	50	0.00523555521825514	0.278880574625724	1	1	0.999999999999943	0.999999999999942	1
down	DVL2; TBX1; SHOX2; MOSPD3; MICAL2; HAND1; TGFB1; COL3A1; RBP4; EDN1; TH; SPARC; GLI2; MTHFD1; SRF; PCNA; BMP2; GYS1; WT1; EDNRA; CAD; OXTR; ADM; FBN1; TGFBR1; CDKN1A; ID1; NOTCH1; IRX4; PRKDC; ID3; MAP2K1; PPARD; FOXL1; CACNA1C; COX17; KCNAB1; ERBB4; ARMC4; RBM20; SYPL2; MTERF4; NEK8; BORCS8; IFT74; DRC1; TBC1D32; IFT140; TBX5; NKX3-1; FOXC2; PKP2; STRA6; WDR11; MKKS; SMYD2; SALL1; PLCE1; HSPB7; PRICKLE4; ZFPM2; POPDC2; PDLIM3; ZFPM1; PDLIM4; HEG1; ACVRL1; LDB3; PDLIM7;	GO:0007507~heart development	69	190	36.3157894736842	0.00536856220443971	0.284242730209763	1	1	0.999999999999943	0.999999999999942	1
down	FGF10; TBX1; EGFR; MYC; HRAS; IGF1; LAMB1; GLUL; VEGFA; C5AR1; FGF7; BMP6; NME2; FGF9; BMPR1A; ID1; NOTCH1; DLX5; ATP7A; TWIST1; OSR2; SFRP1; NR4A3; HTRA1; ESRP2; ZNF304; TCF7L2;	GO:0050679~positive regulation of epithelial cell proliferation	27	57	47.3684210526316	0.00558132606029604	0.291989730618702	1	1	0.999999999999943	0.999999999999942	1
down	INSIG1; CYB5R3; HMGCR; G6PD; CFTR; FDFT1; LSS; ACLY; MVD; HSD17B7; HMGCS1; EBP; PMVK; DHCR24; CYP51A1; PLPP6; ACAT2; IDI2; ARV1; NPC1L1; INSIG2;	GO:0006695~cholesterol biosynthetic process	21	40	52.5	0.00573442239190036	0.298223895872262	1	1	0.999999999999943	0.999999999999942	1
up	ARNTL; PER2; CLOCK; SYT7; ENSA; RAPGEF3; TNF; IFNG; SLC25A5; ADRA2A; GIP; ALOX5; SLC2A2; PRKCA; CNR1; KCNA5; DPP4; HNF4A; GLP1R; RFX3; GIPR; MTNR1B; CPT1A; SLC16A1; RAP1A; CACNA1D; ICA1; ABCC8; TCIRG1; NEUROD1; ITPR2; ITPR3; ITPR1; KCNJ11; CARTPT; SLC8B1; SYT9; RFX6; RAPGEF4; TFAP2B; KCNC2; G6PC2; CACNA2D2; SSTR5;	GO:0050796~regulation of insulin secretion	44	68	64.7058823529412	0.00633696442300824	0.829632073614287	1	1	0.999999996934652	0.999999996934652	1
down	KIF28P; DNM1L; OPA1; PARP1; ALAS1; RAB3A; PHB; HMGCL; LONP1; CAV2; RAB38; CYCS; TFAM; ATP7A; SSBP1; RAB32; MTFR1; PPRC1; MTFR2; TFB1M; SLC25A36; CEP89; PARK7; MTERF1; PHB2; SLC25A33; SHARPIN; TFB2M; SIRT5; POLG2; BCS1L; SIRT4; DNAJA3; FXN; CHCHD2P9; CHCHD2; SQSTM1;	GO:0007005~mitochondrion organization	37	88	42.0454545454545	0.00634650810986681	0.321183562210841	1	1	0.999999999999943	0.999999999999942	1
down	UQCR11; VGF; XYLB; POMC; COX6C; COX8A; COX6A1; SLC25A4; ADRB3; PHKG2; COX7C; FDXR; FECH; COX7A1; ASIP; PHKA1; PPARD; GBE1; RUNX1T1; COX17; ADIPOQ; DHTKD1; MCHR1; CROT;	GO:0006091~generation of precursor metabolites and energy	24	49	48.9795918367347	0.00635130793744931	0.321183562210841	1	1	0.999999999999943	0.999999999999942	1
down	COPE; ZW10; KDELR3; KIF4A; ARF4; KDELR2; TMED10; KIF11; COPB1; ARF3; COPZ1; ARF5; CENPE; KLC1; KIF5A; BNIP1; KIF22; RINT1; KIF18A; SCFD1; KIFAP3; SCYL1; ERGIC2; KIF2C; TMED9; RACGAP1; RAB1B; COG4; PICK1; RAB6B; KIF15; TMED7; COPG1; ATP9B; ERGIC1; RAB41;	GO:0006890~retrograde vesicle-mediated transport, Golgi to endoplasmic reticulum	36	85	42.3529411764706	0.00643171088282035	0.321183562210841	1	1	0.999999999999943	0.999999999999942	1
down	KMO; EPO; TP53; TH; HSP90AB1; ANXA7; BDKRB2; BAX; PAPPA2;	GO:0009651~response to salt stress	9	10	90	0.00649503241768623	0.322513219881606	1	1	0.999999999999943	0.999999999999942	1
down	LAT; NRAS; HRAS; KRAS; TP53; IGF1; CCNA2; CDK2; CDKN1A; SHC2; TRIM28; DHCR24; MAPK11; BRAP; IQGAP3; RASGRP3; RAPGEF6; SHC3; USP28; PARK7; RIT2; ZNF304; RASSF1; PLCE1; G3BP2; RALA; RALB; USP50; RERG; RRAS2; RASL12; RRAS;	GO:0007265~Ras protein signal transduction	32	73	43.8356164383562	0.00667915305465427	0.327130693917473	1	1	0.999999999999943	0.999999999999942	1
down	ANKRD28; BET1; USO1; PDCD6; TRAPPC6A; SEC24D; TRAPPC2; CD59; FOLR1; AREG; LMAN1; TMED10; CTSC; SEC24C; SEC13; COL7A1; GOLGA2; CNIH2; MCFD2; CNIH3; SCFD1; TFG; TBC1D20; GORASP1; RAB1B; PEF1; TRAPPC4; SEC23IP; KLHL21;	GO:0048208~COPII vesicle coating	29	64	45.3125	0.0067226118163638	0.327130693917473	1	1	0.999999999999943	0.999999999999942	1
down	VGF; OGT; INPPL1; TLR2; GOT2; NPPA; ICAM1; FABP3; LYN; CELA2A; EGR2; SLC2A1; GAL; PLN; CAD; MC4R; ADM; UCP3; EIF6; SESN2; RELA; SRSF6; CRY1; PTPRN; GGH; UPRT; SIRT1; GALP; INSIG2; LEP;	GO:0032868~response to insulin	30	67	44.7761194029851	0.00672539591169619	0.327130693917473	1	1	0.999999999999943	0.999999999999942	1
down	POM121C; DDX39A; NUP155; EIF4E; U2AF2; NUP214; NUP62; EIF4A3; SEC13; MAGOH; EIF5A; SRSF3; U2AF1; SRSF2; HHEX; SRSF1; SRSF9; SRSF6; NUP188; THOC7; ALKBH5; NUP54; SMG6; THOC6; NUP93; RBM15B; NUP35; U2AF1L4; NUP205; SEH1L; THOC3; NUP88; NDC1; NUP58; UPF3B; CPSF2; CPSF3; NXT1; NUP50; DDX19B; GLE1;	GO:0006406~mRNA export from nucleus	41	101	40.5940594059406	0.00677993665603238	0.327130693917473	1	1	0.999999999999943	0.999999999999942	1
down	HIP1; DVL1; CREBL2; TSPAN1; PRKRA; CRTAP; FLOT1; WIZ; BAG2; BAG3; GAPDH; TP53; IGF1; PFN1; HSP90AB1; CLU; PIM1; TCP1; FLNA; CPN2; CALR; PHB; CDKN1A; CCT6A; PEX19; RPL5; CCT5; CCT3; CDK7; RASSF2; CCT4; ATP1B3; RPS7; RPL23; RPL11; SMAD3; ANK2; PIN1; TAF9; P3H1; TBRG1; OTUD3; TMEM88; STXBP4; SAXO1; TNIP2; USP33; USP13; MTMR9; PARK7; PHB2; NAPG; CCT7; NAA15; SAV1; RTN4; NLK; FKBPL; MCM8; BAG5; TELO2; DNLZ; SUGT1; CDC37; HSP90AA2P; HSP90AB3P;	GO:0050821~protein stabilization	66	183	36.0655737704918	0.00716130376021784	0.34021999323543	1	1	0.999999999999943	0.999999999999942	1
down	SUV39H1; OPA1; STC2; KCNK2; MYC; LMNA; TP53; EDN1; ICAM1; HMOX1; BCL2; CCNB1; SLC2A4; VEGFA; SLC9A1; CCNA2; AKT1; PTGS2; MPL; OPRD1; IRAK1; STC1; GNGT1; E2F1; PPARD; ATP7A; BNIP3; EIF4EBP1; PMAIP1; ENDOG; TWIST1; PTGIS; SFRP1; FAM162A; SIRT1; PHB2; NKX3-1; BRIP1; SUV39H2; B3GAT1; UBQLN1; HYOU1; TBL2; SIRT4;	GO:0071456~cellular response to hypoxia	44	111	39.6396396396396	0.00720370418521876	0.340394387547783	1	1	0.999999999999943	0.999999999999942	1
down	HIP1; PIK3C2A; DVL2; HGS; SYNJ2; ARPC2; ARPC3; GNPAT; PIP5K1C; DNAJC6; VAMP4; AP2A2; EGFR; LDLR; EGF; ADRB2; CHRM2; CLTA; CLTB; RALA; CFTR; AREG; SYT1; WNT5A; PRKCI; ACTB; ACTR3; YWHAE; UBA52; AP2B1; YWHAZ; ACTG1; LRP2; YWHAH; CTTN; DHCR24; TRIP10; CCDC88A; KIAA0319; SYT2; NECAP1; ARPC1A; SH3KBP1; AP2M1; FNBP1; HBEGF; SLC2A8; EPS15L1; FZD4; PACSIN2; SNX9;	GO:0061024~membrane organization	51	134	38.0597014925373	0.00756865107284255	0.3557266004236	1	1	0.999999999999943	0.999999999999942	1
down	TRABD2B; ETV2; WNT9A; TAX1BP3; STRN; VPS26A; LRP6; TNKS; APC2; CPE; CSNK2A2; CCND1; CD24; RYK; GRK5; WNT5A; WNT7B; FBXW4; RAC3; UBA52; CSNK2B; CSNK2A1; HHEX; FAM53B; HIC1; RSPO4; AMER1; TMEM170B; WLS; NXN; NOTUM; TMEM88; ZBTB33; DAAM2; CSNK1A1L; PAF1; DRAXIN; KREMEN2; LEO1; WNT2B; WNT8B; NKD2; DACT3; OTULIN; BCL7B; WDR61; TNKS2; CELSR2; BRD7; CTNNBIP1; RNF146; DKK3; VPS29; WNT16; ZRANB1; VAX2; FBXW11; ZNRF3; FZD4; MACF1; CTNND2; AMOTL2; AXIN2; VRK1; VRK2; CSNK1G1; TCF7L2; TCF7L1; CSNK1G2;	GO:0016055~Wnt signaling pathway	69	194	35.5670103092784	0.00781084113754382	0.36239204583977	1	1	0.999999999999943	0.999999999999942	1
down	PSMD12; PSMD9; PSMD14; PSMA7; PSMD3; EPO; VEGFA; PSMB1; PSMA1; PSMA2; PSMA3; PSMA4; PSMB8; PSMB9; PSMA5; PSMB5; PSMC4; PSMB3; PSMD7; PSMD4; PSME3; PSMC1; PSMC5; UBA52; PSMD2; PSMD5; CA9; PSMB7; LIMD1; PSMD13; HIGD1A;	GO:0061418~regulation of transcription from RNA polymerase II promoter in response to hypoxia	31	71	43.6619718309859	0.00783416642502632	0.36239204583977	1	1	0.999999999999943	0.999999999999942	1
up	ABCA1; ITGB2; ITGAM; FCGR1A; CD36; MSR1; FCER1G; FCGR2B; MYH9; ARHGAP25; AIF1; CDC42; ARHGAP12; ELMO1; TREM2; GULP1; BIN2; MARCO; SH3BP1; IGHV3-66; IGHG2; IGHV3-30; IGHE; IGHV1-24; IGHV3-7; IGHA1; IGHA2; IGHV3-43; IGHV4OR15-8; IGHV1OR21-1; IGHV3OR15-7; IGHV3-21; IGHV2-5; TRDC; IGHV1-69; TRBC2; IGHV3OR16-8; IGHV3-16; IGHV7-81; IGHV4-39; IGLL1; IGHV3-49; IGHV4-59; IGHV4-61; IGHV1OR15-9; IGHV3OR16-10; IGLC6; IGHV1-69-2; IGHG3; IGHV3-13; IGHV2-70; IGHV3-35; IGKC; IGHV4-34; IGHV2OR16-5; IGHV3OR16-13; IGHV3OR16-12; IGHV1-45; IGHV5-51; IGHV1-58; IGHG4; IGHV3-38; IGLL5; IGHV3OR16-9; TRBC1; IGHM;	GO:0006911~phagocytosis, engulfment	66	115	57.3913043478261	0.00796223599807666	0.829632073614287	1	1	0.999999996934652	0.999999996934652	1
down	AGT; IL1B; APOE; HMGCR; LYN; GSTP1; SMPD1; NUP62; CAV3; ADIPOQ; DUSP7; DAB2IP; PAQR3; CDK5RAP3; INPP5K; SH2B3; IRAK3; SPRY4; SPRY1; SPRY2;	GO:0043407~negative regulation of MAP kinase activity	20	39	51.2820512820513	0.00836721410994057	0.3752419659821	1	1	0.999999999999943	0.999999999999942	1
down	SPTBN2; XRCC2; NDUFS6; ZMPSTE24; TP53; ERCC1; XPA; SLC1A2; COMP; ADARB1; PDE4D; TAF10; FKBP8; ARID5B; STIL; TAL2; PKDCC; GNAS; TNS2; PLAG1; SLC25A25; PALB2; STK40; PPP1R13L; SLITRK1; APBA2; WDR11; WWTR1; TNKS2; SLC12A5; RMI1; RC3H2; UNC79; HEG1; CLIC4;	GO:0035264~multicellular organism growth	35	84	41.6666666666667	0.00864216208324353	0.381837620735926	1	1	0.999999999999943	0.999999999999942	1
down	LYN; SRF; ACAT1; LONP1; NKX2-1; MMP14; SNRPN; SORD; FHL2; DHCR24; STEAP2; GHSR; RERG; RBM14; MMS19; TXN2; FOXC2; TIMP4; NOS2; TIMP2; TIMP1;	GO:0009725~response to hormone	21	42	50	0.00865133966565212	0.381837620735926	1	1	0.999999999999943	0.999999999999942	1
down	ZBTB7A; TSPAN15; EGFR; EGF; GATA2; AKT1; BCL6; MMP14; DLX1; DLK1; DLX2; NRARP; METTL3; GDPD5; SLC35C1; RITA1; EGFL7; NOTCH3; PEAR1; JAG2; DLL3;	GO:0045746~negative regulation of Notch signaling pathway	21	42	50	0.00865133966565212	0.381837620735926	1	1	0.999999999999943	0.999999999999942	1
down	KIF4A; DNAL4; KIF11; CENPE; KLC1; KIF5A; DYNC1I2; KIF22; KIF18A; DYNLRB2; KIFAP3; KIF2C; RACGAP1; DYNLRB1; KIF15; STARD9; DNAH10; KIF28P; KIF20A; KIF14; KIF20B; DYNC1I1; WDR34; DNAH9; KIF9; KIFC3; DNAH14; DNAH11; KIF6; WDR78; DNAI1; ACTR10; KIF17; KIF24;	GO:0007018~microtubule-based movement	34	81	41.9753086419753	0.00877587887002584	0.381837620735926	1	1	0.999999999999943	0.999999999999942	1
down	LRCOL1; CYB5B; PPP1R12B; NUPR1; PRKRA; DPM2; CXCL1; BCL2; XRCC5; FGFR4; GTF2F1; DDOST; NR4A2; GMFB; DAD1; ARF1; ATP7A; STX4; HSPB2; FXN; LTC4S; GNAS; KRTCAP2; NOXO1; NSMAF; AZIN2; DCP1A; PSENEN; DPM3; SAE1; DNMT3L; GTF3C4; MMP17; MMP24;	GO:0043085~positive regulation of catalytic activity	34	81	41.9753086419753	0.00877587887002584	0.381837620735926	1	1	0.999999999999943	0.999999999999942	1
down	DVL2; LIAS; ZEB2; DEAF1; BCL10; TGFB1; PFN1; RALA; MTHFD1; PRKACA; PRKACB; SDC4; ADM; LMO4; RPS7; LRP2; PTCH1; SCRIB; STIL; TEAD2; TWIST1; MTHFD1L; SHROOM3; PRICKLE1; KIF20B; DLC1; IFT122; IFT57; CELSR1; IFT172; SALL4; LRP6; VASP;	GO:0001843~neural tube closure	33	78	42.3076923076923	0.0088995661135427	0.383145487544278	1	1	0.999999999999943	0.999999999999942	1
down	FLOT1; APP; S100A6; BCL2; MAP2; NEFH; STMN1; CCKAR; RYK; NOTCH1; NUMB; ADCY1; LLGL1; AMIGO1; BRSK2; CNTN4; DSCAML1; BRSK1; ATL1; NTNG2; ALS2; RTN4R; SEMA4A; SPAST; VAX2; BAIAP2; AFG3L2; NUMBL; SLITRK3; RAB3A; MAP1S; ACTB; SLITRK1;	GO:0007409~axonogenesis	33	78	42.3076923076923	0.0088995661135427	0.383145487544278	1	1	0.999999999999943	0.999999999999942	1
down	FGF10; NDUFS4; EGFR; AGT; MYC; IGF1; S100A6; ANXA2; MIF; CCNB1; FOSL2; PDGFRA; CCNA2; CDKN1A; WNT5A; PRKDC; CDK6; E2F1; DHX9; RNASEH2B; SIRT6; CDC6; SPHK1;	GO:0048146~positive regulation of fibroblast proliferation	23	48	47.9166666666667	0.00904753548326132	0.384148740881081	1	1	0.999999999999943	0.999999999999942	1
up	GFRAL; CCDC88C; STK3; PAK6; TNIK; MAP2K5; MAP3K1; STK10; MAP2K2; SLK; MAP2K3; NRK; MAP4K2; TAOK1; TAOK2; MAP4K1; STK25; MAP2K7; MAP4K5; MAP3K14; PAK3; MAP4K4; MAP2K4; PAK2; STK24; MINK1; PAK5; MAP3K4; PAK1; MAP3K3; MAP3K19; MAP3K2; STK4; TAOK3;	GO:0031098~stress-activated protein kinase signaling cascade	34	50	68	0.00908547844611163	0.829632073614287	1	1	0.999999996934652	0.999999996934652	1
down	SOX1; SOCS3; RNMT; KLF4; SPRY2; NRP2; MSC; EED; ICAM1; MYBL2; MCF2; NEFH; XRCC5; XBP1; NFYB; SSTR1; CTH; RFX2; GCLM; HK2; CTBP2; UBXN2A; SRSF3; PFKP; EPS8; ARID5B; RIF1; PARP16; NUP35; PMM1; SIRT1; GNPNAT1; MYNN; MRPL15; PCOLCE2; FZD4; SBNO2; PADI2; MPC1;	GO:1990830~cellular response to leukemia inhibitory factor	39	97	40.2061855670103	0.00914311351619412	0.386340503335722	1	1	0.999999999999943	0.999999999999942	1
down	TNKS; PARP1; PARP6; PARP10; TIPARP; PARP16; TNKS2; PARP11; PARP3;	GO:0070213~protein auto-ADP-ribosylation	9	11	81.8181818181818	0.00974556815033567	0.407875230825239	1	1	0.999999999999943	0.999999999999942	1
up	TMEM150B; TECPR2; ATG7; S100A8; S100A9; HMGB1; DRD2; ITGB4; TFEB; DRD3; PIK3CB; VPS41; RGS19; DAP; HAP1; TMBIM6; VCP; GABARAPL2; RAB8A; RAB1A; CLTC; FOXO1; BECN1; USP10; STK11; IFI16; WIPI1; LRRK2; FNBP1L; ULK3; DRAM2; WDFY4; TECPR1; SBF2; SIRT2; DRAM1; PIK3C3; SUPT20H; RB1CC1; SMCR8; TBC1D5; RUBCN; RAB24; RNF166; GRAMD1A; OPTN; NRBF2; RNF185; C9orf72; TRIM5; MAP1LC3B; TOLLIP; ATG5; TBC1D17; TIGAR; VPS18; TBC1D14; UVRAG; VPS51; CHMP2B; PTPN22; SH3GLB1; WDR45; PLEKHM1; ATG4B; AMBRA1; LIX1; EPG5; VMP1;	GO:0006914~autophagy	69	123	56.0975609756098	0.00985502734282451	0.829632073614287	1	1	0.999999996934652	0.999999996934652	1
down	NUDT21; SNRPB; CSTF2; MAZ; SNRPE; SNRPF; SNRPG; SNRPD3; LSM11; CSTF1; CSTF3; PABPN1; CPSF7; ZNF473; CLP1; CSTF2T; CPSF2; CPSF3; TTF2; SCAF8;	GO:0006369~termination of RNA polymerase II transcription	20	40	50	0.010244578132199	0.414289348997801	1	1	0.999999999999943	0.999999999999942	1
down	CIT; TNFRSF21; GAPDH; TP53; APP; POLB; BCL2; HSPA5; ATN1; BID; BAX; BCL2L1; BNIP3; NAE1; POU4F3; USP53; SIAH1; OXR1; PIGT; FAM162A;	GO:0051402~neuron apoptotic process	20	40	50	0.010244578132199	0.414289348997801	1	1	0.999999999999943	0.999999999999942	1
down	FSTL3; EGFR; CLEC3B; SPARC; BCL2; BMP1; MYOG; NPR2; SLC26A2; RASSF2; STC1; CDH11; RPL38; GPM6B; RUNX2; TWIST1; EXT1; ECM1; RIPPLY2; TAPT1; CHRDL2; OSTF1; KAZALD1; FOXC2; TWSG1; DHX36; PDLIM7; EIF2AK3; PAM16; TNFRSF11A; CLEC3A; COL1A1;	GO:0001503~ossification	32	76	42.1052631578947	0.0104074906988614	0.414289348997801	1	1	0.999999999999943	0.999999999999942	1
down	DVL1; MAPT; TUBG1; CAV3; TRDN; WDR73; CCDC13; PLK3; TUBG2; STMN3; CRIPT; MAP10; IFT172; TUBGCP4; TUBGCP5; CCDC88A; FIGNL1; FIGNL2; KATNAL2; SPAST; KATNAL1;	GO:0031122~cytoplasmic microtubule organization	21	43	48.8372093023256	0.0105053280128565	0.414289348997801	1	1	0.999999999999943	0.999999999999942	1
down	CLIC1; FIBP; HSPB1; ITGA2B; ACTN1; PDGFRA; VCL; MYL12A; FLNA; MYL9; MPL; COMP; METAP1; ACTB; ACTG1; GNAS; PEAR1; BLOC1S4; SLC7A11; TLN1; UBASH3B;	GO:0070527~platelet aggregation	21	43	48.8372093023256	0.0105053280128565	0.414289348997801	1	1	0.999999999999943	0.999999999999942	1
down	NRP1; TNFSF12; NRP2; PDCD6; DYSF; NRAS; LRG1; BMP2; F3; VEGFA; BMP6; NR4A1; HMGB2; AKT1; TGFBR1; ACVRL1; WNT5A; STAT5A; CXCL12; CAV2; CCL11; CDH13; EGR3; ECM1; VASH2; SIRT1; EGFL7; PLXNB3; AKT3; PGF; NRARP;	GO:0001938~positive regulation of endothelial cell proliferation	31	73	42.4657534246575	0.0105501297313124	0.414289348997801	1	1	0.999999999999943	0.999999999999942	1
down	QSOX1; ABCC4; PCDH7; WDR1; ENDOD1; CFD; PLG; SERPINA3; TIMP1; KNG1; EGF; TGFB1; ORM1; AHSG; PF4; ALDOA; IGF1; APP; SERPING1; CLEC3B; PROS1; LYN; THBS1; ITGA2B; CD63; SPARC; SRGN; CLU; ACTN1; VEGFA; VCL; FLNA; CD9; TAGLN2; MANF; ITIH3; ITIH4; ECM1; APOOL; NHLRC2; SCCPDH; FAM3C; SYTL4; GTPBP2; TOR4A; MAGED2; TLN1;	GO:0002576~platelet degranulation	47	124	37.9032258064516	0.0105899872432451	0.414289348997801	1	1	0.999999999999943	0.999999999999942	1
down	TMEM120B; SOCS1; KLF4; DYSF; ZBTB7A; EGR2; IL11; NR4A1; CCND1; PSMB8; GRK5; SREBF1; NR4A2; CEBPD; HMGA2; ARID5B; BBS9; METRNL; GDF6; ANGPTL8; LRRC8C; NOC3L; NR4A3; BSCL2; SDF4; C1QTNF3; ALOXE3; MKKS; TCF7L2; FAM120B;	GO:0045444~fat cell differentiation	30	70	42.8571428571429	0.0106770124213675	0.414289348997801	1	1	0.999999999999943	0.999999999999942	1
down	PPIH; FKBP9; FKBP2; PPIF; PPIA; FKBP1A; FKBP1B; PPID; PIN1; FKBP8; PTPA; FKBP15; FKBP9P1; PPIL6; PPIL4; PPWD1; FKBP11; AIPL1; PIN4; FKBP4; FKBP1C; PPIL3;	GO:0000413~protein peptidyl-prolyl isomerization	22	46	47.8260869565217	0.0107001572673229	0.414289348997801	1	1	0.999999999999943	0.999999999999942	1
down	XRCC2; ZEB2; TP53; PAX1; BMPR1A; WNT5A; PRKDC; SMAD3; TCF15; RIPPLY2; PALB2; POGLUT1; NKX3-1; FOXC2; SEMA3C; HES7; NLE1; DLL3; AXIN2; MESP2; MESP1; TBX19;	GO:0001756~somitogenesis	22	46	47.8260869565217	0.0107001572673229	0.414289348997801	1	1	0.999999999999943	0.999999999999942	1
down	GSN; BMP2; XBP1; TRIM21; NR1D1; CAPN3; SNCA; ID1; PLK1; PRKDC; SERF2; DIEXF; SIAH1; SIRT6; RNF139; ISOC2; SIRT1; RNF5; DERL1; HDAC6; FBXW11; FBXO4; FBXL3;	GO:0031648~protein destabilization	23	49	46.9387755102041	0.0108368323421452	0.417740874803131	1	1	0.999999999999943	0.999999999999942	1
up	PPL; KRT75; CSTA; KRT14; KRT6A; KRT6B; KRT1; KRT18; KRT8; CAPN1; FURIN; KRT3; KRT5; JUP; DSP; KRT15; KRT4; FLG; SPRR1B; SPRR2E; SPRR1A; SPRR2A; KRT9; KRT20; KRT2; KRT6C; KRT85; KRT76; DSG1; DSC2; KRT17; DSC1; DSG2; KRT81; DSC3; KRT72; CDSN; PRSS8; KRT24; KRT71; SPINK9; LCE1A; LIPN; LIPK; LIPM; KRT79; KRT40; SPINK6; KRT74; KRT25; KRT77; DSG4; KRT73; CERS3; KRT78; EVPL; PERP; KRT12; KRT23; SPINK5; SPRR3; KLK13; PKP3; ST14;	GO:0070268~cornification	64	113	56.6371681415929	0.0108445144265928	0.829632073614287	1	1	0.999999996934652	0.999999996934652	1
down	ITGB1BP1; NRP1; ARHGEF10; SORBS3; ROCK2; BAG4; RHOC; TPM1; SDC4; NF2; TGFBR1; PXN; S100A10; RHOA; SMAD3; TESK1; CCDC88A; SFRP1; PPM1E; SYNPO2L; ARHGEF10L; NOX4; EVL; FHOD1;	GO:0051496~positive regulation of stress fiber assembly	24	52	46.1538461538462	0.0109224242814029	0.419201689996725	1	1	0.999999999999943	0.999999999999942	1
up	PIK3CD; ICOSLG; SKAP2; RASGRP1; PRKCB; HSPD1; MS4A1; CD79A; CHRNB2; CD22; CXCR5; ZAP70; CHRNA4; HDAC4; BST2; CASP8; BANK1; LAT2; IKZF3; HDAC9; HDAC5; MALT1;	GO:0042113~B cell activation	22	28	78.5714285714286	0.0110759051928877	0.829632073614287	1	1	0.999999996934652	0.999999996934652	1
up	IGKV2-28; IGKV2D-30; IGKV1-12; IGKV2-29; C3; IGKV1D-33; IGKV1-33; IGKV1-39; IGKV1-17; IGKV1D-16; IGKV1-5; IGKV1D-12; IGKV2D-40; IGKV2D-28; IGKV3-20; IGLV1-44; IGLV1-47; IGLV1-51; IGLV1-40; IGLV2-14; IGLV2-23; IGLV2-11; IGLV3-19; IGLV3-25; IGLV3-27; IGHV1-69; IGHV3-13; IGHV3-30; IGHV3-7; IGHV2-70; IGHV2-5; IGHV4-39; IGHV4-59; IGKC; IGHG2; IGHG3; IGHG4; IGKV1-16; IGKV1D-39; IGKV3-11; CFI; IGKV4-1; IGHV4-34; C8A; C8B; C8G; IGLC6; C7; C6; CD46; CR1; C4BPB; SUSD4; IGHV3OR16-9; IGLL1; IGHV1OR21-1; TRDC; IGHV3OR16-12; IGHV3OR16-13; IGHV3-16; IGHV1-45; IGHV3-21; IGHV5-51; IGHV3-35; IGHV1-24; IGHV1-69-2; IGHV3-49; IGHV3-38; IGHV4-61; IGHV3OR15-7; TRBC2; IGLL5; IGHV3OR16-10; TRBC1; IGHV1OR15-9; IGHV3OR16-8; IGHE; IGHV3-66; IGHV2OR16-5; IGHA2; IGHA1; IGHM; IGHV7-81; IGHV1-58; IGHV4OR15-8; IGHV3-43;	GO:0006958~complement activation, classical pathway	86	161	53.416149068323	0.0111084173407462	0.829632073614287	1	1	0.999999996934652	0.999999996934652	1
down	SPTBN2; TBC1D4; PLIN3; ZFPL1; PRKCI; RAB38; ARF6; RAB11A; TBC1D8B; KIF5A; RAB32; RABEP1; SFT2D1; ARAP3; YIPF5; RAB39B; KXD1; VPS33B; SYTL2; KIF17; ADAMTS9; HSPA2; EXOC2; CACFD1; CHM; ARL5C; ARF5; HSPA13; ARL4C; VPS39; SYT1; TVP23C; ARF3; GDI2; AP2B1; ARF4; ARL4A; HSPA6; SYT5; SYT3; AP3S1; TGFBRAP1; SYT11; CCZ1; AP4B1; NECAP1; CHML; SYT2; ARF1; TVP23B; ARL4D; AP3B2;	GO:0016192~vesicle-mediated transport	52	141	36.8794326241135	0.011242642201445	0.428108048732451	1	1	0.999999999999943	0.999999999999942	1
