down	SOCS6; ATE1; BAG6; VCP; CUL4B; PMAIP1; DDB1; DDI2; DDI1; RNF41; PRPF19; PSMB1; PSMB8; PSMB10; PSMB3; PSMA3; PSMB2; PSMB6; PSMA5; PSMB11; PSMB4; PSMA4; PSMA1; PSMB7; PSMA7; PSMA6; PSMA8;	GO:0010498~proteasomal protein catabolic process	27	36	75	0.00116695091584096	0.0669584125996003	1	1	0.999999999997247	0.999999999997246	0.651674016234215
down	SMARCA5; MBD3; ACTL6A; HNRNPC; SMARCA4; ACTB; ERCC6; RBBP4; SMARCB1; CHD3; HDAC1; CHD4; SMARCC2; GATAD2B; HDAC2; SMARCC1; SMARCD2; SMARCE1; CECR2; CHD8; SMARCA2; PBRM1; ACTR5; INO80; ARID1A; ARID1B;	GO:0043044~ATP-dependent chromatin remodeling	26	34	76.4705882352941	0.00117407293880023	0.0669584125996003	1	1	0.999999999997247	0.999999999997246	0.651674016234215
down	MAP2K7; NVL; KLF4; DKC1; TNKS; PARN; MYC; HSP90AA1; HSP90AB1; XRCC5; TCP1; MAPK3; MAPK1; CTNNB1; CCT4; CCT2; PRKCQ; PTGES3; HMBOX1; PARM1; MAPKAPK5; NAF1; PNKP; WRAP53; PKIB; MAP3K4;	GO:0051973~positive regulation of telomerase activity	26	34	76.4705882352941	0.00117407293880023	0.0669584125996003	1	1	0.999999999997247	0.999999999997246	0.651674016234215
down	POLR1C; CD3EAP; SMARCA5; SF3B1; POLR2E; TBP; POLR2H; ACTB; POLR2F; ERCC6; EP300; TAF1C; TAF1A; TWISTNB; TAF1B; KAT2A; KAT2B; WBP2; MYBBP1A; POLR1E; TAF1D; DDX21; SPHK2; ZNRD1; BAZ1B;	GO:0045815~positive regulation of gene expression, epigenetic	25	32	78.125	0.0011744607450902	0.0669584125996003	1	1	0.999999999997247	0.999999999997246	0.651674016234215
down	ADAM10; MAFG; KDM6A; BCL2L11; SLC25A20; ADCY9; PLOD3; EIF4E2; ZFAND5; SEC24D; SYF2; MBD3; MT-ND4; ITGB1; POLB; TPM1; TGFB3; BMP2; MYH6; ERCC2; RXRA; EIF2S2; BTF3; GATA3; CPT2; MGAT1; NMT1; CTNNB1; MYH9; ADD1; ACVR1B; ACVRL1; TGFBR2; MSH2; SSR2; NOTCH1; LIG4; ELL; YBX1; SMAD3; NOTCH2; BCL2L1; NOG; SMAD4; PTCH1; ALKBH1; KEAP1; TAB1; SMAD2; DBN1; ZNF568; C2CD3; RNASEH2B; SH3PXD2A; OTUD7B; ANKRD11; UBR3; RBBP6; CIR1; MIB1; CMIP; WDTC1; WDR19; FLCN; BRK1; KAT2A; SIN3A; APBA2; PRMT1; EGFL8; HINFP; SLC39A3; CCM2; INPP5K; FUT8; UNK; NSRP1; SMG9; ZNF335; TANC2; CHD8; EPB41L5; CHST11; RIC8A; MBNL1; SMPD4; SLC39A1; RRN3; CHD7; KIDINS220; HEG1; ZMIZ1; COPS3; RTCB; CHTOP; TRAF6; KLF2; EPN1;	GO:0001701~in utero embryonic development	98	203	48.2758620689655	0.00118802314089939	0.0673260539249808	1	1	0.999999999997247	0.999999999997246	0.655252092382421
up	CDHR4; PTPRT; PCDH17; PCDH7; MPZL2; CEACAM5; RET; CDH1; CEACAM6; DSG1; DSC2; CDH17; DSG2; FAT1; NECTIN1; FAT4; SDK1; PCDH20; PCDH19; NECTIN2; CDHR1; DCHS1; CADM1; CDHR2; PCDH11Y; CLSTN2; CDHR5; ROBO2; PCDH18; PCDH12; PCDH10; CDH22; PCDHB10; PCDHA7; PCDHA6; PCDHA4; PCDHA12; PCDHB9; PCDHB5; PCDHB2; PCDHB13; PCDHB12; PCDHB1; PCDHGB3; PCDHGB2; PCDHGA8; PCDHGA10; PCDHGA1; PCDHA9; PCDHA8; PCDHA5; PCDHA2; PCDHA13; PCDHA11; CDH5; NECTIN4; VSTM2L; MYOT; IGSF9; NEXN; CDH18; L1CAM; IGSF21; CDH7; CNTN6; HMCN1; CDH2; CDH8; CDH12;	GO:0007156~homophilic cell adhesion via plasma membrane adhesion molecules	69	165	41.8181818181818	0.00118935612434579	0.917832236959077	1	1	0.999999999999994	0.999999999999994	1
down	TRIM38; RNF8; UBR5; ARIH2; TNFAIP3; CDC34; UBE2A; UBE2D1; TTC3; UBE2G2; UBE2K; UBE2H; UBE2D2; UBE3A; SKP2; RNF187; UBE2R2; SYVN1; HACE1; DTX3L; UBE2Q2; RFFL; RNF34; UBE2E3; ITCH; NEDD4L; RNF5; RNF126; TOPORS; BFAR; KLHL3; AMFR; UBE2D4; RNF115; NHLRC4;	GO:0070936~protein K48-linked ubiquitination	35	53	66.0377358490566	0.00123217073112369	0.0694122845199681	1	1	0.999999999997247	0.999999999997246	0.675556371080841
down	PPP6C; GOSR2; SEC16A; BET1; TRAPPC3; USO1; PDCD6; SEC22B; SEC24D; SEC31A; SEC24B; TRAPPC2; AREG; NSF; TRAPPC10; CSNK1D; TMED10; CTSC; NAPA; GOLGA2; STX5; CUL3; TMED2; PPP6R3; TRAPPC6B; TRAPPC5; MCFD2; CNIH3; SCFD1; TFG; TRAPPC9; GORASP1; RAB1B; PREB; CTSZ; PEF1; TRAPPC2L; PPP6R1; TRAPPC4; KLHL21;	GO:0048208~COPII vesicle coating	40	64	62.5	0.00124645325848327	0.0698013824750632	1	1	0.999999999997247	0.999999999997246	0.679343274283305
down	POLR1C; PQBP1; CRCP; POLR3D; XRCC6; XRCC5; PLCG2; POLR2E; NFKB1; CTNNB1; STAT6; SYK; IRAK1; POLR2H; POLR2F; PRKDC; NFKB2; RELA; DHX9; EP300; IRF3; LRRFIP1; CREBBP; IRF7; DHX58; MYD88; ZBP1; POLR3F; DHX36; POLR3B; TBK1; PTPN22; POLR3K; CD14;	GO:0032481~positive regulation of type I interferon production	34	51	66.6666666666667	0.00127832928261773	0.0707491715245274	1	1	0.999999999997247	0.999999999997246	0.688567649121768
down	HTRA2; EPO; GBA; CSF1; SULT1A3; CREB1; TNFRSF1B; CBL; HLA-F; AKT1; SNCA; GSK3B; PPP5C; UCN; PSMC1; AP2B1; CDK5; HSF1; EIF4G1; REL; PPARA; TRAF2; TMEM259; PM20D1; CD200R1; SORL1; SIRT1; VPS35; BTBD10; CHMP4B; ATP13A2; TIGAR; PARP2; IKBKG;	GO:1901215~negative regulation of neuron death	34	51	66.6666666666667	0.00127832928261773	0.0707491715245274	1	1	0.999999999997247	0.999999999997246	0.688567649121768
down	ITGB1BP1; SLC9A3R1; IKBKB; GAK; SEC16A; ROCK2; CLASP2; ATP2C2; TSPAN15; TNF; ANXA2; RAP2A; JUP; EZR; TNFRSF1A; FLNA; EPHA2; AKT2; RDX; BSG; ATP1B3; CD81; S100A10; RAB8A; RAB10; TSPAN5; RAB11A; RAP1A; SPTBN1; ANK3; DLG1; PRKG2; PPIL2; PTCH1; KCNB1; SLMAP; TMED2; ZFYVE27; DENND4C; TMEM88; PACS1; PIGW; PACS2; IFT20; ZDHHC23; MPP5; TSPAN14; TESC; MYADM; PLEKHF1; PIP5K1A; PKP2; INPP5K; CRB3; FAM126A; RAB34; SMURF1; SYTL2; ZDHHC3; EHD3; TNIK; RAPGEF2; MYO5A; F11R; C2CD5; RAB12; RAB3A; TSPAN17; RAB40B; PRAM1; RAB15; RAB40AL; RAB40C; RAB3D;	GO:0072659~protein localization to plasma membrane	74	144	51.3888888888889	0.00128621198679357	0.0707715711803161	1	1	0.999999999997247	0.999999999997246	0.688785654195117
up	CST8; PAPLN; EPPIN; A2M; C3; TIMP1; CST4; AMBP; GAPDH; LPA; CST2; FURIN; C4A; COL6A3; PI3; CST5; PEBP1; SERPINB1; LCN1; COL4A3; COL7A1; ITIH3; ROCK1; WFDC2; SPINK13; COL28A1; CRB2; OVOS2; SPINK14; ITIH6; C3P1; WFDC8; WFDC13; WFDC5; WFIKKN2; WFDC12; SPOCK3; LXN; CST11; CSTL1; WFDC10A; FETUB; PCSK1N; SERPINB13; HMSD; SERPINA13P; AGT; SERPINA4; SERPINA5; SERPINA12; TIMP4; HRG; SERPINA11; AHSG; SERPING1; TIMP2; SERPINF2; SERPINB11; SERPINA10; SERPINH1; SERPINI1; SERPINA7; SERPINA1;	GO:0010951~negative regulation of endopeptidase activity	63	148	42.5675675675676	0.00134631327369905	0.917832236959077	1	1	0.999999999999994	0.999999999999994	1
down	TLR3; DAPK3; PDCD6; SGPL1; CD5; CD3E; CD14; TFPT; CD28; ITGAM; PRKCA; FAS; CASP1; CASP14; CASP3; CASP2; DAP; CASP5; CRADD; PPARD; BAX; FADD; RIPK1; FASTK; CASP8; BAK1; TICAM2; TICAM1; DPF2; CASP10; TNFRSF25; PAWR; P2RX4; P2RX7; DIDO1; SENP1; CASP8AP2; IFI27L1; IFI6; TM2D1;	GO:0097190~apoptotic signaling pathway	40	65	61.5384615384615	0.00153979913625679	0.0842350232689843	1	1	0.999999999997247	0.999999999997246	0.819818956126347
down	STXBP3; YKT6; PLEK; CFTR; RAB8A; STX1B; KCNB1; STXBP2; RABEPK; EXOC6; SCFD2; SCFD1; EXOC4; VPS33B; SYTL2; VPS45; VTI1B; EXOC6B; VPS18; RAB15; RAB3D; RAB12; RAB10; VPS11; RAB3A;	GO:0006904~vesicle docking involved in exocytosis	25	33	75.7575757575758	0.00158564305853981	0.0850714184669281	1	1	0.999999999997247	0.999999999997246	0.827959188199386
down	IKBKB; TLR3; CD14; UBB; UBC; UBE2D1; UBE2D2; RPS27A; UBA52; TRAF3; FADD; BIRC3; BIRC2; RIPK1; IKBKE; IRF3; CASP8; TICAM2; TICAM1; TANK; IRF7; TBK1; IKBKG;	GO:0035666~TRIF-dependent toll-like receptor signaling pathway	23	29	79.3103448275862	0.00158626882091473	0.0850714184669281	1	1	0.999999999997247	0.999999999997246	0.827959188199386
down	PDLIM1; PER2; MED7; ACTN4; NUPR1; PQBP1; TADA2A; MED26; ACTL6A; PRKCB; ZFX; MAK; APEX1; PML; FUS; ID1; BUD31; NUP98; UBE2L3; SP4; TRIM32; MTA1; BIRC2; ARID5B; TRIP11; NFKBIB; PKN1; E4F1; JADE1; PMF1; MED27; MED12L; CCAR2; JMY; SMARCD2; SMARCE1; MYCBP; MNT; TSG101; WDR77; TDRD3; MED20; CENPJ; SRA1; RERE; PSMC3IP; DAXX; GMEB2; ZMIZ1; ING4; RUVBL1; HCFC2; TAF6L;	GO:1903508~positive regulation of nucleic acid-templated transcription	53	95	55.7894736842105	0.00158901167448711	0.0850714184669281	1	1	0.999999999997247	0.999999999997246	0.827959188199386
down	HAX1; POLRMT; DNM1L; RAB29; FANCG; HTRA2; OPA1; CLUH; GBA; ESRRA; ALAS1; TMEM11; RAB3A; LONP1; CEBPA; HCFC1; RAB38; CYCS; TFAM; CDK5; SSBP1; GABPB1; RAB32; NRF1; WDR81; VPS13D; VPS13C; CAMKMT; TFB1M; CHCHD10; MIEF2; SLC25A36; CEP89; YME1L1; P2RX7; PHB2; SLC25A33; PINK1; SHARPIN; SIRT3; SIRT5; BCS1L; GDAP1; DNAJA3; FXN; RHOT1; ATAD3B; SPG7; SQSTM1; PTCD2;	GO:0007005~mitochondrion organization	50	88	56.8181818181818	0.00159104406896093	0.0850714184669281	1	1	0.999999999997247	0.999999999997246	0.827959188199386
down	KLLN; IRF6; PPM1G; PRKAB2; GAS2; HBP1; GAS7; NBN; ERN1; PPP1R15A; MFN2; MYC; HRAS; TGFB1; PRNP; IFNW1; APC; DDIT3; CDKN1A; MTOR; MSH2; CDKN1B; NOTCH1; CDKN1C; CDK7; MAP2K6; PRKAG1; EIF4G2; SMAD3; MAP2K1; NOTCH2; LAMTOR4; ATM; RHEB; DHCR24; STK11; ZFHX3; RRAGB; RRAGA; STRADA; KMT2E; JMY; UHMK1; KAT2B; TBRG4; MTBP; SGSM3; KIF20B; PPP1R9B; GAS2L1; CGRRF1; BARD1; TSG101; MLST8; CAB39L; RRAGC; WDR6; TCF7L2; RRAGD; BTG4; EIF2AK4; LAMTOR3; PLAGL1; ING4; PRKAB1; WHAMM; PML; PRR11;	GO:0007050~cell cycle arrest	68	131	51.9083969465649	0.00162213460707228	0.0861823754667427	1	1	0.999999999997247	0.999999999997246	0.838771598198738
down	IRGM; ACOD1; KMO; ABCA1; LDOC1; BCL10; ASS1; CD14; VIM; GSTP1; HMGB1; RARA; BCR; CDK4; SRC; CAPN2; NFKB1; TNFRSF1B; TNFAIP3; TBXA2R; IL10; MRC1; CD40; ZFP36; CASP1; CD68; MAPK8; RHOA; HAMP; HSF1; IRF8; PPARD; RELA; MEF2C; PDE4B; PDE4D; NFKBIB; PDCD4; ZC3H12A; CMPK2; DAB2IP; CARD17; CDC73; CTR9; PABPN1; SGMS1; TICAM2; TICAM1; LILRB2; PAF1; TNIP2; LILRB1; CACTIN; TRIM41; NLRP7; GHSR; ABCC2; UPF1; NLRP3; GFI1; MYD88; CDK19; NOD2; CHMP5; NFKBIL1; STAP1; PYCARD; HDAC5; PLAA; TRAF6; VDR; PF4; PDCD1LG2; IL36B; NR1H2; CXCL11; CXCL9; DEFA3; IRAK1; NR1I3; IL36A;	GO:0071222~cellular response to lipopolysaccharide	81	163	49.6932515337423	0.00163003436269515	0.0861823754667427	1	1	0.999999999997247	0.999999999997246	0.838771598198738
down	ARNTL; IPO13; LMNA; TPR; PML; FGF9; AKT1; CDKN1A; SYK; TSC2; PTTG1IP; NUTF2; RAN; PPP3CA; MBTPS1; KPNB1; MED1; ELAVL1; HIKESHI; RPAIN; APPL2; IPO4; PPP1R10; PHB2; TXNIP; APPL1; NUP85; CSE1L; NUP107; NUP133; NUP188; FAM53A; NXT1; TNPO2; IPO8; NUP98; NUP62; SPRN; NXT2; HEATR3; NUP93; NUP153; IPO11; IPO5; POM121; IPO7;	GO:0006606~protein import into nucleus	46	79	58.2278481012658	0.00166424069580284	0.087018640580542	1	1	0.999999999997247	0.999999999997246	0.846910564225383
down	ACOD1; IRAK2; KLF4; PSMD10; UFL1; TRIM37; CAT; TRIM21; TNFAIP3; ARRB2; ARRB1; DAP; IRAK1; PRMT2; NLRP12; TMSB4X; TRAF3; MAP2K5; ZC3H12A; DAB2IP; NLRC3; COMMD6; TAX1BP1; COMMD7; NLRC5; PIAS4; NFKBID; SETD6; CACTIN; USP7; SIRT1; ITCH; NLRP3; ERBIN; CHP1; GFI1; CMKLR1; RBCK1; FOXP3; BRMS1; CYLD; NLRP2; NFKBIL1; PYCARD; CARD8; RWDD3;	GO:0032088~negative regulation of NF-kappaB transcription factor activity	46	79	58.2278481012658	0.00166424069580284	0.087018640580542	1	1	0.999999999997247	0.999999999997246	0.846910564225383
down	CCNT1; CCNT2; SP1; POU2F2; GTF2F2; POU2F1; POLR2C; POLR2E; TBP; POLR2A; GTF2E2; GTF2F1; CDK7; CDK9; POLR2H; POLR2J; ZNF143; ELL; POLR2F; NCBP1; SNAPC2; TAF5; SNAPC1; TAF9; SNAPC4; RPRD2; INTS3; INTS5; INTS8; TAF8; RPAP2; INTS1; ZC3H8; SNAPC3; INTS12; INTS4; RPRD1A; SRRT; RPRD1B; INTS7; INTS10; INTS6;	GO:0042795~snRNA transcription by RNA polymerase II	42	70	60	0.00170472958926338	0.0882009353850291	1	1	0.999999999997247	0.999999999997246	0.858417270757095
down	KDM6A; ZMPSTE24; ERCC1; RARA; RARG; ERCC2; ADD1; MTOR; GPD2; ATRX; ADARB1; SP2; ERCC6; NOTCH2; PTPN11; ZFP36L1; SOS1; PDE4D; EP300; TAF10; ATM; FKBP8; ARID5B; TMED2; TARBP2; TAL2; CTC1; GNAS; PLAG1; SLC25A25; ANKRD11; GIGYF2; RBBP6; STK40; WDTC1; WDR48; PPP1R13L; KAT2A; APBA2; CCM2; TBL1XR1; PLEKHA1; RC3H2; SMPD3; DHCR7; HEG1; ATF5; KLF2;	GO:0035264~multicellular organism growth	48	84	57.1428571428571	0.00178574516566699	0.0916129034799611	1	1	0.999999999997247	0.999999999997246	0.891624314732039
down	BECN2; MGRN1; TRAK2; SNAPIN; ADRB2; M6PR; VPS41; RAB7A; SNX16; MTM1; RAB12; SCYL2; ATG14; HOOK3; FAM160A2; DTX3L; TGFBRAP1; HOOK2; SNX27; RILP; TSG101; KIF13A; VPS33B; VPS11; VIPAS39; EPG5; CHMP5; VPS18; STX8; TRAK1; RAB7B;	GO:0008333~endosome to lysosome transport	31	46	67.3913043478261	0.00181018733630101	0.0916129034799611	1	1	0.999999999997247	0.999999999997246	0.891624314732039
down	HNRNPR; HNRNPC; HNRNPA1; GTF2F2; HNRNPL; POLR2C; POLR2E; HNRNPA2B1; POLR2A; PTBP1; HNRNPH1; GTF2F1; HNRNPA3; HNRNPM; POLR2H; POLR2J; HNRNPF; POLR2F; HNRNPK; HNRNPU; NCBP1; HNRNPD; WTAP; PCBP1; PCBP2; WDR74; ATXN2; DDX24; METTL14; LSM1; LSM8;	GO:0016070~RNA metabolic process	31	46	67.3913043478261	0.00181018733630101	0.0916129034799611	1	1	0.999999999997247	0.999999999997246	0.891624314732039
down	SLC9A3R1; KLF4; PHLPP1; PDCD6; CRYBA1; HLA-G; EPHA2; AKT1; ARRB2; DDIT3; TSC2; RACK1; DLG1; PPP2R5C; MTM1; RAPGEF1; DAG1; PPP2R5B; OTUD3; PHLPP2; MAGI2; LEMD2; FLCN; BTN2A2; SIRT1; TRIB3; CIB1; INPP5K; PLEKHA1; SH2B3; BANK1;	GO:0051898~negative regulation of protein kinase B signaling	31	46	67.3913043478261	0.00181018733630101	0.0916129034799611	1	1	0.999999999997247	0.999999999997246	0.891624314732039
down	PDPK1; ROCK2; ULK1; TNKS; OXSR1; PRKCA; PRKACA; TAF1; GRK2; CAD; MAPK1; AKT1; ACVR1B; TGFBR2; MTOR; MAPK8; CLK1; GSK3A; GSK3B; CSNK2B; CDK5; MAP2K1; PRKCD; MAP3K12; CAMK2D; DYRK1A; CDK10; MARK2; PRKD2; HIPK2; WNK1; NLK; STK39; TBK1; CDC42BPG; HIPK4; HIPK1; DYRK1B; CDC42BPB; DYRK2;	GO:0018107~peptidyl-threonine phosphorylation	40	66	60.6060606060606	0.00189153058990399	0.0942181342255334	1	1	0.999999999997247	0.999999999997246	0.916979772205864
down	CTDSP2; GOSR2; TPP1; ASNA1; EXTL3; ERN1; SEC31A; YIF1A; VAPB; LMNA; SRPRA; SULT1A3; HSPA5; PTPN1; SHC1; ADD1; ACADVL; GSK3A; HDGF; ATP6V0D1; ZBTB17; DCTN1; CUL7; PDIA6; PPP2R5B; SYVN1; ARFGAP1; EDEM1; DDX11; TSPYL2; PREB; CXXC1; TLN1; HYOU1; SERP1;	GO:0036498~IRE1-mediated unfolded protein response	35	55	63.6363636363636	0.0019482496218397	0.0965352587491673	1	1	0.999999999997247	0.999999999997246	0.939531230429058
down	PANO1; GIPC1; TRIM24; HDAC3; DPM2; USP19; KRAS; LMNA; CTSA; HSPA8; TPR; MAPK1; NF2; SREBF1; DDOST; USP8; CASP3; CD81; DAD1; KHDRBS1; USP4; TARDBP; PIN1; DDI2; ATF7IP; APTX; CCAR2; DDI1; ADGRV1; KAT2A; USP7; PINX1; NEDD4L; VPS35; HDAC8; QRSL1; VPS11; GNL3L; CDKN2AIP; GGA3; TOMM7; USP36; FBXO4; PYCARD; STUB1; SUGT1;	GO:0031647~regulation of protein stability	46	80	57.5	0.00200276938457278	0.0987198409145665	1	1	0.999999999997247	0.999999999997246	0.960792717645495
down	PQBP1; SNRNP70; SON; HNRNPH1; FUS; CLK1; CLK3; AFF2; HNRNPF; TRA2B; AHNAK; FASTK; ZNF326; MBNL2; METTL4; CELF1; RBM38; MBNL1; MBNL3; CDK12; HNRNPL; HNRNPLL; PTBP2; AHNAK2; PTBP1; PRX; RBM20;	GO:0043484~regulation of RNA splicing	27	38	71.0526315789474	0.00203445462992802	0.0993139183681938	1	1	0.999999999997247	0.999999999997246	0.966574587691827
down	ADGRB1; PER2; SMAD7; PRMT3; N4BP1; UFL1; TNFAIP3; RPS3; U2AF2; DNAJA1; AKT1; ARRB2; MTOR; GCLC; CAMLG; ARRB1; CDK5; PRKCE; UBXN1; USP4; SQSTM1; CRY1; PRR7; GLMN; PINX1; CHP1; HDAC8; GTPBP4; ATG5; SENP2; SIRT7; GNL3L; VPS28; IVNS1ABP;	GO:0031397~negative regulation of protein ubiquitination	34	53	64.1509433962264	0.00203580940019332	0.0993139183681938	1	1	0.999999999997247	0.999999999997246	0.966574587691827
down	MBTPS2; SC5D; SEC14L2; TM7SF2; GGPS1; HMGCR; SP1; FDPS; NFYA; NFYB; SREBF1; FDFT1; FASN; MVD; RAN; HMGCS1; SREBF2; ACACA; NFYC; MBTPS1; KPNB1; CYP51A1; ABCA2; GPAM; DHCR7;	GO:0045540~regulation of cholesterol biosynthetic process	25	34	73.5294117647059	0.00211426455493979	0.101570557096194	1	1	0.999999999997247	0.999999999997246	0.988537366765748
down	GABARAP; SNAPIN; VCP; STX17; GABARAPL2; CLN3; TECPR1; MFSD8; TSG101; VAMP8; MCOLN1; GABARAPL1; VPS33B; MAP1LC3A; RUBCNL; VIPAS39; UVRAG; VTI1B; UBQLN1; CHMP3; WIPI2; SNX14; LIX1; MAP1LC3B2; EPG5;	GO:0097352~autophagosome maturation	25	34	73.5294117647059	0.00211426455493979	0.101570557096194	1	1	0.999999999997247	0.999999999997246	0.988537366765748
down	TOR1B; GAK; CD74; DNAJB1; PTGES3; HSPH1; ERO1A; DNAJC7; BAG1; HSPA2; HSPA1L; HSPA6; DNAJB13; HSPA7; HSPA13; ST13P4; HSPA14; HSPA5; DNAJB5; ST13; ST13P5; DNAJC18; HSPA9; HSPA8;	GO:0051085~chaperone cofactor-dependent protein refolding	24	32	75	0.00214068684348845	0.102320506498862	1	1	0.999999999997247	0.999999999997246	0.995836263502318
down	DDX3X; CCL22; IFIT3; IKBKB; HYAL3; BANF1; PRKRA; DDX58; OAS1; TNF; CYP1A1; IFNW1; ENO1; FGR; IFIT2; IFIT1; SRC; CCL4; TPT1; CCDC130; HMGA1; EIF2AK2; MX1; MX2; BCL3; CFL1; GATA3; OAS2; GTF2F1; IFNAR2; CCT5; ADAR; CXCR4; AP1S1; ACTA2; IFITM3; BCL2L1; BST2; OASL; ZC3HAV1; DDX60; TRIM22; LILRB1; IFI44; RSAD2; IRF7; ISG20; DHX58; HNRNPUL1; IFIH1; FOXP3; IFNK; TBK1; OAS3; IKBKG; IVNS1ABP;	GO:0009615~response to virus	56	104	53.8461538461538	0.00217259088287569	0.103323618671033	1	1	0.999999999997247	0.999999999997246	1
down	IMPA2; INPP4B; INPPL1; PPIP5K2; SYNJ1; PLCH2; NUDT3; CALM1; PLCG2; ITPKA; ITPKB; PLCD1; PLCB2; PLCB3; ITPK1; INPP5A; INPP5J; PPIP5K1; PLCZ1; IP6K1; INPP5D; ITPKC; NUDT11; INPP4A; PLCD4; IPPK; ISYNA1; NUDT4; PLCE1; IP6K2; MINPP1;	GO:0043647~inositol phosphate metabolic process	31	47	65.9574468085106	0.00230341062769779	0.108997390902659	1	1	0.999999999997247	0.999999999997246	1
down	RIOK3; PER1; ESR1; GSTP1; TNFAIP3; RORA; NLRP12; RHOA; RIPK1; HDAC1; CASP8; TNIP1; ZMYND11; RHOH; ZC3H12A; DAB2IP; OTUD7B; NLRC3; TRIM59; NFKBID; CACTIN; TANK; OPTN; SIRT1; CARD19; TRIM39; ASH1L; PYCARD; CARD8; PPM1N;	GO:0043124~negative regulation of I-kappaB kinase/NF-kappaB signaling	30	45	66.6666666666667	0.00239214903133467	0.111025209081616	1	1	0.999999999997247	0.999999999997246	1
down	KMT2D; SETD1A; CNOT4; PF4; EIF6; WDR5; RUNX1; KMT2A; PRKCQ; MEF2C; EP300; HDAC1; RBBP5; HIST2H3A; KMT2E; TNRC6A; KMT2C; NR4A3; KAT2B; SIN3A; PRMT1; DPY30; AGO3; MOV10; TNRC6C; AGO4; AGO1; KMT2B; TNRC6B; L3MBTL1;	GO:0045652~regulation of megakaryocyte differentiation	30	45	66.6666666666667	0.00239214903133467	0.111025209081616	1	1	0.999999999997247	0.999999999997246	1
down	EVI5; CDKL5; TBC1D8; CDKL1; IFT88; TBC1D9B; SDCCAG8; TBC1D10C; IFT20; TBC1D3; CNTROB; DYNC2LI1; TBC1D22A; SYNE2; TBC1D5; USP6NL; SGSM3; TBC1D10A; TBC1D2; ATG5; RABEP2; TBC1D17; CYLD; ATG3; TBC1D22B; TBC1D13; TBC1D14; TBC1D2B; VDAC3; RABGAP1;	GO:1902017~regulation of cilium assembly	30	45	66.6666666666667	0.00239214903133467	0.111025209081616	1	1	0.999999999997247	0.999999999997246	1
down	IRGM; HAX1; AXIN1; RIPK2; CREBL2; LATS1; TCL1B; TGFB1; AVP; TNF; TFRC; RAF1; APP; HSP90AA1; HSP90AB1; ARAF; HCLS1; BRAF; CD44; ATP2B4; CALCR; AKT1; ARRB2; SNCA; PIK3CA; ARRB1; GSK3A; UCN; TCL1A; EIF4G1; STK4; PAK1; CAPRIN2; CNOT9; DOCK7; AKAP9; MAPKAP1; PDCD10; PINK1; PRKD2; TRIM6; TNKS1BP1; SMYD3; TERF2IP; FNIP2; TBK1; MAD2L2; SH2D3C; SH2D3A;	GO:0033138~positive regulation of peptidyl-serine phosphorylation	49	88	55.6818181818182	0.00239318920674658	0.111025209081616	1	1	0.999999999997247	0.999999999997246	1
down	DVL1; TUBG1; PCM1; HOOK3; CCDC13; CHP1; CIB1; FSD1; SLK; PLK3; TUBG2; STMN3; CRIPT; SLAIN2; CEP126; CAMSAP2; TUBGCP4; TUBGCP3; TUBGCP6; TUBGCP5; TUBGCP2; HOOK2; DYNC1H1; CCDC88A; CCDC88C; FIGNL1; FIGNL2; CCDC88B; KATNAL2;	GO:0031122~cytoplasmic microtubule organization	29	43	67.4418604651163	0.00247925286008455	0.114456824721171	1	1	0.999999999997247	0.999999999997246	1
down	IRAK2; RIPK2; PAK3; S1PR2; SOD1; C5; EGF; TNF; CD74; PTPRC; UBB; UBC; TGFB3; BMP2; HGF; C5AR1; DRD4; MAPK3; MAPK1; SHC1; ERP29; MAP2K2; PIK3CB; CRKL; MAP2K3; ARRB1; IRAK1; MAP2K6; CD81; CXCR4; UBE2N; RPS27A; UBA52; NRG1; MAP2K1; PTPN11; MAP2K5; UBE2V1; PEA15; TAB1; MAP3K11; MAPKAPK3; DUSP5; DUSP6; DUSP7; TAOK1; MAPKAPK5; TAB3; FRS2; MADD; P2RX7; NOD2; TAB2; PLCE1; STK39; TAOK2; NOD1; TRAF6; IKBKG; MAP2K4; MUC20; SBK2; MAP2K7;	GO:0000187~activation of MAPK activity	63	122	51.6393442622951	0.00256586696264749	0.117880412303378	1	1	0.999999999997247	0.999999999997246	1
down	STX6; RAB11FIP3; SNX4; EPS15; ARL4C; RAB14; ARF6; SNX17; KIAA1109; CCDC93; VPS53; VPS52; SNF8; VPS50; EHD4; PTPN23; EHD1; EPG5; GGA3; EHD3; VPS29; VPS51; DENND1C; RAB35; RAB11FIP4; SNX3; SNX12;	GO:0032456~endocytic recycling	27	39	69.2307692307692	0.00264392766865817	0.120879862107154	1	1	0.999999999997247	0.999999999997246	1
down	PSMD14; RAD51B; AP5Z1; RAD51C; XRCC3; NBN; REC8; RPA2; SFPQ; YY1; RPA1; RPA3; BRCA1; BRCA2; BLM; UBE2N; ATM; SPIDR; ZSWIM7; ZFYVE26; KDM4D; SWSAP1; RFWD3; MMS22L; SFR1; SMC5; CCDC155; WDR48; HELQ; RNF138; NSMCE2; RBBP8; NUCKS1; RAD21L1; MCM9; MORF4L1; POLL; MCM8; INO80; FAN1; SAMHD1; HUS1; RECQL5; RECQL; WRN; NSMCE1;	GO:0000724~double-strand break repair via homologous recombination	46	82	56.0975609756098	0.00286295153508909	0.128353668373469	1	1	0.999999999997247	0.999999999997246	1
down	PSMD14; TNFAIP3; SHMT2; USP8; BRCC3; ATXN3; OTUD4; YOD1; OTUD7B; USP17L2; USP13; USP7; OTUD5; DESI2; CYLD; BABAM1; ZRANB1; USP25; SPATA2; USP20; USP50; STAMBP; STAMBPL1;	GO:0070536~protein K63-linked deubiquitination	23	31	74.1935483870968	0.00288877127679088	0.128353668373469	1	1	0.999999999997247	0.999999999997246	1
down	LEPROT; HTRA2; ATG13; ARIH2; RAC2; HSPA1L; GSK3A; NPEPPS; UBE2L3; SREBF2; FZD5; HUWE1; UBE2J2; BAP1; FBXW7; RNF31; PINK1; UBL5; VPS11; HPS4; TOMM7; USP36; SAE1;	GO:1903955~positive regulation of protein targeting to mitochondrion	23	31	74.1935483870968	0.00288877127679088	0.128353668373469	1	1	0.999999999997247	0.999999999997246	1
down	TAPBP; SEC24D; SEC31A; SEC24B; HLA-B; HLA-H; HLA-A; HLA-C; HLA-E; HLA-G; CALR; CANX; PDIA3; HLA-F; BCAP31; B2M; TAP1; TAP2; HFE; ERAP2; MR1; ERAP1;	GO:0002474~antigen processing and presentation of peptide antigen via MHC class I	22	29	75.8620689655172	0.00291899854888156	0.128406901632713	1	1	0.999999999997247	0.999999999997246	1
down	POLR1C; CD3EAP; UBTF; ERCC2; POLR2E; TBP; GTF2H1; CDK7; CCNH; POLR2H; POLR2F; ERCC6; GTF2H2; GTF2H3; TAF1C; TAF1A; TWISTNB; TAF1B; GTF2H4; POLR1E; TAF1D; ZNRD1;	GO:0006362~transcription elongation from RNA polymerase I promoter	22	29	75.8620689655172	0.00291899854888156	0.128406901632713	1	1	0.999999999997247	0.999999999997246	1
down	NCBP2L; PRPF40A; NCBP1; PRPF40B; DCPS; RBM22; SRSF9; SRSF7; SART1; CWC15; WBP11; SRSF5; SRSF3; RBM4B; SRSF1; SRSF6; SRSF10; SRSF12; SRSF8; SRSF2; SRSF4;	GO:0045292~mRNA cis splicing, via spliceosome	21	27	77.7777777777778	0.00293067315645246	0.128406901632713	1	1	0.999999999997247	0.999999999997246	1
down	DNM1L; SIAH2; SUV39H1; ROCK2; SP1; DDX5; DRD4; SFPQ; NFYA; KDM5C; MTOR; MAPK8; MAPK9; RACK1; PRKDC; CDK5; NFKB2; CREM; UBE3A; DHX9; TEF; TARDBP; CBX3; DDB1; CRTC1; PASD1; CCAR2; PSPC1; CREBBP; KAT2B; USP9X; USP7; FBXW7; SIN3A; HES7; CIPC; SUV39H2; KDM5B; FBXL3;	GO:0048511~rhythmic process	39	66	59.0909090909091	0.00296766071202215	0.12942829944045	1	1	0.999999999997247	0.999999999997246	1
down	PXDNL; ZC3H12D; EME2; RAD1; DXO; ENDOD1; RAG1; ENPP1; POLG; POLE; G3BP1; WRN; ASTE1; SETMAR; ZRANB3; ZC3H12B; PDE12; TATDN1; DCLRE1A; RAD9B; APTX; N4BP2; PLD3; APLF; REXO1L1P; FANCM; REXO1; PGBD5; EXD3; TSEN15; HMCES; ATAD5; DCLRE1C; PNKP; RAD9A; RBBP8; TREX2; MGME1; PELO; EXO5; APEX2; LAS1L;	GO:0090305~nucleic acid phosphodiester bond hydrolysis	42	73	57.5342465753425	0.00302691009890366	0.131406776036808	1	1	0.999999999997247	0.999999999997246	1
down	HDAC3; NCOR1; HAUS5; TNKS; TUBB; RCC1; RPS3; CSNK1D; GOLGA2; HAUS3; CCDC155; HAUS1; HAUS7; HAUS8; NEK6; HAUS2; STARD9; INO80; MAPRE3; GOLGA8A; GOLGA6D; TUBGCP3; GOLGA8O; SAC3D1; TUBGCP2; GOLGA8N; TUBGCP4; TUBGCP6; MAPRE2; TUBGCP5; MAPRE1; GOLGA6A; GOLGA8B; GOLGA8R;	GO:0051225~spindle assembly	34	55	61.8181818181818	0.00315195721785022	0.135636224629956	1	1	0.999999999997247	0.999999999997246	1
down	CLIC1; ARNTL; PES1; PER2; CDKL5; CCNDBP1; ITGB1; PTPRC; HSPA8; BCR; SON; MX2; NF2; CDK8; RACK1; ADARB1; CDK3; CDKL1; CDK16; CDK18; RBBP4; EP300; TARDBP; SRSF5; BIRC2; BOP1; PUM1; MED1; BAK1; LIN52; FIGNL1; CDKL3; SIRT2; PHACTR4; CDK20; MADD; BAP1; COPS5; MASTL; PRR11; MNT; SPIN2B; CABLES2; CDK19; BEX2; WDR12; HIPK2; ZNF703; YY1AP1; PRDM11; CDK12; L3MBTL1; USP16; FBXL18; SKP2; TSC2; E2F4; FBXL3; FBXL8; JUND; FBXL12; TSC1;	GO:0051726~regulation of cell cycle	62	121	51.2396694214876	0.0031529976139677	0.135636224629956	1	1	0.999999999997247	0.999999999997246	1
down	CLOCK; MBD3; ATF2; TAF1; ARRB1; MECP2; EP300; TAF1L; PHF10; KAT6B; DPF2; CREBBP; KAT6A; KAT2A; SGF29; RSF1; KAT8; GTF3C4; TRRAP; NCOA3; MRGBP; RUVBL1; KAT14; RUVBL2; MORF4L2; MORF4L1; MSL3P1;	GO:0016573~histone acetylation	27	40	67.5	0.00340180683485702	0.145677375045642	1	1	0.999999999997247	0.999999999997246	1
down	OGG1; ERCC1; UBB; UBC; RPA2; ERCC2; RPA1; ERCC5; GTF2H1; RPA3; RFC2; RFC1; RFC5; RBX1; RPS27A; UBA52; CUL4B; GTF2H2; GTF2H3; POLD3; DDB1; CHD1L; GTF2H4; POLD4; POLK; FAN1;	GO:0033683~nucleotide-excision repair, DNA incision	26	38	68.4210526315789	0.00351872028722888	0.150005264857361	1	1	0.999999999997247	0.999999999997246	1
down	AP4M1; PLOD3; ULK1; NPM1; TSC2; MECP2; IST1; HAP1; CD81; SQSTM1; RAB35; DHCR24; MAPRE1; NEDD8; ODF2; CROCC; CEP128; DDX42; CDAN1; STK11IP; NIN; NBEA; CCDC120; WNK4; VPS13A; CEP250; BBS2; CCDC68; SLC9A2; GGA1; AP4E1; MAPRE3; AP4S1; AKAP11; PARD3; TRAK2; HEATR5A; LRRC61; AKAP10; AKAP3; TRAK1; HEATR5B;	GO:0008104~protein localization	42	74	56.7567567567568	0.00362996396459248	0.154053717313467	1	1	0.999999999997247	0.999999999997246	1
down	USP19; TNFAIP3; USP8; USP5; ATXN3; OTUD4; OTUD3; YOD1; OTUD7B; USP17L2; USP34; USP37; BAP1; USP13; USP9X; USP7; OTUB1; OTUD5; VCPIP1; DESI2; CYLD; USP25; USP20; USP50;	GO:0071108~protein K48-linked deubiquitination	24	34	70.5882352941177	0.00373122285659222	0.157644165691021	1	1	0.999999999997247	0.999999999997246	1
down	SLC25A14; CAT; ADSL; UQCRC1; MDH2; UCN; BLOC1S1; OXA1L; SURF1; FXN; ME3; SDHC; PANK2; SIRT3; MTFR1L; MT-ND1; SDHB; MT-CO3; NDUFS8; MT-ND4; COX6A1; MT-CO1; UQCRHL;	GO:0009060~aerobic respiration	23	32	71.875	0.00382138880906124	0.160736105284247	1	1	0.999999999997247	0.999999999997246	1
down	IPO8; TPR; POLR2C; POLR2E; POLR2A; NUP62; NUP153; RANBP2; POLR2H; POLR2J; NUP98; NUP107; POLR2F; EIF4G1; FMR1; NUP160; PUM1; NUP188; HIST2H3A; NUP54; NUP93; TNRC6A; NUP43; NUP35; PUM2; NUP210; NUP133; SEH1L; POM121; NUP58; NUP85; AAAS; AGO2; AGO1;	GO:0060964~regulation of gene silencing by miRNA	34	56	60.7142857142857	0.00388277968712158	0.162444502085277	1	1	0.999999999997247	0.999999999997246	1
