up	MCIDAS; SDCBP; DAPK3; RNF40; RB1; RPA3; IQGAP1; ASCL1; CDK9; PLK1; HNRNPU; PTCH1; TTLL12; RNF20; MAEA; NEK7; GBF1; SIRT1; SRA1; CYLD; ASAH2; THAP1; AATF; FBXO5; MAP3K14; MAP3K4; CDK11B; PAK2; CKS2; STK26; MAP2K4; STK39; PIM2; MAP2K2; MAP3K2; MAP4K4; MAP4K1; MAP2K3; MINK1; MAP3K1; MAP4K2; MAP2K7; PAK3; STRADB; SLK; MAP2K1; TNIK; STK24; RPRM; STK3; MAP2K5; CDC26; MAP4K5; STK4; STK25; TAOK3; STK10; OXSR1; TAOK2; TAOK1; PAK6; PAK4; PAK1; CDK11A; MAP3K3;	GO:0007346~regulation of mitotic cell cycle	65	90	72.2222222222222	0.00187446080387355	0.296000492221321	1	1	0.999069657152916	0.999986162720648	1
up	ARHGAP10; RASSF10; CLIC1; TNFRSF11B; PIK3CD; AGRN; STK25; CCL22; SH2B2; PLPP1; PTPRT; CXCL11; PTGES; MAP2K7; TAAR5; HGS; PPP1R12A; INPP4B; IPO8; TLR3; CAPN5; CLOCK; P2RX6; PLXNB1; THAP12; AKAP10; PSTPIP1; NCK2; PRKAB2; OR1F1; TYROBP; GMFG; SH3BP5; DOK2; ADCY9; LPXN; HPGDS; OPHN1; SRGAP2; ICOSLG; FLNB; NR1I2; SKAP2; TOM1L1; RHBDL1; TNFSF13; NCR1; PDE5A; PDE9A; NFAT5; DIRAS1; TNFSF15; RASAL1; IPO7; CNIH1; PCNT; CXCL14; CLIC3; GUCA1C; NCR2; PEX11B; PAK4; ACTL6A; EGFR; LALBA; PLAU; C3; HRAS; EGF; TGFA; OXT; AVP; POMC; LHB; GAST; LTA; HLA-DRB1; CXCL10; OPN1LW; RAF1; PLA2G1B; ERBB2; GNAI2; CHGB; PRKCB; CCK; S100A6; GPI; NPM1; CSF1R; LYN; IGF1R; CHRM4; NR3C2; MET; FGF4; IGFBP1; ANXA4; GIP; ADORA3; CGB3; CALCB; RARA; SPP1; NR2F6; KIT; IAPP; CHRM1; CHRNB1; RALA; BCR; VDR; FGF3; IGF2R; CDK4; SRC; BMP1; IL2RB; RAC2; IFNGR1; SPN; CREB1; STMN1; SMPD1; IGFBP2; ATF6; EPOR; CD53; CD33; CHRM3; MX1; ITGAL; RASA1; MDK; ERBB3; CCL1; IGFBP4; RPS6KB1; ITPKA; IL4R; NR2F2; AKAP5; FPR3; FAS; KLRC2; PDE4A; ITPKB; MAPK1; GRN; IMPA1; LTK; CASP1; CRABP1; GNA11; CHRNA5; LRPAP1; SRI; AKT1; AKT2; IL2RG; SFN; FCGR2B; CHRNA3; CSF2RB; CD70; LSP1; BTC; PHB; ADM; DEK; IGFALS; GNL1; LTBR; PPARG; GDNF; CD79B; NBL1; ELK3; ASIP; STAT6; ARHGAP25; PIK3CB; PI4KA; IL12RB1; GUCA1A; RANBP1; MAP2K4; RANGAP1; MAP2K3; IQGAP1; RAP1GAP; OMP; OR1G1; XCL1; FASLG; SOX9; CSNK1A1; PXN; CSNK1E; PGF; HINT1; GNG10; GDI2; DNM2; TNFSF10; BCAM; P2RX1; CCL11; CCR6; CLCN6; GPR143; RPS6KA3; HDGF; TDGF1P3; VAV2; COPA; LIMK1; PRKAG1; MANF; AFDN; PRMT2; CCL23; CCL18; GFER; TPTE; HUNK; SOX8; GMFB; RAP2B; HNRNPK; GNB1; YWHAZ; SH3BP2; IGBP1; GTF2I; DLG4; CSNK1G2; CCL7; CXCL6; HAMP; TNFAIP6; MPP1; CD83; CAP1; MAP2K1; RASSF7; TLE3; CD164; MST1R; PRKCD; LTB; SOS1; LGALS3BP; VAC14; PLCXD2; BST1; AIMP1; TRAF2; ANK3; STK4; TRAF3; PRKAA1; PPFIA1; MAP2K5; MAPK7; PAK2; STK3; PRKG2; ATM; MTA1; ITGB3BP; PPP2R5C; PDAP1; TMED1; ROCK1; PNOC; CAMK2B; NAE1; ITPK1; IQGAP2; OR5I1; RIN1; ACVR2B; ALCAM; ARFRP1; RAPGEF1; RASGRF1; ARHGEF7; PTK2B; GNA13; GAS6; ITPR2; INSL4; RASA3; PPP2R5D; NR1I3; GAPVD1; ARHGAP19; SNX17; PPP2R5A; PTGES3; PTPRK; RASA2; TLR1; RPS6KA1; TRADD; TRIP10; NFKBIB; PMCHL1; CNGA3; EXT1; PKN1; PKN2; PPP2R5E; MAPK14; CARTPT; ECM1; MAPKAPK3; MAPK6; MIA; DGKD; TXNRD1; ARHGAP44; ARHGAP11B; ANKDD1A; ERFE; SFRP5; ARHGAP21; ARHGAP40; METRNL; ARHGAP17; SIGIRR; RGMB; RASL11A; ENHO; LMBR1L; VSTM1; ARHGAP36; RASSF6; ARHGAP27; TOM1L2; RAPH1; RASGRP2; ZFYVE16; MAVS; APBB1IP; PLEKHH3; ADGRA1; RASSF3; THNSL2; MAPKAPK5; ARHGAP12; RTKN2; CMTM8; TAGAP; TMEM102; APPL2; LILRB4; STOML3; CMTM2; RIN3; CD200R1; DLG5; MICAL1; PPP4R1; SECTM1; ARAP3; FAM3C; NSMAF; CREBBP; INPP5D; TANK; OSTF1; CDS1; RIT1; TNFRSF25; EXT2; P2RX5; OPTN; SIPA1; THOC1; HSH2D; SNX27; MRGPRX1; AGAP3; ARAP1; INPP4A; ASB2; SCGB3A1; HHIP; ERBIN; P2RX4; CCL13; DOK1; KIR2DL4; SMAD5; PIP5K1A; MYD88; ATF6B; SH3GL1; SH3GL2; GDF15; AKAP9; ARHGAP9; RTKN; TRAIP; TRIM54; PPP1R12C; CD244; ARHGAP39; TOLLIP; WWP1; ING2; RASSF4; RABEP2; IL21; RETN; FGF20; CABP2; CD320; KIF13B; DLL4; PYY2; CDC42SE1; ARHGAP35; FGF21; PAG1; FAM13B; SIGLEC8; CALML5; CALCOCO1; ARHGAP23; XCL2; PI4KB; GNG12; RPS6KB2; PPP1R1B; SERGEF; IL17B; FEZ2; OSGIN1; RPS6KA6; APPL1; CASP8AP2; AMFR; MKLN1; CORO1C; NENF; ARHGAP26; COPS3; CTNND2; OSGIN2; NOD1; CLEC11A; CCL26; PLAA; TNFSF13B; PKIG; ARL2BP; STARD13; SIT1; PRKAB1; IRS2; CD2AP; CDC42BPB; TNFRSF18; STK24; CSNK1G3; TNFRSF11A; HTR3A; SCUBE1; GLRA3; GABRG2; ZYX; GABRA6; GLRA2; CBLB; CD86; GABRR3; HTR3E; NDRG1; PLPP5; GABRA2; GABRQ; CHRNA9; GABRG3; TIPRL; LMBR1; CHRFAM7A; MAGI1; GSK3A; MAGI3; HTR3C; GABRA3; PRKX; IMPA2; GABRA4; HTR3D; CHRNA10; GABRP; PLPPR1; GABRB2; GABRB3; CBL; CHRNB3; GABRB1; SLC39A4; GSK3B; NDRG3; GABRA5; CHRNA1; GABRA1;	GO:0007165~signal transduction	512	989	51.7694641051567	0.00188190922565512	0.296000492221321	1	1	0.999076730462818	0.999986162720648	1
up	MFGE8; IGHV3-11; IGHV7-81; IGHV3-74; IGHG1; IGHV1-69; IGLL5; IGHV3-30; IGHV1-2; IGHV4-4; IGHV1OR21-1; IGHV3-43; IGHV4-28; TRDC; IGLC6; IGHV1OR15-9; IGHV3OR16-13; IGHV3OR16-12; IGHV1-46; IGHV3-64; IGHV3-66; IGHV3-16; IGHV3-72; IGHV1-45; IGHV3OR15-7; TRBC2; IGHA2; IGHA1; IGHV1-3; IGHV3-35; IGHV1-18; IGHG4; IGHV3-15; IGHV3OR16-10; IGHV3-49; IGHV1-69-2; IGHV3OR16-9; IGHV3-20; IGHV3-21; IGLC7; IGLC3; IGHE; IGHV3-23; IGHV3-13; IGHV2-70; IGHV3-53; IGHV3OR16-8; IGHG3; IGHV3-38; IGHV3-7; IGHV1-58; IGHV4OR15-8; IGHV4-61; IGHM; IGLL1; IGHV1OR15-1; IGHD; IGHV2-26; TRBC1; IGHV5-51; IGHV3-73; IGLC2; IGKC; IGHV6-1; IGHV4-31; IGHV3-48; IGHV1-24; IGHV4-59; IGHV4-34; IGHV3-33;	GO:0006910~phagocytosis, recognition	70	99	70.7070707070707	0.00189752519180486	0.296000492221321	1	1	0.999091038450909	0.999986162720648	1
up	POLR2D; AQR; ERCC1; UBB; UBC; PCNA; RPA2; LIG1; POLR2C; POLR2E; TCEA1; POLR2A; RPA1; POLD1; ERCC5; GTF2H1; RPA3; RFC4; RFC2; RFC1; POLR2I; RFC5; RFC3; POLD2; CDK7; POLR2H; POLR2J; POLR2K; POLR2F; POLR2G; POLR2L; RBX1; RPS27A; UBA52; ERCC6; EP300; GPS1; CUL4B; GTF2H2; GTF2H3; POLD3; DDB1; UVSSA; GTF2H5; COPS6; GTF2H4; COPS5; USP7; ZNF830; COPS4; POLD4; ISY1; PRPF19; PPIE; COPS3;	GO:0006283~transcription-coupled nucleotide-excision repair	55	73	75.3424657534247	0.00211414054260228	0.320229087912775	1	1	0.999307931787337	0.999986162720648	1
up	MRPS12; MRPS14; MRPL33; ERAL1; MRPL3; DAP3; MRPL12; MRPS22; MRPS25; MRPS10; MRPS5; MRPS15; MRPS21; MRPS9; MRPL28; MRPL49; MRPL58; OXA1L; MRPL23; MRPL2; MRPL14; MRPL21; MRPL55; MRPL10; MRPL52; MRPL41; MRPL50; MRPL43; MRPL30; MRPS27; MRPS31; GFM2; MRPL24; MRPL34; MRPL57; MRPL45; MRPL20; MRPL9; MRPL4; MRPL1; MRPL37; MRPL18; MRPL44; MRPL47; MRPS30; MRPL40; MRPL17; MRPS18A; AURKAIP1; MRPL22; MRPL16; MRPL39; MRPL35; MRPL15; MRPL36; MRPL27; MRPS28; MRPS17; MRPS7; MRPL11; MRPS16; MRPS18C; MRPS23; MTRF1;	GO:0070126~mitochondrial translational termination	64	89	71.9101123595506	0.00217322042851475	0.320229087912775	1	1	0.999367768656315	0.999986162720648	1
up	KIF2A; KIF3B; DYNC1LI2; AP1G1; CTSV; DCTN3; SEC24D; SEC31A; SEC24A; SEC24B; AP2A1; HLA-DRA; HLA-DRB1; HLA-DQB1; CD74; HLA-DQB2; CTSD; CLTA; HLA-DOB; CTSE; LAG3; HLA-DPA1; CANX; HLA-DMB; FCGR2B; ACTR1B; CAPZA2; CAPZB; DNM2; RAB7A; KIF11; CAPZA1; AP2S1; SEC13; ACTR1A; AP1S1; AP2B1; DYNLL1; ARF1; CLTC; KIF23; KLC1; AP1B1; KIF5A; DYNC1I2; DCTN2; DYNC1H1; KIF22; SEC23A; HLA-DRB5; KIF18A; AP2M1; DYNLL2; CAPZA3; RILP; AP1S3; LGMN; KIF2C; SH3GL2; DCTN5; AP1M1; OSBPL1A; RACGAP1; ACTR10; DCTN4; TRAF6; SAR1B; DYNC1LI1; FCER1G;	GO:0019886~antigen processing and presentation of exogenous peptide antigen via MHC class II	69	98	70.4081632653061	0.0021916095086274	0.320229087912775	1	1	0.999382061673601	0.999986162720648	1
up	TGM5; KRT86; PPL; KRT33A; KRT34; KRT36; KRT37; KRT38; KRT75; CSTA; KRT14; KRT6A; KRT6B; KRT1; CAPNS1; KRT18; KRT8; CAPN1; KRT19; KRT16; FURIN; KRT3; KRT10; KRT13; JUP; DSP; KRT15; KRT4; PI3; SPRR1B; SPRR2D; CASP14; SPRR1A; SPRR2B; SPRR2A; KRT9; KRT20; KRT2; KRT6C; KRT83; KRT85; KRT76; DSG1; DSC2; KRT17; DSG2; KRT33B; KRT32; KRT81; KRT72; KRT31; PRSS8; LCE1A; KAZN; KRT40; KRT80; RPTN; KRT74; KRT28; KRT77; DSG4; KRT78; EVPL; PERP; SPRR2F; KRT12; PKP2; TMEM79; LCE3D; SPRR2G; KRT23; KRT84; KRT82; SPRR3; KLK13; PKP3; ST14;	GO:0070268~cornification	77	113	68.141592920354	0.0023817311852028	0.343037340131637	1	1	0.999575170911925	0.999986162720648	1
up	DDX39A; CASC3; CDC40; SLU7; EIF4E; TPR; HNRNPA2B1; U2AF2; NUP62; NUP153; RANBP2; AGFG1; NUP98; SEC13; NUP107; MAGOH; EIF5A; RAE1; SRSF3; SRSF2; HHEX; SRSF11; SRSF4; NCBP1; CPSF1; NUP160; SRSF9; SRSF5; THOC5; DDX39B; SLBP; SRSF7; NUP188; THOC7; THOC6; SRRM1; RBM15B; NUP43; NUP37; THOC2; NUP210; NUP133; SMG7; DHX38; SYMPK; UPF1; THOC1; POM121; THOC3; YTHDC1; SMG1; FYTTD1; NDC1; NUP85; POLDIP3; UPF3B; WDR33; NXF2; NXF3; UPF2; CPSF2; NXF1; CPSF3; NXT1; NUP50; SMG5; CHTOP; RBM8A; GLE1; MCM3AP;	GO:0006406~mRNA export from nucleus	70	101	69.3069306930693	0.00270571697006905	0.384211809749805	1	1	0.99989765612644	0.999986162720648	1
down	DSCAM; MPZL2; PCDH8; CEACAM5; RET; CEACAM1; PECAM1; PTPRM; CEACAM6; CDH13; PKD1; DSC1; DSC3; SDK2; IGSF11; AMIGO2; AMIGO1; KIRREL3; CADM3; PCDH19; DCHS1; PCDH15; PCDHB18P; CLSTN3; CADM1; PCDHAC1; CLSTN2; PCDH18; CELSR2; CELSR1; CELSR3; FAT2; PCDH10; CD84; CDH22; PCDHB10; PCDHGC3; PCDHA6; PCDHA4; PCDHA12; PCDHB7; PCDHB5; PCDHB14; PCDHB11; PCDHB1; PCDHGB7; PCDHGB3; PCDHGB2; PCDHGA8; PCDHGA7; PCDHGA6; PCDHGA2; PCDHGA10; PCDHGA1; PCDHA9; PCDHA8; PCDHA3; PCDHA2; PCDHA13; PCDHA11; PCDHA10; PCDHAC2; ROBO1; CNTN2; CDH15; NECTIN4; CNTN4; MYOT; PVR; CDH4; CDH18; L1CAM; CDH23; CDH11; ROBO4; IGSF21; CDH7; CDHR3; HMCN1; CDH2; MYPN; CDH8; CDH9; CDH12;	GO:0007156~homophilic cell adhesion via plasma membrane adhesion molecules	84	165	50.9090909090909	0.00285786315202019	0.965059936037424	1	1	0.99999999999447	0.99999999999447	1
up	IGKV2-28; IGKV2D-30; IGKV3D-20; IGLC7; IGKV2-29; CD5L; CFB; C3; IGKV1D-33; IGKV1-33; IGKV1-39; IGKV1-17; IGKV1D-16; IGKV1-5; IGKV1D-12; IGKV2D-40; IGKV2D-28; IGKV3-20; IGKV3-15; IGLV1-44; IGLV1-47; IGLV1-51; IGLV1-40; IGLV2-14; IGLV2-8; IGLV3-19; IGLV3-25; IGLV3-27; IGLV6-57; IGHV1-69; IGHV1-46; IGHV3-11; IGHV3-48; IGHV3-23; IGHV3-13; IGHV3-53; IGHV3-30; IGHV3-33; IGHV3-7; IGHV2-70; IGHV4-59; IGKC; IGHG1; IGHG3; IGHG4; C1QA; C1QB; IGLV7-43; IGKV1-16; IGKV1D-39; IGKV3-11; IGKV2-30; IGKV4-1; IGKV5-2; IGHV4-34; C2; C8A; C8G; CD55; IGLC6; IGLC2; IGLC3; CPN1; CD19; CD46; CR1; CR2; C4BPB; IGHV1-2; CFHR2; CD81; IGLV3-21; C1QBP; C3AR1; PHB2; CFHR5;	GO:0030449~regulation of complement activation	76	113	67.2566371681416	0.00321541630083699	0.440745339617719	1	1	0.999986162720649	0.999986162720648	1
up	WASL; DNM1L; KPNA3; SLC9A3R1; LIN7A; CLGN; MDM4; FANCA; TAPBP; ZW10; GPAA1; PPIH; WIPF1; NUPR1; LPXN; PEX14; SKAP2; FGA; CD74; TP53; CD3E; VIL1; CD3G; EPB41; IL2RB; HMGA1; APC; FAS; CD40; MAPK3; TEAD1; GCHFR; PPP2R1A; OTX2; WAS; CAPZA2; SOX9; CAPZA1; NCKAP1L; SH3BGR; BID; MAX; VAMP2; DLG4; TFAP4; KMT2A; PPID; TRAF2; TRAF1; AIMP2; PTK2B; HES1; OXA1L; VAMP3; OCLN; HFE; HES5; RIMS1; WDR19; REPS2; DLG5; NUP210; PARD3; CHCHD10; CREBBP; MAGI1; RANBP9; NAPG; TUBGCP2; CARD10; SSBP3; NIFK; PARD6B; IL1RAP; MDN1; PPARGC1A; ZNF148; NDUFAF1; CD2AP; SNX9; IKBKG; SAMM50; ST13; AFG3L2;	GO:0065003~protein-containing complex assembly	84	128	65.625	0.0033069159587813	0.440745339617719	1	1	0.999986162720649	0.999986162720648	1
up	PSMD12; PSMD14; AZIN1; PSMD3; PSMD10; OAZ2; INS; ODC1; NQO1; PSMC3; PSMB1; PSMA1; PSMA3; PSMA4; PSMB9; PSMA5; PSMB4; PSMB6; PSMB5; PSMC2; PSMB10; PSMC4; PSMD8; PSMB3; PSMB2; PSMD7; OAZ1; PSMD4; PSMA6; PSME3; PSMC1; PSMC5; PSMC6; PSME1; PSMD2; PSMA8; PSMF1; PSMB7; PSMD1; PSME2; PSMD13;	GO:0006521~regulation of cellular amino acid metabolic process	41	51	80.3921568627451	0.00333886573585618	0.440745339617719	1	1	0.999986162720649	0.999986162720648	1
up	PSMD12; PSMD14; CHUK; PSMD3; PSMD10; PSMC3; PSMB1; PSMA1; PSMA3; PSMA4; PSMB9; PSMA5; PSMB4; PSMB6; PSMB5; AKT1; PSMC2; PSMB10; PSMC4; PSMD8; PSMB3; PSMB2; PSMD7; PSMD4; PPP4C; PSMA6; PSME3; PSMC1; PSMC5; PSMC6; SKP1; NFKB2; RELB; PSME1; PSMD2; BIRC3; BIRC2; IKBKE; PSMA8; PSMF1; PSMB7; PSMD1; MAP3K14; PSME2; PSMD13; DICER1; RELA; NFKB1;	GO:0038061~NIK/NF-kappaB signaling	48	63	76.1904761904762	0.00334774141432603	0.440745339617719	1	1	0.999986162720649	0.999986162720648	1
up	PSMD12; PSMD14; IKBKB; CHUK; IRAK2; PSMD3; ST18; RPS6KA5; RPS6KA4; PSMD10; UBB; UBC; PSMC3; IL1RN; NFKB1; PSMB1; PSMA1; PSMA3; PSMA4; MAPK3; PSMB9; PSMA5; PSMB4; PSMB6; PSMB5; PSMC2; PSMB10; PSMC4; PSMD8; PSMB3; PSMB2; IRAK1; PSMD7; PSMD4; PSMA6; PSME3; PSMC1; PSMC5; PSMC6; RBX1; RPS27A; UBA52; SKP1; RELA; PSME1; PSMD2; SQSTM1; TAB1; TAB3; TNIP2; PSMA8; PSMF1; PSMB7; PSMD1; MAP3K3; MYD88; TOLLIP; PELI2; IL1RAP; IRAK4; TAB2; PSME2; PSMD13; NOD1; TRAF6; IKBKG;	GO:0070498~interleukin-1-mediated signaling pathway	66	95	69.4736842105263	0.00336613679335096	0.440745339617719	1	1	0.999986162720649	0.999986162720648	1
up	NUDT19; AGPS; PEX7; ACOT8; PHYH; GNPAT; ACOX3; PEX14; ECI2; IDH1; CAT; ACAA1; UBB; UBC; IDE; DAO; SCP2; PEX2; HMGCL; CRAT; ACOT2; PEX5; HSD17B4; UBE2D3; UBE2D2; RPS27A; UBA52; ECH1; PEX6; BAAT; ACOX1; TYSND1; ZFAND6; PEX26; ACOT4; PEX13; USP9X; ACOX2; DDO; DHRS4; PECR; DECR2; PIPOX; AMACR; HACL1; HAO1; CROT; GSTK1; PEX16;	GO:0006625~protein targeting to peroxisome	49	65	75.3846153846154	0.00353987269092926	0.44611245587436	1	1	0.999986162720649	0.999986162720648	1
up	TLR4; IKBKB; CHUK; TLR3; IRAK2; ROCK2; TNF; CD14; UBB; UBC; TNFRSF1A; BCL3; AKT1; RPS27A; UBA52; BTK; TRAF2; ROCK1; BIRC3; BIRC2; RIPK1; TRADD; TAB1; TIFAB; NLRC3; TICAM1; TAB3; TNIP2; SNIP1; RNF31; MAP3K14; CARD11; RBCK1; SHARPIN; CARD9; TAB2; NKIRAS2; HACD3; TBK1; TRAF6; IKBKG; LY96; TANK; TIFA; NFKBIL1; NFKB2; TLR9; NFKB1; RELA; RELB;	GO:0007249~I-kappaB kinase/NF-kappaB signaling	50	67	74.6268656716418	0.00373177314294559	0.456201283659819	1	1	0.999986162720649	0.999986162720648	1
up	IGKV2-28; IGKV2D-30; IGKV3D-20; IGLC7; IGKV2-29; CFB; C3; IGKV1D-33; IGKV1-33; IGKV1-39; IGKV1-17; IGKV1D-16; IGKV1-5; IGKV1D-12; IGKV2D-40; IGKV2D-28; IGKV3-20; IGKV3-15; IGLV1-44; IGLV1-47; IGLV1-51; IGLV1-40; IGLV2-14; IGLV2-8; IGLV3-19; IGLV3-25; IGLV3-27; IGLV6-57; IGHV1-69; IGHV1-46; IGHV3-11; IGHV3-48; IGHV3-23; IGHV3-13; IGHV3-53; IGHV3-30; IGHV3-33; IGHV3-7; IGHV2-70; IGHV4-59; IGKC; IGHG1; IGHG3; IGHG4; C1QA; C1QB; IGLV7-43; IGKV1-16; IGKV1D-39; IGKV3-11; IGKV2-30; IGKV4-1; IGKV5-2; IGHV4-34; C2; C8A; IGLC6; IGLC2; IGLC3; MBL2; IGHV1-2; IGLV3-21; COLEC11; COLEC10;	GO:0006956~complement activation	64	92	69.5652173913043	0.00375567412653888	0.456201283659819	1	1	0.999986162720649	0.999986162720648	1
up	VPS37C; HGS; PRKAB2; ATG13; VPS4B; STAM2; ATG12; TOMM70; MFN2; GABARAP; ATG7; TOMM40; SRC; PRKAG1; VCP; GABARAPL2; DYNLL1; PRKAA1; TCIRG1; SQSTM1; MTMR3; BECN1; NBR1; WIPI1; ACBD5; YOD1; ATG16L1; ATG14; VPS36; VPS37D; FUNDC1; MTMR14; PIK3C3; RB1CC1; TBC1D5; HDAC10; MVB12A; DYNLL2; CHMP6; SNF8; PGAM5; PIK3R4; TSG101; ATG101; PINK1; UBXN6; AMBRA1; GABARAPL1; ATG5; CHMP4B; MAP1LC3A; VTA1; TOMM22; ATG3; PRKAG3; VPS28; VPS4A; CHMP2B; PLAA; CHMP3; PRKAB1; ATG4B; WIPI2; MAP1LC3B2; EI24;	GO:0016236~macroautophagy	65	94	69.1489361702128	0.00387948876453903	0.462913989180523	1	1	0.999986162720649	0.999986162720648	1
up	HMX2; NKX2-6; PRAMEF25; CDC7; SDCBP; E2F3; ADAM10; KMT2D; TBX3; PRC1; PRAMEF10; PRAMEF4; PRAMEF2; PRAMEF11; DNAJA2; LRP5; CDC123; TNFSF13; ALDH1A2; UFL1; CLDN7; PRAMEF1; PRAMEF12; STAMBP; NTN1; FGFR1OP; TBC1D8; SLC25A27; SYF2; EGFR; TIMP1; CST3; HRAS; KRAS; EGF; TGFB1; AVP; CGA; FSHB; VIP; GHRH; INS; KRT6A; CXCL10; PLA2G1B; PDGFA; CSF2; CAPNS1; GNAI2; SLC25A5; EDN1; ITGB1; INSR; CCK; NPM1; ITGAV; CSF1R; CAPN1; LYN; IGF1R; GLI1; FGF4; HCK; IL6R; ADRA2A; PKHD1; CSF1; CTSH; RARA; TGFB3; KIT; FGF6; FGF3; CDK4; ODC1; IL7; TDGF1; HCLS1; LIF; RAC2; IL9; EPCAM; ZNF16; XBP1; POU3F3; IL11; PTN; EPHA1; FGFR2; FGFR3; DPP4; CALR; POU1F1; PTPN6; SERPINB3; PRDX3; CCND2; CDC25B; ALDH3A1; AKT1; AKT2; VIPR1; TTK; SHMT2; ADM; FLT4; TGFBR2; GDNF; IL6ST; CASR; CD86; SSR1; CRKL; CDKN1B; NOTCH1; RPS9; FASLG; SOX9; MARCKSL1; ARRB1; UBE2A; PGF; MECP2; EFNB2; PDX1; NKX2-5; MVD; PGGT1B; EMP2; MAZ; TCL1A; HDAC4; CD81; PTEN; IL2; ROMO1; RPS15A; CNBP; RPS4X; RPL23; EIF5A; SRPK2; PRAME; RHOG; PURA; HSF1; NRG1; RELA; MST1R; EGR4; PTK2; BCL2L1; FOXM1; CD47; BST1; STX4; DLG1; TSPAN31; TIAM1; PRKAA1; BAMBI; PAK1; STX3; TCIRG1; HDAC1; CUL3; LAMC2; KLF5; CDK13; COX17; PTK2B; HES1; HLX; NOLC1; SUZ12; EZH2; AKIRIN2; EAPP; PRAMEF14; PRAMEF19; RNF187; HES5; PRAMEF20; PRAMEF17; PRAMEF18; PRAMEF15; PRAMEF13; PRAMEF6; TNS3; IL34; NCCRP1; SCX; CARM1; CACUL1; HIPK1; DYNAP; OSR2; SLC35F6; FTMT; AQP11; MAPK15; TRPM4; DOT1L; MZB1; BRK1; PHIP; HDAC2; TSLP; TBRG4; NUDT16; SIRT1; CDCA7L; CNOT6L; KIF20B; NACC1; LGMN; S100A13; CDX2; CIB1; PRMT1; WDR77; SLC25A33; PDCD10; TIPIN; SSBP3; ROGDI; DERL2; HIPK2; KDM4C; GAREM1; ZNF703; IL21; PDF; ARNT2; CBX8; MLXIPL; FGF20; ESM1; BIRC6; SPHK2; FGF21; ACER3; GID8; SIRPG; ASH2L; CNOT8; CNOT7; FBXO5; MCTS1; CNOT6; HSF4; FZR1; CEP131; GAB2; CLEC11A; CHTOP; IRS2; HILPDA; TNFRSF11A; ERBB2; ERBB3; REG3A; TGFA; BTC; PROK2; RTKN2;	GO:0008284~positive regulation of cell population proliferation	266	490	54.2857142857143	0.00390276622498953	0.462913989180523	1	1	0.999986162720649	0.999986162720648	1
up	PSMD12; PSMD14; BACH1; PSMD3; PSMD10; UBB; UBC; PSMC3; PSMB1; PSMA1; PSMA3; PSMA4; ARNT; PSMB9; PSMA5; PSMB4; PSMB6; PSMB5; PSMC2; PSMB10; VHL; PSMC4; PSMD8; PSMB3; PSMB2; PSMD7; PSMD4; PSMA6; PSME3; PSMC1; PSMC5; PSMC6; RBX1; RPS27A; UBA52; PSME1; EP300; PSMD2; CUL2; CA9; PSMA8; PSMF1; CREBBP; EGLN2; PSMB7; PSMD1; EGLN1; EGLN3; HIF1AN; PSME2; PSMD13; HIGD1A;	GO:0061418~regulation of transcription from RNA polymerase II promoter in response to hypoxia	52	71	73.2394366197183	0.00411353050096119	0.482239703612683	1	1	0.999986162720649	0.999986162720648	1
up	FZD9; PSMD12; ARNTL; PSMD14; DDX3X; AXIN1; PSMD3; DAPK3; TBL1X; PSMD10; UBR5; CTDNEP1; EGFR; EGF; TGFB1; COL1A1; SRC; JUP; PSMC3; NFKB1; PSMB1; FGFR2; CDH3; PSMA1; PSMA3; PSMA4; PSMB9; PSMA5; PSMB4; PSMB6; PSMB5; PPM1A; PSMC2; PSMB10; USP8; PSMC4; PSMD8; CSNK1D; PSMB3; PSMB2; PSMD7; PSMD4; VCP; PSMA6; PSME3; PSMC1; PSMC5; PSMC6; UBE2B; SMAD3; XIAP; PSME1; BAMBI; PSMD2; SEMA5A; FAM53B; KANK1; LRRK1; WLS; RNF220; TMEM198; USP34; NRARP; SULF2; CCAR2; PSMA8; TRPM4; PSMF1; FRAT1; ZBED3; USP47; VPS35; PSMB7; PSMD1; TBL1XR1; WNK1; SMURF2; LGR6; NLE1; GID8; GSKIP; PSME2; PSMD13; RUVBL1; AXIN2; WNK2; BIRC8; CSNK1G3; LYPD6; PPM1N; CSNK1G2;	GO:0090263~positive regulation of canonical Wnt signaling pathway	91	144	63.1944444444444	0.00496077958907171	0.568347497920693	1	1	0.999986162720649	0.999986162720648	1
up	PIK3CD; PIK3R2; PITPNM1; PIK3C2B; CDIPT; PIP5K1B; SYNJ2; INPP4B; INPPL1; SYNJ1; PIP5K1C; PIK3C2G; SBF1; PLCG2; RAB4A; RAB5A; IMPA1; PIK3CA; PIK3CB; PI4KA; PIP4K2A; PIK3CG; PTEN; RAB14; ARF3; ARF1; VAC14; MTM1; MTMR1; MTMR2; MTMR3; INPP5J; SLC27A1; MTMR14; PIK3C3; PIP4K2C; PI4K2B; FIG4; INPP5D; CDS1; SH3YL1; PLEKHA8; INPP4A; RUFY1; PIK3R4; PIP5K1A; MTMR12; PLEKHA2; PLEKHA1; INPP5E; SACM1L; MTMR4; PI4KB; PIKFYVE;	GO:0006661~phosphatidylinositol biosynthetic process	54	76	71.0526315789474	0.0054230240664852	0.61093566442922	1	1	0.999986162720649	0.999986162720648	1
up	PES1; MPHOSPH10; NOP56; WDR46; NVL; RRP9; DKC1; RPP40; RPS17; RPS2; RPL35A; RPL7; FBL; RPS27; RPL5; RPS9; RPL14; SNU13; YBEY; RPL26; RPL27; RPS7; RPS16; RPS14; RPS6; RPS15; RPS24; RPS28; RPP38; RNASEL; TBL3; EXOSC2; C1D; BOP1; PDCD11; BMS1; NOLC1; EXOSC7; PWP2; EXOSC6; WDR74; ERI1; DHX37; DDX17; EMG1; RRP36; IMP4; DDX27; MPHOSPH6; RPP25; WDR18; NOC4L; WDR12; REXO4; XRN2; SENP3; WDR55; NOL11; ISG20L2; EXOSC4; EXOSC5; UTP3; DCAF13; LYAR; DDX56; CHD7; WDR3; PA2G4; DDX52; WBP11; FCF1; UTP11; RRP7A; SBDS; EXOSC1; LAS1L; UTP18; DDX49; POP5; DDX54; RPF1; EBNA1BP2; POP4; MDN1; RRP1; RRP1B; MRTO4; ESF1;	GO:0006364~rRNA processing	88	139	63.3093525179856	0.00545370063465878	0.61093566442922	1	1	0.999986162720649	0.999986162720648	1
up	ARHGAP10; ARHGAP32; MYO9A; RHOD; PIK3R2; ARHGEF11; SIPA1L3; OPHN1; SRGAP2; TRIO; PLEKHG5; RHOC; BCR; RAC2; VAV1; ARHGAP25; RAP1GAP; TSC2; GDI2; ARHGDIA; ARHGDIB; VAV2; CHN2; CDC42; RHOA; RAC1; RHOG; ARHGAP4; SOS1; SOS2; ARHGAP1; ARHGEF5; ABR; TIAM1; ARHGAP5; MYO9B; ARHGEF7; GNA13; ARHGAP19; ARHGEF6; RALBP1; TRIP10; RHOH; ARHGAP44; RALGAPA2; ARHGAP11B; FGD3; ARHGAP21; ARHGAP40; RAP1GAP2; ARHGAP17; RALGAPA1; ARHGAP36; ARHGEF18; RHOU; ARHGAP30; RALGAPB; TIAM2; ARHGEF19; ARHGAP12; RHOT2; RHOT1; TAGAP; ARHGAP18; DEPDC1B; ARAP3; ARHGAP45; ARHGEF1; ARHGEF2; SIPA1; RHOV; ARAP1; DEPDC7; ARHGDIG; ARHGAP9; RHOBTB2; ARHGAP39; RACGAP1; ECT2; RHOF; ARHGAP35; FAM13B; ARHGEF12; GMIP; ARHGAP23; SIPA1L2; VAV3; ARHGAP26; STARD13;	GO:0051056~regulation of small GTPase mediated signal transduction	89	141	63.1205673758865	0.00552980185952656	0.612653432392822	1	1	0.999986162720649	0.999986162720648	1
up	CDC7; E2F3; PPP6C; CDC45; ZNF324; GMNN; PIAS1; CCNE2; ITGB1; RB1; EIF4E; POLA1; CDK4; GSPT1; RPA2; RCC1; RPS6KB1; CCND1; CCNE1; MCM3; RPA1; MCM4; MCM5; MCM7; RPA3; CDKN1B; NASP; CDC34; PRIM1; PRIM2; MCM2; CDK7; CDKN2D; POLE2; MAX; CDK3; ACVR1; PPAT; KHDRBS1; POLE; TAF10; ORC2; EIF4EBP1; CUL2; CUL3; CUL4B; POLA2; MCM6; TFDP3; RHOU; MCM10; USP37; CACUL1; CRLF3; RBBP8; CDC6; HINFP; POLE4; POLE3; LATS2; PLK2; PIM2; DBF4; PHF8; LATS1; USP26; USP29;	GO:0000082~G1/S transition of mitotic cell cycle	67	100	67	0.0057326358089782	0.628222111153459	1	1	0.999986162720649	0.999986162720648	1
up	TMEM129; RNF103; SGTA; TRIM13; ERLIN1; USP19; HSPA5; HSP90B1; BAG6; VCP; SEC61B; UBE2G2; OS9; TRIM25; YOD1; TMUB2; SYVN1; UBE2J2; NPLOC4; STT3B; UBXN4; EDEM1; CCDC47; RNF185; DERL3; RNF5; TMUB1; DERL2; JKAMP; DNAJB9; SEL1L; MAN1B1; AMFR; STUB1; UBE2J1; ANKZF1; HSP90B2P; PSMC6; DNAJB14; SGTB; NCCRP1; FBXO27; RNF121; RHBDD2; FBXO2; ERLEC1; UBE4A; DNAJB12; DNAJB2; AUP1; UBE4B;	GO:0030433~ubiquitin-dependent ERAD pathway	51	71	71.830985915493	0.00581396288431113	0.630283589243278	1	1	0.999986162720649	0.999986162720648	1
up	PPP6C; GOSR2; SEC16A; TRAPPC3; USO1; SEC22B; SEC24D; SEC31A; CNIH1; SEC24A; SEC24B; SERPINA1; TGFA; TRAPPC2; NSF; TRAPPC10; CSNK1D; LMAN1; TMED10; CTSC; NAPA; SEC13; RAB1A; COL7A1; GOLGA2; STX5; CUL3; TMED2; SEC23A; KLHL12; PPP6R3; TRAPPC6B; TRAPPC5; CNIH3; SCFD1; TFG; SEC16B; TRAPPC9; RAB1B; PREB; CTSZ; PEF1; TRAPPC2L; PPP6R1; TRAPPC1; SAR1B; KLHL21;	GO:0048208~COPII vesicle coating	47	64	73.4375	0.00593349932556453	0.636399363833421	1	1	0.999986162720649	0.999986162720648	1
up	NKX2-8; COBL; PHF2; ZMPSTE24; ALDH1A2; ONECUT2; HRAS; KRAS; JUN; QDPR; IGF2R; PKM; XBP1; SRD5A1; HNF1A; PTN; NF1; UGT1A1; ACAT1; MPST; CAD; HMGCL; PIK3CA; NOTCH1; CEBPA; PDX1; CEBPG; WNT4; ARF6; SMAD3; HMGCS1; SP3; RELA; FPGS; DBP; DDX39B; BAAT; HNRNPD; HES1; HLX; MED1; MAN2A1; LSR; RB1CC1; GATA6; GNPNAT1; ACO2; CITED2; UPF2; RHBDD3; GFER; RARA; MET;	GO:0001889~liver development	53	75	70.6666666666667	0.00628492141475434	0.653704679191908	1	1	0.999986162720649	0.999986162720648	1
up	TMEM150B; TECPR2; TM9SF1; ATG7; GBA; TP53; S100A8; HMGB1; DRD2; ITGB4; XBP1; TFEB; ANXA7; PIK3CB; VPS41; RGS19; DAP; ARFIP2; HAP1; TMBIM6; VCP; GABARAPL2; RAB8A; RAB1A; CLTC; IRF8; SQSTM1; BECN1; USP10; RAB39A; STK11; WIPI1; FNBP1L; MAP1S; ULK3; DRAM2; NHLRC1; TECPR1; ATG4D; SBF2; SIRT2; DRAM1; PIK3C3; SUPT20H; RB1CC1; SMCR8; ATG4A; TBC1D5; RAB24; RNF166; GRAMD1A; OPTN; RAB39B; ATG4C; NRBF2; RNF185; C9orf72; GPR137; PHF23; TMEM59; TOLLIP; ATG5; CHMP4B; RNF41; EVA1A; TBC1D17; ATP13A2; TIGAR; VPS18; TBC1D14; UVRAG; VPS51; CHMP2B; SH3GLB1; WDR45; PLEKHM1; ATG4B; AMBRA1; EPG5;	GO:0006914~autophagy	79	123	64.2276422764228	0.00628936261472079	0.653704679191908	1	1	0.999986162720649	0.999986162720648	1
up	POLA1; PCNA; RPA2; RPA1; POLD1; RPA3; RFC4; RFC2; RFC1; RFC5; RFC3; POLD2; PRIM1; PRIM2; DNA2; POLE2; POLE; POLA2; POLD3; UPF1; POLD4; POLE4; POLE3;	GO:0032201~telomere maintenance via semi-conservative replication	23	24	95.8333333333333	0.00648672293519281	0.662037467246239	1	1	0.999986162720649	0.999986162720648	1
up	DNAJB6; HSBP1; HSP90AA1; HSP90AB1; HSPA1A; HSPA1B; HSPA8; TPR; RPA2; DNAJB1; MAPK3; RPA1; MAPK1; HSPA1L; RPA3; NUP62; MTOR; NUP153; RANBP2; GSK3B; NUP98; SEC13; NUP107; YWHAE; RAE1; HSF1; FKBP4; EP300; NUP160; ATM; ATR; CAMK2B; CAMK2G; CAMK2D; PTGES3; HIKESHI; NUP188; CCAR2; NUP43; NUP37; NUP210; NUP133; HSPH1; CREBBP; SIRT1; POM121; DNAJC2; DNAJC7; BAG1; NDC1; MLST8; NUP85; CHORDC1; NUP50;	GO:1900034~regulation of cellular response to heat	54	77	70.1298701298701	0.00651530850232918	0.662037467246239	1	1	0.999986162720649	0.999986162720648	1
up	CCL21; BCR; EPHA1; AKT2; CCR7; RANGAP1; CRK; CRKL; EIF5; RHOG; ABR; TIAM1; RAPGEF1; RASGRF1; SCRIB; PTK2B; RALGAPA2; RALGAPA1; RALGAPB; CCDC125; GPR65; TSC1; FOXJ1; DOCK7; PIP5K1A; BCAS3; ECT2; RCC2; CORO1C; TBC1D8B; TBC1D3K; TBC1D15; EVI5; TBC1D16; TBC1D5; TBC1D10A; TBC1D22B; TBC1D3D; TBC1D9; TBC1D3H; TBC1D17; TBC1D2B; GRTP1; TBC1D14; TBC1D3C; TBC1D1; RUNDC1; TBC1D21; TBC1D13; TBC1D3E; TBC1D30; TBC1D3G; TBC1D9B; TBC1D8; TBC1D3I; TBC1D22A; SGSM2; TBC1D2; RABGAP1L; TBC1D10C; TBC1D12; TIAM2; TBC1D3L; TBC1D28; TBC1D3; TBC1D3F;	GO:0090630~activation of GTPase activity	66	99	66.6666666666667	0.00656652913356714	0.662037467246239	1	1	0.999986162720649	0.999986162720648	1
up	TAF4; CHEK1; AURKA; MDM4; TRIM24; PRKAB2; RAD1; HUS1; NBN; RAD17; MBD3; CHEK2; TP53; RPA2; TBP; TAF1; RPA1; AKT1; RPA3; RFC4; RFC2; BRCA1; RFC5; RFC3; RPL5; DNA2; BLM; PRKAG1; POU4F1; SSRP1; RBBP4; EP300; CHD3; TAF10; PRKAA1; ATM; TOP3A; ATR; HDAC1; BOP1; RRS1; CDK5R1; TAF5; TAF13; TAF11; TAF7; STK11; TAF12; MAPK14; RBBP7; TAF9; TAF2; HIPK1; MAPKAPK5; JMY; BANP; SETD9; PPP1R13L; TOPBP1; DYRK2; HDAC2; KAT6A; TAF15; PPP1R13B; PRMT6; TP53RK; RAD9A; RBBP8; RHNO1; PHF20; BRIP1; HIPK2; RPF2; RMI1; EHMT1; MEAF6; KMT5A; SMYD2; PAK1IP1; PRKAG3; NOC2L; PRKAB1; SUPT16H;	GO:1901796~regulation of signal transduction by p53 class mediator	83	131	63.3587786259542	0.00668890662286559	0.667698579918127	1	1	0.999986162720649	0.999986162720648	1
up	PSMD12; PSMD14; AURKA; PSMD3; RAD21; RFPL1; PSMD10; PSMC3; PSMB1; PSMA1; PSMA3; PSMA4; PSMB9; PSMA5; PSMB4; PSMB6; PSMB5; PSMC2; PSMB10; PSMC4; PSMD8; PSMB3; PSMB2; PSMD7; PSMD4; PSMA6; PSME3; PSMC1; PSMC5; PSMC6; RBX1; SKP1; PSME1; PSMD2; MIIP; PSMA8; PSMF1; USP47; PSMB7; PSMD1; PSME2; PSMD13;	GO:0010972~negative regulation of G2/M transition of mitotic cell cycle	42	56	75	0.0069816339839146	0.684303634620831	1	1	0.999986162720649	0.999986162720648	1
