down	PSMD11; PSMD9; PSMA7; PSMD3; TRIM13; PSMD10; UBE4B; HERC2; UCHL1; PSMC3; PSMB1; PSMA1; PSMA2; PSMB8; PSMB9; PSMA5; PSMB4; PSMB6; PSMB5; DDIT3; PSMC2; PSMD8; ARRB1; CDC34; PSMB3; PSMD7; RBX1; RNF4; UBXN1; ERCC8; SKP2; CUL4A; PSMD6; KIF14; PSMD5; KLHL22; HECTD3; NHLRC1; SIAH1; KCTD17; ZNRF1; ZFAND2B; PCNP; KAT5; RNF34; FBXW5; NEDD4L; CRBN; PSMB7; RNF126; TRIM9; TOPORS; RNF216; RNF186; BFAR; KLHL42; FBXL17; FBXW11; STUB1; FAF1; BTRC; ARMC8; CUL5; HECW1; CUL2; RMND5A; DCAF11; UBE2K; NSFL1C; NEDD4; GID4; TRIM3; SHARPIN; RMND5B; SIAH3; RAD23A; UBXN2A; CUL1; SPSB3; SPSB2; NHLRC3; HACE1; SIAH2; UBE2A; TRIM2; LTN1;	GO:0043161~proteasome-mediated ubiquitin-dependent protein catabolic process	86	183	46.9945355191257	0.0108383327938457	0.717042053553129	1	1	0.999999999999963	0.999999999999963	1
up	GAK; SURF4; CLASP2; HTT; CSNK1A1; CSNK1D; STX17; CDC42; RAB2A; RAB1A; GOLGB1; TMED2; RAB30; LRRK2; ARHGAP21; CLASP1; PLEKHM2; SYNE1; NPLOC4; TRAPPC12; GBF1; MYO18A; COG3; GOLPH3; BCAS3; ARFGEF1; SEC16A; GORASP2; GOLGA8F; GOLGA6B; ATP8B4; GOLGA6D; TMED5; GOLGA6C; GOLGA6A; GOLGA2; UBXN2B; GOLGA8B; GOLGA8T; TJAP1; GOLGA8A;	GO:0007030~Golgi organization	41	119	34.453781512605	0.0109248662265243	0.797393739975426	1	1	0.99999935444007	0.99999935444007	1
down	NOTO; DLL1; HAND1; ENG; SOX18; WNT5A; GATA4; PSEN1; FGF8; WNT3A; MEF2C; TBX2; PKD2; IHH; SHH; STIL; ARL13B; NPHP3; CCDC103; BBS7; AHI1; FOXN4; BBS4; SMO; MESP1; OVOL2; MKKS; IFT57; IFT172; VANGL2; TBX20; SUFU; IFT52; TBX1; EOMES; TBX3;	GO:0001947~heart looping	36	63	57.1428571428571	0.0113113333961157	0.717042053553129	1	1	0.999999999999963	0.999999999999963	1
down	TMEM189; PER2; NDUFS6; LYPLA1; SGPL1; CYP1A1; FABP3; TH; CD36; PRKAR2B; ACADSB; UCP3; AASDH; THEM4; AACS; PLA2G4D; ACOT11; ACOT12; ACSF2; MECR; CYP4F11; HACL1; CROT; ANGPTL3; MORC2; GPAT2; CPT1A; ACOT2; ACOT6; GNPAT; ACOT4; PPARG; GPAM; BAAT; ACOT7; FA2H;	GO:0006631~fatty acid metabolic process	36	63	57.1428571428571	0.0113113333961157	0.717042053553129	1	1	0.999999999999963	0.999999999999963	1
down	WNT7A; ITGB1BP1; NRP1; NRP2; ROCK2; PDCD6; ABL1; THBS1; SPARC; BMP4; TDGF1; ETS1; PRKCA; KDR; WNT5A; BCAR1; RHOB; TSTA3; AAMP; ANGPT1; EMC10; CCBE1; SCARB1; RIN2; PROX1; ADGRA2; ATOH8; FOXC2; FOXP1; SMOC2; ZNF580; ANGPT4;	GO:0010595~positive regulation of endothelial cell migration	32	54	59.2592592592593	0.011322499451267	0.717042053553129	1	1	0.999999999999963	0.999999999999963	1
up	GMNC; CHEK1; GAK; OIP5; EPB41L2; EVI5; CCNT1; RAB11FIP3; PRPF40A; CCNDBP1; GNAI3; CLTA; RALB; PIM1; SRC; MYOG; MAPK1; RGS2; CSNK1A1; LIG4; RASSF2; HCFC1; RPS6KA3; PSME3; PPP1CA; ARF6; UBE2I; HNRNPU; PRKCD; RBBP4; SMARCB1; CHAF1B; IKZF1; TP53BP2; NEDD9; WTAP; PKN2; USP39; TET2; MIS18BP1; CDC73; TMPRSS11A; MAEA; BOD1L2; BANP; PIK3C3; NUP43; RB1CC1; PARD3; AHCTF1; USP9X; ANAPC16; SENP5; MARK4; NSMCE2; ANAPC13; CABLES2; KIF13A; TRIOBP; TSPYL2; KMT5A; BIRC6; ARL8B; THAP1; TXNL4B; HMG20B; KLHL9; APEX2; KLHL21; ANAPC5; CASP8AP2; FZR1; RUVBL1; FAM32A; DYNC1LI1;	GO:0007049~cell cycle	75	248	30.241935483871	0.0115904950410329	0.797393739975426	1	1	0.99999935444007	0.99999935444007	1
down	CACNA1G; SLC24A1; CACNA1F; TRPA1; ANXA9; ANXA6; OPRM1; CHRNA7; PSEN1; CACNG7; PKD1; CACNA1B; CACNA1D; ATP2B2; CACNB1; CACNG1; CACNB2; TRPC3; PKD2; CACNA1S; GAS6; RYR3; CACHD1; CATSPER4; CACNA2D4; TRPM1; NALCN; MCOLN2; CACNA2D3; TRPV3; MCOLN3; TMC1; PKD1L1; CACNG8; CUL5; ATP2A3; ORAI1; TRPM7; PANX1; P2RX4; ORAI3; TRPM6; CACNG6; TRPV4; SLC24A3; TRPC7; TRPV5; CACNA2D2; PKD2L2; CACNA1I; STIM2; CACNG4; CHRNA9; TRPC5; TMCO1; TRPV2; SLC24A5; ATP2C2;	GO:0070588~calcium ion transmembrane transport	58	115	50.4347826086956	0.0118555716634036	0.717042053553129	1	1	0.999999999999963	0.999999999999963	1
down	UPK1A; NR5A2; UPK2; TGFB1I1; TBX1; DNPH1; TCF21; SULT1B1; UPK3A; COL4A1; CDK1; PCNA; CBR1; LGALS3; BMP7; KRT4; VDAC1; FGFR2; HNRNPH3; PPARG; ACADVL; CPT1A; CASP6; DLX6; ELF3; TAGLN; ID3; AKR1C1; SIX1; PTER; BDH2; TOLLIP; FN3K; BARX1; SPINK5; PIH1D1; FZD1; GSTK1;	GO:0030855~epithelial cell differentiation	38	68	55.8823529411765	0.0121697109896788	0.717042053553129	1	1	0.999999999999963	0.999999999999963	1
down	HMX3; STXBP3; MEN1; EML1; PHGDH; NDUFS4; BCL2L11; TSPAN2; CTNND1; CTNS; TULP3; CLN5; NEURL1; UNC5C; ZIC2; EOMES; MBD3; CST3; COL4A1; ATXN1L; XRCC5; SNRPB; STMN1; ATP2B1; NF1; S1PR1; CD9; PTPRG; ACAT1; AK4; SMARCA1; GABRA5; CASP2; BAG6; SLC6A11; PPP3CC; NES; POU3F4; STAR; HNMT; BRCA2; AFF2; RIDA; ITGA8; FOXG1; OXCT1; UFM1; GRIN1; FPGS; PPP3CA; ADCY1; GRIN2A; PTCH1; SHROOM2; COX17; WRN; NCOA6; KCNAB1; ITSN1; ZIC1; DPYSL2; CNTN4; BBS7; SPATA5; DMBX1; PCDH19; DSCAML1; CTTNBP2; PROX1; CDK5RAP3; DNAJC30; CDK5RAP1; IMMP2L; CITED1; PYGO2; ROGDI; SRR; SHARPIN; SMG9; PCDH18; ABCB6; RAB18; CA10; H2AFY2; IFT172; CNTNAP2; BOK; UFC1; GRHL2; EMX2; PAFAH1B3; AMIGO2; ZFHX3; AMIGO1; PAFAH1B2; ADGRL3; SYNJ2; SIX3; THRA;	GO:0007420~brain development	99	217	45.6221198156682	0.012295954724039	0.717042053553129	1	1	0.999999999999963	0.999999999999963	1
down	PARP1; UBB; PCNA; RPS3; RPA1; POLD1; RFC4; RFC5; RFC3; POLD2; HMGA2; RBX1; RPS27A; UBA52; MRPS35; MRPS11; MRPS9; SOX4; CUL4A; WDR48; NEK1; MRPS26; RAD18; DTL;	GO:0042769~DNA damage response, detection of DNA damage	24	37	64.8648648648649	0.012553240794878	0.717042053553129	1	1	0.999999999999963	0.999999999999963	1
up	TLR4; IKBKB; CHUK; IRAK2; RIPK2; CD14; UBC; TNFRSF1A; AKT1; ROCK1; BIRC3; BIRC2; RIPK1; TRADD; NLRC3; TICAM1; SNIP1; RNF31; MAP3K14; RBCK1; TAB2; TBK1; TRAF6; NFKB1; RELA; RELB;	GO:0007249~I-kappaB kinase/NF-kappaB signaling	26	67	38.8059701492537	0.0126020691292368	0.797393739975426	1	1	0.99999935444007	0.99999935444007	1
up	PSMB11; PSMD12; PSMD14; DVL1; GPC4; AP2A1; PFN1; PSMA3; PSMA4; PSMB10; PSMC4; PSMD4; CDC42; PSME3; RHOA; PSMC5; PSMC6; RAC1; AP2B1; CLTC; PSME1; TIAM1; PSMD2; VANGL1; PSMF1; DVL3; MED12; AP2M1; PSMD1; SMURF2; SMURF1; PSMD13;	GO:0060071~Wnt signaling pathway, planar cell polarity pathway	32	88	36.3636363636364	0.0127093528263544	0.797393739975426	1	1	0.99999935444007	0.99999935444007	1
down	IRF6; WNT9B; TBX3; SNAI2; TCF21; DHRS3; GDF11; SGPL1; WDPCP; GLI3; PDGFRA; EPHB2; BMPR1A; TGFBR1; MEOX2; EPHB3; DLX6; MEF2C; SOS1; FOXF2; TBX2; SHH; ALX1; PKDCC; BCOR; FRAS1; OSR2; OSR1; PYGO2; ALX4; PLEKHA1; PAK1IP1; IFT172; INTU; SATB2; INSIG2; LRP6;	GO:0060021~roof of mouth development	37	66	56.0606060606061	0.0127739017863202	0.717042053553129	1	1	0.999999999999963	0.999999999999963	1
up	HDAC4; REST; HDAC1; SIRT2; SIRT7; RCOR1; HDAC9; HDAC3;	GO:0070933~histone H4 deacetylation	8	11	72.7272727272727	0.0129277068402194	0.797393739975426	1	1	0.99999935444007	0.99999935444007	1
down	PANO1; GIPC1; AURKA; TRIM24; TADA3; DPM2; USP19; FAM107A; ASGR2; BCL2; MYCNOS; LSS; PTEN; ANK2; SOX4; TARDBP; PIN1; DDI2; APTX; SLC51B; TMEM25; SIAH3; CCAR2; RNF128; KAT2A; USP7; PINX1; NEDD4L; VPS35; USP28; HDAC8; QRSL1; VPS11; GNL3L; DACT1; TOMM7; DPM3; HDAC6; FBXO4; PYCARD; STUB1; FBXO7; USP3;	GO:0031647~regulation of protein stability	43	80	53.75	0.0129830823751896	0.717042053553129	1	1	0.999999999999963	0.999999999999963	1
up	SIPA1L1; BCR; AKT2; CRK; EIF5; TIAM1; RAPGEF1; PTK2B; NEDD9; RALGAPA2; RALGAPA1; RALGAPB; CCDC125; TSC1; DOCK7; PIP5K1A; BCAS3; TBC1D7; TBC1D3K; TBC1D15; EVI5; TBC1D16; TBC1D22B; TBC1D9; TBC1D17; TBC1D14; TBC1D21; TBC1D30; TBC1D9B; TBC1D8; SGSM2; TBC1D26; RABGAP1L; TBC1D10C; TBC1D3;	GO:0090630~activation of GTPase activity	35	99	35.3535353535354	0.0131695898721915	0.797393739975426	1	1	0.99999935444007	0.99999935444007	1
down	POLR2D; RNMT; GTF2F2; ERCC2; POLR2C; POLR2E; ERCC3; POLR2B; POLR2I; CDK7; MNAT1; NCBP2; POLR2H; POLR2J; POLR2K; POLR2F; POLR2G; POLR2L; GTF2H2; GTF2H5; CMTR2; CMTR1;	GO:0006370~7-methylguanosine mRNA capping	22	33	66.6666666666667	0.0132978876449249	0.717042053553129	1	1	0.999999999999963	0.999999999999963	1
up	ITGAV; SRC; NCF1; VAV1; NCF2; PIK3CA; PIK3CB; CRK; PXN; CDC42; RHOA; RAC1; PTK2; PAK2; ROCK1; PTK2B; MAPK14; MAPKAPK3; CYFIP1; ABI1; BRK1; CYFIP2; PRKD2; BAIAP2; WASF2;	GO:0048010~vascular endothelial growth factor receptor signaling pathway	25	64	39.0625	0.0133921270276262	0.797393739975426	1	1	0.99999935444007	0.99999935444007	1
up	TLR4; DDX3X; ACTN4; TLR2; PTP4A3; SASH1; NFAT5; IL1B; APP; CD14; EIF2AK2; MMP8; IRAK1; RHOA; RELA; EP300; TRADD; RC3H1; TRIM44; RBCK1; AGO3; TERF2IP; NOD1; TRAF6; HMGB1;	GO:1901224~positive regulation of NIK/NF-kappaB signaling	25	64	39.0625	0.0133921270276262	0.797393739975426	1	1	0.99999935444007	0.99999935444007	1
down	PLPP1; FADS1; EDF1; SIN3B; PEX11A; ZMPSTE24; ABCA1; SERPINA3; HMGCR; CYP1A1; FABP1; ACADM; CD36; RXRA; FGFR4; CYP7A1; CPT2; DRD3; FDFT1; HNF4A; GLIPR1; ME1; CPT1A; HMGCS2; ID2; GPS2; NCOA6; NR1D2; ANKRD1; NCOA2; TNFAIP8L3; PPP4R3B; ANGPTL8; LSR; CARM1; ACER1; BBS4; TGS1; SIN3A; PLIN2; C1QTNF2; TM6SF2; BCL11B; RGL1; DNAJC15; PPARG; OPA3; PSAPL1;	GO:0019216~regulation of lipid metabolic process	48	92	52.1739130434783	0.0134018987035031	0.717042053553129	1	1	0.999999999999963	0.999999999999963	1
up	PSMB11; PSMD12; PSMD14; FGF16; PAK3; KRAS; TGFB1; IL1B; MBP; RAF1; MET; IL3; SBK2; FGF6; FGF3; FGF5; NCAM1; BRAF; AREG; RASA1; PSMA3; PSMA4; ZFP36; MARK3; ITPKB; MAPK1; PSMB10; PSMC4; MAP2K6; PSMD4; PSME3; PSMC5; YWHAE; PSMC6; GRB2; HSF1; SPTBN1; MEF2A; NRG1; PTK2; PSME1; ZFP36L1; PAK1; PSMD2; MAP3K1; CUL3; SPTAN1; PTK2B; RASA3; RASA2; MAPKAPK3; DUSP5; LRRK2; SETX; SPRED1; PABPN1; KSR1; PSMF1; DLG3; CAMKK2; RANBP9; HBEGF; PSMD1; MAP3K14; RIT2; MAP3K5; MAP3K3; GFRA4; TAOK3; RASAL2; PSMD13; RAPGEF2; IRS2; MAP3K4; MAP4K2; MAP4K5;	GO:0000165~MAPK cascade	76	254	29.9212598425197	0.0134888404792407	0.797393739975426	1	1	0.99999935444007	0.99999935444007	1
down	PLPP3; KIF3B; ZW10; KDELR3; KIF1C; KIF4A; PITPNB; TMED10; COPB1; ARF3; COPZ1; COG7; CENPE; KIF23; KIF5A; TMEM115; LMAN2; BNIP1; KIF22; KIF4B; RINT1; ARFGAP1; KIF18A; KIFAP3; ERGIC2; KIF2C; TMED9; KLC2; RACGAP1; COG4; PICK1; RAB6B; KIF15; USE1; STX18; KIF26A; TMED7; TMED3; KIF3A; ATP9B; RAB6C; DNAJC28; RAB41; GOLPH3L; ERGIC3;	GO:0006890~retrograde vesicle-mediated transport, Golgi to endoplasmic reticulum	45	85	52.9411764705882	0.0135797637961514	0.717042053553129	1	1	0.999999999999963	0.999999999999963	1
down	ANO9; CLCA1; GPR89A; TMEM150C; SGK1; ABCC4; GRID2; ATP8B1; ATP2C2; CYBB; ANXA6; ATP1B2; ATP6V1B1; GJA1; ATP2B1; ATP4A; RYR1; GLRA2; ATP6V0C; CLCN1; CHRNA7; GRIK1; ATP1A2; ATP4B; SCNN1B; CLCN4; CLCN5; CLCNKA; ATP12A; FXYD2; ATP8B2; ATP2B2; ATP7A; SLC12A1; ATP1A4; FXYD3; LASP1; CLCA4; RYR3; ATP6AP1; GRIK4; GRIK5; ASIC2; ATP2B3; ATP6V1F; ZACN; ATP13A5; ATP13A4; PDZD11; ANO1; ANO7; SFXN4; SLC24A5; ANO5; TMC7; OSTM1; TMC8; NALCN; ATP6V1C2; ATP6V0E2; SFXN5; BSND; ATP6V0A1; ATP2A3; SFXN2; NEDD4L; ATP6V0B; P2RX4; ANO3; TTYH1; ATP6V0A4; ATP13A1; ATP13A2; ANO10; ATP10D; ATP6V0A2; CHRNB2; GABRB1; CHRNA9; GABRA3; CHRNA2; GABRA5; GABRR2; GABRG1; CHRND; CHRFAM7A; GABRG3; CHRNA6; CHRNB1; GABRA2; GABRA1; GLRB; HTR3B; GABRR3; CHRNG;	GO:0034220~ion transmembrane transport	95	208	45.6730769230769	0.0136268224599282	0.717042053553129	1	1	0.999999999999963	0.999999999999963	1
down	SMIM22; PES1; PER2; RAD51D; CCNB2; INHA; MYBL2; CCNB1; CDC25A; GRK5; NUP214; CENPF; PLK1; RACK1; CDK3; CDKL1; CDK17; ID3; MECOM; CDK18; FOXM1; TARDBP; CTBP1; BOP1; PUM1; LIN52; CDKL4; LIN9; LIN54; TRNP1; FIGNL1; CDKL3; PHACTR4; CDK20; UBA3; CABLES1; MS4A3; UHRF2; CDK19; BEX2; WDR12; TRIM36; PRDM11; TXLNG; DTL; MOK; CSNK2A1; SKP2; E2F8; TSC2; CSNK2A3; FBXL3; CSNK2A2; E2F5; JUN; FBXL8; E2F2; E2F1; E2F6; JUNB;	GO:0051726~regulation of cell cycle	60	121	49.5867768595041	0.01367603661838	0.717042053553129	1	1	0.999999999999963	0.999999999999963	1
down	RNF8; TRIM27; NEDD4; UBE2N; RNF4; TRAF2; RNF135; RNF168; RNF152; UBE2E3; ZFP91; RNF5; RNF126; UBE2O; UBE2T; RNF186; BFAR; MAGEL2; PRPF19; STUB1; UBE2D4; RNF115; UBE2V2; PELI3; UBE2NL; TRAF5; TRAF4;	GO:0070534~protein K63-linked ubiquitination	27	44	61.3636363636364	0.013937235743717	0.717042053553129	1	1	0.999999999999963	0.999999999999963	1
down	TRIM13; RNF8; LTN1; TRIM37; UBE4B; RAG1; TRIM21; UBE2A; RNF4; TRAF2; NFX1; ERCC8; RNFT1; TRIM68; KLHL24; LRSAM1; SH3RF1; SH3RF3; RNF141; RNF133; DDB2; TRIM52; RNF185; UHRF2; RNF157; UHRF1; UBE2T; RAD18; RNF146; RNF186; BFAR; AMFR; RNF112; STUB1; RNF11; RNF115; ASB4; TRIM17;	GO:0051865~protein autoubiquitination	38	69	55.0724637681159	0.0143089518701663	0.717042053553129	1	1	0.999999999999963	0.999999999999963	1
down	WNT9A; WNT9B; TBX1; HTRA2; FZD7; GJB3; ABCA1; YES1; WNT2; MYB; ZNF35; FGFR2; EPHA3; LTK; AQP1; SLC6A4; PCK1; SERPINF1; PPARG; WNT5A; YAP1; SOX9; WNT3A; WNT7B; PAX2; PTK7; TEAD2; TWF2; ADNP2; OSR1; HDAC2; WNT8B; TESC; PHB2; WNT5B; FZD4; BRINP1; RARG;	GO:0071300~cellular response to retinoic acid	38	69	55.0724637681159	0.0143089518701663	0.717042053553129	1	1	0.999999999999963	0.999999999999963	1
down	RAB29; ZW10; USO1; OBSL1; ARL1; LMAN1; ARHGEF7; COG2; CUL7; FAM174B; HIKESHI; ATL3; DYM; TRAPPC11; LYSMD3; HACE1; FBXW8; ATL2; GOLGA5; COG1; USP6NL; TBC1D20; OPTN; GORASP1; TMED9; BLZF1; GOLPH3L; COG4; HOOK1; ZFP69B; BAG5; TRAPPC8; SEC23IP; GOLGA8IP; PI4K2A; ATP8B2; PI4K2B; TANGO2; GOLGA8Q; TMED3; TMED7; GOLGA8S; LMAN2L; VPS51; GOLGA8M; COG7; DNAJC28; TICAM2; ATP8B1; GOLGA8K; LMAN2; NSFL1C; GOLGA8R; LMAN1L; TMED4; UBXN2A; TMED10; GOLGA8N; GOLGA8O;	GO:0007030~Golgi organization	59	119	49.5798319327731	0.0144075355698295	0.717042053553129	1	1	0.999999999999963	0.999999999999963	1
down	POM121C; OGT; NUP155; ZBTB7A; PGAM1; NUP214; PRKAG1; SEC13; EIF6; RAE1; GCKR; NUP54; NUP93; NUP37; NUP35; NUP210; NUP205; SEH1L; POM121; NUP88; NDC1; NUP58; AAAS; PRKAG2; SLC2A6; NUP50;	GO:0006110~regulation of glycolytic process	26	42	61.9047619047619	0.0144919888793311	0.717042053553129	1	1	0.999999999999963	0.999999999999963	1
down	MAP3K7; TADA2A; SUPT3H; TADA3; TAF5L; SUPT7L; KAT7; TRIM16; BRD1; BRCA2; BRPF1; WDR5; TAF12; KAT6B; ING5; JADE3; KAT2A; TADA1; SGF29; KAT14; JADE2; POLE3; MBIP; BRPF3; TAF6L; NAA60;	GO:0043966~histone H3 acetylation	26	42	61.9047619047619	0.0144919888793311	0.717042053553129	1	1	0.999999999999963	0.999999999999963	1
up	PSMB11; FZD9; PSMD12; PSMD14; DDX3X; DAPK3; TBL1X; UBR5; CTDNEP1; TGFB1; SRC; NFKB1; PSMA3; PSMA4; PSMB10; USP8; PSMC4; CSNK1D; PSMD4; VCP; PSME3; PSMC5; PSMC6; UBE2B; SMAD3; XIAP; PSME1; PSMD2; KANK1; LRRK2; WLS; RNF220; USP34; PSMF1; FRAT1; ZBED3; USP47; PSMD1; TBL1XR1; WNK1; SMURF2; GID8; PSMD13; RUVBL1; CSNK1G3; PPM1N; CSNK1G2;	GO:0090263~positive regulation of canonical Wnt signaling pathway	47	144	32.6388888888889	0.0145714912687959	0.797393739975426	1	1	0.99999935444007	0.99999935444007	1
up	PSMB11; SNAP23; PSMD12; PSMD14; IKBKB; CHUK; SEC22B; HLA-A; ITGAV; NCF1; HLA-G; NCF2; PSMA3; PSMA4; PDIA3; HLA-F; PSMB10; PSMC4; PSMD4; PSME3; PSMC5; PSMC6; PSME1; PSMD2; VAMP3; PSMF1; PSMD1; PSMD13;	GO:0002479~antigen processing and presentation of exogenous peptide antigen via MHC class I, TAP-dependent	28	75	37.3333333333333	0.0145763023819104	0.797393739975426	1	1	0.99999935444007	0.99999935444007	1
up	CSF1R; PLEK; TPM1; MTOR; ARFIP2; RAC1; TCIRG1; CYFIP1; CORO1B;	GO:0031529~ruffle organization	9	14	64.2857142857143	0.0146124595078463	0.797393739975426	1	1	0.99999935444007	0.99999935444007	1
up	INPP4B; ATM; FIG4; PIKFYVE; PIK3CD; PIK3C2B; PIK3C3; PIK3CA; PIK3CB;	GO:0036092~phosphatidylinositol-3-phosphate biosynthetic process	9	14	64.2857142857143	0.0146124595078463	0.797393739975426	1	1	0.99999935444007	0.99999935444007	1
up	PPP1R12A; CCP110; ENSA; PPP1R12B; OFD1; CDK14; HAUS5; PCNT; LATS1; CALM3; PRKACA; PAFAH1B1; CSNK1D; CSNK1E; CCNH; ARPP19; ACTR1A; YWHAG; YWHAE; PPP2R2A; DYNLL1; KHDRBS1; DYNC1H1; PCM1; MAPRE1; HAUS3; TAF2; TUBA1A; CLASP1; SDCCAG8; BRSK2; CCNY; CEP76; CEP192; MASTL; CDK5RAP2; CEP250; PLK3; HAUS4; CEP131; CEP164; PPME1; FBXL12; FBXL18;	GO:0000086~G2/M transition of mitotic cell cycle	44	133	33.0827067669173	0.0148077082561798	0.797393739975426	1	1	0.99999935444007	0.99999935444007	1
up	PLOD2; APAF1; ACTN4; TLR2; MT-CYB; LDHA; PLAU; MT-ND4; MT-ND5; RAF1; ATP1B1; SOD3; SLC2A1; BMP2; CREB1; ITGA2; CAPN2; PAM; CD24; ARNT; ADSL; LONP1; ACVRL1; TGFBR2; LEP; CASP3; MTHFR; CDKN1B; PSEN2; MMP14; MECP2; CXCR4; RHOA; ADAM17; SMAD3; EP300; KCNMA1; REST; PRKAA1; PAK1; ATM; BIRC2; PTK2B; ITPR2; ADIPOQ; SCFD1; TM9SF4; CREBBP; EGLN2; EPAS1; EGLN1; SLC11A2;	GO:0001666~response to hypoxia	52	163	31.9018404907975	0.0148594354303487	0.797393739975426	1	1	0.99999935444007	0.99999935444007	1
down	IPO5; NEURL1; EGFR; COL3A1; COL4A1; COL1A2; MMP2; PDGFRA; GLRA2; DNMT1; SESN2; ATP7A; COL16A1; BCL2L1; NTRK2; RRAGB; LAMTOR1; NSMF; RRAGA; RPTOR; SLC38A9; CPEB3; CPEB1; PDGFD; PDGFC; SH3BP4; LAMTOR3; LAMTOR2; SESN3; SESN1;	GO:0071230~cellular response to amino acid stimulus	30	51	58.8235294117647	0.0148857530585861	0.717042053553129	1	1	0.999999999999963	0.999999999999963	1
down	PSMD11; PSMD9; PSMA7; PSMD3; PSMD10; HSPB1; UBB; SCGB1A1; PABPC1; PRKCA; PSMC3; PSMB1; PSMA1; PSMA2; APEX1; PSMB8; PSMB9; PSMA5; PSMB4; PSMB6; PSMB5; YWHAB; NUP214; PSMC2; ANP32A; ZFP36L2; PSMD8; PSMB3; PSMD7; PCBP4; CACNG7; RPS27A; UBA52; RNASEL; EXOSC9; EXOSC2; PUM1; PSMD6; EXOSC7; PSMD5; PCID2; ALKBH5; SERBP1; PUM2; EXOSC8; PSMB7; DHX36; EXOSC4; DCP1A; EXOSC5; EXOSC3; DIS3; EXOSC1; IGF2BP2; SAMD4A; ZC3H14;	GO:0043488~regulation of mRNA stability	56	112	50	0.014911666792253	0.717042053553129	1	1	0.999999999999963	0.999999999999963	1
down	NUDT21; CPSF4; SNRPB; CSTF2; NCBP2; MAZ; SNRPE; SNRPF; SNRPG; SNRPD3; LSM11; CSTF1; CPSF1; FIP1L1; CPSF7; ZNF473; SYMPK; CLP1; LSM10; CSTF2T; CPSF2; CPSF3; MED18; SSU72; SCAF8;	GO:0006369~termination of RNA polymerase II transcription	25	40	62.5	0.0150517335928895	0.717042053553129	1	1	0.999999999999963	0.999999999999963	1
down	ACACB; NDUFAB1; PRKAB2; MLYCD; ABCD3; PRKAG1; ACACA; FA2H; MCAT; CBR4; FADS6; ACOT4; HSD17B8; MGLL; MECR; PECR; PRKAG3; PRKAG2; PRKAB1; OXSM; ACSM6; ACSM1; ACSM3; ACSM2A; ACSM2B;	GO:0006633~fatty acid biosynthetic process	25	40	62.5	0.0150517335928895	0.717042053553129	1	1	0.999999999999963	0.999999999999963	1
down	KIF3B; KIF1B; KIF4A; DNAL4; CENPE; KIF23; KIF5A; DYNC1I2; KIF22; KIF4B; KIF18A; DYNLRB2; KIFAP3; KIF2C; KLC2; RACGAP1; DYNLRB1; KIF13B; KIF15; STARD9; KIF26A; KIF3A; KIF28P; DNAH3; KIF20A; KIF12; KIF14; KIF5C; KIF20B; WDR34; KIF9; DNAI2; DNAH6; KIF1C; DNAH11; KIF25; KIF26B; KIFC1; WDR78; KIF17; KIF16B; KIFC2; KIF21A;	GO:0007018~microtubule-based movement	43	81	53.0864197530864	0.0150533939006627	0.717042053553129	1	1	0.999999999999963	0.999999999999963	1
down	RCCD1; SOX1; SUV39H1; SOX15; SS18L1; ACTL6B; TOX; ZBTB7A; NR3C1; HMGN1; DNMT1; RBL1; BAG6; SMARCA4; HMGA2; FOXA3; HMGN5; SATB1; MBTD1; RBL2; HLTF; BRD3; ZMYND11; SAFB; HMGN3; EZH2; BCORL1; GFI1B; RSBN1; ATAD2; EMSY; TLK2; PHF13; CDAN1; RCBTB1; CHD6; L3MBTL2; HDAC11; ZNF462; L3MBTL3; HDAC8; ING2; NUCKS1; TDRD3; BRD9; ZNF304; HMG20A; BRWD1; BABAM1; ALKBH4; SFMBT1; TLK1; PADI4; HDAC5; FOXA2; SPIN1; HYPM; HIST2H2AB; TAF6; HIST1H2AH; H2AFV; TAF6L; HIST3H2A; GATAD1; PHF19; H2AFY2; FAM50B;	GO:0006325~chromatin organization	67	139	48.2014388489209	0.015100982025033	0.717042053553129	1	1	0.999999999999963	0.999999999999963	1
up	RAB5A; RAB27A; RAB1A; RAB8A; RAB11A; RAB9A; RAB24; RAB33A; DNAJC27; RAB6A; RAB15; RAB3D; RAB1B; RAB2B; RAB7A; RAB30; RABL2B; RAB7B; RAB20; RAB33B; RAB14; RAB5C; RAB21; RAB5B; RAB35; RAB2A; RAB10;	GO:0032482~Rab protein signal transduction	27	72	37.5	0.0155563299587467	0.797393739975426	1	1	0.99999935444007	0.99999935444007	1
down	MAP2K7; MUSK; DYRK3; STK16; ABL1; EGFR; PDGFB; ERBB2; INSR; LCK; FYN; PDGFRB; WEE2; KIT; FGFR1; PDGFRA; FER; EPHA1; FGFR2; ERBB3; FGFR4; FGFR3; EPHA3; EPHA8; EPHB2; LTK; WEE1; AXL; RYK; KDR; MAP2K2; ZAP70; CLK2; BMX; EPHB3; EPHA5; EPHA4; ROR1; BTK; EFEMP1; MERTK; MAP2K5; MELK; ERBB4; NTRK2; DDR2; PKDCC; EPHA10; DSTYK; LMTK2; HIPK4; DYRK2; NEK1; TESK2; SRMS; CLK4; DYRK4; ABI3; EPHA6; BAZ1B; ALK; DYRK1B;	GO:0018108~peptidyl-tyrosine phosphorylation	62	127	48.8188976377953	0.0156053456197116	0.717042053553129	1	1	0.999999999999963	0.999999999999963	1
up	FZD9; DFFA; DNM1L; DDX3X; ADAM10; APAF1; UNC13B; MCF2L; ARHGEF11; DAPK3; RIPK2; KALRN; BNIP3L; HIP1R; GADD45B; ARL6IP5; TRIO; PLEKHG5; GADD45G; LDHA; SOD1; HRG; ITGB1; HMGB1; HMOX1; IFIT2; UBC; IGF2R; BMP2; SRC; VAV1; CREB1; SMPD1; ATF6; GADD45A; APC; FAS; AKT1; CTNNB1; PTGS2; BCL6; HTT; MAPK8; PSEN2; RASSF2; MAP2K6; RBM5; PRKDC; MAP3K9; NOTCH2; EEF1A2; BAX; KCNMA1; AKAP13; TIAM1; STK4; REST; ATM; SQSTM1; RIPK1; GNA13; TRADD; NCOA1; PDCD2; BAK1; ANO6; ARHGEF18; NET1; RYBP; JMY; PNMA1; FLCN; PRR7; FANK1; PREX1; CTNNBL1; NCSTN; NSMAF; ARHGEF1; ARHGEF2; APH1A; SIRT1; FGD4; MAP3K5; SAV1; UBE2Z; BCLAF1; PSENEN; MTCH1; STK17A; ING4; TRAF6; LATS1; BBC3; MAP3K11;	GO:0043065~positive regulation of apoptotic process	95	332	28.6144578313253	0.016448129518583	0.797393739975426	1	1	0.99999935444007	0.99999935444007	1
up	PSMB11; PSMD12; QSOX1; PSMD14; ADAM10; APOL1; CALU; UBXN7; PRSS23; C3; APOA1; APOA2; FGG; APP; P4HB; CSF1; VCAN; RAB5A; HRC; PSMA3; PSMA4; FBN1; PSMB10; PSMC4; PSMD4; RAB8A; RAB2A; UBE2M; PSME3; PSMC5; PSMC6; RAB11A; RAB1A; PSME1; CKAP4; MFGE8; PTP4A2; PSMD2; DNAJC3; DMP1; MSLN; NAE1; CUL3; CUL4B; KEAP1; MBTPS1; RCN1; LRRC41; NEDD8; IGFBP7; DDB1; TMEM132A; MIA3; DCAF10; FBXL19; APOA5; ASB18; KTN1; CAND1; FBXO11; CUL9; SHISA5; BPIFB2; GOLM1; KCTD6; FBXO22; FBXO30; STT3B; LMO7; ASB10; ASB17; PSMF1; COPS5; PNPLA2; SPSB1; DCUN1D1; FEM1C; FBXL18; KCTD7; AMELX; PSMD1; EPAS1; MXRA8; FEM1A; RAB1B; ANO8; MEPE; CISH; ASB6; FBXL12; KLHL9; KLHL21; FBXO9; FBXL5; FBXW2; PSMD13; KLHL20; NUB1;	GO:0043687~post-translational protein modification	98	344	28.4883720930233	0.0164770047869821	0.797393739975426	1	1	0.99999935444007	0.99999935444007	1
down	POM121C; XPOT; NUP155; SSB; NUP214; SEC13; RAN; RAE1; NUP54; NUP93; NUP37; NUP35; NUP210; NUP205; SEH1L; POM121; NUP88; NDC1; NUP58; AAAS; NUP50; NOL6;	GO:0006409~tRNA export from nucleus	22	34	64.7058823529412	0.0167173343249	0.717042053553129	1	1	0.999999999999963	0.999999999999963	1
up	CFLAR; SP1; GSTP1; SRC; SLC2A4; AKT1; AKT2; LEP; PRKCI; STAT1; GCLC; GSK3A; RAB8A; RAB10; YWHAG; VAMP2; PRKDC; ZFP36L1; PAK1; SRSF5; PDE3B; ADIPOQ; CYFIP1; CPEB2; KAT2B; GHSR; SYAP1; SLC25A33; HDAC9; IRS2; LPIN2; LPIN1; RPS6KB1;	GO:0032869~cellular response to insulin stimulus	33	94	35.1063829787234	0.0169322473902089	0.797393739975426	1	1	0.99999935444007	0.99999935444007	1
down	EXOC5; DCTN1; ARL13B; RPGRIP1L; TMEM107; BBS7; POC1A; BBS10; IFT74; BBS4; IFT140; CEP89; BBS2; CENPJ; MKKS; MKS1; CEP126; IFT80; IFT172; INTU; VANGL2; IFT52; IFT88; TMEM216; TTC8; IFT122; IFT57;	GO:1905515~non-motile cilium assembly	27	45	60	0.0169762137086412	0.717042053553129	1	1	0.999999999999963	0.999999999999963	1
down	NOTO; WNT7A; LMX1B; HOXD11; FOXG1; NOG; PTCH1; SHH; ARL13B; SP8; DSCAML1; AIDA; DISP1; HHIP; OVOL2; FBXL15; IFT172; TBX20; IFT52; BMPR1B; BMPR1A;	GO:0009953~dorsal/ventral pattern formation	21	32	65.625	0.0172473577148436	0.717042053553129	1	1	0.999999999999963	0.999999999999963	1
up	WWP2; KPNA3; SIVA1; GYPA; TFRC; ITGB1; ITGAV; LAMP1; NCAM1; CD46; ITGA2; CR1; MRC1; GRK2; SERPINB3; EPS15; NUP153; EFNB2; CD81; DYNLT1; DAG1; SELPLG; MOG; TNFRSF14; ITCH; WWP1; CD209; SLC52A1; VPS18; UVRAG; F11R;	GO:0046718~viral entry into host cell	31	87	35.632183908046	0.0173013624980728	0.797393739975426	1	1	0.99999935444007	0.99999935444007	1
down	MANBA; TGM5; ICMT; ABL1; PLAT; YES1; ARAF; UBL4A; CPE; TGM1; LOX; PHKA2; CDC34; SEPHS1; MMP15; RABGGTB; ADPRH; UBE2N; UBA52; UBE2L3; SLC35A1; TGM3; PIGH; GNMT; STK38; QPCT; CDKL3; UEVLD; RIMKLA; UBA3; RABGGTA; MCRS1; WDYHV1; PPP4R2; B4GALT7; NAGPA; FBXL2; RIMKLB; PADI4; DUSP12; LIPT1; LOXL2; RIPK3;	GO:0006464~cellular protein modification process	43	82	52.4390243902439	0.0173840377093512	0.717042053553129	1	1	0.999999999999963	0.999999999999963	1
down	PEX7; SLC27A2; SLC25A17; ECI2; ACAA1; ACADM; CPT2; ACAT1; ABCD3; ACADL; ECHS1; ECI1; ACADVL; CPT1A; SESN2; EHHADH; ECH1; DECR1; ACAD11; MCAT; BDH2; MECR; CROT; ECHDC2; ACAT2; AUH;	GO:0006635~fatty acid beta-oxidation	26	43	60.4651162790698	0.0177129290581003	0.717042053553129	1	1	0.999999999999963	0.999999999999963	1
down	CHL1; NRP1; TOX3; PDPK1; XRCC2; WFS1; STAMBP; HRAS; JUN; FYN; BCL2; HSPD1; CCL2; EN2; MAG; ERBB3; IL10; F2R; CNTF; AXL; GABRA5; GDF5; MSH2; NES; ARRB1; STAR; PSEN1; FGF8; DLX1; ISL1; STXBP1; GRIN1; MEF2C; BCL2L1; CLN3; PIN1; ALKBH1; NFATC4; KIF14; ANGPT1; SIX1; ITSN1; SNCB; NTRK2; BHLHB9; SLC30A10; UNC5B; OXR1; DRAXIN; TFAP2B; SYNGAP1; PARK7; LGMN; FOXB1; CITED1; FAIM2; PINK1; BARHL1; ADNP; NMNAT1; FGF20; NRBP2; BOK; APOE; NGF; BDNF;	GO:0043524~negative regulation of neuron apoptotic process	66	138	47.8260869565217	0.0177457291921336	0.717042053553129	1	1	0.999999999999963	0.999999999999963	1
up	FAM170A; SUPT5H; DVL1; NKX2-8; KLF4; CCNT1; RNGTT; NCOR1; MAF; GCM2; NFAT5; NFIC; POU2F2; PAX1; CREB1; JUND; NFKB1; TBP; BTF3; NFYA; POLR2A; GTF2H1; GTF2F1; DEK; MLLT3; LHX1; CEBPD; CDK9; CCNH; GTF2A1; ZNF143; PKNOX1; MAX; YBX1; GTF2I; TMF1; MLLT1; KMT2A; NCBP1; TAF10; NFATC3; BMPR2; GTF2H3; VEZF1; TFDP1; NFE2L1; IRF3; NFIX; TAF1C; TRIP11; TSC22D1; USF2; NFE2L2; TAF9; POU2AF1; NFIL3; CDC73; TAF2; SUPT6H; PAF1; LEO1; RREB1; TAF15; COPS5; SNAPC3; EPAS1; SCAF1; DDX21; ASH1L; EHF; AFF4; GTF2IRD1; MBD1; GMEB2; TCFL5; MAFF; MED16; GTF2A1L;	GO:0006366~transcription by RNA polymerase II	78	266	29.3233082706767	0.0179294399849232	0.797393739975426	1	1	0.99999935444007	0.99999935444007	1
up	TAOK2; OXSR1; MAP3K3; STK24; PAK3; SLK; PAK1; MAP2K6; SBK2; STK4; TAOK1; MAP2K4; TAOK3; MAP4K5; MAP3K14; MAP4K2; MAP3K1; MAP3K4; MAP3K2; PAK2;	GO:0023014~signal transduction by protein phosphorylation	20	49	40.8163265306122	0.0179454848620823	0.797393739975426	1	1	0.99999935444007	0.99999935444007	1
down	HYKK; PMS2P1; PDXK; PAPSS1; PAPSS2; CKM; PRPS2; CKB; CKMT1A; MAPK3; DCK; EPHB2; CHKA; HTR2B; SEPHS1; AK2; ADK; PRPS1; CDK5; MVK; TNK2; COASY; PMVK; NADK2; NOL9; IDNK; PPIP5K1; PSTK; NAGS; COQ8A; PANK1; CLP1; UCK2; TOLLIP; FN3K; PANK3; UCK1; FN3KRP; ETNK1; NMRK1; LIMD1; SHPK; AK3; ALK; DOLK; AK6; FAM20A; GK5; FAM20B; XYLB;	GO:0016310~phosphorylation	50	99	50.5050505050505	0.0180185139028142	0.717042053553129	1	1	0.999999999999963	0.999999999999963	1
